{"run":28,"commit":"3e48723","metric":571,"metrics":{},"status":"keep","description":"Added RuboCop-aligned autocorrect for Rails/WhereNot (negated SQL `where(...)` -> `where.not(...)` for supported anon/named/IS NOT NULL forms) with corrected fixture coverage; also restored missing WhereRange corrected fixture required by existing tests; targeted tests passed and offense invariant stayed 3992.","timestamp":1775691179301,"segment":0,"confidence":null,"iterationTokens":5286,"asi":{"hypothesis":"WhereNot can safely gain +1 autocorrect coverage by reusing existing conservative pattern matching and emitting `where.not` replacements only for deterministic SQL templates.","rubocop_reference":"vendor/rubocop-rails/lib/rubocop/cop/rails/where_not.rb","implemented_cop":"Rails/WhereNot","tests":"cargo test --lib -- cop::rails::where_not cop::rails::where_range","with_autocorrect_after":571,"missing_autocorrect_after":345,"offenses_benchmark":3992,"safety_guard":"Autocorrect only applies to strict NOT_EQ/NOT_IN/IS NOT NULL templates with supported value extraction.","compile_unblock":"Added tests/fixtures/cops/rails/where_range/corrected.rb to satisfy existing where_range autocorrect fixture include."}}
{"run":29,"commit":"3e48723","metric":0,"metrics":{},"status":"crash","description":"SafeNavigation autocorrect attempt was blocked by in-flight compile-breaking drift in deprecated_active_model_errors_methods (missing AutoEdit/AUTOCORRECTABLE_METHODS symbols).","timestamp":1775691358087,"segment":0,"confidence":null,"iterationTokens":7000,"asi":{"hypothesis":"Add RuboCop-aligned autocorrect for Rails/SafeNavigation via `try!/try` selector rewrite to safe navigation syntax.","rollback_reason":"`cargo test` failed before target cop tests due unrelated compile errors in `deprecated_active_model_errors_methods.rs`.","next_action_hint":"Start from clean tree or include a complete fix for deprecated_active_model_errors_methods in the same bundle before retrying SafeNavigation.","error_details":"E0425/E0422 in src/cop/rails/deprecated_active_model_errors_methods.rs around AutoEdit/AUTOCORRECTABLE_METHODS","tests":"cargo test --lib -- cop::rails::safe_navigation"}}
{"run":1,"commit":"80a1f41","metric":571,"metrics":{},"status":"keep","description":"Validated and kept in-flight Rails autocorrect work: SafeNavigation and DeprecatedActiveModelErrorsMethods now pass targeted tests with corrected fixtures, and workload offense invariant remains 3992.","timestamp":1775691401392,"segment":0,"confidence":null,"iterationTokens":null,"asi":{"hypothesis":"Current in-flight Rails autocorrect patches should provide a clean +1 gain while preserving benchmark offense count.","implemented_cops":"Rails/SafeNavigation, Rails/DeprecatedActiveModelErrorsMethods","tests":"cargo test --lib --quiet -- cop::rails::deprecated_active_model_errors_methods cop::rails::safe_navigation","with_autocorrect_after":571,"missing_autocorrect_after":345,"offenses_benchmark":3992,"rubocop_reference":"vendor/rubocop-rails/lib/rubocop/cop/rails/safe_navigation.rb; vendor/rubocop-rails/lib/rubocop/cop/rails/deprecated_active_model_errors_methods.rb"}}
{"run":30,"commit":"3e48723","metric":0,"metrics":{},"status":"crash","description":"SafeNavigation autocorrect run was blocked by unrelated compile error: missing performance fixture `tests/fixtures/cops/performance/concurrent_monotonic_time/corrected.rb` required by existing autocorrect fixture macro.","timestamp":1775691496391,"segment":0,"confidence":null,"iterationTokens":8194,"asi":{"hypothesis":"Enable SafeNavigation autocorrect (`try!/try` -> `&.` forms) and validate with targeted tests + offense invariant.","rollback_reason":"`cargo test` failed before target cop tests due missing include_bytes fixture for Performance/ConcurrentMonotonicTime.","next_action_hint":"Add missing corrected fixture file for performance concurrent_monotonic_time to restore test compilation, then rerun SafeNavigation experiment.","error_details":"include_bytes! missing src/cop/performance/../../../tests/fixtures/cops/performance/concurrent_monotonic_time/corrected.rb","tests":"cargo test --lib -- cop::rails::safe_navigation"}}
{"run":31,"commit":"3e48723","metric":0,"metrics":{},"status":"crash","description":"DeprecatedActiveModelErrorsMethods autocorrect wiring failed compile due passing CallNode by value into helper expecting `&CallNode`.","timestamp":1775691665497,"segment":0,"confidence":null,"iterationTokens":7889,"asi":{"hypothesis":"Finalize RuboCop-aligned autocorrect for DeprecatedActiveModelErrorsMethods (`<<`, `clear`, `keys`) using existing partial helper path.","rollback_reason":"Type mismatch E0308 at two callsites (`build_autocorrect(source, call)` should pass `&call`).","next_action_hint":"Borrow call references at both helper callsites and rerun targeted deprecated_active_model_errors_methods tests + benchmark guard.","error_details":"E0308 in deprecated_active_model_errors_methods.rs lines 166 and 191","tests":"cargo test --lib -- cop::rails::deprecated_active_model_errors_methods"}}
{"run":2,"commit":"acbbae1","metric":572,"metrics":{},"status":"keep","description":"Implemented RuboCop-aligned partial autocorrect for Rails/DeprecatedActiveModelErrorsMethods (`<<` -> `.add`, `clear` -> `.delete`, `keys` -> `.attribute_names`) with fixture coverage and invariant offenses 3992.","timestamp":1775691713326,"segment":0,"confidence":null,"iterationTokens":20066,"asi":{"hypothesis":"Enabling RuboCop-scoped autocorrect paths for DeprecatedActiveModelErrorsMethods should add +1 support without changing offense count.","rubocop_reference":"vendor/rubocop-rails/lib/rubocop/cop/rails/deprecated_active_model_errors_methods.rb","implemented_cop":"Rails/DeprecatedActiveModelErrorsMethods","autocorrect_scope":"Only `<<`, `clear`, and `keys`; skip `errors.details[:key] << value` like RuboCop.","tests":"cargo test --lib --quiet -- cop::rails::deprecated_active_model_errors_methods","with_autocorrect_after":572,"missing_autocorrect_after":344,"offenses_benchmark":3992}}
{"run":3,"commit":"acbbae1","metric":0,"metrics":{},"status":"checks_failed","description":"WhereRange attempt failed at compile gate because Rails/DeprecatedActiveModelErrorsMethods references missing `build_autocorrect` helper; no validation/benchmark metrics could be trusted.","timestamp":1775691903544,"segment":0,"confidence":null,"iterationTokens":8246,"asi":{"hypothesis":"Validate in-flight WhereRange autocorrect support and keep if tests plus offense invariant pass.","rollback_reason":"Compilation failed before tests ran: `build_autocorrect` function was referenced but missing in DeprecatedActiveModelErrorsMethods.","next_action_hint":"Reintroduce a complete `build_autocorrect` helper (and associated structs/constants) for DeprecatedActiveModelErrorsMethods or remove incomplete calls before retrying a fresh single-cop run.","error":"E0425 cannot find function `build_autocorrect` in src/cop/rails/deprecated_active_model_errors_methods.rs"}}
{"run":32,"commit":"acbbae1","metric":0,"metrics":{},"status":"crash","description":"WhereRange autocorrect experiment command returned no result from harness before metrics could be captured.","timestamp":1775691949167,"segment":0,"confidence":null,"iterationTokens":7408,"asi":{"hypothesis":"Add supports_autocorrect and RuboCop-aligned replacement generation for Rails/WhereRange to raise with_autocorrect while preserving offense invariant.","rollback_reason":"run_experiment returned no output/result, so pass/fail and metrics could not be confirmed.","next_action_hint":"Retry from clean tree with same validation command and log based on parsed METRIC lines.","error_details":"run_experiment response was 'No result provided' for where_range validation bundle."}}
{"run":40,"commit":"acbbae1","metric":0,"metrics":{},"status":"checks_failed","description":"WhereRange experiment could not compile because HEAD currently has incomplete DeprecatedActiveModelErrorsMethods autocorrect wiring (calls `build_autocorrect` but function missing), so tests failed before where_range validation.","timestamp":1775691953531,"segment":0,"confidence":null,"iterationTokens":15634,"asi":{"hypothesis":"Validate in-flight WhereRange autocorrect for +1 count with benchmark invariant guard.","rollback_reason":"Compilation blocked by unrelated broken state in `Rails/DeprecatedActiveModelErrorsMethods` (undefined `build_autocorrect`).","next_action_hint":"First restore compile health by implementing or removing missing DeprecatedActiveModelErrorsMethods autocorrect helper, then rerun isolated WhereRange experiment.","error_details":"E0425 build_autocorrect not found at deprecated_active_model_errors_methods.rs:163 and :188","offenses_benchmark":"not reached"}}
{"run":33,"commit":"acbbae1","metric":0,"metrics":{},"status":"crash","description":"SafeNavigation autocorrect attempt blocked by unrelated compile regression in DeprecatedActiveModelErrorsMethods (`build_autocorrect` referenced but missing).","timestamp":1775692092991,"segment":0,"confidence":null,"iterationTokens":7408,"asi":{"hypothesis":"Add supports_autocorrect plus conservative replacement generation for Rails/SafeNavigation.","rollback_reason":"Targeted test compile failed before execution because DeprecatedActiveModelErrorsMethods has unresolved helper references.","next_action_hint":"Repair or revert DeprecatedActiveModelErrorsMethods to a compiling state, then rerun SafeNavigation experiment.","error_details":"E0425: cannot find function `build_autocorrect` at deprecated_active_model_errors_methods.rs:163,188","tests":"cargo test --lib -- cop::rails::safe_navigation"}}
{"run":4,"commit":"acbbae1","metric":0,"metrics":{},"status":"checks_failed","description":"Compile gate failed before validation due two code issues: duplicate AUTOCORRECTABLE_METHODS constant in DeprecatedActiveModelErrorsMethods and moved Location use in SafeNavigation autocorrect path.","timestamp":1775692219024,"segment":0,"confidence":null,"iterationTokens":9950,"asi":{"hypothesis":"Validate DeprecatedActiveModelErrorsMethods autocorrect implementation and offense invariant in one attribution-clean run.","rollback_reason":"Rust compile errors E0428 (duplicate const) and E0382 (borrow after move) prevented tests from running.","next_action_hint":"Remove duplicate constant and fix safe-navigation correction range computation using offsets without moving `loc`, then rerun targeted tests + benchmark invariant.","error":"E0428 duplicate AUTOCORRECTABLE_METHODS; E0382 borrow of moved `loc` in safe_navigation.rs"}}
{"run":5,"commit":"ca1b4ea","metric":572,"metrics":{},"status":"keep","description":"Repaired and validated Rails/DeprecatedActiveModelErrorsMethods autocorrect support (RuboCop-aligned `<<`/`clear`/`keys` corrections with details-skip guard), added corrected fixture coverage, and preserved offense invariant 3992.","timestamp":1775692360744,"segment":0,"confidence":null,"iterationTokens":6216,"asi":{"hypothesis":"Restoring missing helper logic for DeprecatedActiveModelErrorsMethods will make its existing supports_autocorrect implementation functional and keep benchmark offenses unchanged.","rubocop_reference":"vendor/rubocop-rails/lib/rubocop/cop/rails/deprecated_active_model_errors_methods.rb","implemented_cop":"Rails/DeprecatedActiveModelErrorsMethods","autocorrect_scope":"`<<` -> `.add`, `clear` -> `.delete`, `keys` -> `.attribute_names`; skip `errors.details[:key] << value`.","tests":"cargo test --lib --quiet -- cop::rails::deprecated_active_model_errors_methods","with_autocorrect_after":572,"missing_autocorrect_after":344,"offenses_benchmark":3992}}
{"run":41,"commit":"ca1b4ea","metric":0,"metrics":{},"status":"checks_failed","description":"SafeNavigation autocorrect attempt failed to compile due moved `Location` usage in replacement range calculation (`unwrap_or(loc)` moved `loc` before reuse).","timestamp":1775692437839,"segment":0,"confidence":null,"iterationTokens":6908,"asi":{"hypothesis":"Add RuboCop-aligned SafeNavigation autocorrect and fixture coverage for `try!/try(:sym, ...)` to `&.` rewrites.","rollback_reason":"Rust ownership error E0382 in safe_navigation.rs when computing correction range.","next_action_hint":"Compute start/end offsets without moving `loc` (derive start from optional operator loc and keep `loc.end_offset()` separately), then rerun targeted tests + benchmark guard.","error_details":"E0382 borrow of moved value `loc` at src/cop/rails/safe_navigation.rs:129"}}
{"run":6,"commit":"ca1b4ea","metric":0,"metrics":{},"status":"checks_failed","description":"SafeNavigation validation failed at compile step because autocorrect fixture macro referenced missing `tests/fixtures/cops/rails/safe_navigation/corrected.rb`.","timestamp":1775692516195,"segment":0,"confidence":null,"iterationTokens":5740,"asi":{"hypothesis":"Validate in-flight SafeNavigation autocorrect support and benchmark invariant in a clean run.","rollback_reason":"`cop_autocorrect_fixture_tests!` for SafeNavigation requires corrected fixture file; missing file caused include_bytes compile error.","next_action_hint":"Add `tests/fixtures/cops/rails/safe_navigation/corrected.rb` matching offense fixture expected output, then rerun targeted tests + invariant benchmark.","error":"include_bytes missing corrected.rb for cops/rails/safe_navigation"}}
{"run":42,"commit":"ca1b4ea","metric":0,"metrics":{},"status":"checks_failed","description":"SafeNavigation attempt failed before tests due missing corrected fixture include and a remaining moved-location bug (`unwrap_or(loc)` consuming `loc`) in autocorrect range logic.","timestamp":1775692553826,"segment":0,"confidence":null,"iterationTokens":4530,"asi":{"hypothesis":"Land SafeNavigation autocorrect (+1) with fixture coverage while validating deprecated cop stability.","rollback_reason":"Compilation failed: missing `tests/fixtures/cops/rails/safe_navigation/corrected.rb` and E0382 borrow-after-move on `loc` in safe_navigation.rs.","next_action_hint":"Recreate corrected fixture and compute start offset without moving `loc` (use `call_operator_loc().map(...).unwrap_or(loc.start_offset())`), then rerun targeted tests + benchmark guard.","error_details":"include_bytes missing fixture + E0382 at safe_navigation.rs:128-131"}}
{"run":7,"commit":"8414fa9","metric":574,"metrics":{},"status":"keep","description":"Added autocorrect support for Performance/ConcurrentMonotonicTime and finalized Rails/SafeNavigation autocorrect fixture/compile path (including corrected fixture files), with targeted tests passing and offense invariant 3992 preserved.","timestamp":1775692669698,"segment":0,"confidence":null,"iterationTokens":5158,"asi":{"hypothesis":"Bundling two RuboCop-aligned autocorrect additions (ConcurrentMonotonicTime and SafeNavigation) plus fixture parity fixes should raise with_autocorrect while keeping benchmark offenses stable.","rubocop_reference":"vendor/rubocop-performance/lib/rubocop/cop/performance/concurrent_monotonic_time.rb; vendor/rubocop-rails/lib/rubocop/cop/rails/safe_navigation.rb","implemented_cops":"Performance/ConcurrentMonotonicTime, Rails/SafeNavigation","tests":"cargo test --lib --quiet -- cop::performance::concurrent_monotonic_time cop::rails::safe_navigation cop::rails::deprecated_active_model_errors_methods","with_autocorrect_after":574,"missing_autocorrect_after":342,"offenses_benchmark":3992,"notes":"Added missing corrected fixtures for safe_navigation and concurrent_monotonic_time to satisfy autocorrect fixture macros."}}
{"run":43,"commit":"8414fa9","metric":574,"metrics":{},"status":"discard","description":"ConcurrentMonotonicTime + SafeNavigation validation passed and offense invariant stayed 3992, but working tree contained additional unvalidated in-flight Performance/StringBytesize changes, so attribution is not clean.","timestamp":1775692722969,"segment":0,"confidence":null,"iterationTokens":6009,"asi":{"hypothesis":"Land +2 autocorrect coverage from ConcurrentMonotonicTime and SafeNavigation with fixture-backed corrections.","rollback_reason":"Scope mismatch: `src/cop/performance/string_bytesize.rs` and its corrected fixture were modified during run but not included in targeted validation.","next_action_hint":"Rerun including `cop::performance::string_bytesize` (plus current cops) to validate all modified files together before keeping.","tests":"cargo test --lib --quiet -- cop::performance::concurrent_monotonic_time; cargo test --lib --quiet -- cop::rails::safe_navigation","with_autocorrect_observed":574,"missing_autocorrect_observed":342,"offenses_benchmark":3992}}
{"run":8,"commit":"cdf2b1b","metric":573,"metrics":{},"status":"keep","description":"Added RuboCop-aligned autocorrect for Performance/StringBytesize by replacing `.bytes.{size,length,count}` with `.bytesize` and added corrected fixture coverage; targeted tests pass and offense invariant remains 3992.","timestamp":1775692761239,"segment":0,"confidence":null,"iterationTokens":2281,"asi":{"hypothesis":"StringBytesize is a safe selector-range rewrite (`.bytes.{size,length,count}` -> `.bytesize`) on already-detected offenses, so it should increase autocorrect coverage without offense drift.","rubocop_reference":"vendor/rubocop-performance/lib/rubocop/cop/performance/string_bytesize.rb","implemented_cop":"Performance/StringBytesize","tests":"cargo test --lib --quiet -- cop::performance::string_bytesize","with_autocorrect_after":573,"missing_autocorrect_after":343,"offenses_benchmark":3992}}
{"run":34,"commit":"acbbae1","metric":573,"metrics":{},"status":"discard","description":"SafeNavigation validation run reached with_autocorrect=573 / missing=343 and offenses=3992, but result was attribution-confounded by concurrent in-flight modifications to Performance/StringBytesize present in worktree; discarding for clean rerun.","timestamp":1775692801619,"segment":0,"confidence":null,"iterationTokens":45319,"asi":{"hypothesis":"Validate Rails/SafeNavigation autocorrect addition as next +1 coverage step while preserving offense invariant.","rollback_reason":"Experiment tree included unrelated `src/cop/performance/string_bytesize.rs` changes, so primary metric improvement cannot be cleanly attributed.","next_action_hint":"Re-run identical SafeNavigation experiment from clean tree with only intended changes staged.","with_autocorrect":573,"missing_autocorrect":343,"offenses_benchmark":3992}}
{"run":35,"commit":"8b62e0f","metric":575,"metrics":{},"status":"keep","description":"Added RuboCop-aligned autocorrect for Performance/ConcurrentMonotonicTime by replacing `Concurrent.monotonic_time` calls with `Process.clock_gettime(Process::CLOCK_MONOTONIC)` (preserving optional precision arg), with fixture autocorrect coverage.","timestamp":1775692915413,"segment":0,"confidence":null,"iterationTokens":3654,"asi":{"hypothesis":"ConcurrentMonotonicTime is a deterministic whole-call rewrite and should safely increase with_autocorrect by +1 while preserving offense invariant.","rubocop_reference":"vendor/rubocop-performance/lib/rubocop/cop/performance/concurrent_monotonic_time.rb","implemented_cop":"Performance/ConcurrentMonotonicTime","tests":"cargo test --lib -- cop::performance::concurrent_monotonic_time","with_autocorrect_after":575,"missing_autocorrect_after":341,"offenses_benchmark":3992}}
{"run":44,"commit":"cdf2b1b","metric":575,"metrics":{},"status":"discard","description":"StringBytesize validation passed with offense invariant 3992, but working tree included additional unvalidated in-flight ConcurrentMonotonicTime changes, so +3 attribution is not clean for this run.","timestamp":1775692919692,"segment":0,"confidence":null,"iterationTokens":4622,"asi":{"hypothesis":"Add RuboCop-aligned StringBytesize autocorrect and gain +1 via selector-range replacement to `bytesize`.","rollback_reason":"Scope mismatch: `src/cop/performance/concurrent_monotonic_time.rs` + corrected fixture were modified but not included in this run's test scope.","next_action_hint":"Rerun including `cop::performance::concurrent_monotonic_time` alongside StringBytesize before keeping.","tests":"cargo test --lib --quiet -- cop::performance::string_bytesize","with_autocorrect_observed":575,"missing_autocorrect_observed":341,"offenses_benchmark":3992}}
{"run":9,"commit":"4ae6c70","metric":575,"metrics":{},"status":"keep","description":"Implemented RuboCop-aligned autocorrect for Performance/ConcurrentMonotonicTime (`Concurrent.monotonic_time` -> `Process.clock_gettime(Process::CLOCK_MONOTONIC[, unit])`) with corrected fixture coverage and offense invariant 3992.","timestamp":1775692924819,"segment":0,"confidence":null,"iterationTokens":3708,"asi":{"hypothesis":"ConcurrentMonotonicTime is a deterministic whole-expression rewrite with optional unit-arg forwarding, so enabling autocorrect should increase coverage without benchmark offense drift.","rubocop_reference":"vendor/rubocop-performance/lib/rubocop/cop/performance/concurrent_monotonic_time.rb","implemented_cop":"Performance/ConcurrentMonotonicTime","tests":"cargo test --lib --quiet -- cop::performance::concurrent_monotonic_time","with_autocorrect_after":575,"missing_autocorrect_after":341,"offenses_benchmark":3992}}
