{"run":78,"commit":"9f7c882","metric":596,"metrics":{},"status":"keep","description":"Added RuboCop-aligned autocorrect for Performance/Count (`select/reject/filter/find_all ... count/size/length` -> `count { ... }`) including reject-negation and block-pass handling, with corrected fixture coverage; targeted tests pass and benchmark offenses remain 3992.","timestamp":1775704048253,"segment":0,"confidence":null,"iterationTokens":8817,"asi":{"hypothesis":"Port RuboCop Performance/Count autocorrect semantics to raise with_autocorrect by +1 without changing offense totals.","rubocop_reference":"vendor/rubocop-performance/lib/rubocop/cop/performance/count.rb","implemented_cop":"Performance/Count","tests":"cargo test --lib --quiet -- cop::performance::count","with_autocorrect_after":596,"missing_autocorrect_after":320,"offenses_benchmark":3992,"pre_post_guard":"count.rs + corrected.rb exact dirty set stable pre/post"}}
{"run":83,"commit":"9f7c882","metric":320,"metrics":{},"status":"discard","description":"Validation run on advanced HEAD confirmed Performance/Count autocorrect is already landed (with reject-negation + block-pass handling), with stable 596/320 and offense invariant 3992; no fresh local delta remained to attribute in this cycle.","timestamp":1775704070816,"segment":0,"confidence":15.785714285714286,"iterationTokens":30120,"asi":{"hypothesis":"Validate newly landed Performance/Count autocorrect and benchmark safety before attributing a keep.","rollback_reason":"Autocorrect implementation was already committed at HEAD (`9f7c88231`) before logging, so this run did not measure a new isolated patch.","next_action_hint":"Use 596/320 as the working baseline and pursue next unresolved idea (Rails/WhereRange) conservatively with strict offense-invariant gating.","tests":"cargo test --lib --quiet -- cop::performance::count","with_autocorrect_observed":596,"missing_autocorrect_observed":320,"offenses_benchmark":3992,"head_commit_validated":"9f7c88231"}}
{"run":79,"commit":"9f7c882","metric":0,"metrics":{},"status":"crash","description":"Rails/WhereRange autocorrect attempt failed to compile: used nonexistent Prism API `ArgumentsNode::opening_loc` in parenthesization helper.","timestamp":1775704219448,"segment":0,"confidence":null,"iterationTokens":13205,"asi":{"hypothesis":"Add RuboCop-aligned autocorrect for Rails/WhereRange while preserving existing offense patterns.","rollback_reason":"Compile error E0599 (`opening_loc` not found on `ruby_prism::ArgumentsNode`) blocked tests before validation.","next_action_hint":"Use conservative call-parenthesization logic without `opening_loc`, then rerun where_range tests + benchmark guard.","error":"E0599 no method `opening_loc` on ArgumentsNode","failing_command":"cargo test --lib --quiet -- cop::rails::where_range"}}
{"run":80,"commit":"9f7c882","metric":0,"metrics":{},"status":"crash","description":"Guarded multi-file validation failed attribution: during run, unrelated cop edits (casecmp/double_start_end_with/squeeze) disappeared, invalidating the bundled file-set assumptions.","timestamp":1775704445342,"segment":0,"confidence":null,"iterationTokens":15177,"asi":{"hypothesis":"Validate pending ArraySemiInfiniteRangeSlice autocorrect alongside all concurrently dirty Performance files with strict pre/post guards.","rollback_reason":"Post-run dirty set collapsed from 5 files to ArraySemiInfiniteRangeSlice-only, so bundled attribution was unsafe.","next_action_hint":"Immediately rerun in isolated mode for the surviving ArraySemiInfiniteRangeSlice source+corrected fixture only.","error_signature":"post-run dirty-file set changed from bundled to isolated"}}
{"run":84,"commit":"9f7c882","metric":320,"metrics":{},"status":"discard","description":"Attempted Performance/ArraySemiInfiniteRangeSlice autocorrect looked like 597/319 during run, but immediate post-run recheck reverted to 596/320 with no source diff present; treated as churn/non-persistent and not attributable.","timestamp":1775704493942,"segment":0,"confidence":14.258064516129032,"iterationTokens":32710,"asi":{"hypothesis":"Add RuboCop-aligned autocorrect for Performance/ArraySemiInfiniteRangeSlice (`[]/slice` with semi-infinite ranges -> `drop/take`) to reduce missing_autocorrect by 1.","rollback_reason":"Observed metric improvement did not persist; post-run `git diff` was empty and recount returned baseline 596/320.","next_action_hint":"Re-attempt in isolated worktree or reapply patch and verify `git diff` persistence immediately before logging.","tests":"cargo test --lib --quiet -- cop::performance::array_semi_infinite_range_slice","with_autocorrect_observed_during_run":597,"missing_autocorrect_observed_during_run":319,"with_autocorrect_recheck":596,"missing_autocorrect_recheck":320,"offenses_benchmark":3992}}
{"run":81,"commit":"9f7c882","metric":0,"metrics":{},"status":"crash","description":"Bundled validation attempt aborted at preflight: expected multi-file dirty set collapsed instantly to ArraySemiInfiniteRangeSlice source+fixture only.","timestamp":1775704650043,"segment":0,"confidence":null,"iterationTokens":12511,"asi":{"hypothesis":"Validate combined pending autocorrect set (ArraySemiInfiniteRangeSlice + WhereRange + transient Performance files) in one guarded run.","rollback_reason":"Preflight guard failed because concurrent worktree churn removed all files except ArraySemiInfiniteRangeSlice before tests started.","next_action_hint":"Run isolated guarded experiment for the surviving ArraySemiInfiniteRangeSlice pair immediately.","error_signature":"preflight dirty-set collapse to array_semi_infinite_range_slice only"}}
{"run":85,"commit":"9f7c882","metric":320,"metrics":{},"status":"discard","description":"Re-applied ArraySemiInfiniteRangeSlice autocorrect patch and validated 597/319 in-run, but immediate post-run recheck again reverted to baseline 596/320 with no persisted source diff; treating as non-persistent churn and discarding attribution.","timestamp":1775704706878,"segment":0,"confidence":13,"iterationTokens":8084,"asi":{"hypothesis":"Land RuboCop-aligned autocorrect for Performance/ArraySemiInfiniteRangeSlice to move baseline from 596/320 to 597/319 while keeping offenses at 3992.","rollback_reason":"Patch state disappeared before logging; `git diff` empty and recount returned baseline immediately after run.","next_action_hint":"Switch to isolated execution path (worktree/subagent branch) and only log after verifying patch persistence post-run.","tests":"cargo test --lib --quiet -- cop::performance::array_semi_infinite_range_slice","with_autocorrect_observed_during_run":597,"missing_autocorrect_observed_during_run":319,"with_autocorrect_recheck":596,"missing_autocorrect_recheck":320,"offenses_benchmark":3992}}
{"run":82,"commit":"9f7c882","metric":0,"metrics":{},"status":"crash","description":"Rails/WhereRange autocorrect attempt failed tests: regex backreference `\\1` in Rust regex is unsupported, poisoning LazyLock and preventing offense/autocorrect matching.","timestamp":1775704820812,"segment":0,"confidence":null,"iterationTokens":5393,"asi":{"hypothesis":"Enable RuboCop-style WhereRange autocorrect using regex-based SQL pattern parsing for anonymous/named ranges.","rollback_reason":"Rust `regex` does not support backreferences; RANGE_* regex initialization panicked and no corrections were produced.","next_action_hint":"Replace backreference-based range matching with manual two-column equality checks (parse both column tokens and compare), then rerun where_range tests.","error":"regex parse error: backreferences are not supported","failing_tests":"cop::rails::where_range::{offense_fixture,no_offense_fixture,autocorrect_fixture}"}}
{"run":83,"commit":"d26776f","metric":597,"metrics":{},"status":"keep","description":"Added RuboCop-aligned autocorrect for Performance/TimesMap by rewriting `times.map/collect` block forms to `Array.new(count) { ... }` (including block-pass and argument parity), with corrected fixture coverage; targeted tests pass and benchmark offenses remain 3992.","timestamp":1775705017596,"segment":0,"confidence":null,"iterationTokens":9421,"asi":{"hypothesis":"Port RuboCop Performance/TimesMap autocorrect so offense chains have deterministic Array.new rewrites and improve autocorrect coverage by +1.","rubocop_reference":"vendor/rubocop-performance/lib/rubocop/cop/performance/times_map.rb","implemented_cop":"Performance/TimesMap","tests":"cargo test --lib --quiet -- cop::performance::times_map","with_autocorrect_after":597,"missing_autocorrect_after":319,"offenses_benchmark":3992,"pre_post_guard":"times_map.rs + corrected.rb stable pre/post"}}
{"run":86,"commit":"aad5169","metric":319,"metrics":{},"status":"keep","description":"Added RuboCop-aligned autocorrect for Performance/TimesMap by rewriting `n.times.map/collect` offense nodes to `Array.new(n)` with block or block-pass parity, plus corrected fixture coverage; targeted tests pass and benchmark offense invariant remains 3992.","timestamp":1775705022514,"segment":0,"confidence":12.742857142857142,"iterationTokens":8084,"asi":{"hypothesis":"Implement TimesMap autocorrect to reduce missing_autocorrect by one while preserving offense-count invariant.","tests":"cargo test --lib --quiet -- cop::performance::times_map","with_autocorrect_observed":597,"missing_autocorrect_observed":319,"offenses_benchmark":3992,"ruboCop_alignment":"Mirrors RuboCop replacement strategy for map/collect chains on times receiver, including block-pass handling and safe-navigation exclusion"}}
{"run":84,"commit":"aad5169","metric":0,"metrics":{},"status":"crash","description":"Bundled ArraySemiInfiniteRangeSlice+FlatMap validation aborted at preflight: dirty set collapsed to FlatMap-only before tests started.","timestamp":1775705206930,"segment":0,"confidence":null,"iterationTokens":12005,"asi":{"hypothesis":"Validate two isolated Performance autocorrect additions together (+2 coverage) with strict file-set guards.","rollback_reason":"Preflight guard failed when ArraySemiInfiniteRangeSlice source/fixture disappeared under churn, leaving only FlatMap edits.","next_action_hint":"Run isolated FlatMap experiment immediately against the surviving source+corrected fixture pair.","error_signature":"preflight file-set collapse to flat_map only"}}
{"run":87,"commit":"aad5169","metric":319,"metrics":{},"status":"discard","description":"FlatMap autocorrect patch compiled and tests passed, but run metric parsed as 597/319 while immediate post-run recount with same diff was 598/318; treated as unstable/confounded measurement in shared-tree churn, so not attributed.","timestamp":1775705337772,"segment":0,"confidence":12.38888888888889,"iterationTokens":11881,"asi":{"hypothesis":"Add RuboCop-aligned autocorrect for Performance/FlatMap (`map/collect...flatten(1)` -> `flat_map`) with corrected fixture coverage.","rollback_reason":"Primary metric from run_experiment (319 missing) conflicted with immediate persistence recheck (318 missing), indicating non-deterministic/churned measurement for this cycle.","next_action_hint":"Re-run FlatMap in a fresh cycle and log only when parsed METRIC and immediate recount agree.","tests":"cargo test --lib --quiet -- cop::performance::flat_map","with_autocorrect_parsed":597,"missing_autocorrect_parsed":319,"with_autocorrect_recheck":598,"missing_autocorrect_recheck":318,"offenses_benchmark":3992}}
{"run":85,"commit":"aad5169","metric":0,"metrics":{},"status":"crash","description":"FlatMap guarded run passed tests/benchmark but failed attribution guard because `flat_map/corrected.rb` transitioned from untracked to tracked during the run.","timestamp":1775705409185,"segment":0,"confidence":null,"iterationTokens":3986,"asi":{"hypothesis":"Land isolated FlatMap autocorrect (`map/collect...flatten(1)` -> `flat_map`) with explicit source+fixture guards.","rollback_reason":"Post-run file-set differed from preflight (`corrected.rb` no longer untracked), invalidating strict guard assumptions.","next_action_hint":"Rerun immediately with updated guard expecting only `src/cop/performance/flat_map.rs` dirty while tracked fixture remains present.","error_signature":"pre/post guard mismatch due fixture tracking transition"}}
{"run":86,"commit":"aad5169","metric":0,"metrics":{},"status":"crash","description":"FlatMap autocorrect build failed: `cop_autocorrect_fixture_tests!` requires `tests/fixtures/cops/performance/flat_map/corrected.rb`, which was absent.","timestamp":1775705500175,"segment":0,"confidence":null,"iterationTokens":3893,"asi":{"hypothesis":"Enable Performance/FlatMap autocorrect with selector rewrite + flatten(1) tail removal.","rollback_reason":"Compile-time include_bytes error because corrected fixture file did not exist.","next_action_hint":"Add `tests/fixtures/cops/performance/flat_map/corrected.rb` matching offense rewrites, then rerun isolated guarded validation.","error":"include_bytes missing tests/fixtures/cops/performance/flat_map/corrected.rb","failing_command":"cargo test --lib --quiet -- cop::performance::flat_map"}}
{"run":88,"commit":"aad5169","metric":0,"metrics":{},"status":"crash","description":"Attempted Performance/RedundantSortBlock autocorrect run crashed in targeted tests because `supports_autocorrect`/corrections were absent at execution time (no corrections emitted).","timestamp":1775705583782,"segment":0,"confidence":12.38888888888889,"iterationTokens":11556,"asi":{"hypothesis":"Enable RuboCop-aligned autocorrect for Performance/RedundantSortBlock (`sort { |a,b| a <=> b }` -> `sort`) with corrected fixture coverage.","rollback_reason":"Run failed: supports_autocorrect assertion false and autocorrect fixture reported no corrections, indicating patch did not apply/persist during execution.","next_action_hint":"Re-check file persistence immediately before run and use a single contiguous edit+run cycle on one file.","tests":"cargo test --lib --quiet -- cop::performance::redundant_sort_block","error_excerpt":"assertion failed: RedundantSortBlock.supports_autocorrect(); Cop produced no corrections"}}
{"run":87,"commit":"aad5169","metric":0,"metrics":{},"status":"crash","description":"RedundantSortBlock validation passed tests/benchmark but attribution failed: target source+fixture vanished post-run and dirty state switched to unrelated `big_decimal_with_numeric_argument.rs`.","timestamp":1775705664381,"segment":0,"confidence":null,"iterationTokens":5738,"asi":{"hypothesis":"Land isolated RedundantSortBlock autocorrect (`sort { |a,b| a <=> b }` -> `sort`) with corrected fixture coverage.","rollback_reason":"Post-run worktree mutated to a different cop file, so measured metrics were not attributable to RedundantSortBlock patch.","next_action_hint":"Run the next experiment only against the file that survives immediately before execution (`big_decimal_with_numeric_argument.rs`).","error_signature":"post-run dirty-file swap redundant_sort_block -> big_decimal_with_numeric_argument"}}
{"run":89,"commit":"aad5169","metric":0,"metrics":{},"status":"crash","description":"FlatMap autocorrect attempt crashed: targeted tests reported `supports_autocorrect` false and no corrections emitted, indicating source edits were not present at execution time.","timestamp":1775705803765,"segment":0,"confidence":12.38888888888889,"iterationTokens":10936,"asi":{"hypothesis":"Enable RuboCop-aligned autocorrect for Performance/FlatMap (`map/collect...flatten(1)` -> `flat_map`) with corrected fixture coverage.","rollback_reason":"Run failed before metric collection because expected FlatMap autocorrect hooks were missing during test execution.","next_action_hint":"Investigate/mitigate shared-tree churn that is dropping source edits before test execution; verify file content immediately before run in a stable environment.","tests":"cargo test --lib --quiet -- cop::performance::flat_map","error_excerpt":"assertion failed: FlatMap.supports_autocorrect(); Cop Performance/FlatMap produced no corrections"}}
{"run":90,"commit":"aad5169","metric":319,"metrics":{},"status":"discard","description":"Baseline sanity run after pruning ideas confirmed stable 597/319 and offense invariant 3992 with no code delta; recorded as control run while workspace-churn mitigation is prioritized.","timestamp":1775705880182,"segment":0,"confidence":12.054054054054054,"iterationTokens":1878,"asi":{"hypothesis":"Validate current baseline after repeated non-persistent edit incidents to ensure metric and offense invariants remain stable.","rollback_reason":"No source-level optimization was applied in this cycle; control measurement only.","next_action_hint":"Next attempt should start with a persistence check strategy, then implement one small autocorrect cop (FlatMap or ArraySemiInfiniteRangeSlice) and log only if patch survives to post-run diff.","with_autocorrect_observed":597,"missing_autocorrect_observed":319,"offenses_benchmark":3992}}
{"run":88,"commit":"aad5169","metric":0,"metrics":{},"status":"crash","description":"BigDecimalWithNumericArgument run passed tests/benchmark but post-run attribution guard failed: source+corrected fixture disappeared before logging, reverting to baseline 597/319.","timestamp":1775705887343,"segment":0,"confidence":null,"iterationTokens":7130,"asi":{"hypothesis":"Add RuboCop-aligned autocorrect for BigDecimal numeric literals and to_d forms with corrected fixture coverage.","rollback_reason":"Post-run dirty files vanished under shared-tree churn, so measured metrics were non-attributable to persistent code changes.","next_action_hint":"Either run in isolated worktree or only keep runs where source+fixture files still exist immediately after benchmark.","error_signature":"post-run dirty-set collapse to baseline"}}
{"run":91,"commit":"aad5169","metric":318,"metrics":{},"status":"discard","description":"Run reported 598/318 with invariant 3992, but attempted RedundantSortBlock source/fixture diffs disappeared before logging and the only remaining delta was unrelated churn in `src/cop/rails/where_range.rs`; treated as confounded/non-attributable.","timestamp":1775706130548,"segment":0,"confidence":11.736842105263158,"iterationTokens":3615,"asi":{"hypothesis":"Add RuboCop-aligned autocorrect for Performance/RedundantSortBlock (`sort { |a,b| a <=> b }` -> `sort`) and reduce missing_autocorrect by 1.","rollback_reason":"Observed improvement could not be tied to persistent RedundantSortBlock changes; patch vanished and unrelated where_range churn remained.","next_action_hint":"Retry on a clean tree and require intended cop source + fixture diffs to persist immediately before log_experiment.","tests":"cargo test --lib --quiet -- cop::performance::redundant_sort_block","with_autocorrect_parsed":598,"missing_autocorrect_parsed":318,"offenses_benchmark":3992,"confounder":"unrelated src/cop/rails/where_range.rs working-tree change"}}
{"run":89,"commit":"aad5169","metric":0,"metrics":{},"status":"crash","description":"WhereRange test run failed: offense location started at selector (col 5, expected col 0) and generic autocorrect fixture test ran without TargetRailsVersion, so no corrections were emitted.","timestamp":1775706164721,"segment":0,"confidence":null,"iterationTokens":6810,"asi":{"hypothesis":"Land Rails/WhereRange autocorrect with manual SQL parser while preserving existing fixtures.","rollback_reason":"Fixture assertions failed due incorrect offense anchor and missing Rails-configured autocorrect test harness.","next_action_hint":"Anchor diagnostic to call start (column 0) and replace generic `cop_autocorrect_fixture_tests!` with `assert_cop_autocorrect_with_config(..., rails_config())`.","failing_tests":"cop::rails::where_range::{offense_fixture,autocorrect_fixture}"}}
{"run":92,"commit":"aad5169","metric":0,"metrics":{},"status":"crash","description":"Added a persistence/confounder guard to RedundantSortBlock attempt; targeted tests passed but guard failed because required source diff disappeared before metric collection (`src/cop/performance/redundant_sort_block.rs` missing).","timestamp":1775706292071,"segment":0,"confidence":11.736842105263158,"iterationTokens":6571,"asi":{"hypothesis":"Require intended patch files to persist through validation to avoid misattributed keeps under shared-tree churn.","rollback_reason":"Experiment aborted by guard: intended cop diff vanished during run, so metrics were not trustworthy for attribution.","next_action_hint":"Use stronger isolation (dedicated clean worktree/branch session) before attempting additional autocorrect implementations.","tests":"cargo test --lib --quiet -- cop::performance::redundant_sort_block","guard_failure":"Required diff missing: src/cop/performance/redundant_sort_block.rs"}}
{"run":90,"commit":"aad5169","metric":0,"metrics":{},"status":"crash","description":"WhereRange implementation passed full targeted tests and benchmark invariant, but post-run dirty-file guard failed: `where_range.rs` vanished and counts reverted to baseline 597/319.","timestamp":1775706379119,"segment":0,"confidence":null,"iterationTokens":10925,"asi":{"hypothesis":"Add conservative Rails/WhereRange autocorrect (manual parser + Rails-configured autocorrect fixture test) to raise with_autocorrect by +1.","rollback_reason":"Post-run worktree churn removed the edited source file before logging, making the metric non-attributable.","next_action_hint":"Need isolated workspace/worktree to preserve file state through long benchmark; current shared tree is too volatile for keep decisions.","tests":"cargo test --lib --quiet -- cop::rails::where_range","with_autocorrect_observed_during_run":598,"missing_autocorrect_observed_during_run":318,"offenses_benchmark":3992,"error_signature":"post-run where_range.rs disappeared"}}
