{"run":430,"commit":"5435412","metric":611,"metrics":{},"status":"keep","description":"Added conservative RuboCop-aligned autocorrect for Performance/RedundantMerge by rewriting single-pair `merge!` offenses to `[]=` assignments (including each_with_object accumulator cases), with corrected fixture coverage; benchmark offense invariant remains 3992.","timestamp":1775755582811,"segment":1,"confidence":21.43859649122807,"iterationTokens":6424,"asi":{"hypothesis":"RedundantMerge can safely gain baseline autocorrect by handling only deterministic single-pair `merge!` rewrites and leaving multi-pair/modifier reordering paths diagnostic-only for now.","rubocop_reference":"vendor/rubocop-performance/lib/rubocop/cop/performance/redundant_merge.rb","implemented_cop":"Performance/RedundantMerge","tests":"cargo test --lib --quiet -- cop::performance::redundant_merge","with_autocorrect_after":611,"missing_autocorrect_after":305,"offenses_benchmark":3992,"known_gap":"Multi-pair merge! autocorrect and modifier-form restructuring are intentionally deferred."}}
{"run":431,"commit":"5435412","metric":0,"metrics":{},"status":"crash","description":"Attempted to add conservative autocorrect for Performance/Sum (selector rewrite for no-block symbol forms), but compile failed due to invalid Diagnostic field usage (`correctable`).","timestamp":1775755954874,"segment":1,"confidence":21.43859649122807,"iterationTokens":6424,"asi":{"hypothesis":"Performance/Sum can gain safe baseline autocorrect by replacing only no-block `inject/reduce(:+)` and `(init, :+)` selectors with `sum`/`sum(init)` while leaving block/block-pass cases unchanged.","rollback_reason":"Build failed with E0609 because `Diagnostic` has no `correctable` field.","next_action_hint":"Remove invalid field write, rerun targeted sum tests, then re-evaluate fixture/correction parity.","error":"E0609 no field `correctable` on diagnostic::Diagnostic at src/cop/performance/sum.rs:523"}}
{"run":432,"commit":"6893222","metric":612,"metrics":{},"status":"keep","description":"Added conservative RuboCop-aligned autocorrect support for Performance/Sum by rewriting no-block `inject/reduce(:+)` and `(init, :+)` forms to `sum`/`sum(init)` selector replacements; block and block-pass variants remain diagnostic-only. Added autocorrect fixture coverage; offense invariant remains 3992.","timestamp":1775756140381,"segment":1,"confidence":21.857142857142858,"iterationTokens":21953,"asi":{"hypothesis":"A safe baseline for Performance/Sum autocorrect is to only rewrite selector spans for no-block symbol-argument forms, avoiding block/block-pass semantics differences.","rubocop_reference":"vendor/rubocop-performance/lib/rubocop/cop/performance/sum.rb","implemented_cop":"Performance/Sum","tests":"cargo test --lib --quiet -- cop::performance::sum","with_autocorrect_after":612,"missing_autocorrect_after":304,"offenses_benchmark":3992,"deferred_paths":"Autocorrect for block and block-pass forms plus map/collect...sum transformations remains for parity follow-up."}}
{"run":433,"commit":"6893222","metric":0,"metrics":{},"status":"checks_failed","description":"Attempted to add autocorrect for Performance/BlockGivenWithExplicitBlock by replacing `block_given?` calls with explicit block-param variable, but autocorrect fixture mismatch failed targeted tests.","timestamp":1775756374443,"segment":1,"confidence":21.857142857142858,"iterationTokens":16908,"asi":{"hypothesis":"This cop can safely mirror RuboCop autocorrect by replacing `block_given?`/`Kernel.block_given?`/`::Kernel.block_given?` with the explicit `&block` param name.","rollback_reason":"`cop::performance::block_given_with_explicit_block::tests::autocorrect_fixture` failed; corrected fixture and/or replacement spans are not aligned yet.","next_action_hint":"Inspect fixture diff from experiment log, align corrected fixture with actual correction output, and rerun targeted tests before benchmark gate.","failing_test":"cop::performance::block_given_with_explicit_block::tests::autocorrect_fixture"}}
{"run":434,"commit":"90d0d89","metric":613,"metrics":{},"status":"keep","description":"Added RuboCop-aligned autocorrect for Performance/BlockGivenWithExplicitBlock by replacing flagged `block_given?`/`Kernel.block_given?`/`::Kernel.block_given?` calls with the explicit block parameter name; added corrected fixture coverage and preserved offense invariant 3992.","timestamp":1775756593431,"segment":1,"confidence":21.892857142857142,"iterationTokens":6663,"asi":{"hypothesis":"This cop can safely autocorrect by replacing each flagged `block_given?` call expression with the method's explicit `&block` parameter variable, while preserving reassignment guards.","rubocop_reference":"vendor/rubocop-performance/lib/rubocop/cop/performance/block_given_with_explicit_block.rb","implemented_cop":"Performance/BlockGivenWithExplicitBlock","tests":"cargo test --lib --quiet -- cop::performance::block_given_with_explicit_block","with_autocorrect_after":613,"missing_autocorrect_after":303,"offenses_benchmark":3992,"notes":"Correction spans replace the whole call expression, so contexts like negation, ternary, args, and default values remain syntactically valid."}}
{"run":435,"commit":"4716f91","metric":614,"metrics":{},"status":"keep","description":"Added RuboCop-aligned autocorrect support for Performance/RegexpMatch: `match` selector rewrites to `match?`, `=~`/`!~` and `===` forms rewrite to `match?` predicate expressions with conservative receiver/arg handling; added autocorrect unit coverage and preserved offense invariant 3992.","timestamp":1775756793757,"segment":1,"confidence":21.928571428571427,"iterationTokens":11387,"asi":{"hypothesis":"RegexpMatch can gain safe baseline autocorrect by rewriting flagged condition expressions to `match?` while retaining existing MatchData-use guards.","rubocop_reference":"vendor/rubocop-performance/lib/rubocop/cop/performance/regexp_match.rb","implemented_cop":"Performance/RegexpMatch","tests":"cargo test --lib --quiet -- cop::performance::regexp_match","with_autocorrect_after":614,"missing_autocorrect_after":302,"offenses_benchmark":3992,"limitations":"Does not yet include full RuboCop parity for all operator edge forms or fixture-wide autocorrect snapshots; currently covered by targeted autocorrect unit tests."}}
{"run":436,"commit":"74c4667","metric":615,"metrics":{},"status":"keep","description":"Added conservative autocorrect support for Performance/CaseWhenSplat: for offending `when` branches with mixed condition lists, reorder branch-local conditions to put non-splats before splats (e.g. `when *Foo, Bar` -> `when Bar, *Foo`), with corrected fixture coverage; benchmark offense invariant remains 3992.","timestamp":1775757021476,"segment":1,"confidence":21.964285714285715,"iterationTokens":12561,"asi":{"hypothesis":"CaseWhenSplat can safely gain a baseline autocorrect by limiting rewrites to in-branch condition-list reordering instead of full branch movement.","rubocop_reference":"vendor/rubocop-performance/lib/rubocop/cop/performance/case_when_splat.rb","implemented_cop":"Performance/CaseWhenSplat","tests":"cargo test --lib --quiet -- cop::performance::case_when_splat","with_autocorrect_after":615,"missing_autocorrect_after":301,"offenses_benchmark":3992,"deferred_paths":"Full RuboCop parity branch-reorder autocorrect (moving offending when branches to end, preserving comments/then forms) remains deferred."}}
{"run":437,"commit":"cf033da","metric":616,"metrics":{},"status":"keep","description":"Added conservative autocorrect support for Performance/FixedSize by rewriting statically-sized literal `.size/.length/.count` calls to integer literals (strings/symbols/arrays/hashes with no dynamic splats and no count args), with corrected fixture coverage; offense invariant remains 3992.","timestamp":1775757327289,"segment":1,"confidence":22,"iterationTokens":19188,"asi":{"hypothesis":"FixedSize can safely autocorrect the deterministic literal-size subset by replacing entire calls with computed integer literals while leaving dynamic/arg-dependent count cases unchanged.","rubocop_reference":"vendor/rubocop-performance/lib/rubocop/cop/performance/fixed_size.rb (no autocorrect there; implemented conservative nitrocop-only baseline)","implemented_cop":"Performance/FixedSize","tests":"cargo test --lib --quiet -- cop::performance::fixed_size","with_autocorrect_after":616,"missing_autocorrect_after":300,"offenses_benchmark":3992,"deferred_paths":"Do not autocorrect `count` with arguments or dynamic splat-containing literal receivers."}}
{"run":438,"commit":"cf033da","metric":0,"metrics":{},"status":"crash","description":"Attempted to add conservative autocorrect for Performance/MapMethodChain (collapse chained symbol maps into single `map { |e| ... }`), but compile failed from call-node traversal type mismatches (`Option<&CallNode>` vs `Option<CallNode>`).","timestamp":1775757551024,"segment":1,"confidence":22,"iterationTokens":1569,"asi":{"hypothesis":"MapMethodChain can gain baseline autocorrect by collapsing deterministic symbol-map chains while skipping safe-navigation chains.","rollback_reason":"Rust type mismatch errors (E0308) in new chain traversal helper prevented build/test execution.","next_action_hint":"Refactor traversal to avoid owned-vs-borrowed CallNode mismatch (likely by collecting chain nodes during initial check pass) before reattempting.","error":"E0308 in src/cop/performance/map_method_chain.rs at cursor/c reassignment."}}
{"run":439,"commit":"cf033da","metric":0,"metrics":{},"status":"crash","description":"Re-attempted MapMethodChain conservative two-hop autocorrect, but compile failed due moved `inner_call` borrow after assigning chain start.","timestamp":1775757670647,"segment":1,"confidence":22,"iterationTokens":11664,"asi":{"hypothesis":"A safe baseline autocorrect can rewrite exactly two-hop symbol map chains to one block map while skipping safe-navigation and longer chains.","rollback_reason":"Build failed with E0382 borrow-of-moved-value on `inner_call` in MapMethodChain.","next_action_hint":"Store inner call start offset before moving into chain traversal, then rerun targeted tests.","error":"E0382 borrow of moved value inner_call at src/cop/performance/map_method_chain.rs:156"}}
{"run":440,"commit":"cf033da","metric":0,"metrics":{},"status":"checks_failed","description":"Attempted conservative autocorrect for Performance/MethodObjectAsBlock by replacing `&method(:sym)` block-pass nodes with explicit `{ |arg| ... }` blocks, but fixture mismatch showed replacement shape was incorrect in call context.","timestamp":1775757826122,"segment":1,"confidence":22,"iterationTokens":5892,"asi":{"hypothesis":"MethodObjectAsBlock can gain baseline autocorrect by converting simple `&method(:sym)` usages into explicit one-arg blocks.","rollback_reason":"Autocorrect fixture failed; replacing only block-pass argument range produced non-parity call formatting/structure.","next_action_hint":"Rework correction to replace the entire call expression (or selector+args region) rather than only the block-pass token, then revalidate fixtures.","failing_test":"cop::performance::method_object_as_block::tests::autocorrect_fixture"}}
{"run":441,"commit":"cf033da","metric":0,"metrics":{},"status":"crash","description":"MapMethodChain autocorrect attempt failed to compile (borrow of moved `inner_call` after chain traversal move).","timestamp":1775758234041,"segment":1,"confidence":22,"iterationTokens":5892,"asi":{"hypothesis":"Two-hop symbol map chains can be autocorrected conservatively into a single block map while leaving longer/safe-nav chains unchanged.","rollback_reason":"Build failed with E0382 borrow-of-moved-value for `inner_call` in map_method_chain autocorrect guard.","next_action_hint":"Clone/store inner call for autocorrect path before moving into chain_start traversal, then rerun targeted tests.","error":"E0382 at src/cop/performance/map_method_chain.rs:157"}}
{"run":442,"commit":"e4c1461","metric":617,"metrics":{},"status":"keep","description":"Added conservative autocorrect for Performance/SelectMap: direct `select/filter(&:pred).map(&:mapper)` chains now rewrite to `filter_map { |o| o.mapper if o.pred }` (including receiverless and chained-receiver forms), while complex block/bare-enumerator patterns remain diagnostic-only. Offense invariant remains 3992.","timestamp":1775758365422,"segment":1,"confidence":22.035714285714285,"iterationTokens":6279,"asi":{"hypothesis":"SelectMap can safely gain baseline autocorrect by limiting rewrites to deterministic symbol block-pass direct chains and skipping complex block-body/bare select forms.","rubocop_reference":"vendor/rubocop-rails/lib/rubocop/cop/rails/select_map.rb (autocorrect behavior inspiration)","implemented_cop":"Performance/SelectMap","tests":"cargo test --lib --quiet -- cop::performance::select_map","with_autocorrect_after":617,"missing_autocorrect_after":299,"offenses_benchmark":3992,"deferred_paths":"Autocorrect for block-form chains and block-body candidate patterns remains deferred for parity/safety."}}
{"run":443,"commit":"e4c1461","metric":0,"metrics":{},"status":"crash","description":"MapMethodChain autocorrect retry failed to compile because `ruby_prism::CallNode` is not clonable; attempted clone-based ownership workaround is invalid.","timestamp":1775758526085,"segment":1,"confidence":22.035714285714285,"iterationTokens":9307,"asi":{"hypothesis":"Two-hop symbol map chains can be autocorrected conservatively, but implementation must avoid moving non-clone CallNode values.","rollback_reason":"Build failed with E0599 (`CallNode` has no `clone`).","next_action_hint":"Avoid retaining owned CallNode instances for autocorrect; derive needed offsets/symbol names/base source before moving into traversal, or restructure to avoid move entirely.","error":"E0599 no method clone for ruby_prism::CallNode at src/cop/performance/map_method_chain.rs:104"}}
{"run":444,"commit":"d8f39bb","metric":618,"metrics":{},"status":"keep","description":"Added conservative autocorrect support for Performance/OpenStruct: zero-argument `OpenStruct.new` now autocorrects to `Struct.new.new`, while argument-bearing forms remain diagnostic-only. Added corrected fixture coverage; offense invariant remains 3992.","timestamp":1775758650420,"segment":1,"confidence":22.071428571428573,"iterationTokens":2706,"asi":{"hypothesis":"OpenStruct can incrementally gain safe baseline autocorrect by handling only deterministic zero-arg constructor calls and deferring non-trivial keyed-constructor rewrites.","rubocop_reference":"vendor/rubocop-performance/lib/rubocop/cop/performance/open_struct.rb (no upstream autocorrect)","implemented_cop":"Performance/OpenStruct","tests":"cargo test --lib --quiet -- cop::performance::open_struct","with_autocorrect_after":618,"missing_autocorrect_after":298,"offenses_benchmark":3992,"deferred_paths":"Keyword/hash argument OpenStruct.new rewrites to Struct equivalents are deferred due semantics/shape risk."}}
{"run":445,"commit":"e3cb023","metric":619,"metrics":{},"status":"keep","description":"Added conservative autocorrect support for Performance/MethodObjectAsBlock by rewriting simple `&method(:sym)` block-pass calls to explicit one-arg block forms (e.g., `arr.map(&method(:foo))` -> `arr.map { |arg| foo(arg) }`), with corrected fixture coverage; offense invariant remains 3992.","timestamp":1775758876549,"segment":1,"confidence":22.107142857142858,"iterationTokens":9945,"asi":{"hypothesis":"MethodObjectAsBlock can safely autocorrect baseline patterns by replacing whole call expressions with explicit single-argument blocks derived from `method(:sym)` targets.","rubocop_reference":"vendor/rubocop-performance/lib/rubocop/cop/performance/method_object_as_block.rb","implemented_cop":"Performance/MethodObjectAsBlock","tests":"cargo test --lib --quiet -- cop::performance::method_object_as_block","with_autocorrect_after":619,"missing_autocorrect_after":297,"offenses_benchmark":3992,"deferred_paths":"Edge cases with complex argument lists/alternate block-pass placements may need additional parity hardening."}}
{"run":446,"commit":"e3cb023","metric":0,"metrics":{},"status":"checks_failed","description":"MapMethodChain conservative autocorrect compiled but failed fixture parity: unexpectedly rewrote safe-navigation chain and partially rewrote triple chain.","timestamp":1775759105229,"segment":1,"confidence":22.107142857142858,"iterationTokens":9156,"asi":{"hypothesis":"Two-hop symbol map chains can be autocorrected conservatively, but additional guards are required for safe-navigation and multi-hop chains.","rollback_reason":"Autocorrect fixture mismatch showed semantic drift for `items&.map...` and triple-chain shape.","next_action_hint":"Add explicit safe-navigation guard on inner call and align expected behavior for multi-hop chains (either skip or codify partial rewrite) before re-running.","failing_test":"cop::performance::map_method_chain::tests::autocorrect_fixture"}}
{"run":447,"commit":"090e63a","metric":620,"metrics":{},"status":"keep","description":"Added conservative autocorrect support for Performance/MapMethodChain: direct two-hop symbol chains now rewrite to a single block map (`map(&:a).map(&:b)` -> `map { |e| e.a.b }`), while safe-navigation and deeper multi-hop chains remain partially/fully uncorrected by design. Offense invariant remains 3992.","timestamp":1775759323210,"segment":1,"confidence":22.142857142857142,"iterationTokens":7503,"asi":{"hypothesis":"MapMethodChain can safely gain baseline autocorrect by restricting rewrites to deterministic two-hop symbol map chains and guarding against safe-navigation semantics drift.","rubocop_reference":"vendor/rubocop-performance/lib/rubocop/cop/performance/map_method_chain.rb (no upstream autocorrect)","implemented_cop":"Performance/MapMethodChain","tests":"cargo test --lib --quiet -- cop::performance::map_method_chain","with_autocorrect_after":620,"missing_autocorrect_after":296,"offenses_benchmark":3992,"deferred_paths":"Full multi-hop normalization and broader parity semantics remain deferred."}}
{"run":448,"commit":"090e63a","metric":621,"metrics":{},"status":"keep","description":"Added conservative autocorrect support for Rails/SelectMap: direct `select(:col).map/collect(&:col)` and receiverless `select(:col).map(&:col)` now rewrite to `pluck(:col)`, while intermediate-chain forms remain diagnostic-only. Offense invariant remains 3992.","timestamp":1775759597899,"segment":1,"confidence":21.789473684210527,"iterationTokens":1628,"asi":{"hypothesis":"Rails/SelectMap can gain safe baseline autocorrect by limiting rewrites to direct select->map/collect symbol chains and deferring intermediate-chain rewrites.","rubocop_reference":"vendor/rubocop-rails/lib/rubocop/cop/rails/select_map.rb","implemented_cop":"Rails/SelectMap","tests":"cargo test --lib --quiet -- cop::rails::select_map","with_autocorrect_after":621,"missing_autocorrect_after":295,"offenses_benchmark":3992,"deferred_paths":"Autocorrect for chains with intermediate methods between select and map/collect remains deferred."}}
{"run":449,"commit":"1416d1f","metric":621,"metrics":{},"status":"keep","description":"Re-ran Rails/SelectMap keep cycle after transient git index-lock issue; conservative direct-chain autocorrect remains valid at 621/295 with benchmark offense invariant 3992.","timestamp":1775759634452,"segment":1,"confidence":21.413793103448278,"iterationTokens":1790,"asi":{"hypothesis":"Prior keep for Rails/SelectMap is stable; rerun confirms no benchmark overfit and allows clean commit retry.","with_autocorrect_after":621,"missing_autocorrect_after":295,"offenses_benchmark":3992,"recovery":"Transient index.lock condition cleared before rerun commit attempt."}}
{"run":450,"commit":"3fea411","metric":622,"metrics":{},"status":"keep","description":"Added conservative autocorrect support for Rails/IndexWith by rewriting direct `map { [el, value] }.to_h`, `to_h { [el, value] }`, and `each_with_object({}) { |el, memo| memo[el] = value }` patterns to `index_with` forms. Added rails-version-aware autocorrect unit coverage; offense invariant remains 3992.","timestamp":1775760131578,"segment":1,"confidence":21.448275862068964,"iterationTokens":3413,"asi":{"hypothesis":"Rails/IndexWith can safely gain baseline autocorrect by handling the core direct patterns already detected by the cop while deferring more complex shapes.","rubocop_reference":"vendor/rubocop-rails/lib/rubocop/cop/rails/index_with.rb","implemented_cop":"Rails/IndexWith","tests":"cargo test --lib --quiet -- cop::rails::index_with","with_autocorrect_after":622,"missing_autocorrect_after":294,"offenses_benchmark":3992,"deferred_paths":"Hash[map { ... }] and broader block-shape autocorrect parity can be added later with stronger range handling."}}
{"run":451,"commit":"1b3ef78","metric":623,"metrics":{},"status":"keep","description":"Added conservative autocorrect support for Rails/IndexBy for direct block-param patterns, rewriting `map { |e| [key, e] }.to_h`, `to_h { |e| [key, e] }`, and `each_with_object({}) { |e, memo| memo[key] = e }` into `index_by { |e| key }`. Added explicit autocorrect unit coverage; benchmark offense invariant remains 3992.","timestamp":1775760533133,"segment":1,"confidence":21.482758620689655,"iterationTokens":1198,"asi":{"hypothesis":"Rails/IndexBy can safely mirror the same conservative direct-pattern autocorrect strategy used for Rails/IndexWith while leaving numbered/it/Hash[map] variants diagnostic-only.","implemented_cop":"Rails/IndexBy","rubocop_reference":"~/Dev/rubocop and existing nitrocop index_by detection behavior","tests":"cargo test --lib --quiet -- cop::rails::index_by","with_autocorrect_after":623,"missing_autocorrect_after":293,"offenses_benchmark":3992,"deferred_paths":"Numbered/it block forms and Hash[map] autocorrect parity require additional range-safe rewriting."}}
