{"run":473,"commit":"57e39ac","metric":641,"metrics":{},"status":"keep","description":"Added conservative autocorrect support for RSpecRails/HttpStatus. Baseline autocorrect handles symbolic style integer forms by rewriting `have_http_status 200` to `have_http_status :ok` when canonical mapping exists; other style pathways remain diagnostic-only. Added supports_autocorrect and targeted autocorrect unit coverage; offense invariant remains 3992.","timestamp":1775770706094,"segment":1,"confidence":21.366666666666667,"iterationTokens":17746,"asi":{"hypothesis":"RSpecRails/HttpStatus can safely gain baseline autocorrect through deterministic integer->symbol mapping in symbolic style without touching more complex style conversions.","implemented_cop":"RSpecRails/HttpStatus","rubocop_reference":"vendor/rubocop-rails/lib/rubocop/cop/rails/http_status.rb","tests":"cargo test --lib --quiet -- cop::rspec_rails::http_status","with_autocorrect_after":641,"missing_autocorrect_after":275,"offenses_benchmark":3992,"deferred_paths":"Parity follow-up for numeric/string and be_status-style rewrites remains deferred."}}
{"run":474,"commit":"7787879","metric":642,"metrics":{},"status":"keep","description":"Added conservative autocorrect support for RSpecRails/HttpStatusNameConsistency. Baseline autocorrect rewrites deprecated status symbols to preferred Rack 3.1+ names (e.g., `:unprocessable_entity` -> `:unprocessable_content`) at argument range. Added supports_autocorrect and targeted autocorrect tests; offense invariant remains 3992.","timestamp":1775770875850,"segment":1,"confidence":21.4,"iterationTokens":6610,"asi":{"hypothesis":"HttpStatusNameConsistency can safely gain baseline autocorrect by direct symbol replacement for known deprecated-to-preferred mappings under rack>=3.1 gating.","implemented_cop":"RSpecRails/HttpStatusNameConsistency","rubocop_reference":"vendor/rubocop-rails/lib/rubocop/cop/rails/http_status_name_consistency.rb","tests":"cargo test --lib --quiet -- cop::rspec_rails::http_status_name_consistency","with_autocorrect_after":642,"missing_autocorrect_after":274,"offenses_benchmark":3992,"deferred_paths":"Future parity could include broader source-shape handling if additional status-name mappings are introduced upstream."}}
{"run":475,"commit":"1fab5bb","metric":643,"metrics":{},"status":"keep","description":"Added conservative autocorrect support for Rails/DuplicateScope. Baseline autocorrect removes non-last duplicate scope declarations in same-expression groups, preserving the final declaration; diagnostics remain for all duplicates. Added supports_autocorrect and targeted autocorrect tests; offense invariant remains 3992.","timestamp":1775771055467,"segment":1,"confidence":21.433333333333334,"iterationTokens":7425,"asi":{"hypothesis":"DuplicateScope can safely gain baseline autocorrect via non-last duplicate removal, matching practical behavior where later scope declaration wins.","implemented_cop":"Rails/DuplicateScope","rubocop_reference":"vendor/rubocop-rails/lib/rubocop/cop/rails/duplicate_scope.rb","tests":"cargo test --lib --quiet -- cop::rails::duplicate_scope","with_autocorrect_after":643,"missing_autocorrect_after":273,"offenses_benchmark":3992,"deferred_paths":"Parity follow-up for comment/line-aware removal and potential first-node replacement strategy alignment remains deferred."}}
{"run":476,"commit":"92bf310","metric":644,"metrics":{},"status":"keep","description":"Added RuboCop-aligned autocorrect support for RSpecRails/HaveHttpStatus. When matching `expect(response.status/code).to|not_to|to_not be/eq/eql/equal(<numeric>)`, autocorrect now rewrites to `expect(response).<runner> have_http_status(<numeric>)` via targeted receiver/selector/argument replacements. Added supports_autocorrect and focused autocorrect unit coverage; offense invariant remains 3992.","timestamp":1775771359431,"segment":1,"confidence":21.466666666666665,"iterationTokens":18137,"asi":{"hypothesis":"HaveHttpStatus can safely gain autocorrect by mirroring upstream's three localized replacements (response accessor, matcher selector, matcher argument) on already-detected patterns.","implemented_cop":"RSpecRails/HaveHttpStatus","rubocop_reference":"vendor/rubocop-rspec_rails/lib/rubocop/cop/rspec_rails/have_http_status.rb","tests":"cargo test --lib --quiet -- cop::rspec_rails::have_http_status","with_autocorrect_after":644,"missing_autocorrect_after":272,"offenses_benchmark":3992,"deferred_paths":"Further parity may include expanded matcher/argument shape handling if upstream broadens node patterns."}}
{"run":477,"commit":"ac4e189","metric":645,"metrics":{},"status":"keep","description":"Added autocorrect support for RSpecRails/NegationBeValid, mirroring RuboCop selector swaps: default style rewrites `.to be_invalid` -> `.not_to be_valid`, and be_invalid style rewrites `.not_to be_valid` -> `.to be_invalid`. Added supports_autocorrect and targeted autocorrect tests for both styles; offense invariant remains 3992.","timestamp":1775772728340,"segment":1,"confidence":21.5,"iterationTokens":5902,"asi":{"hypothesis":"NegationBeValid can safely gain autocorrect by localized runner/matcher selector replacement on already-matched expect patterns, matching RuboCop behavior.","implemented_cop":"RSpecRails/NegationBeValid","rubocop_reference":"vendor/rubocop-rspec_rails/lib/rubocop/cop/rspec_rails/negation_be_valid.rb","tests":"cargo test --lib --quiet -- cop::rspec_rails::negation_be_valid","with_autocorrect_after":645,"missing_autocorrect_after":271,"offenses_benchmark":3992,"deferred_paths":"Potential parity follow-up for nuanced chained matcher contexts if additional upstream edge cases appear."}}
{"run":478,"commit":"301bff0","metric":646,"metrics":{},"status":"keep","description":"Added RuboCop-aligned autocorrect support for RSpecRails/AvoidSetupHook by replacing bare `setup` selector with `before` in matched setup blocks. Added supports_autocorrect and targeted autocorrect test coverage; offense invariant remains 3992.","timestamp":1775772921636,"segment":1,"confidence":21.533333333333335,"iterationTokens":7210,"asi":{"hypothesis":"AvoidSetupHook can safely gain autocorrect with a selector-only rewrite (`setup` -> `before`) on already-detected setup-hook blocks.","implemented_cop":"RSpecRails/AvoidSetupHook","rubocop_reference":"vendor/rubocop-rspec_rails/lib/rubocop/cop/rspec_rails/avoid_setup_hook.rb","tests":"cargo test --lib --quiet -- cop::rspec_rails::avoid_setup_hook","with_autocorrect_after":646,"missing_autocorrect_after":270,"offenses_benchmark":3992,"deferred_paths":"No major deferred paths beyond future upstream matcher-shape changes."}}
{"run":479,"commit":"33d41e6","metric":647,"metrics":{},"status":"keep","description":"Added conservative RuboCop-aligned autocorrect support for RSpecRails/MinitestAssertions by replacing entire assertion calls with preferred expect(...) forms only for deterministic no-failure-message shapes. Left message-bearing forms diagnostic-only to avoid dropping assertion message semantics; offense invariant remains 3992.","timestamp":1775773338784,"segment":1,"confidence":21.566666666666666,"iterationTokens":3021,"asi":{"hypothesis":"MinitestAssertions can safely gain supports_autocorrect with whole-call rewrites for deterministic argument-shape cases while skipping optional failure-message variants.","implemented_cop":"RSpecRails/MinitestAssertions","rubocop_reference":"vendor/rubocop-rspec_rails/lib/rubocop/cop/rspec_rails/minitest_assertions.rb","safety_guard":"Autocorrect only when optional failure-message arg is absent (and predicate symbol shape valid).","tests":"cargo test --lib --quiet -- cop::rspec_rails::minitest_assertions","with_autocorrect_after":647,"missing_autocorrect_after":269,"offenses_benchmark":3992,"next_action_hint":"Continue with low-risk RSpecRails cops like TravelAround/InferredSpecType using similarly conservative autocorrect gating."}}
{"run":480,"commit":"33d41e6","metric":648,"metrics":{},"status":"keep","description":"Added conservative RuboCop-aligned autocorrect support for RSpecRails/InferredSpecType. Baseline autocorrect removes redundant sole `type:` hash arg when it follows a positional described target (e.g., `describe User, type: :model` -> `describe User`). Kept RuboCop crash-parity skip for no-described-class sole type hash; offense invariant remains 3992.","timestamp":1775773576703,"segment":1,"confidence":21.6,"iterationTokens":40760,"asi":{"hypothesis":"InferredSpecType can safely gain autocorrect by only removing the redundant full hash argument in deterministic described-class forms, avoiding fragile pair-level range surgery.","implemented_cop":"RSpecRails/InferredSpecType","rubocop_reference":"vendor/rubocop-rspec_rails/lib/rubocop/cop/rspec_rails/inferred_spec_type.rb","safety_guard":"Autocorrect only when redundant `type:` is the sole hash pair and there is a positional arg before the hash; no-described-class crash-parity path still skipped.","tests":"cargo test --lib --quiet -- cop::rspec_rails::inferred_spec_type","with_autocorrect_after":648,"missing_autocorrect_after":268,"offenses_benchmark":3992,"next_action_hint":"Continue with conservative RSpecRails/TravelAround or deepen InferredSpecType parity for multi-pair hash removal ranges."}}
{"run":481,"commit":"b876acb","metric":649,"metrics":{},"status":"keep","description":"Added conservative RuboCop-aligned autocorrect support for RSpecRails/TravelAround and RSpecRails/InferredSpecType. TravelAround baseline autocorrect handles deterministic block-pass around form (`around { |ex| freeze_time(&ex) }` -> `before { freeze_time }`), and InferredSpecType baseline removes sole redundant `type:` hash args after described targets. Offense invariant remains 3992.","timestamp":1775773857218,"segment":1,"confidence":21.633333333333333,"iterationTokens":1591,"asi":{"hypothesis":"Pairing two low-risk RSpecRails autocorrect baselines can safely lift coverage while avoiding unsafe range rewrites and ordering-sensitive around-block transformations.","implemented_cops":"RSpecRails/InferredSpecType, RSpecRails/TravelAround","rubocop_references":"vendor/rubocop-rspec_rails/lib/rubocop/cop/rspec_rails/inferred_spec_type.rb; vendor/rubocop-rspec_rails/lib/rubocop/cop/rspec_rails/travel_around.rb","safety_guards":"InferredSpecType corrects only sole-type hash with positional target; TravelAround corrects only single-statement block-pass travel calls with no travel args.","tests":"cargo test --lib --quiet -- cop::rspec_rails::travel_around cop::rspec_rails::inferred_spec_type","with_autocorrect_after":649,"missing_autocorrect_after":267,"offenses_benchmark":3992,"dead_end_note":"Initial TravelAround correction range used block-only span and produced `around before { ... }`; fixed by replacing from `around` call start through block end.","next_action_hint":"Next likely target is remaining RSpecRails missing-autocorrect cops with deterministic transformations (e.g., guarded InferredSpecType mixed-pair removal or TravelAround run-in-travel pattern)."}}
{"run":482,"commit":"dfbf896","metric":650,"metrics":{},"status":"keep","description":"Added conservative RuboCop-aligned autocorrect support for RSpec/InstanceSpy. For `instance_double(...).as_null_object` assignments later asserted with `have_received`, autocorrect now rewrites selector to `instance_spy` and removes trailing `.as_null_object`. Added supports_autocorrect and focused autocorrect unit coverage; offense invariant remains 3992.","timestamp":1775774520283,"segment":1,"confidence":21.311475409836067,"iterationTokens":37179,"asi":{"hypothesis":"InstanceSpy can safely autocorrect by applying two localized edits (`instance_double` -> `instance_spy`, remove `.as_null_object`) only on assignments proven to be checked with `have_received`.","implemented_cop":"RSpec/InstanceSpy","rubocop_reference":"vendor/rubocop-rspec/lib/rubocop/cop/rspec/instance_spy.rb","tests":"cargo test --lib --quiet -- cop::rspec::instance_spy","with_autocorrect_after":650,"missing_autocorrect_after":266,"offenses_benchmark":3992,"safety_guard":"Autocorrect fires only for lvar assignments detected as null doubles AND observed in expect(...).to have_received(...) within same example.","next_action_hint":"Continue in RSpec department with similarly deterministic selector-level autocorrects (e.g., receive_counts/receive_messages) before riskier structural rewrites."}}
{"run":483,"commit":"51ea1b3","metric":651,"metrics":{},"status":"keep","description":"Added conservative RuboCop-aligned autocorrect support for RSpec/ReceiveCounts. For `receive` expectation chains ending in `.exactly|at_least|at_most(1|2).times`, autocorrect now replaces the count suffix with `.once`, `.twice`, `.at_least(:once|:twice)`, or `.at_most(:once|:twice)`. Added supports_autocorrect and focused autocorrect unit coverage; offense invariant remains 3992.","timestamp":1775774720269,"segment":1,"confidence":21,"iterationTokens":11336,"asi":{"hypothesis":"ReceiveCounts can safely autocorrect via suffix-range replacement from the count-method dot through `.times` for canonical `receive` chains.","implemented_cop":"RSpec/ReceiveCounts","rubocop_reference":"vendor/rubocop-rspec/lib/rubocop/cop/rspec/receive_counts.rb","tests":"cargo test --lib --quiet -- cop::rspec::receive_counts","with_autocorrect_after":651,"missing_autocorrect_after":265,"offenses_benchmark":3992,"safety_guard":"Only corrects when chain resolves to `receive` and count arg is literal 1 or 2.","next_action_hint":"Continue with similarly localized RSpec autocorrect targets (e.g., ReceiveMessages/ExpectChange) before broader structural cops."}}
{"run":484,"commit":"855bc65","metric":652,"metrics":{},"status":"keep","description":"Added conservative RuboCop-aligned autocorrect support for RSpec/ExpectChange. Baseline autocorrect now rewrites simple `change { Receiver.message }` to `change(Receiver, :message)` in method_call style, and rewrites `change(Receiver, :message)` to `change { Receiver.message }` in block style. Added supports_autocorrect and focused bidirectional autocorrect tests; offense invariant remains 3992.","timestamp":1775774971922,"segment":1,"confidence":21.032258064516128,"iterationTokens":16553,"asi":{"hypothesis":"ExpectChange can safely gain autocorrect by limiting rewrites to the same simple receiver/message shapes the cop already flags, mirroring RuboCop's style-specific replacements.","implemented_cop":"RSpec/ExpectChange","rubocop_reference":"vendor/rubocop-rspec/lib/rubocop/cop/rspec/expect_change.rb","tests":"cargo test --lib --quiet -- cop::rspec::expect_change","with_autocorrect_after":652,"missing_autocorrect_after":264,"offenses_benchmark":3992,"safety_guard":"Only rewrites simple flagged forms (single message send block body / two-arg change call with symbol attr).","next_action_hint":"Continue with similarly deterministic RSpec cops (e.g., PredicateMatcher inflected path) before tackling complex grouping cops like ReceiveMessages."}}
{"run":485,"commit":"3405aaf","metric":653,"metrics":{},"status":"keep","description":"Added conservative RuboCop-aligned autocorrect support for RSpec/PredicateMatcher (inflected style baseline). For deterministic no-arg predicate actuals, autocorrect rewrites `expect(obj.pred?).to be_truthy/be_falsey` forms to predicate matchers (`expect(obj).to/not_to be_pred`). Added supports_autocorrect and focused autocorrect unit coverage; offense invariant remains 3992.","timestamp":1775775177812,"segment":1,"confidence":21.06451612903226,"iterationTokens":10063,"asi":{"hypothesis":"PredicateMatcher can safely autocorrect by whole-expression replacement only for simple no-arg/no-block predicate calls, preserving safe-navigation and explicit-style exclusions.","implemented_cop":"RSpec/PredicateMatcher","rubocop_reference":"vendor/rubocop-rspec/lib/rubocop/cop/rspec/predicate_matcher.rb","tests":"cargo test --lib --quiet -- cop::rspec::predicate_matcher","with_autocorrect_after":653,"missing_autocorrect_after":263,"offenses_benchmark":3992,"safety_guard":"Autocorrect restricted to inflected-path detections with no predicate args/block and uses matcher truthiness to preserve to/not_to semantics.","next_action_hint":"Next low-risk target: RSpec/ExpectChange parity deepening or another RSpec cop with selector/suffix-only correction surface."}}
{"run":486,"commit":"3405aaf","metric":0,"metrics":{},"status":"crash","description":"Attempted to add conservative block-style autocorrect baseline for RSpec/ReturnFromStub (`and_return` -> block) but compile failed.","timestamp":1775775345291,"segment":1,"confidence":21.06451612903226,"iterationTokens":13206,"asi":{"hypothesis":"ReturnFromStub can gain low-risk autocorrect in block style by replacing `.and_return(static)` suffix with ` { static }`.","rollback_reason":"Used `hash.opening_loc().is_none()` assumption that is invalid in Prism bindings (`opening_loc` is non-optional Location), causing compile error E0599.","error_detail":"no method named `is_none` found for struct `ruby_prism::Location` at src/cop/rspec/return_from_stub.rs:166","next_action_hint":"Reattempt without `opening_loc().is_none()` and keep first baseline to simple `.and_return(value)` -> ` { value }` rewrite; handle bare hash kwargs parity later.","implemented_cop":"RSpec/ReturnFromStub"}}
{"run":487,"commit":"907f00f","metric":654,"metrics":{},"status":"keep","description":"Added conservative RuboCop-aligned autocorrect support for RSpec/ReturnFromStub (block style baseline). For static single-arg `.and_return(value)` stubs in `EnforcedStyle: block`, autocorrect now rewrites suffix to block form (` { value }`). Added supports_autocorrect and targeted autocorrect test coverage; offense invariant remains 3992.","timestamp":1775775478130,"segment":1,"confidence":21.096774193548388,"iterationTokens":3475,"asi":{"hypothesis":"ReturnFromStub can safely gain initial autocorrect by only converting deterministic block-style offenses from `.and_return(static)` to inline block return syntax.","implemented_cop":"RSpec/ReturnFromStub","rubocop_reference":"vendor/rubocop-rspec/lib/rubocop/cop/rspec/return_from_stub.rb","tests":"cargo test --lib --quiet -- cop::rspec::return_from_stub","with_autocorrect_after":654,"missing_autocorrect_after":262,"offenses_benchmark":3992,"dead_end_note":"First attempt used nonexistent optional hash opening-loc API and crashed (run #486); reattempt simplified conversion to avoid brace-shape introspection.","next_action_hint":"Consider parity follow-up for `and_return` hash-without-braces and reciprocal `and_return` style autocorrect path from static block bodies."}}
{"run":488,"commit":"0c55c98","metric":655,"metrics":{},"status":"keep","description":"Added conservative RuboCop-aligned autocorrect support for RSpec/RedundantAround. For redundant around hooks (`around { |ex| ex.run }` and `around(&:run)`), autocorrect now removes the redundant around node. Added supports_autocorrect and focused autocorrect test coverage; offense invariant remains 3992.","timestamp":1775775719589,"segment":1,"confidence":21.129032258064516,"iterationTokens":3579,"asi":{"hypothesis":"RedundantAround is a low-risk whole-node deletion autocorrect because offense patterns already guarantee semantic no-op around hooks.","implemented_cop":"RSpec/RedundantAround","rubocop_reference":"vendor/rubocop-rspec/lib/rubocop/cop/rspec/redundant_around.rb","tests":"cargo test --lib --quiet -- cop::rspec::redundant_around","with_autocorrect_after":655,"missing_autocorrect_after":261,"offenses_benchmark":3992,"safety_guard":"Autocorrect only applied for already-matched redundant around forms (single `run` body or `&:run`).","next_action_hint":"Continue with deterministic RSpec cops (e.g., ReturnFromStub parity deepening or receive_messages baseline) while avoiding ordering-sensitive rewrites without strict guards."}}
{"run":489,"commit":"0d5c2cb","metric":656,"metrics":{},"status":"keep","description":"Added conservative RuboCop-aligned autocorrect support for RSpec/VerifiedDoubleReference. For verified double helpers with string first arg, autocorrect now replaces the string literal with its constant reference text (e.g., `instance_double('ClassName')` -> `instance_double(ClassName)`). Added supports_autocorrect and focused autocorrect tests; offense invariant remains 3992.","timestamp":1775775910273,"segment":1,"confidence":20.825396825396826,"iterationTokens":5849,"asi":{"hypothesis":"VerifiedDoubleReference is a low-risk argument-token rewrite where replacing string literal text with its unquoted value matches upstream autocorrect behavior.","implemented_cop":"RSpec/VerifiedDoubleReference","rubocop_reference":"vendor/rubocop-rspec/lib/rubocop/cop/rspec/verified_double_reference.rb","tests":"cargo test --lib --quiet -- cop::rspec::verified_double_reference","with_autocorrect_after":656,"missing_autocorrect_after":260,"offenses_benchmark":3992,"safety_guard":"Autocorrect only when first argument is a plain string literal on receiverless verified-double DSL calls.","next_action_hint":"Continue with similar token-level RSpec autocorrects before attempting complex group-merging cops like ReceiveMessages."}}
