{"run":60,"commit":"ef32207","metric":587,"metrics":{},"status":"discard","description":"Detect experiment run executed against baseline state (only 2 detect tests ran, metrics stayed 587/329), indicating stale/non-attributed evaluation. Discarded pending clean rerun.","timestamp":1775698924111,"segment":0,"confidence":null,"iterationTokens":3894,"asi":{"hypothesis":"Add RuboCop-aligned autocorrect for Performance/Detect (`select/find_all/filter` + `first/last/[0]/[-1]` -> `detect`/`reverse.detect`).","rollback_reason":"run_experiment output reflected baseline detect test set and baseline autocorrect counts, not the prepared modified detect implementation.","next_action_hint":"Rerun with explicit preflight output (status + grep in command output) and verify detect test count is 4 before accepting metrics.","with_autocorrect_observed":587,"missing_autocorrect_observed":329,"offenses_benchmark":3992,"stale_run_signal":"cargo test filter reported 2 detect tests instead of 4"}}
{"run":66,"commit":"cf15089","metric":328,"metrics":{},"status":"keep","description":"Added RuboCop-aligned autocorrect for Performance/Detect by rewriting `select/find_all/filter` chains ending in `first/last/[0]/[-1]` to `detect` / `reverse.detect`, with corrected fixture coverage; targeted tests pass and offense invariant remains 3992.","timestamp":1775699000881,"segment":0,"confidence":19.454545454545453,"iterationTokens":6017,"asi":{"hypothesis":"Performance/Detect offense chains can be corrected deterministically by removing trailing `first/last/[idx]` and replacing inner selector with `detect` or `reverse.detect` while preserving block/block-pass tails.","rubocop_reference":"vendor/rubocop-performance/lib/rubocop/cop/performance/detect.rb","implemented_cop":"Performance/Detect","tests":"cargo test --lib --quiet -- cop::performance::detect","with_autocorrect_after":588,"missing_autocorrect_after":328,"offenses_benchmark":3992}}
{"run":61,"commit":"ef32207","metric":0,"metrics":{},"status":"crash","description":"Detect autocorrect run invalidated by concurrent worktree drift during benchmark phase: Detect changes disappeared and unrelated StartWith changes appeared post-run, failing attribution guard.","timestamp":1775699086799,"segment":0,"confidence":null,"iterationTokens":6158,"asi":{"hypothesis":"Land Performance/Detect autocorrect with strict pre/post dirty-file guard.","rollback_reason":"Post-run status guard failed (`detect.rs`/fixture replaced by `start_with.rs` changes), indicating concurrent tree mutation during experiment.","next_action_hint":"Run next experiment only after forcing a clean baseline via discard revert and avoid long benchmark overlap; re-check status immediately before and after benchmark.","error_signature":"post-run status mismatch: expected detect files, got start_with.rs","with_autocorrect_pre_benchmark":588,"missing_autocorrect_pre_benchmark":328}}
{"run":67,"commit":"cf15089","metric":0,"metrics":{},"status":"crash","description":"StartWith autocorrect attempt failed to compile: helper functions referenced in correction path were missing (`extract_start_anchored_literal_bytes`, `to_double_quoted_string_literal`).","timestamp":1775699290777,"segment":0,"confidence":19.454545454545453,"iterationTokens":9008,"asi":{"hypothesis":"Add RuboCop-aligned autocorrect for Performance/StartWith by converting anchored regex match forms to `start_with?` with decoded literal strings.","rollback_reason":"Compile failure E0425 due unresolved helper functions in start_with.rs prevented tests from running.","next_action_hint":"Define extraction/string-literal helper functions in-file, then rerun `cop::performance::start_with` + invariant benchmark.","error":"E0425 unresolved functions in src/cop/performance/start_with.rs","failing_command":"cargo test --lib --quiet -- cop::performance::start_with"}}
{"run":62,"commit":"cf15089","metric":0,"metrics":{},"status":"crash","description":"StartWith autocorrect attempt aborted immediately: pre-run status guard found no StartWith dirty files (expected edits vanished before execution), so attribution could not start.","timestamp":1775699311092,"segment":0,"confidence":null,"iterationTokens":11598,"asi":{"hypothesis":"Fix Performance/StartWith compile/autocorrect helpers and land corrected fixture (+1 with_autocorrect).","rollback_reason":"Expected StartWith edits were not present at run start; concurrent worktree mutation removed them before validation.","next_action_hint":"Re-apply StartWith changes and run immediately with pre/post status guards; if drift persists, treat environment as concurrently mutating and avoid keep decisions without guarded snapshots.","error_signature":"PRE_STATUS empty when StartWith files were expected"}}
{"run":32,"commit":"cf15089","metric":588,"metrics":{},"status":"discard","description":"StartWith reattempt passed targeted tests and invariant checks, but primary metric remained flat at 588 with no attributable net improvement in this cycle.","timestamp":1775699377175,"segment":0,"confidence":null,"iterationTokens":1483,"asi":{"hypothesis":"Implement RuboCop-aligned StartWith autocorrect for anchored regex match forms to increase coverage by +1.","rollback_reason":"Observed with_autocorrect stayed at 588; no net primary-metric movement in this iteration.","next_action_hint":"Pivot to next missing cop with deterministic rewrite and clear attribution (e.g., Performance/EndWith or Performance/StringInclude).","tests":"cargo test --lib --quiet -- cop::performance::start_with","with_autocorrect_observed":588,"missing_autocorrect_observed":328,"offenses_benchmark":3992}}
{"run":68,"commit":"cf15089","metric":0,"metrics":{},"status":"crash","description":"Casecmp autocorrect attempt could not compile tests because branch had existing EndWith autocorrect test macro without required corrected fixture (`tests/fixtures/cops/performance/end_with/corrected.rb`).","timestamp":1775699582928,"segment":0,"confidence":19.454545454545453,"iterationTokens":19604,"asi":{"hypothesis":"Add autocorrect for Performance/Casecmp via full-expression rewrite to `casecmp(...).zero?` (and negated form for `!=`).","rollback_reason":"Compilation failed before Casecmp tests ran due unrelated EndWith fixture include_bytes compile error.","next_action_hint":"Stabilize EndWith fixture/autocorrect state first (or revert it), then retry Casecmp in isolation.","error":"include_bytes missing tests/fixtures/cops/performance/end_with/corrected.rb","failing_command":"cargo test --lib --quiet -- cop::performance::casecmp"}}
{"run":69,"commit":"cf15089","metric":0,"metrics":{},"status":"crash","description":"EndWith autocorrect branch compiled with corrected fixture present, but no_offense fixture failed (regex metacharacter patterns like `foo.*\\z`, `foo+\\z`, `\\w\\z`, `\\d\\z`, `\\s\\z` were incorrectly flagged).","timestamp":1775699720051,"segment":0,"confidence":19.454545454545453,"iterationTokens":6149,"asi":{"hypothesis":"Complete Performance/EndWith autocorrect by rewriting anchored regex match forms to `end_with?` while preserving RuboCop literal-safety guards.","rollback_reason":"Targeted no_offense fixture regression indicates literal-safety matching is too permissive for metacharacter patterns.","next_action_hint":"Tighten end-anchor literal extraction/guard to reject metachar prefixes (`.`, `+`, `\\w`, `\\d`, `\\s`) before emitting diagnostics/corrections; rerun end_with tests and benchmark guard.","failing_test":"cop::performance::end_with::tests::no_offense_fixture"}}
{"run":33,"commit":"67e4dbd","metric":589,"metrics":{},"status":"keep","description":"Added RuboCop-aligned autocorrect for Performance/EndWith by rewriting anchored regex `match/match?/=~` offense forms to `end_with?` across receiver orientations, with fixture autocorrect coverage and invariant offenses preserved.","timestamp":1775699772880,"segment":0,"confidence":null,"iterationTokens":5618,"asi":{"hypothesis":"EndWith offense shapes are deterministic and mirror StartWith semantics, so whole-call rewrite to `end_with?` should safely increase autocorrect coverage by +1.","rubocop_reference":"vendor/rubocop-performance/lib/rubocop/cop/performance/end_with.rb","implemented_cop":"Performance/EndWith","tests":"cargo test --lib --quiet -- cop::performance::end_with","with_autocorrect_after":589,"missing_autocorrect_after":327,"offenses_benchmark":3992}}
{"run":63,"commit":"cf15089","metric":0,"metrics":{},"status":"crash","description":"EndWith guarded run failed before metric emission (one of pre/test/post assertions failed), so no attributable benchmark result recorded.","timestamp":1775699820546,"segment":0,"confidence":null,"iterationTokens":4085,"asi":{"hypothesis":"Land Performance/EndWith autocorrect with corrected fixture while preserving offense invariant.","rollback_reason":"Guarded command exited early without METRIC output; likely status/test-count drift during run.","next_action_hint":"Rerun with explicit step-by-step logging to pinpoint failing assertion, then either keep if stable at 589/327 or discard on drift.","error_signature":"run_experiment exited 1 with no trailing diagnostic lines"}}
{"run":70,"commit":"67e4dbd","metric":327,"metrics":{},"status":"discard","description":"Validation run on advanced HEAD passed EndWith tests and benchmark invariant with 589/327, but EndWith autocorrect was already committed in branch before logging; no new local delta attributable in this cycle.","timestamp":1775699835832,"segment":0,"confidence":19.454545454545453,"iterationTokens":11167,"asi":{"hypothesis":"Verify Performance/EndWith autocorrect stability and offense invariant after fixture/compile turbulence.","rollback_reason":"Primary metric improvement came from already-landed commit `67e4dbd81`, not a fresh patch generated in this iteration.","next_action_hint":"Use 589/327 as new baseline and pursue next isolated missing-autocorrect cop (StartWith or StringInclude) with clean attribution.","tests":"cargo test --lib --quiet -- cop::performance::end_with","with_autocorrect_observed":589,"missing_autocorrect_observed":327,"offenses_benchmark":3992,"head_commit_validated":"67e4dbd81"}}
{"run":71,"commit":"67e4dbd","metric":0,"metrics":{},"status":"crash","description":"DoubleStartEndWith autocorrect attempt failed to compile: updated `check_pair` signature added corrections arg, but call sites still passed only 5 arguments.","timestamp":1775700151937,"segment":0,"confidence":19.454545454545453,"iterationTokens":14534,"asi":{"hypothesis":"Enable Performance/DoubleStartEndWith autocorrect by combining duplicated start_with?/end_with? arguments into one call (and negated && form into `!receiver.method(...)`).","rollback_reason":"Compile error E0061 due missing corrections argument in `check_pair` call sites.","next_action_hint":"Pass `corrections.as_deref_mut()` at both `check_pair` call sites, then rerun targeted tests + benchmark guard.","error":"E0061 check_pair argument mismatch","failing_command":"cargo test --lib --quiet -- cop::performance::double_start_end_with"}}
{"run":64,"commit":"67e4dbd","metric":0,"metrics":{},"status":"crash","description":"Combined StartWith + DoubleStartEndWith run failed to compile: `double_start_end_with::check_pair` signature gained corrections arg but caller sites were not updated.","timestamp":1775700163570,"segment":0,"confidence":null,"iterationTokens":14298,"asi":{"hypothesis":"Land StartWith and DoubleStartEndWith autocorrects together (+2 with_autocorrect).","rollback_reason":"Rust compile error E0061 in `src/cop/performance/double_start_end_with.rs` at two `check_pair` call sites missing new corrections parameter.","next_action_hint":"Patch both call sites to pass through `corrections.as_deref_mut()` (or equivalent), then rerun targeted tests + benchmark guard.","error_signature":"E0061 check_pair takes 6 args but 5 supplied at lines ~119 and ~143"}}
{"run":65,"commit":"67e4dbd","metric":0,"metrics":{},"status":"crash","description":"Guarded multi-cop run aborted at preflight: expected StartWith+DoubleStartEndWith+Squeeze dirty set collapsed to StartWith-only before execution, so attribution was unsafe.","timestamp":1775700297942,"segment":0,"confidence":null,"iterationTokens":7696,"asi":{"hypothesis":"Land StartWith and DoubleStartEndWith autocorrect additions together.","rollback_reason":"Pre-run status mismatch indicated concurrent worktree mutation removed expected files before tests/benchmark.","next_action_hint":"Run single-cop guarded experiment only on whatever file is actually present at preflight (currently StartWith).","error_signature":"PRE_STATUS missing double_start_end_with/squeeze files"}}
{"run":72,"commit":"67e4dbd","metric":327,"metrics":{},"status":"discard","description":"DoubleStartEndWith validation run passed tests and invariant with 589/327, but no persistent local delta remained post-run (worktree reverted to baseline), so this datapoint is non-attributable.","timestamp":1775700380605,"segment":0,"confidence":17.833333333333332,"iterationTokens":5942,"asi":{"hypothesis":"Add autocorrect for Performance/DoubleStartEndWith by combining duplicate start/end predicate calls into one multi-arg call.","rollback_reason":"Post-run git status showed no surviving cop/fixture changes, so metric cannot be tied to a durable implementation change.","next_action_hint":"Before next run, verify changed files still exist immediately before logging; if churn persists, isolate edits in a dedicated worktree.","tests":"cargo test --lib --quiet -- cop::performance::double_start_end_with","with_autocorrect_observed":589,"missing_autocorrect_observed":327,"offenses_benchmark":3992}}
{"run":34,"commit":"cb5662d","metric":590,"metrics":{},"status":"keep","description":"Added RuboCop-aligned autocorrect for Performance/StartWith by rewriting anchored regex `match/match?/=~` offense forms to `start_with?` across receiver orientations, with fixture autocorrect coverage; targeted tests pass and benchmark offense invariant remains 3992.","timestamp":1775700614342,"segment":0,"confidence":null,"iterationTokens":27579,"asi":{"hypothesis":"Performance/StartWith offense shapes are deterministic and can be safely rewritten to `start_with?` by decoding anchored literal regex content, mirroring RuboCop behavior.","rubocop_reference":"vendor/rubocop-performance/lib/rubocop/cop/performance/start_with.rb","implemented_cop":"Performance/StartWith","tests":"cargo test --lib --quiet -- cop::performance::start_with","with_autocorrect_after":590,"missing_autocorrect_after":326,"offenses_benchmark":3992}}
{"run":73,"commit":"cb5662d","metric":326,"metrics":{},"status":"discard","description":"Validation run on advanced HEAD passed StartWith tests and benchmark invariant at 590/326, but the StartWith autocorrect commit was already landed in branch before logging; no fresh local delta to attribute in this cycle.","timestamp":1775700740479,"segment":0,"confidence":17.833333333333332,"iterationTokens":5942,"asi":{"hypothesis":"Verify Performance/StartWith autocorrect stability and invariant safety.","rollback_reason":"Primary-metric improvement came from already-landed commit `cb5662d7b`, not an isolated new patch in this logged iteration.","next_action_hint":"Treat 590/326 as new baseline and continue with next isolated idea (StringInclude or DoubleStartEndWith) with explicit pre-log diff checks.","tests":"cargo test --lib --quiet -- cop::performance::start_with","with_autocorrect_observed":590,"missing_autocorrect_observed":326,"offenses_benchmark":3992,"head_commit_validated":"cb5662d7b"}}
{"run":66,"commit":"67e4dbd","metric":0,"metrics":{},"status":"crash","description":"Planned bundled run (DoubleStartEndWith + StringInclude) aborted at preflight: only StringInclude files remained dirty; DoubleStartEndWith deltas vanished before execution.","timestamp":1775700854430,"segment":0,"confidence":null,"iterationTokens":9932,"asi":{"hypothesis":"Land autocorrect for both Performance/DoubleStartEndWith and Performance/StringInclude in one attribution-clean run.","rollback_reason":"Pre-run status mismatch (expected 4 files, found only StringInclude pair) indicates concurrent worktree mutation.","next_action_hint":"Run isolated StringInclude experiment immediately with guarded pre/post status checks.","error_signature":"PRE_STATUS missing double_start_end_with.rs and corrected.rb"}}
{"run":35,"commit":"cb5662d","metric":0,"metrics":{},"status":"crash","description":"StringInclude autocorrect attempt failed to compile (E0308 borrow mismatch in `is_simple_regex_node` calls within `=~`/`!~` branches), and local StringInclude edits did not survive post-failure worktree state.","timestamp":1775700914872,"segment":0,"confidence":null,"iterationTokens":9325,"asi":{"hypothesis":"Enable RuboCop-aligned autocorrect for Performance/StringInclude by rewriting literal-only regex match forms to `include?`/`!include?` with escape decoding.","rollback_reason":"Compile failure E0308 prevented tests from running; subsequent worktree state no longer contained the attempted StringInclude patch, so the run is non-attributable.","next_action_hint":"Reapply StringInclude patch in a single edit, ensure `is_simple_regex_node` receives references in all branches, then rerun targeted tests + invariant benchmark immediately.","error":"E0308 mismatched types at string_include.rs lines in `=~` and `!~` branches"}}
{"run":74,"commit":"cb5662d","metric":326,"metrics":{},"status":"discard","description":"StringInclude implementation run passed targeted tests and benchmark invariant at 590/326, but post-run tree had no surviving StringInclude/fixture changes, so result is non-attributable under churn.","timestamp":1775700952768,"segment":0,"confidence":16.46153846153846,"iterationTokens":15338,"asi":{"hypothesis":"Add RuboCop-aligned autocorrect for Performance/StringInclude by converting literal-only regex match forms to `include?`/`!include?` with escape decoding.","rollback_reason":"Working tree reverted to baseline immediately after run; no persistent cop/fixture diff to attribute metric.","next_action_hint":"Re-run StringInclude in an isolated worktree and verify diffs still exist immediately before log_experiment.","tests":"cargo test --lib --quiet -- cop::performance::string_include","with_autocorrect_observed":590,"missing_autocorrect_observed":326,"offenses_benchmark":3992}}
{"run":36,"commit":"cb5662d","metric":590,"metrics":{},"status":"discard","description":"Performance/StringInclude autocorrect implementation passed targeted tests and offense invariant, but primary metric stayed flat at 590/326 (no net autocorrect-coverage gain in this cycle), so discarded per objective.","timestamp":1775701113420,"segment":0,"confidence":null,"iterationTokens":13828,"asi":{"hypothesis":"Adding RuboCop-aligned autocorrect to Performance/StringInclude should increase `with_autocorrect` by +1 via deterministic regex-literal rewrites to `include?`/`!include?`.","rollback_reason":"Primary metric did not improve (`with_autocorrect` remained 590), so this iteration does not advance the configured optimization target.","next_action_hint":"Verify whether StringInclude is already counted as autocorrect-capable upstream/baseline; then pivot to another missing cop with clear expected +1 (e.g., Performance/DoubleStartEndWith).","tests":"cargo test --lib --quiet -- cop::performance::string_include","with_autocorrect_observed":590,"missing_autocorrect_observed":326,"offenses_benchmark":3992}}
{"run":67,"commit":"cb5662d","metric":0,"metrics":{},"status":"crash","description":"DoubleStartEndWith guarded run aborted by overly strict test-count assertion (expected 3, actual 4 tests); targeted tests themselves passed.","timestamp":1775701247702,"segment":0,"confidence":null,"iterationTokens":7481,"asi":{"hypothesis":"Enable autocorrect for Performance/DoubleStartEndWith with corrected fixture coverage.","rollback_reason":"Harness assertion mismatch (`running 4 tests`) caused early exit before benchmark/metrics despite green test output.","next_action_hint":"Rerun same change with corrected assertion (expect 4 tests) and full benchmark guard.","error_signature":"pre-benchmark assertion failure on test count"}}
{"run":75,"commit":"cb5662d","metric":0,"metrics":{},"status":"crash","description":"DoubleStartEndWith autocorrect run failed during release benchmark build due disk exhaustion (`No space left on device`) before metrics could be emitted.","timestamp":1775701261062,"segment":0,"confidence":16.46153846153846,"iterationTokens":10690,"asi":{"hypothesis":"Enable Performance/DoubleStartEndWith autocorrect by combining duplicate start/end predicate chains into single multi-argument calls (including negated && form).","rollback_reason":"Build failed with OS error 28 while creating release archive; benchmark step could not complete.","next_action_hint":"Free disk space (e.g., prune old cargo target artifacts) and rerun the same DoubleStartEndWith validation command.","error":"No space left on device (os error 28) while building libnitrocop .rlib","failing_command":"cargo run --release --bin nitrocop -- ~/Dev/wt-gph-rspec-rip-out"}}
