{"run":523,"commit":"2b3dec9","metric":685,"metrics":{},"status":"keep","description":"Added conservative RuboCop-aligned autocorrect support for RSpec/IteratedExpectation. For deterministic single-expectation `.each` offenses, autocorrect now rewrites full iteration calls to `expect(collection).to all(matcher)` when matcher does not reference the block param; multi-expectation cases remain diagnostic-only. Added supports_autocorrect, corrected fixture, and focused tests.","timestamp":1775789342731,"segment":1,"confidence":18.513513513513512,"iterationTokens":1670,"asi":{"hypothesis":"IteratedExpectation can safely gain baseline autocorrect by replacing only deterministic single-expectation `.each` call nodes with `all` matcher form while guarding against matcher-local param usage.","implemented_cop":"RSpec/IteratedExpectation","rubocop_reference":"vendor/rubocop-rspec/lib/rubocop/cop/rspec/iterated_expectation.rb","tests":"cargo test --lib --quiet -- cop::rspec::iterated_expectation","with_autocorrect_after":685,"missing_autocorrect_after":231,"offenses_benchmark":3992,"safety_guard":"Autocorrect only runs for single expectation bodies where matcher subtree does not reference block parameter; all other offenses stay diagnostic-only.","learning":"Replacing block range alone leaves `receiver.each` prefix; full call-node range replacement is required for correct rewrite."}}
{"run":524,"commit":"3b077bf","metric":686,"metrics":{},"status":"keep","description":"Added conservative RuboCop-aligned autocorrect support for RSpec/HooksBeforeExamples. Baseline autocorrect now moves the first deterministic offending hook statement in an example group above the first example/include-example boundary via stable contiguous-range rewrite; remaining offenses stay diagnostic-only in that pass. Added supports_autocorrect, corrected fixture, and focused move test.","timestamp":1775789825930,"segment":1,"confidence":18.54054054054054,"iterationTokens":1818,"asi":{"hypothesis":"HooksBeforeExamples can safely gain baseline autocorrect by moving a single offending hook statement before the first example boundary using source-range reorder, avoiding multi-move overlap complexity.","implemented_cop":"RSpec/HooksBeforeExamples","rubocop_reference":"vendor/rubocop-rspec/lib/rubocop/cop/rspec/hooks_before_examples.rb","tests":"cargo test --lib --quiet -- cop::rspec::hooks_before_examples","with_autocorrect_after":686,"missing_autocorrect_after":230,"offenses_benchmark":3992,"safety_guard":"Autocorrect currently applies only one hook move per group per run to avoid overlapping move corrections; diagnostics still report all offenses.","learning":"Insertion point must use first-example line start (not selector offset) to preserve indentation when moving statements."}}
{"run":525,"commit":"65cedf5","metric":687,"metrics":{},"status":"keep","description":"Added conservative RuboCop-aligned autocorrect support for RSpec/LetBeforeExamples. Baseline autocorrect moves the first deterministic offending let/let! statement in an example group before the first example boundary via contiguous-range reorder, and skips autocorrect when include-example calls are present (matching RuboCop’s conservative behavior). Added supports_autocorrect and focused move test.","timestamp":1775790010948,"segment":1,"confidence":18.56756756756757,"iterationTokens":14085,"asi":{"hypothesis":"LetBeforeExamples can safely gain baseline autocorrect by moving one offending let declaration before first example using stable source-range reorder with include-example safety guard.","implemented_cop":"RSpec/LetBeforeExamples","rubocop_reference":"vendor/rubocop-rspec/lib/rubocop/cop/rspec/let_before_examples.rb","tests":"cargo test --lib --quiet -- cop::rspec::let_before_examples","with_autocorrect_after":687,"missing_autocorrect_after":229,"offenses_benchmark":3992,"safety_guard":"Autocorrect currently performs one move per group and is disabled for groups containing include-example calls to avoid unsafe reorder semantics.","learning":"Using a single contiguous replacement (from first-example insertion point through moved statement end) avoids offset-order issues from separate insert/delete corrections."}}
{"run":526,"commit":"ca0a5f6","metric":688,"metrics":{},"status":"keep","description":"Added conservative RuboCop-aligned autocorrect support for RSpec/ScatteredLet. Baseline autocorrect now moves the first deterministic scattered let/let! declaration per group to immediately follow the initial let block via contiguous-range reorder (including block-pass let forms), while remaining offenses in the same pass stay diagnostic-only.","timestamp":1775790230591,"segment":1,"confidence":18.346666666666668,"iterationTokens":18967,"asi":{"hypothesis":"ScatteredLet can safely gain baseline autocorrect by relocating one scattered let declaration after the first let anchor using stable source-range reorder and existing let-form guards.","implemented_cop":"RSpec/ScatteredLet","rubocop_reference":"vendor/rubocop-rspec/lib/rubocop/cop/rspec/scattered_let.rb","tests":"cargo test --lib --quiet -- cop::rspec::scattered_let","with_autocorrect_after":688,"missing_autocorrect_after":228,"offenses_benchmark":3992,"safety_guard":"Autocorrect performs at most one move per example group per pass to avoid overlapping reorder corrections.","learning":"Using anchor-at-first-let-end plus contiguous replacement preserves indentation and avoids insert/delete offset races."}}
{"run":527,"commit":"8ebd641","metric":689,"metrics":{},"status":"keep","description":"Added conservative RuboCop-aligned autocorrect support for RSpec/ScatteredSetup. Baseline autocorrect now merges one repeated hook occurrence per duplicate hook group by appending the later hook body into the first hook body and removing the moved hook statement line; around hooks/class-method hooks/unknown-scope hooks remain guarded by existing logic.","timestamp":1775790511062,"segment":1,"confidence":18.13157894736842,"iterationTokens":19772,"asi":{"hypothesis":"ScatteredSetup can safely gain baseline autocorrect by performing one deterministic merge per duplicate hook group (insert body text after first hook body, remove moved hook line) while retaining existing scope/metadata and safety guards.","implemented_cop":"RSpec/ScatteredSetup","rubocop_reference":"vendor/rubocop-rspec/lib/rubocop/cop/rspec/scattered_setup.rb","tests":"cargo test --lib --quiet -- cop::rspec::scattered_setup","with_autocorrect_after":689,"missing_autocorrect_after":227,"offenses_benchmark":3992,"safety_guard":"Autocorrect performs at most one merge per duplicate group per pass to avoid overlapping multi-merge edits.","learning":"Hook-body insertion + whole-line removal gives stable baseline merges without offset collisions."}}
{"run":528,"commit":"bda0699","metric":690,"metrics":{},"status":"keep","description":"Added conservative RuboCop-aligned autocorrect support for RSpec/LeadingSubject. Baseline autocorrect now moves the first deterministic offending `subject` declaration before the first prior relevant declaration in the same block scope via contiguous-range reorder; remaining same-scope subject offenses stay diagnostic-only in that pass.","timestamp":1775790833486,"segment":1,"confidence":18.157894736842106,"iterationTokens":32361,"asi":{"hypothesis":"LeadingSubject can safely gain baseline autocorrect by moving one offending subject statement before the first relevant prior declaration while preserving existing scope traversal and conditional recursion logic.","implemented_cop":"RSpec/LeadingSubject","rubocop_reference":"vendor/rubocop-rspec/lib/rubocop/cop/rspec/leading_subject.rb","tests":"cargo test --lib --quiet -- cop::rspec::leading_subject","with_autocorrect_after":690,"missing_autocorrect_after":226,"offenses_benchmark":3992,"safety_guard":"Autocorrect performs one move per block scope per pass to avoid overlapping reorders in deeply nested structures.","learning":"Using statement line-start insertion anchors plus contiguous replacement preserves indentation and avoids insert/delete offset conflicts."}}
{"run":529,"commit":"d3bfef6","metric":691,"metrics":{},"status":"keep","description":"Enabled conservative autocorrect for Lint/UselessRuby2Keywords (inline-def offenses only): remove the `ruby2_keywords ` prefix from `ruby2_keywords def ...` when the method signature makes the call unnecessary, preserving the original `def` body unchanged.","timestamp":1775791337573,"segment":1,"confidence":18.18421052631579,"iterationTokens":32361,"asi":{"hypothesis":"A safe baseline autocorrect for UselessRuby2Keywords can be added by only correcting the already-detected inline `ruby2_keywords def ...` form via prefix deletion.","implemented_cop":"Lint/UselessRuby2Keywords","scope_guard":"Autocorrect intentionally limited to inline-def argument form; symbol-reference form remains diagnostic-only.","tests":"cargo test --lib --quiet -- cop::lint::useless_ruby2_keywords","with_autocorrect_after":691,"missing_autocorrect_after":225,"offenses_benchmark":3992,"learning":"Prefix-range deletion between call start and nested def start gives a deterministic rewrite (`ruby2_keywords def ...` -> `def ...`) without touching method body formatting."}}
{"run":530,"commit":"22e2771","metric":692,"metrics":{},"status":"keep","description":"Added conservative autocorrect support for Lint/RefinementImportMethods by rewriting direct `include`/`prepend` calls inside single-statement `refine` bodies to `import_methods`, while preserving existing Ruby-version gating and direct-child matching behavior.","timestamp":1775791459798,"segment":1,"confidence":17.974025974025974,"iterationTokens":5180,"asi":{"hypothesis":"RefinementImportMethods can safely gain deterministic baseline autocorrect by selector rewrite (`include`/`prepend` -> `import_methods`) only in the exact offense shape we already detect.","implemented_cop":"Lint/RefinementImportMethods","scope_guard":"Only direct no-receiver include/prepend in refine body; still respects TargetRubyVersion >= 3.1 and single-statement refine-body parity guard.","tests":"cargo test --lib --quiet -- cop::lint::refinement_import_methods","with_autocorrect_after":692,"missing_autocorrect_after":224,"offenses_benchmark":3992,"safety_note":"Behavioral risk is inherited from the cop semantics; correction remains tightly scoped to deterministic selector replacement."}}
{"run":531,"commit":"c7a8f5e","metric":693,"metrics":{},"status":"keep","description":"Added conservative baseline autocorrect for Lint/EmptyExpression: deterministic empty-parentheses offenses now autocorrect to `nil` via node-range replacement; empty interpolation offenses remain diagnostic-only.","timestamp":1775791632079,"segment":1,"confidence":17.76923076923077,"iterationTokens":42487,"asi":{"hypothesis":"Lint/EmptyExpression can safely gain incremental autocorrect by only rewriting empty `()` nodes to `nil` while leaving `#{}` forms unchanged.","implemented_cop":"Lint/EmptyExpression","scope_guard":"Autocorrect applies only to empty parentheses nodes; embedded empty interpolation stays offense-only for now.","tests":"cargo test --lib --quiet -- cop::lint::empty_expression","with_autocorrect_after":693,"missing_autocorrect_after":223,"offenses_benchmark":3992,"learning":"Replacing the full parentheses node range with `nil` provides a stable, context-agnostic baseline rewrite with minimal formatting risk."}}
{"run":532,"commit":"edb830a","metric":694,"metrics":{},"status":"keep","description":"Added conservative baseline autocorrect for Lint/FloatOutOfRange: rewrite infinite overflow literals to explicit infinity constants (`Float::INFINITY` / `(-Float::INFINITY)`) via node-range replacement.","timestamp":1775791774081,"segment":1,"confidence":17.794871794871796,"iterationTokens":7397,"asi":{"hypothesis":"FloatOutOfRange can safely support deterministic autocorrect by replacing only literals that already parse to ±infinity.","implemented_cop":"Lint/FloatOutOfRange","scope_guard":"Autocorrect applies only when parsed float value is infinite; finite literals remain untouched.","tests":"cargo test --lib --quiet -- cop::lint::float_out_of_range","with_autocorrect_after":694,"missing_autocorrect_after":222,"offenses_benchmark":3992,"learning":"Value-based infinity detection allows minimal-range replacement while preserving surrounding expression structure."}}
{"run":533,"commit":"25591c7","metric":695,"metrics":{},"status":"keep","description":"Added conservative baseline autocorrect for Style/ImplicitRuntimeError: rewrite single-string bare `raise`/`fail` calls to include explicit `RuntimeError` class (`raise RuntimeError, 'msg'`).","timestamp":1775795911020,"segment":1,"confidence":17.375,"iterationTokens":3124,"asi":{"hypothesis":"ImplicitRuntimeError can gain deterministic baseline autocorrect by rewriting only the currently flagged bare-message call shape (`raise|fail` with exactly one string/dstr arg and no receiver).","implemented_cop":"Style/ImplicitRuntimeError","scope_guard":"Autocorrect limited to no-receiver one-arg string/dstr calls; existing stricter offense shape unchanged.","tests":"cargo test --lib --quiet -- cop::style::implicit_runtime_error","with_autocorrect_after":695,"missing_autocorrect_after":221,"offenses_benchmark":3992,"learning":"Whole-call replacement is stable for this narrow shape and avoids argument-range parsing pitfalls around parenthesized call forms."}}
{"run":534,"commit":"edb830a","metric":0,"metrics":{},"status":"crash","description":"Attempted to add baseline autocorrect to Lint/Debugger, but compile failed with type mismatches passing `CallNode` by value into helper expecting `&CallNode`.","timestamp":1775796246620,"segment":1,"confidence":17.375,"iterationTokens":30886,"asi":{"hypothesis":"Lint/Debugger could support conservative autocorrect by removing standalone debugger-entry-point lines.","rollback_reason":"Compilation failed (E0308) in src/cop/lint/debugger.rs due to borrowed-vs-owned CallNode mismatch while threading helper calls.","next_action_hint":"Borrow `call` at helper call sites (`&call`), rerun targeted debugger tests, then validate metric/invariant before deciding keep/discard.","error":"error[E0308] mismatched types: expected &CallNode, found CallNode"}}
{"run":535,"commit":"a356f42","metric":696,"metrics":{},"status":"keep","description":"Added conservative autocorrect support for Lint/Debugger: when a flagged debugger entry point is a standalone statement line, autocorrect removes the full line; non-standalone usage remains diagnostic-only.","timestamp":1775796497516,"segment":1,"confidence":17.4,"iterationTokens":13097,"asi":{"hypothesis":"Debugger offenses can safely gain baseline autocorrect by deleting only standalone debugger-entry-point statements while leaving embedded usage untouched.","implemented_cop":"Lint/Debugger","scope_guard":"Autocorrect applies only when the offending call occupies a standalone statement line (allowing trailing comments), avoiding embedded expression rewrites.","tests":"cargo test --lib --quiet -- cop::lint::debugger","with_autocorrect_after":696,"missing_autocorrect_after":220,"offenses_benchmark":3992,"recovery":"Previous compile crash (E0308 borrow mismatch) was fixed by avoiding helper call borrowing issues and applying direct guarded correction logic at offense sites."}}
{"run":536,"commit":"386a414","metric":697,"metrics":{},"status":"keep","description":"Added conservative autocorrect support for Style/InlineComment: for flagged trailing inline comments, autocorrect moves the comment to its own line above the statement while preserving statement text and indentation.","timestamp":1775796746468,"segment":1,"confidence":17.425,"iterationTokens":9416,"asi":{"hypothesis":"InlineComment can safely gain baseline autocorrect by line-local rewrite that lifts trailing comments to standalone comment lines.","implemented_cop":"Style/InlineComment","scope_guard":"Only applies to already-flagged inline comments; standalone comments and directive comments remain unchanged.","tests":"cargo test --lib --quiet -- cop::style::inline_comment","with_autocorrect_after":697,"missing_autocorrect_after":219,"offenses_benchmark":3992,"learning":"Single-line replacement over the full statement line avoids overlapping edits and keeps indentation stable for both comment and statement."}}
{"run":537,"commit":"2c41239","metric":698,"metrics":{},"status":"keep","description":"Added conservative autocorrect support for Lint/RequireParentheses: for flagged non-parenthesized predicate/ternary call forms, autocorrect rewrites the call to wrap the existing argument span in parentheses while preserving receiver/method text.","timestamp":1775796960571,"segment":1,"confidence":17.45,"iterationTokens":11597,"asi":{"hypothesis":"RequireParentheses can safely gain baseline autocorrect by converting only already-flagged no-paren call shapes into equivalent parenthesized call expressions.","implemented_cop":"Lint/RequireParentheses","scope_guard":"Autocorrect skipped for calls with blocks and only applies when argument span and call prefix can be deterministically sliced.","tests":"cargo test --lib --quiet -- cop::lint::require_parentheses","with_autocorrect_after":698,"missing_autocorrect_after":218,"offenses_benchmark":3992,"learning":"Prefix+argument-span rewrite is stable and avoids token-level edits in mixed boolean/ternary argument expressions."}}
{"run":538,"commit":"d2a4616","metric":699,"metrics":{},"status":"keep","description":"Added conservative autocorrect support for Style/ExponentialNotation (scientific style baseline): normalize flagged lowercase-`e` literals to mantissa-in-[1,10) form via deterministic source-based exponent/mantissa rewriting.","timestamp":1775797168797,"segment":1,"confidence":17.475,"iterationTokens":13641,"asi":{"hypothesis":"ExponentialNotation can gain safe baseline autocorrect for scientific style using source-driven decimal normalization without floating-point evaluation.","implemented_cop":"Style/ExponentialNotation","scope_guard":"Autocorrect only applies for `EnforcedStyle: scientific` and skips unsupported source forms (e.g., leading `+` mantissa).","tests":"cargo test --lib --quiet -- cop::style::exponential_notation","with_autocorrect_after":699,"missing_autocorrect_after":217,"offenses_benchmark":3992,"learning":"Digit-index based normalization avoids numeric precision drift and handles high exponents deterministically."}}
{"run":539,"commit":"1d04882","metric":700,"metrics":{},"status":"keep","description":"Added conservative autocorrect support for Lint/UriEscapeUnescape: for deterministic single-argument `URI.escape`/`URI.unescape` offenses, autocorrect rewrites calls to `CGI.escape(...)`/`CGI.unescape(...)`; broader `encode`/`decode` paths remain diagnostic-only.","timestamp":1775797408951,"segment":1,"confidence":17.28395061728395,"iterationTokens":11068,"asi":{"hypothesis":"UriEscapeUnescape can gain safe baseline autocorrect by handling only unambiguous one-arg escape/unescape forms with direct CGI replacements.","implemented_cop":"Lint/UriEscapeUnescape","scope_guard":"Autocorrect limited to `escape`/`unescape` with exactly one argument and exact URI receiver match; `encode`/`decode` left unchanged due multiple valid replacements.","tests":"cargo test --lib --quiet -- cop::lint::uri_escape_unescape","with_autocorrect_after":700,"missing_autocorrect_after":216,"offenses_benchmark":3992,"learning":"Conservative single-argument CGI rewrite gives deterministic behavior while respecting the cop’s broader replacement ambiguity."}}
{"run":540,"commit":"d5cbcb3","metric":701,"metrics":{},"status":"keep","description":"Added conservative autocorrect support for Lint/UselessDefined: rewrite useless `defined?` calls with string/symbol-like literal arguments to the deterministic truthy result literal `\"expression\"`.","timestamp":1775798368614,"segment":1,"confidence":17.097560975609756,"iterationTokens":2620,"asi":{"hypothesis":"UselessDefined can safely autocorrect literal-argument `defined?` calls by replacing them with the guaranteed Ruby result string.","implemented_cop":"Lint/UselessDefined","scope_guard":"Autocorrect only triggers for existing offense shapes (string/symbol/interpolated/source-file-like arguments), leaving variable/constant probes unchanged.","tests":"cargo test --lib --quiet -- cop::lint::useless_defined","with_autocorrect_after":701,"missing_autocorrect_after":215,"offenses_benchmark":3992,"learning":"Whole-node replacement to `\"expression\"` provides deterministic semantics-preserving baseline for these literal-only `defined?` forms."}}
{"run":541,"commit":"c14e3f2","metric":702,"metrics":{},"status":"keep","description":"Added conservative autocorrect support for Lint/RandOne: deterministic `rand(1)`/`rand(-1)`/`Kernel.rand(1.0)`-style offenses now autocorrect by replacing the call expression with `0`.","timestamp":1775798636801,"segment":1,"confidence":17.121951219512194,"iterationTokens":23028,"asi":{"hypothesis":"RandOne offenses are safe to autocorrect by replacing the offending call with the constant result `0`.","implemented_cop":"Lint/RandOne","scope_guard":"Autocorrect only applies to already-detected RandOne offense shapes (receiverless/Kernel.rand with ±1 or ±1.0 literal argument).","tests":"cargo test --lib --quiet -- cop::lint::rand_one","with_autocorrect_after":702,"missing_autocorrect_after":214,"offenses_benchmark":3992,"learning":"Whole-call replacement to `0` is deterministic and preserves semantics for all flagged RandOne literals."}}
