{"run":2,"commit":"f65cce6","metric":0,"metrics":{},"status":"crash","description":"RootPublicPath validation command failed on offense-invariant check because the sed capture was greedy and parsed `3992 offenses detected` as `2`; experiment data invalid despite successful test run.","timestamp":1775679694979,"segment":0,"confidence":null,"iterationTokens":7502,"asi":{"hypothesis":"Validate Rails/RootPublicPath autocorrect implementation and advance primary metric via targeted tests + count + offense invariant.","rollback_reason":"Benchmark parser bug (greedy sed regex) produced false invariant failure (`got 2`) and forced run exit.","next_action_hint":"Use a robust parser (`grep -Eo '[0-9]+ offenses detected' | head -n1 | cut -d' ' -f1`) and rerun the same RootPublicPath experiment.","error_details":"Offense invariant check expected 3992 but parsed value 2 from summary line."}}
{"run":3,"commit":"52beb97","metric":530,"metrics":{},"status":"keep","description":"Added RuboCop-aligned autocorrect for Rails/RedundantTravelBack by removing redundant `travel_back` lines inside `def teardown` and `after do ... end` scopes, with Rails-versioned autocorrect tests and offense invariant preserved.","timestamp":1775679731483,"segment":0,"confidence":null,"iterationTokens":6865,"asi":{"hypothesis":"Rails/RedundantTravelBack should safely autocorrect by deleting the full line containing redundant `travel_back` within teardown/after scopes, matching RuboCop's whole-line removal behavior.","rubocop_reference":"vendor/rubocop-rails/lib/rubocop/cop/rails/redundant_travel_back.rb","implemented_cop":"Rails/RedundantTravelBack","tests":"cargo test --lib -- cop::rails::redundant_travel_back","with_autocorrect_after":530,"missing_autocorrect_after":386,"offenses_benchmark":3992}}
{"run":3,"commit":"4407c64","metric":530,"metrics":{},"status":"keep","description":"Implemented RuboCop-aligned autocorrect for Rails/RootPublicPath by replacing `Rails.root.join('public...')` calls with `Rails.public_path` (+ optional `.join(...)`) and validated offense invariant 3992.","timestamp":1775679855699,"segment":0,"confidence":null,"iterationTokens":4038,"asi":{"hypothesis":"RootPublicPath is a deterministic whole-call rewrite (`Rails.root.join('public...')` -> `Rails.public_path...`) and should increase with_autocorrect while preserving benchmark offenses.","rubocop_reference":"vendor/rubocop-rails/lib/rubocop/cop/rails/root_public_path.rb","implemented_cop":"Rails/RootPublicPath","tests":"cargo test --lib -- cop::rails::root_public_path","offenses_benchmark":3992,"with_autocorrect_after":530,"missing_autocorrect_after":386,"learning":"Portable benchmark parsing must avoid gawk-only match-array usage and greedy sed captures; grep-based extraction is stable."}}
{"run":4,"commit":"4407c64","metric":530,"metrics":{},"status":"discard","description":"Tried adding autocorrect parity for RSpec/IncludeExamples selector rewrite (`include_examples` -> `it_behaves_like`), but primary metric stayed flat at 530 while offense invariant remained 3992.","timestamp":1775679977772,"segment":0,"confidence":null,"iterationTokens":11381,"asi":{"hypothesis":"IncludeExamples selector autocorrect should be a safe +1 by replacing only the method token.","rollback_reason":"Primary metric did not improve (with_autocorrect remained 530), so this iteration is discarded per objective.","next_action_hint":"Target another cop still missing supports_autocorrect and verify count increase before keeping.","rubocop_reference":"vendor/rubocop-rspec/lib/rubocop/cop/rspec/include_examples.rb","tests":"cargo test --lib -- cop::rspec::include_examples","with_autocorrect_observed":530,"missing_autocorrect_observed":386,"offenses_benchmark":3992}}
{"run":4,"commit":"570cc06","metric":532,"metrics":{},"status":"keep","description":"Enabled RuboCop-aligned autocorrect for RSpec/SharedExamples (style-based first-arg rewrite) and validated offense invariant 3992; continuation also contained RSpec/DuplicatedMetadata autocorrect changes now verified with targeted tests.","timestamp":1775680121022,"segment":0,"confidence":null,"iterationTokens":28508,"asi":{"hypothesis":"SharedExamples can safely autocorrect by replacing the first shared-group title arg (`:sym` <-> 'string') under EnforcedStyle rules, and any pending supports_autocorrect work should be validated before keep.","rubocop_reference":"vendor/rubocop-rspec/lib/rubocop/cop/rspec/shared_examples.rb","implemented_cops":"RSpec/SharedExamples, RSpec/DuplicatedMetadata","tests":"cargo test --lib -- cop::rspec::shared_examples; cargo test --lib -- cop::rspec::duplicated_metadata","offenses_benchmark":3992,"with_autocorrect_after":532,"missing_autocorrect_after":384,"learning":"Resumed continuations can leave additional modified cop files; always check `git status` before logging keep so co-committed cops are explicitly validated."}}
{"run":5,"commit":"5e6a35d","metric":532,"metrics":{},"status":"keep","description":"Added RuboCop-aligned autocorrect for RSpec/DuplicatedMetadata by removing duplicated symbol metadata entries with surrounding comma/space cleanup; targeted tests pass and offense invariant remains 3992.","timestamp":1775680172474,"segment":0,"confidence":null,"iterationTokens":7417,"asi":{"hypothesis":"DuplicatedMetadata can safely autocorrect by deleting duplicate symbol metadata arguments (left-comma removal) while preserving remaining metadata ordering.","rubocop_reference":"vendor/rubocop-rspec/lib/rubocop/cop/rspec/duplicated_metadata.rb","implemented_cop":"RSpec/DuplicatedMetadata","tests":"cargo test --lib -- cop::rspec::duplicated_metadata","with_autocorrect_after":532,"missing_autocorrect_after":384,"offenses_benchmark":3992,"note":"Count jump indicates multiple pending supports_autocorrect additions are now present and validated in this state."}}
{"run":5,"commit":"009c1fc","metric":534,"metrics":{},"status":"keep","description":"Enabled RuboCop-aligned autocorrect for RSpec/SharedContext (selector rewrite between shared_context/shared_examples based on block contents) and validated offense invariant 3992; continuation also included Rails/TopLevelHashWithIndifferentAccess autocorrect support verified with targeted tests.","timestamp":1775680359784,"segment":0,"confidence":265,"iterationTokens":22969,"asi":{"hypothesis":"SharedContext can autocorrect safely by replacing only the shared-group selector when block content indicates examples-only vs setup-only; pending continuation changes must be co-validated before keep.","rubocop_references":"vendor/rubocop-rspec/lib/rubocop/cop/rspec/shared_context.rb; vendor/rubocop-rails/lib/rubocop/cop/rails/top_level_hash_with_indifferent_access.rb","implemented_cops":"RSpec/SharedContext, Rails/TopLevelHashWithIndifferentAccess","tests":"cargo test --lib -- cop::rspec::shared_context; cargo test --lib -- cop::rails::top_level_hash_with_indifferent_access","offenses_benchmark":3992,"with_autocorrect_after":534,"missing_autocorrect_after":382,"learning":"Context-resume state may include additional unstaged cop work; validate all modified cop files before each keep commit."}}
{"run":76,"commit":"decbdae","metric":534,"metrics":{},"status":"keep","description":"Resumed from compacted context and validated current branch state with targeted Rails/TopLevelHashWithIndifferentAccess autocorrect coverage; branch now measures with_autocorrect=534 while preserving benchmark offense invariant 3992.","timestamp":1775680377014,"segment":1,"confidence":31.41176470588235,"iterationTokens":6332,"asi":{"hypothesis":"Current HEAD includes additional landed autocorrect work; validating targeted tests + count/benchmark should confirm higher with_autocorrect without offense drift.","tests":"cargo test --lib -- cop::rails::top_level_hash_with_indifferent_access","runtime_ms":518.08,"offenses_benchmark":3992,"missing_autocorrect_after":382,"note":"Working tree was already effectively at this state except autoresearch.jsonl; validation run recorded new baseline progression."}}
{"run":1,"commit":"747d4b7","metric":534,"metrics":{},"status":"keep","description":"Enabled RuboCop-aligned autocorrect for RSpec/SharedContext (selector swap between shared_context/shared_examples based on recursive block content) and Rails/TopLevelHashWithIndifferentAccess (prepend ActiveSupport:: for top-level constant references); targeted tests passed and offense invariant remained 3992.","timestamp":1775680414662,"segment":0,"confidence":null,"iterationTokens":null,"asi":{"hypothesis":"Two pending missing-autocorrect cops (RSpec/SharedContext and Rails/TopLevelHashWithIndifferentAccess) should safely increase with_autocorrect by +2 via localized selector/constant-prefix rewrites mirroring RuboCop.","rubocop_references":"vendor/rubocop-rspec/lib/rubocop/cop/rspec/shared_context.rb; vendor/rubocop-rails/lib/rubocop/cop/rails/top_level_hash_with_indifferent_access.rb","implemented_cops":"RSpec/SharedContext, Rails/TopLevelHashWithIndifferentAccess","tests":"cargo test --lib -- cop::rspec::shared_context cop::rails::top_level_hash_with_indifferent_access","with_autocorrect_after":534,"missing_autocorrect_after":382,"offenses_benchmark":3992,"ideas_review":"Checked autoresearch.ideas.md; RSpec/Focus metadata parity remains actionable and was kept. No stale/tried ideas to prune in this pass."}}
{"run":77,"commit":"2217f11","metric":537,"metrics":{},"status":"keep","description":"Added RuboCop-aligned autocorrect for Rails/AddColumnIndex by removing the `index:` pair from `add_column` and inserting a follow-up `add_index` statement (including hash options), with fixture autocorrect coverage.","timestamp":1775680558030,"segment":1,"confidence":31.58823529411765,"iterationTokens":7620,"asi":{"hypothesis":"AddColumnIndex can be corrected by deleting the offending `index:` pair with comma cleanup and appending `add_index table, column` with optional index hash options.","rubocop_reference":"vendor/rubocop-rails/lib/rubocop/cop/rails/add_column_index.rb","implemented_cop":"Rails/AddColumnIndex","tests":"cargo test --lib -- cop::rails::add_column_index","runtime_ms":570.02,"offenses_benchmark":3992,"missing_autocorrect_after":379}}
{"run":6,"commit":"009c1fc","metric":0,"metrics":{},"status":"checks_failed","description":"IgnoredSkipActionFilterOption autocorrect attempt failed fixture checks: offense anchor moved to keyword-pair column instead of existing call-start location expected by fixtures.","timestamp":1775680605765,"segment":0,"confidence":265,"iterationTokens":23805,"asi":{"hypothesis":"Add autocorrect by removing ignored keyword pair (`if` with `only`, or `except` with `if`) while preserving existing diagnostics.","rollback_reason":"offense_fixture failed with column mismatch (expected 0, got 49) because diagnostic location changed from call start to pair key offset.","next_action_hint":"Re-apply with diagnostic anchor unchanged at call start and keep pair-location logic only for corrections, then rerun targeted tests + metrics.","error_details":"testutil column mismatch in cop::rails::ignored_skip_action_filter_option::tests::offense_fixture"}}
{"run":2,"commit":"2217f11","metric":538,"metrics":{},"status":"discard","description":"ShortI18n validation run was confounded: target tests passed and offense invariant held, but primary metric increase came from an unrelated pending StripHeredoc change in the working tree, so this result is not attribution-clean for a keep decision.","timestamp":1775680700643,"segment":0,"confidence":null,"iterationTokens":28603,"asi":{"hypothesis":"Validate ShortI18n autocorrect and advance count by +1.","rollback_reason":"Run mixed unrelated in-flight changes; measured with_autocorrect increase cannot be attributed solely to the intended experiment, so keeping would risk bundling unvalidated code.","next_action_hint":"Run a clean experiment explicitly targeting Rails/StripHeredoc with its own cop tests plus benchmark guard, then keep/discard based on that isolated result.","tests":"cargo test --lib -- cop::rails::short_i18n","offenses_benchmark":3992,"with_autocorrect_observed":538,"missing_autocorrect_observed":378}}
{"run":78,"commit":"2217f11","metric":0,"metrics":{},"status":"crash","description":"Attempted Rails/StripHeredoc autocorrect implementation, but targeted autocorrect tests failed with no corrections emitted.","timestamp":1775680750942,"segment":1,"confidence":31.58823529411765,"iterationTokens":4606,"asi":{"hypothesis":"StripHeredoc can autocorrect by converting heredoc opener to `<<~` and removing `.strip_heredoc` call.","rollback_reason":"Autocorrect path did not emit corrections in tests (`Cop produced no corrections`).","next_action_hint":"Rework detection/correction using robust receiver source/opening-loc extraction and add fixture-based autocorrect assertions before rerun.","error_details":"Failed tests: autocorrects_dash_heredoc_strip_call, autocorrects_plain_heredoc_strip_call."}}
{"run":7,"commit":"2217f11","metric":537,"metrics":{},"status":"discard","description":"StripHeredoc validation run passed targeted tests and offense invariant, but with_autocorrect remained at 537 in this clean tree (no net primary-metric gain this iteration).","timestamp":1775680773812,"segment":0,"confidence":265,"iterationTokens":8069,"asi":{"hypothesis":"Re-validate Rails/StripHeredoc autocorrect behavior after prior failed attempt and keep only if it moves with_autocorrect upward from current clean baseline.","rollback_reason":"Primary metric was unchanged for the current HEAD; this run was validation-only and did not provide a new count improvement.","next_action_hint":"Pick another missing-autocorrect cop and run an attribution-clean experiment with only intended code changes.","tests":"cargo test --lib -- cop::rails::strip_heredoc","offenses_benchmark":3992,"with_autocorrect_observed":537,"missing_autocorrect_observed":379}}
{"run":3,"commit":"5d696a9","metric":538,"metrics":{},"status":"keep","description":"Added RuboCop-aligned autocorrect for Rails/StripHeredoc by converting heredoc opener to `<<~` and removing `.strip_heredoc` selector (preserving chained calls like `.do_something`); targeted tests passed and offense invariant stayed 3992.","timestamp":1775680819805,"segment":0,"confidence":null,"iterationTokens":12017,"asi":{"hypothesis":"Rails/StripHeredoc is a deterministic autocorrect (`<<`/`<<-`/`<<~` heredoc opener normalization + removing `.strip_heredoc`) and should increase with_autocorrect by +1 safely.","rubocop_reference":"vendor/rubocop-rails/lib/rubocop/cop/rails/strip_heredoc.rb","implemented_cop":"Rails/StripHeredoc","tests":"cargo test --lib -- cop::rails::strip_heredoc","with_autocorrect_after":538,"missing_autocorrect_after":378,"offenses_benchmark":3992,"ideas_review":"Reviewed autoresearch.ideas.md; RSpec/Focus metadata parity remains actionable and no stale/tried ideas required pruning this pass."}}
{"run":79,"commit":"cc4ff1f","metric":539,"metrics":{},"status":"keep","description":"Added RuboCop-aligned autocorrect for Rails/MultipleRoutePaths by expanding multi-path route declarations into separate per-path route lines while preserving method/options and indentation.","timestamp":1775680869013,"segment":1,"confidence":31.705882352941178,"iterationTokens":7950,"asi":{"hypothesis":"MultipleRoutePaths offenses can be corrected by replacing full route send with one route per path argument plus the original trailing options segment.","rubocop_reference":"vendor/rubocop-rails/lib/rubocop/cop/rails/multiple_route_paths.rb","implemented_cop":"Rails/MultipleRoutePaths","tests":"cargo test --lib -- cop::rails::multiple_route_paths","runtime_ms":583.79,"offenses_benchmark":3992,"missing_autocorrect_after":377}}
{"run":80,"commit":"dd4ecbb","metric":541,"metrics":{},"status":"keep","description":"Added RuboCop-aligned autocorrect for Rails/ScopeArgs by wrapping plain second-argument scope calls in `-> { ... }`, with focused autocorrect test coverage.","timestamp":1775680970829,"segment":1,"confidence":30.914285714285715,"iterationTokens":3278,"asi":{"hypothesis":"ScopeArgs offenses can be corrected by replacing the plain method-call second argument with a lambda wrapper preserving original expression source.","rubocop_reference":"vendor/rubocop-rails/lib/rubocop/cop/rails/scope_args.rb","implemented_cop":"Rails/ScopeArgs","tests":"cargo test --lib -- cop::rails::scope_args","runtime_ms":809.32,"offenses_benchmark":3992,"missing_autocorrect_after":375,"runtime_note":"Runtime spike observed in this single run; offense invariant preserved and primary metric improved."}}
{"run":4,"commit":"5d696a9","metric":541,"metrics":{},"status":"discard","description":"RenderPlainText run was again confounded by unrelated in-flight ScopeArgs changes in the working tree, so the +3 metric jump is not attribution-clean for a keep decision.","timestamp":1775680979613,"segment":0,"confidence":null,"iterationTokens":9938,"asi":{"hypothesis":"Add RuboCop-aligned autocorrect for Rails/RenderPlainText and raise with_autocorrect by +1.","rollback_reason":"Measured primary metric reflected multiple modified cops (RenderPlainText + ScopeArgs), but only RenderPlainText was validated in this run.","next_action_hint":"Run a clean experiment that explicitly validates all currently modified cops together (or isolate one cop at a time) before keeping.","tests":"cargo test --lib -- cop::rails::render_plain_text","offenses_benchmark":3992,"with_autocorrect_observed":541,"missing_autocorrect_observed":375}}
{"run":8,"commit":"f3b2b0c","metric":540,"metrics":{},"status":"keep","description":"Kept continuation autocorrect work for Rails/ScopeArgs and Rails/RenderPlainText after targeted cop tests passed; benchmark offense invariant remained 3992 and with_autocorrect reached 540.","timestamp":1775680987864,"segment":0,"confidence":176.66666666666666,"iterationTokens":10202,"asi":{"hypothesis":"Current continuation had pending Rails autocorrect additions that should improve with_autocorrect if both cops pass targeted tests and preserve offense invariant.","rubocop_references":"vendor/rubocop-rails/lib/rubocop/cop/rails/scope_args.rb; vendor/rubocop-rails/lib/rubocop/cop/rails/render_plain_text.rb","implemented_cops":"Rails/ScopeArgs, Rails/RenderPlainText","tests":"cargo test --lib -- cop::rails::strip_heredoc; cargo test --lib -- cop::rails::scope_args; cargo test --lib -- cop::rails::render_plain_text","offenses_benchmark":3992,"with_autocorrect_after":540,"missing_autocorrect_after":376,"learning":"Continuation state can surface additional modified cop files post-run; validating each modified cop before keep avoids blind co-commits."}}
{"run":5,"commit":"f3b2b0c","metric":543,"metrics":{},"status":"discard","description":"SquishedSQLHeredocs run was confounded by an unrelated in-flight ResponseParsedBody change, so the observed +2 metric jump is not attribution-clean for keeping this experiment.","timestamp":1775681141053,"segment":0,"confidence":null,"iterationTokens":13695,"asi":{"hypothesis":"Add RuboCop-aligned autocorrect for Rails/SquishedSQLHeredocs by inserting `.squish` after SQL heredoc delimiters.","rollback_reason":"Measured improvement included multiple modified cops, but only SquishedSQLHeredocs was validated in this run.","next_action_hint":"Run an isolated experiment that validates all modified cops together (including ResponseParsedBody) before keeping, or re-apply one cop at a time on a clean tree.","tests":"cargo test --lib -- cop::rails::squished_sql_heredocs","offenses_benchmark":3992,"with_autocorrect_observed":543,"missing_autocorrect_observed":373}}
{"run":9,"commit":"f3b2b0c","metric":0,"metrics":{},"status":"checks_failed","description":"ResponseParsedBody autocorrect attempt failed because new autocorrect unit tests used default config, so Rails version gate prevented offenses/corrections (`produced no corrections`).","timestamp":1775681177629,"segment":0,"confidence":176.66666666666666,"iterationTokens":22657,"asi":{"hypothesis":"Add safe full-node replacement autocorrect (`response.parsed_body`) for JSON/Nokogiri response-body parse offenses.","rollback_reason":"Autocorrect tests were misconfigured (missing Rails target version options), so assertions failed before metric validation.","next_action_hint":"Re-run with config-aware autocorrect tests (`assert_cop_autocorrect_with_config` and TargetRailsVersion + lockfile flag), then rerun experiment.","error_details":"cop::rails::response_parsed_body autocorrect tests reported no corrections due gate short-circuit."}}
{"run":6,"commit":"03f29fd","metric":542,"metrics":{},"status":"keep","description":"Added RuboCop-aligned autocorrect for Rails/ResponseParsedBody by replacing `JSON.parse(response.body)` and `Nokogiri::HTML/HTML5.parse(response.body)` with `response.parsed_body`; targeted tests passed and offense invariant stayed 3992.","timestamp":1775681265974,"segment":0,"confidence":null,"iterationTokens":6285,"asi":{"hypothesis":"ResponseParsedBody offenses are whole-expression replacements and should safely autocorrect to `response.parsed_body`, increasing with_autocorrect by +1.","rubocop_reference":"vendor/rubocop-rails/lib/rubocop/cop/rails/response_parsed_body.rb","implemented_cop":"Rails/ResponseParsedBody","tests":"cargo test --lib -- cop::rails::response_parsed_body","with_autocorrect_after":542,"missing_autocorrect_after":374,"offenses_benchmark":3992,"ideas_review":"Reviewed autoresearch.ideas.md; RSpec/Focus metadata parity remains actionable and no stale/tried ideas removed this pass."}}
