{"run":24,"commit":"f908d27","metric":0,"metrics":{},"status":"checks_failed","description":"RedundantStringChars autocorrect attempt failed to compile due Node borrow mismatch in helper call.","timestamp":1775696547017,"segment":0,"confidence":null,"iterationTokens":8630,"asi":{"hypothesis":"Add autocorrect for Performance/RedundantStringChars by replacing `.chars.<method>` tails with RuboCop-style direct string operations.","rollback_reason":"Compile error E0308 in `source_for_node(source, args[0])` expected `&Node`, found `Node` (missing borrow).","next_action_hint":"Fix the borrow (`&args[0]`), rerun `cop::performance::redundant_string_chars`, then revalidate count + offense invariant.","error_signature":"E0308 mismatched types in redundant_string_chars.rs"}}
{"run":58,"commit":"f908d27","metric":585,"metrics":{},"status":"discard","description":"Baseline revalidation on advanced HEAD passed redundant_string_chars tests and benchmark invariant 3992, but this cycle introduced no new code delta (state already at 585/331).","timestamp":1775696641606,"segment":0,"confidence":null,"iterationTokens":1846,"asi":{"hypothesis":"Confirm latest head stability before selecting next missing-autocorrect target after context resume.","rollback_reason":"No attributable implementation change in working tree; run only re-measured existing branch state.","next_action_hint":"Pick a fresh missing cop (e.g., Performance/StringInclude or StartWith/EndWith) and run isolated implementation + validation cycle.","tests":"cargo test --lib --quiet -- cop::performance::redundant_string_chars","with_autocorrect_observed":585,"missing_autocorrect_observed":331,"offenses_benchmark":3992}}
{"run":53,"commit":"f908d27","metric":585,"metrics":{},"status":"discard","description":"Squeeze autocorrect run passed tests/invariant but reported with_autocorrect=585 while immediate post-run count was 586 with only Squeeze changes present; measurement appears race/confounded.","timestamp":1775696778100,"segment":0,"confidence":null,"iterationTokens":14355,"asi":{"hypothesis":"Add autocorrect for Performance/Squeeze by rewriting `gsub(/x+/, 'x')` to `squeeze('x')` / bang variant.","rollback_reason":"Parsed METRIC value did not match immediate local counter after run (585 vs 586), so attribution/measurement was inconsistent.","next_action_hint":"Rerun Squeeze experiment from clean state and keep only if run_experiment parsed metrics match local count.","with_autocorrect_reported":585,"with_autocorrect_postcheck":586,"offenses_benchmark":3992}}
{"run":59,"commit":"f908d27","metric":585,"metrics":{},"status":"discard","description":"Squeeze validation run passed tests/invariant at 585/331, but no Squeeze implementation delta survived in the tree (run reflected baseline state only).","timestamp":1775696866308,"segment":0,"confidence":null,"iterationTokens":13099,"asi":{"hypothesis":"Enable autocorrect for Performance/Squeeze (`gsub(/x+/, 'x')` -> `squeeze('x')`) as a low-risk +1.","rollback_reason":"Working tree reverted to baseline Squeeze implementation before/after run, so there was no attributable code change to keep.","next_action_hint":"Target a different missing cop with stable file state (e.g., StartWith/EndWith) and verify modified files still present immediately before logging.","tests":"cargo test --lib --quiet -- cop::performance::squeeze","with_autocorrect_observed":585,"missing_autocorrect_observed":331,"offenses_benchmark":3992}}
{"run":25,"commit":"f908d27","metric":0,"metrics":{},"status":"checks_failed","description":"StartWith autocorrect attempt failed to compile due duplicate helper definitions and receiver-borrow issues in orientation handling.","timestamp":1775697024404,"segment":0,"confidence":null,"iterationTokens":35517,"asi":{"hypothesis":"Add RuboCop-aligned autocorrect for Performance/StartWith by rewriting anchored regex `match/match?/=~` forms to `start_with?` with receiver-orientation support.","rollback_reason":"Compile failed (E0428 duplicate helper names plus E0597/E0507 borrow/move errors in regex-receiver orientation path).","next_action_hint":"Rework StartWith using the existing strip_start_anchor-style helpers and source-string replacements, avoiding moved Node values and duplicate helper insertion.","error_signatures":["E0428 duplicate function definitions","E0597 borrowed value does not live long enough","E0507 cannot move out of borrowed Node"]}}
{"run":60,"commit":"f908d27","metric":585,"metrics":{},"status":"discard","description":"StartWith autocorrect validation run passed tests and invariant 3992 at 585/331, but no StartWith code delta survived in-tree by log time (validation reflected baseline only).","timestamp":1775697132643,"segment":0,"confidence":null,"iterationTokens":11165,"asi":{"hypothesis":"Add RuboCop-aligned StartWith autocorrect by rewriting anchored literal regex match forms to `start_with?`.","rollback_reason":"Working tree reverted to baseline StartWith implementation before logging, so there is no attributable patch to keep.","next_action_hint":"Select next target from ideas and verify modified files still exist immediately before logging keep/discard.","tests":"cargo test --lib --quiet -- cop::performance::start_with","with_autocorrect_observed":585,"missing_autocorrect_observed":331,"offenses_benchmark":3992}}
{"run":54,"commit":"f908d27","metric":585,"metrics":{},"status":"discard","description":"StartWith validation run passed tests and invariant at 585/331, but by post-run check there were no surviving StartWith code/fixture deltas in the worktree, so the result is non-attributable baseline measurement.","timestamp":1775697137346,"segment":0,"confidence":null,"iterationTokens":4803,"asi":{"hypothesis":"Enable autocorrect for Performance/StartWith by rewriting anchored regex match forms to `start_with?` with conservative literal extraction.","rollback_reason":"Working tree had no StartWith modifications at log time; run reflects existing branch state rather than an isolated new change.","next_action_hint":"Select next missing cop and ensure modified files are still present immediately before logging.","with_autocorrect_observed":585,"missing_autocorrect_observed":331,"offenses_benchmark":3992}}
{"run":26,"commit":"f908d27","metric":0,"metrics":{},"status":"checks_failed","description":"StartWith attempt failed tests because autocorrect test hooks were added without actual supports_autocorrect/correction implementation in the cop.","timestamp":1775697257087,"segment":0,"confidence":null,"iterationTokens":14887,"asi":{"hypothesis":"Land Performance/StartWith autocorrect by mirroring RuboCop anchored-regex rewrites.","rollback_reason":"`supports_autocorrect` assertion failed and `autocorrect_fixture` reported no corrections; only test-side wiring landed in this attempt.","next_action_hint":"Implement `supports_autocorrect` + correction generation in `check_node` before enabling autocorrect fixture tests, then rerun.","failing_tests":["cop::performance::start_with::tests::supports_autocorrect","cop::performance::start_with::tests::autocorrect_fixture"]}}
{"run":27,"commit":"f908d27","metric":0,"metrics":{},"status":"checks_failed","description":"ConstantRegexp autocorrect compile/test attempt failed due corrected fixture mismatch (expected included stray `end` line not present in actual offense stream).","timestamp":1775697421685,"segment":0,"confidence":null,"iterationTokens":7228,"asi":{"hypothesis":"Enable Performance/ConstantRegexp autocorrect by appending `/o` flag to interpolated constant regex offenses.","rollback_reason":"`cop::performance::constant_regexp::tests::autocorrect_fixture` failed because expected fixture contained an `end` line absent from offense-derived output.","next_action_hint":"Update `tests/fixtures/cops/performance/constant_regexp/corrected.rb` to match actual autocorrect output shape (remove extra `end`), then rerun.","failing_test":"cop::performance::constant_regexp::tests::autocorrect_fixture"}}
{"run":61,"commit":"f908d27","metric":585,"metrics":{},"status":"discard","description":"ConstantRegexp autocorrect tests and benchmark invariant passed, but post-run recheck showed count advanced to 586/330, indicating this run's measured metric was stale/non-reproducible under concurrent churn.","timestamp":1775697509028,"segment":0,"confidence":null,"iterationTokens":14438,"asi":{"hypothesis":"Enable Performance/ConstantRegexp autocorrect by appending `/o` to eligible interpolated regex literals, with fixture coverage.","rollback_reason":"Primary metric captured in this run (585) did not match immediate post-run remeasurement (586), so attribution for this datapoint is unstable.","next_action_hint":"Rerun the exact ConstantRegexp validation command immediately and keep only if measured metric matches recheck.","tests":"cargo test --lib --quiet -- cop::performance::constant_regexp","with_autocorrect_observed":585,"with_autocorrect_rechecked":586,"missing_autocorrect_rechecked":330,"offenses_benchmark":3992}}
{"run":28,"commit":"f009940","metric":586,"metrics":{},"status":"keep","description":"Added RuboCop-aligned autocorrect for Performance/ConstantRegexp by appending `/o` to interpolated constant regex literals, with corrected fixture coverage and offense invariant preserved.","timestamp":1775697514055,"segment":0,"confidence":null,"iterationTokens":3732,"asi":{"hypothesis":"ConstantRegexp offenses are deterministic and RuboCop autocorrect is a simple node-local insertion (`/o`), so enabling autocorrect should safely increase coverage by +1.","rubocop_reference":"vendor/rubocop-performance/lib/rubocop/cop/performance/constant_regexp.rb","implemented_cop":"Performance/ConstantRegexp","tests":"cargo test --lib --quiet -- cop::performance::constant_regexp","with_autocorrect_after":586,"missing_autocorrect_after":330,"offenses_benchmark":3992}}
{"run":55,"commit":"42488d8","metric":586,"metrics":{},"status":"keep","description":"Added RuboCop-aligned autocorrect for Performance/ConstantRegexp by appending `/o` to interpolated-constant regex literals outside allowed assignments, with corrected fixture coverage; targeted tests pass and benchmark offense invariant remains 3992.","timestamp":1775697641302,"segment":0,"confidence":null,"iterationTokens":4803,"asi":{"hypothesis":"Enable deterministic autocorrect for ConstantRegexp by inserting `o` flag at regex end only when offense already proven and context is safe (not within constant/or assignment).","implementation_notes":"supports_autocorrect enabled, correction inserted at regex end offset, added corrected fixture and autocorrect fixture test macro.","validation":"cargo test --lib --quiet -- cop::performance::constant_regexp; count_missing_autocorrect; release benchmark offense guard","with_autocorrect_observed":586,"missing_autocorrect_observed":330,"offenses_benchmark":3992}}
{"run":62,"commit":"42488d8","metric":586,"metrics":{},"status":"discard","description":"Validation run on advanced HEAD (ConstantRegexp autocorrect already landed in branch) passed targeted tests and offense invariant 3992, but this iteration had no local implementation delta to attribute.","timestamp":1775697665241,"segment":0,"confidence":null,"iterationTokens":4022,"asi":{"hypothesis":"Confirm newly landed ConstantRegexp autocorrect state is stable and benchmark-safe.","rollback_reason":"Run reflected already-committed branch changes rather than a fresh patch in this cycle.","next_action_hint":"Use 586/330 as new baseline and target next missing cop (e.g., StartWith/EndWith/StringInclude) with an isolated edit+validate run.","tests":"cargo test --lib --quiet -- cop::performance::constant_regexp","with_autocorrect_observed":586,"missing_autocorrect_observed":330,"offenses_benchmark":3992,"head_commit_validated":"42488d874"}}
{"run":29,"commit":"f009940","metric":586,"metrics":{},"status":"discard","description":"ConstantRegexp validation run showed +1 metric in experiment sandbox, but no corresponding source/fixture delta remained in working tree after run, so attribution was not keep-safe.","timestamp":1775697683625,"segment":0,"confidence":null,"iterationTokens":7300,"asi":{"hypothesis":"Performance/ConstantRegexp autocorrect (`/#{CONST}/` -> `/#{CONST}/o`) should increase with_autocorrect by +1.","rollback_reason":"Post-run tree contained no `constant_regexp` code/fixture changes, so metric improvement could not be tied to a persistent patch.","next_action_hint":"Reapply the ConstantRegexp patch immediately after successful validation, confirm file diffs are present, then rerun keep cycle.","with_autocorrect_observed":586,"missing_autocorrect_observed":330,"offenses_benchmark":3992}}
{"run":56,"commit":"42488d8","metric":0,"metrics":{},"status":"crash","description":"Attempted Performance/Squeeze autocorrect (`gsub(/x+/, 'x')` -> `squeeze`) failed autocorrect fixture: multiline receiver chain collapsed (`text.downcase.squeeze`) due full-call replacement strategy.","timestamp":1775697785058,"segment":0,"confidence":null,"iterationTokens":7345,"asi":{"hypothesis":"Enable autocorrect for Squeeze by replacing full `gsub/gsub!` call with `squeeze/squeeze!` while preserving receiver and replacement literal.","rollback_reason":"Autocorrect changed formatting/line breaks for multiline chain receivers; expected fixture keeps chained newline layout.","next_action_hint":"Switch to selector-only replacement (`gsub` -> `squeeze`) and keep existing arguments/whitespace; re-run targeted fixture and benchmark guard.","error_signature":"autocorrect_fixture mismatch on multiline chain in cops/performance/squeeze","learning":"Replacing full call spans can normalize formatting; selector/argument-local edits are safer for preserving source layout."}}
{"run":30,"commit":"42488d8","metric":0,"metrics":{},"status":"checks_failed","description":"Squeeze autocorrect attempt failed autocorrect fixture due multiline chain formatting mismatch in expected fixture.","timestamp":1775697795727,"segment":0,"confidence":null,"iterationTokens":4470,"asi":{"hypothesis":"Performance/Squeeze can be safely autocorrected by replacing `gsub` with `squeeze` and preserving receiver/operator shape.","rollback_reason":"`cop::performance::squeeze::tests::autocorrect_fixture` expected multiline `downcase.`/`squeeze` chain, but actual replacement collapses to `downcase.squeeze(...)`.","next_action_hint":"Update squeeze corrected fixture to match RuboCop-style whole-call replacement shape, then rerun targeted test + invariant checks.","failing_test":"cop::performance::squeeze::tests::autocorrect_fixture"}}
{"run":57,"commit":"42488d8","metric":588,"metrics":{},"status":"discard","description":"Confounded run: metrics improved to 588/328, but worktree changes were in Performance/StartWith (not Squeeze), and the validation command only tested Squeeze. Non-attributable/untested delta discarded.","timestamp":1775697993808,"segment":0,"confidence":null,"iterationTokens":5429,"asi":{"hypothesis":"Add autocorrect for Performance/Squeeze.","rollback_reason":"Post-run diff showed StartWith changes and corrected fixture present while Squeeze edits were absent; targeted test coverage did not match changed cop.","next_action_hint":"Re-check git status before each run and validate the actual modified cop with matching targeted tests.","with_autocorrect_observed":588,"missing_autocorrect_observed":328,"offenses_benchmark":3992,"attribution_issue":"dirty start_with.rs + start_with/corrected.rb influenced counts"}}
{"run":63,"commit":"ef32207","metric":329,"metrics":{},"status":"keep","description":"Added RuboCop-aligned autocorrect for Performance/Squeeze by rewriting `gsub(/X+/, 'X')` and `gsub!` offense nodes to `squeeze('X')`/`squeeze!('X')`, with corrected fixture coverage; targeted tests pass and benchmark invariant remains 3992 offenses.","timestamp":1775698050240,"segment":0,"confidence":21.3,"iterationTokens":4022,"asi":{"hypothesis":"Performance/Squeeze is a deterministic whole-call rewrite: once offense conditions are met, replacing gsub/gsub! with squeeze/squeeze! using the same replacement literal should be safe and RuboCop-aligned.","rubocop_reference":"vendor/rubocop-performance/lib/rubocop/cop/performance/squeeze.rb","implemented_cop":"Performance/Squeeze","tests":"cargo test --lib --quiet -- cop::performance::squeeze","with_autocorrect_after":587,"missing_autocorrect_after":329,"offenses_benchmark":3992}}
{"run":31,"commit":"42488d8","metric":587,"metrics":{},"status":"discard","description":"StartWith validation run showed +1 in-command, but StartWith patch did not survive post-run working tree; unrelated in-flight Squeeze edits reappeared, so attribution was not clean.","timestamp":1775698053277,"segment":0,"confidence":null,"iterationTokens":6945,"asi":{"hypothesis":"Performance/StartWith autocorrect should raise coverage by +1 via anchored-regex to `start_with?` rewrites.","rollback_reason":"After run, StartWith source/fixture diffs were absent while unrelated Squeeze diffs were present; cannot attribute metric bump to persistent StartWith patch.","next_action_hint":"Either isolate StartWith changes in a clean worktree or pivot to validating the persistent Squeeze patch that remains after runs.","with_autocorrect_observed":587,"missing_autocorrect_observed":329,"offenses_benchmark":3992}}
{"run":58,"commit":"ef32207","metric":587,"metrics":{},"status":"discard","description":"Validation-only run returned 587/329 with offense invariant 3992, but no isolated new change was under test (Squeeze is already committed in HEAD and unrelated dirty StartWith/ideas edits were present). Discarded as non-attributable baseline.","timestamp":1775698200228,"segment":0,"confidence":null,"iterationTokens":4041,"asi":{"hypothesis":"Re-verify Squeeze autocorrect end-to-end after cleanup.","rollback_reason":"Run executed on a dirty tree with pre-existing StartWith edits; metric movement cannot be attributed to a fresh experiment.","next_action_hint":"Ensure git status is clean (except autoresearch logs), then run next isolated cop experiment.","with_autocorrect_observed":587,"missing_autocorrect_observed":329,"offenses_benchmark":3992,"head_commit_already_contains":"Performance/Squeeze autocorrect commit ef3220720"}}
{"run":64,"commit":"ef32207","metric":0,"metrics":{},"status":"crash","description":"StartWith autocorrect implementation failed to compile: passed owned Prism node where `extract_regex_node` expected `&Node` in `=~` branch.","timestamp":1775698560643,"segment":0,"confidence":21.3,"iterationTokens":34729,"asi":{"hypothesis":"Add RuboCop-aligned autocorrect for Performance/StartWith by rewriting anchored regex match forms to `start_with?` with decoded literal strings.","rollback_reason":"Compile error E0308 at start_with.rs (`extract_regex_node(first_arg)` type mismatch) prevented tests from running.","next_action_hint":"Borrow `first_arg` in the `=~` branch (`extract_regex_node(&first_arg)`), rerun targeted tests and benchmark invariant guard.","error":"E0308 mismatched types in src/cop/performance/start_with.rs","failing_command":"cargo test --lib --quiet -- cop::performance::start_with"}}
{"run":59,"commit":"ef32207","metric":588,"metrics":{},"status":"discard","description":"Confounded run: StartWith tests+benchmark passed at 588/328, but post-run worktree no longer contained StartWith edits and instead contained Detect deltas, so result cannot be attributed to the tested change.","timestamp":1775698687491,"segment":0,"confidence":null,"iterationTokens":6649,"asi":{"hypothesis":"Land Performance/StartWith autocorrect with conservative escape decoding and fixture coverage.","rollback_reason":"Working-tree drift replaced StartWith edits with Detect changes between run and log; attribution/validation mismatch.","next_action_hint":"Before running, snapshot `git status --short` and only proceed when exactly expected files are dirty; if drift recurs, run a cleaning discard cycle and retry one cop.","with_autocorrect_observed":588,"missing_autocorrect_observed":328,"offenses_benchmark":3992,"attribution_issue":"unexpected post-run file swap (start_with -> detect)"}}
{"run":65,"commit":"ef32207","metric":587,"metrics":{},"status":"discard","description":"Detect autocorrect patch passed tests and benchmark invariant, but parsed run metric stayed at 587/329 while immediate post-run recheck shows 588/328; treating this datapoint as stale/non-attributable.","timestamp":1775698767665,"segment":0,"confidence":19.363636363636363,"iterationTokens":5422,"asi":{"hypothesis":"Enable Performance/Detect autocorrect by rewriting `select/find_all/filter` chains ending in `first/last/[0]/[-1]` to `detect`/`reverse.detect`.","rollback_reason":"Primary metric from run output did not match immediate remeasurement on the same working tree.","next_action_hint":"Rerun the identical validation command immediately; keep only if parsed metrics match post-run recheck (588/328).","tests":"cargo test --lib --quiet -- cop::performance::detect","with_autocorrect_observed":587,"with_autocorrect_rechecked":588,"missing_autocorrect_rechecked":328,"offenses_benchmark":3992}}
