{"run":5,"commit":"9159f2d","metric":0,"metrics":{},"status":"checks_failed","description":"Baseline validation run hit a harness parsing bug: benchmark summary now includes ', 172 offenses corrected', so offense parser misread 172 as total offenses.","timestamp":1775685912479,"segment":0,"confidence":null,"iterationTokens":3788,"asi":{"hypothesis":"Revalidate clean baseline (targeted rails tests + count + offense invariant) before next implementation.","rollback_reason":"Invariant gate falsely failed because `awk $(NF-2)` parsed corrected-offense count from `... 3992 offenses detected, 172 offenses corrected` summary format.","next_action_hint":"Use regex extraction for the number immediately before `offenses detected` instead of fixed field index, then rerun baseline validation.","with_autocorrect_observed":557,"missing_autocorrect_observed":359,"actual_summary":"6143 files inspected, 3992 offenses detected, 172 offenses corrected"}}
{"run":16,"commit":"3454028","metric":0,"metrics":{},"status":"crash","description":"FreezeTime autocorrect experiment crashed during test compilation because local helper `rails_config` in tests conflicted with macro-generated `rails_config` from `cop_rails_fixture_tests!`.","timestamp":1775685967415,"segment":0,"confidence":null,"iterationTokens":7277,"asi":{"hypothesis":"Adding supports_autocorrect plus targeted with-config autocorrect tests for FreezeTime should increase with_autocorrect by +1 safely.","rollback_reason":"Compile error E0428 duplicate `rails_config` symbol in `freeze_time.rs` tests.","next_action_hint":"Rename local config helper (e.g., `autocorrect_rails_config`) and rerun the same targeted experiment.","error_details":"error[E0428]: the name `rails_config` is defined multiple times"}}
{"run":4,"commit":"3454028","metric":0,"metrics":{},"status":"checks_failed","description":"FreezeTime autocorrect attempt failed to compile tests due duplicate `rails_config` helper name collision with `cop_rails_fixture_tests!` macro-generated function.","timestamp":1775685973350,"segment":0,"confidence":null,"iterationTokens":6520,"asi":{"hypothesis":"Implement RuboCop-aligned FreezeTime autocorrect (`travel_to(Time.now/current/zone.now)` -> `freeze_time`, with block-pass argument support) for +1 coverage.","rollback_reason":"Rust compile error E0428: local `rails_config` test helper duplicated macro-generated `rails_config` from `cop_rails_fixture_tests!`.","next_action_hint":"Rename local config helper (e.g., `autocorrect_config`) and rerun targeted FreezeTime tests + metric guard.","error":"E0428 duplicate definition of `rails_config` in src/cop/rails/freeze_time.rs","tests":"cargo test --lib -- cop::rails::freeze_time","offenses_benchmark":"not reached"}}
{"run":6,"commit":"680b80f","metric":557,"metrics":{},"status":"keep","description":"Re-anchored continuation baseline with corrected offense-summary parsing (`... offenses detected, ... offenses corrected`); current measured state is with_autocorrect=557, missing=359, offense invariant 3992.","timestamp":1775685989283,"segment":0,"confidence":null,"iterationTokens":2468,"asi":{"hypothesis":"A parser-safe baseline validation run is needed before resuming cop implementations, to avoid false invariant failures from summary-format drift.","with_autocorrect_after":557,"missing_autocorrect_after":359,"offenses_benchmark":3992,"learning":"Use regex extraction for the value immediately before `offenses detected`; fixed-field parsing overcounts when corrected-offense suffix is present."}}
{"run":5,"commit":"3454028","metric":0,"metrics":{},"status":"checks_failed","description":"FreezeTime autocorrect compile passed, but block-pass autocorrect test failed: `travel_to(Time.now, &method(...))` corrected to `freeze_time` instead of preserving `&method(...)`.","timestamp":1775686099358,"segment":0,"confidence":null,"iterationTokens":3648,"asi":{"hypothesis":"FreezeTime autocorrect can mirror RuboCop by preserving block-pass arguments as `freeze_time(&block)` while converting plain calls to `freeze_time`.","rollback_reason":"Current extraction path did not capture block-pass argument location/source, causing dropped argument in autocorrect output.","next_action_hint":"Detect block-pass from both call arguments and `call.block()` Prism slots, then rerun FreezeTime targeted tests and metric guard.","failed_test":"cop::rails::freeze_time::tests::autocorrects_travel_to_with_block_pass_argument","tests":"cargo test --lib -- cop::rails::freeze_time","offenses_benchmark":"not reached"}}
{"run":7,"commit":"33c07d5","metric":558,"metrics":{},"status":"keep","description":"Added RuboCop-aligned autocorrect support for Rails/FreezeTime by replacing flagged `travel_to(Time.now/current/Time.zone.now)` calls with `freeze_time` and preserving block-pass arguments (`freeze_time(&...)`); targeted tests and offense invariant passed.","timestamp":1775686174371,"segment":0,"confidence":null,"iterationTokens":4258,"asi":{"hypothesis":"FreezeTime has deterministic replacements on already-detected current-time travel_to calls, so enabling autocorrect should raise with_autocorrect by +1 without offense drift.","rubocop_reference":"vendor/rubocop-rails/lib/rubocop/cop/rails/freeze_time.rb","implemented_cop":"Rails/FreezeTime","tests":"cargo test --lib -- cop::rails::freeze_time","with_autocorrect_after":558,"missing_autocorrect_after":358,"offenses_benchmark":3992,"harness_fix":"Benchmark offense parsing now extracts the number before 'offenses detected' to avoid misreading ', <n> offenses corrected' suffix."}}
{"run":6,"commit":"4d405fa","metric":558,"metrics":{},"status":"keep","description":"Added RuboCop-aligned baseline autocorrect for Rails/FreezeTime by replacing plain one-arg `travel_to(Time.now/current/Time.zone.now)` calls with `freeze_time`, with Rails-gated autocorrect fixture coverage and offense invariant preserved.","timestamp":1775686271892,"segment":0,"confidence":null,"iterationTokens":4188,"asi":{"hypothesis":"FreezeTime can safely gain autocorrect by whole-call replacement for currently detected one-argument current-time forms, increasing coverage by +1.","rubocop_reference":"vendor/rubocop-rails/lib/rubocop/cop/rails/freeze_time.rb","implemented_cop":"Rails/FreezeTime","tests":"cargo test --lib -- cop::rails::freeze_time","with_autocorrect_after":558,"missing_autocorrect_after":358,"offenses_benchmark":3992,"known_gap":"Conservative baseline skips block-pass/extra-argument forms for autocorrect parity safety.","overfitting_guard":"Validated on full benchmark workload with offense invariant check after release rebuild."}}
{"run":17,"commit":"33c07d5","metric":558,"metrics":{},"status":"discard","description":"Validation-only cycle on already-advanced HEAD confirmed Rails/FreezeTime autocorrect and offense invariant 3992, but no new implementation delta was introduced in this iteration.","timestamp":1775686279882,"segment":0,"confidence":null,"iterationTokens":6063,"asi":{"hypothesis":"Revalidate current FreezeTime state before selecting the next missing-autocorrect target.","rollback_reason":"No attribution-clean code delta in working tree (only autoresearch files), so this run does not represent a distinct optimization step to keep.","next_action_hint":"Target a currently missing cop (e.g., Rails/WhereMissing) with isolated implementation + focused tests + benchmark guard.","tests":"cargo test --lib -- cop::rails::freeze_time","with_autocorrect_observed":558,"missing_autocorrect_observed":358,"offenses_benchmark":3992}}
{"run":8,"commit":"9957228","metric":559,"metrics":{},"status":"keep","description":"Added conservative RuboCop-aligned autocorrect for Rails/WhereMissing: rewrites simple one-condition `left_joins/left_outer_joins` + `where(...id:nil)` chains to `where.missing(:assoc)` and ships Rails-configured autocorrect fixture coverage.","timestamp":1775686335472,"segment":0,"confidence":557,"iterationTokens":8085,"asi":{"hypothesis":"WhereMissing can safely gain +1 autocorrect coverage by correcting only the deterministic single-condition pair shape, leaving multi-condition where calls diagnostic-only.","rubocop_reference":"vendor/rubocop-rails/lib/rubocop/cop/rails/where_missing.rb","implemented_cop":"Rails/WhereMissing","tests":"cargo test --lib -- cop::rails::where_missing","with_autocorrect_after":559,"missing_autocorrect_after":357,"offenses_benchmark":3992,"safety_guard":"Autocorrect path is gated to where(...) hashes with exactly one top-level pair to avoid unsafe multi-condition rewrites."}}
{"run":18,"commit":"9957228","metric":0,"metrics":{},"status":"checks_failed","description":"Attempted bundled autocorrect enablement for I18nLazyLookup + RootJoinChain; I18nLazyLookup tests passed, but RootJoinChain regressed no-offense behavior by falsely flagging non-Rails chained joins.","timestamp":1775686449120,"segment":0,"confidence":null,"iterationTokens":10643,"asi":{"hypothesis":"Both missing Rails cops could be enabled with conservative autocorrect and yield a clean +2.","rollback_reason":"RootJoinChain detector no longer constrained to Rails.root/public_path join chains, causing FP on generic `top.join(...).join(...)` fixture.","next_action_hint":"Restore strict Rails.root/public_path chain guard in `flatten_join_chain`/detection before rerunning combined experiment.","failed_test":"cop::rails::root_join_chain::tests::no_offense_fixture"}}
{"run":7,"commit":"9957228","metric":561,"metrics":{},"status":"discard","description":"Validation-only run on advanced HEAD measured with_autocorrect=561 and offense invariant 3992, but there was no new working-tree code delta to attribute in this iteration.","timestamp":1775686502146,"segment":0,"confidence":null,"iterationTokens":7169,"asi":{"hypothesis":"Re-test I18nLazyLookup autocorrect path and confirm metric movement.","rollback_reason":"No attribution-clean code change was present at logging time (`git status` clean except autoresearch), so this measurement reflects already-landed branch state rather than a new experiment delta.","next_action_hint":"Identify a currently missing-autocorrect cop not yet landed on HEAD, implement in an isolated patch, and rerun targeted tests + benchmark guard.","with_autocorrect_observed":561,"missing_autocorrect_observed":355,"offenses_benchmark":3992,"learning":"Branch drift can outpace local baseline assumptions; verify `git status` and recent commits before keep/discard decisions."}}
{"run":19,"commit":"9957228","metric":0,"metrics":{},"status":"crash","description":"Combined i18n/migration/where_missing validation crashed at compile stage due move semantics bugs in in-flight RootJoinChain autocorrect helpers (`CallNode` moved then reused).","timestamp":1775686631451,"segment":0,"confidence":null,"iterationTokens":13140,"asi":{"hypothesis":"Validate pending multi-cop autocorrect bundle, including I18nLazyLookup, MigrationClassName, and WhereMissing, for a clean metric gain.","rollback_reason":"`root_join_chain.rs` failed to compile (E0382 borrow/use after move) before full experiment checks completed.","next_action_hint":"Change RootJoinChain helper signatures to borrow `CallNode` references (or clone where needed), rerun targeted tests, then rerun metric guard.","error_details":"E0382 at root_join_chain.rs lines around collect_chain_evidence/is_rails_root_or_public_path"}}
{"run":8,"commit":"9957228","metric":0,"metrics":{},"status":"checks_failed","description":"RootJoinChain autocorrect implementation failed to compile due moved-value ownership errors in helper functions (`CallNode` consumed then reused).","timestamp":1775686632201,"segment":0,"confidence":null,"iterationTokens":21076,"asi":{"hypothesis":"Add RuboCop-aligned RootJoinChain autocorrect by flattening chained joins into one `Rails.root/public_path.join(...)` replacement.","rollback_reason":"Rust E0382 ownership errors: `collect_chain_evidence(call)` consumed `call` before later use, and `is_rails_root_or_public_path(recv_call)` consumed `recv_call` before returning it.","next_action_hint":"Refactor helper signatures to borrow `&CallNode` (or clone call handles where available), then rerun targeted RootJoinChain tests and metric guard.","error":"E0382 moved-value borrow/use errors in src/cop/rails/root_join_chain.rs","tests":"cargo test --lib -- cop::rails::root_join_chain","offenses_benchmark":"not reached"}}
{"run":9,"commit":"9957228","metric":0,"metrics":{},"status":"checks_failed","description":"Attribution-clean validation of migration/i18n/root_join_chain/where_missing bundle failed at compile time due move/borrow errors in in-flight RootJoinChain changes.","timestamp":1775686645515,"segment":0,"confidence":557,"iterationTokens":1505,"asi":{"hypothesis":"Confirm whether the observed +2 jump (to 561) is safe by validating all drifted modified cops together.","rollback_reason":"`cargo test --lib -- cop::rails::i18n_lazy_lookup cop::rails::root_join_chain cop::rails::where_missing cop::rails::migration_class_name` failed to compile (`E0382` move/borrow errors in root_join_chain).","next_action_hint":"Revert drifted RootJoinChain edits and rerun isolated MigrationClassName experiment, or fix RootJoinChain ownership signatures before bundle validation.","error":"E0382 in src/cop/rails/root_join_chain.rs (moved CallNode used after move)","confounding_files":"src/cop/rails/root_join_chain.rs, src/cop/rails/i18n_lazy_lookup.rs, src/cop/rails/where_missing.rs"}}
{"run":106,"commit":"9957228","metric":0,"metrics":{},"status":"checks_failed","description":"Validation of in-flight bundle failed benchmark invariant: RootJoinChain drift caused widespread new offenses (4141 vs required 3992), so changes were reverted.","timestamp":1775686725335,"segment":1,"confidence":23.659574468085108,"iterationTokens":61854,"asi":{"hypothesis":"Validate pending Rails autocorrect bundle (WhereMissing/MigrationClassName/I18nLazyLookup/RootJoinChain) and keep only if targeted tests plus offense invariant pass.","rollback_reason":"Benchmark offense invariant failed after RootJoinChain drift introduced many extra offenses on workload (4141 detected).","next_action_hint":"Re-run from clean tree and isolate a single cop (MigrationClassName) with narrow autocorrect scope and targeted tests before invariant benchmark.","offenses_observed":4141,"offenses_expected":3992,"failing_cop_signal":"Rails/RootJoinChain offenses appeared across workload paths"}}
{"run":10,"commit":"9957228","metric":0,"metrics":{},"status":"checks_failed","description":"Validation run failed to compile because in-flight MigrationClassName autocorrect test macro referenced missing fixture file `tests/fixtures/cops/rails/migration_class_name/corrected.rb`.","timestamp":1775686794489,"segment":0,"confidence":557,"iterationTokens":7398,"asi":{"hypothesis":"Revalidate baseline on current head before next cop implementation.","rollback_reason":"`cargo test` could not compile due missing corrected fixture include for MigrationClassName autocorrect tests.","next_action_hint":"Ensure corrected fixture file exists alongside migration_class_name offense fixture, then rerun targeted migration/rails validation.","error":"include_bytes! failed: migration_class_name/corrected.rb missing"}}
{"run":9,"commit":"9957228","metric":559,"metrics":{},"status":"discard","description":"RootJoinChain validation run passed and offense invariant held, but measured +1 was confounded by unrelated in-flight MigrationClassName autocorrect changes present in working tree.","timestamp":1775686801863,"segment":0,"confidence":null,"iterationTokens":4263,"asi":{"hypothesis":"Land RootJoinChain autocorrect by flattening chained `join` calls on Rails.root/public_path into one `join(...)` call.","rollback_reason":"Primary metric improvement was not attribution-clean because unexpected modified files (`migration_class_name.rs` + corrected fixture) were present but not included in targeted validation.","next_action_hint":"Run an isolated validation for MigrationClassName (or clear drift first), then rerun RootJoinChain in a clean tree for attribution-safe keep/discard.","with_autocorrect_observed":559,"missing_autocorrect_observed":357,"offenses_benchmark":3992,"tests":"cargo test --lib -- cop::rails::root_join_chain","confounding_files":"src/cop/rails/migration_class_name.rs, tests/fixtures/cops/rails/migration_class_name/corrected.rb"}}
{"run":107,"commit":"6e8939d","metric":560,"metrics":{},"status":"keep","description":"Added conservative RuboCop-aligned autocorrect for Rails/MigrationClassName: underscore-style migration class names now autocorrect to CamelCase with fixture coverage; targeted tests pass and offense invariant stays 3992.","timestamp":1775686877771,"segment":1,"confidence":23.333333333333332,"iterationTokens":4557,"asi":{"hypothesis":"Rails/MigrationClassName can safely add baseline autocorrect for underscore names without touching filename-mismatch-only cases.","rubocop_reference":"vendor/rubocop-rails/lib/rubocop/cop/rails/migration_class_name.rb","implemented_cop":"Rails/MigrationClassName","tests":"cargo test --lib -- cop::rails::migration_class_name","with_autocorrect_after":560,"missing_autocorrect_after":356,"offenses_benchmark":3992,"scope_guard":"Autocorrect only when class identifier contains underscore."}}
{"run":11,"commit":"ff0396e","metric":560,"metrics":{},"status":"keep","description":"Added conservative autocorrect for Rails/MigrationClassName by camelizing underscore-style migration class identifiers (e.g. `Add_users` -> `AddUsers`) with fixture autocorrect coverage; offense invariant remained 3992.","timestamp":1775686911891,"segment":0,"confidence":557,"iterationTokens":3312,"asi":{"hypothesis":"MigrationClassName can gain +1 autocorrect coverage with a safe first step: only autocorrect underscore-style class names while leaving other mismatch forms diagnostic-only.","rubocop_reference":"vendor/rubocop-rails/lib/rubocop/cop/rails/migration_class_name.rb","implemented_cop":"Rails/MigrationClassName","tests":"cargo test --lib -- cop::rails::migration_class_name","with_autocorrect_after":560,"missing_autocorrect_after":356,"offenses_benchmark":3992,"safety_guard":"Autocorrection is restricted to class names containing underscores to avoid speculative filename-derived rewrites."}}
{"run":20,"commit":"ff0396e","metric":560,"metrics":{},"status":"discard","description":"MigrationClassName-targeted run passed tests and offense invariant, but working tree contained additional unvalidated modified cops (DotSeparatedKeys, RootJoinChain, WhereMissing), so the +1 metric cannot be attributed cleanly to this single-cop experiment.","timestamp":1775686979266,"segment":0,"confidence":null,"iterationTokens":12936,"asi":{"hypothesis":"Add conservative autocorrect for underscore-style migration class names in Rails/MigrationClassName and improve with_autocorrect by +1.","rollback_reason":"Branch state included unrelated in-flight cop changes outside the validated scope at log time, making attribution ambiguous.","next_action_hint":"Run an attribution-clean experiment validating all modified cops together (or isolate MigrationClassName on a clean tree) before keeping.","tests":"cargo test --lib -- cop::rails::migration_class_name","with_autocorrect_observed":560,"missing_autocorrect_observed":356,"offenses_benchmark":3992}}
{"run":10,"commit":"9957228","metric":0,"metrics":{},"status":"checks_failed","description":"DotSeparatedKeys autocorrect attempt failed to compile: type mismatch in scope-removal helper and simultaneous RootJoinChain compile break (`has_chained_join_after`/`flatten_join_chain` unresolved) in current branch state.","timestamp":1775686992478,"segment":0,"confidence":null,"iterationTokens":12379,"asi":{"hypothesis":"Enable DotSeparatedKeys autocorrect by replacing first key with joined dot path and removing `scope:` pair.","rollback_reason":"Compilation failed before tests/benchmark: DotSeparatedKeys expected slice vs NodeList, plus RootJoinChain unresolved helper references in current source state.","next_action_hint":"Rebaseline on clean compile state first; then isolate one cop change with minimal helper signatures to avoid cross-cop compile drift.","error":"E0308 in dot_separated_keys.rs + E0425/E0282 in root_join_chain.rs","tests":"cargo test --lib -- cop::rails::dot_separated_keys","offenses_benchmark":"not reached"}}
{"run":108,"commit":"6e8939d","metric":560,"metrics":{},"status":"discard","description":"RootJoinChain autocorrect implementation and fixture coverage passed tests/invariant, but primary metric stayed unchanged at with_autocorrect=560, so no measurable gain.","timestamp":1775687005212,"segment":1,"confidence":23.829787234042552,"iterationTokens":12873,"asi":{"hypothesis":"Enabling conservative autocorrect for Rails/RootJoinChain would increase with_autocorrect by +1 while preserving offense invariant.","rollback_reason":"Primary metric did not improve (with_autocorrect unchanged at 560).","next_action_hint":"Investigate how count_missing_autocorrect determines support; prioritize a cop that clearly registers as missing (e.g., HttpPositionalArguments or WhereNot).","tests":"cargo test --lib -- cop::rails::root_join_chain","with_autocorrect_observed":560,"missing_autocorrect_observed":356,"offenses_benchmark":3992}}
