{"run":505,"commit":"2e0ab97","metric":671,"metrics":{},"status":"keep","description":"Added conservative RuboCop-aligned autocorrect support for RSpec/EmptyLineAfterFinalLet. For flagged final `let`/`let!` separation offenses, autocorrect now inserts a single blank line before the following statement (using computed report line that already accounts for heredoc/comment handling). Added supports_autocorrect and focused insertion test; offense invariant remains 3992.","timestamp":1775780887360,"segment":1,"confidence":19.17142857142857,"iterationTokens":21997,"asi":{"hypothesis":"EmptyLineAfterFinalLet can safely autocorrect by inserting a newline at the start of the next statement line for already-flagged missing-separator cases.","implemented_cop":"RSpec/EmptyLineAfterFinalLet","rubocop_reference":"vendor/rubocop-rspec/lib/rubocop/cop/rspec/empty_line_after_final_let.rb","tests":"cargo test --lib --quiet -- cop::rspec::empty_line_after_final_let","with_autocorrect_after":671,"missing_autocorrect_after":245,"offenses_benchmark":3992,"safety_guard":"Autocorrect uses existing offense line computation (including heredoc/comment-aware checks), so only missing-separator cases receive insertion.","next_action_hint":"Continue with adjacent empty-line cops (after_hook/after_subject/after_example_group) reusing the same insertion strategy and heredoc/comment guards."}}
{"run":506,"commit":"49152e2","metric":672,"metrics":{},"status":"keep","description":"Added conservative RuboCop-aligned autocorrect support for RSpec/EmptyLineAfterHook. For flagged hook-separation offenses, autocorrect now inserts a single blank line before the following statement using the existing heredoc/comment-aware report line computation. Added supports_autocorrect and focused insertion test; offense invariant remains 3992.","timestamp":1775781203861,"segment":1,"confidence":19.47826086956522,"iterationTokens":15401,"asi":{"hypothesis":"EmptyLineAfterHook can safely gain autocorrect by inserting one newline at the computed missing-separator boundary for already-flagged offenses.","implemented_cop":"RSpec/EmptyLineAfterHook","rubocop_reference":"vendor/rubocop-rspec/lib/rubocop/cop/rspec/empty_line_after_hook.rb","tests":"cargo test --lib --quiet -- cop::rspec::empty_line_after_hook","with_autocorrect_after":672,"missing_autocorrect_after":244,"offenses_benchmark":3992,"safety_guard":"Reuses existing offense detection including block-argument exclusions, heredoc end handling, and directive comment behavior.","next_action_hint":"Apply same insertion baseline to sibling RSpec empty-line cops (after_subject/after_example_group/after_example) for fast low-risk gains."}}
{"run":507,"commit":"d81ca8e","metric":673,"metrics":{},"status":"keep","description":"Added conservative RuboCop-aligned autocorrect support for RSpec/EmptyLineAfterSubject. For flagged subject-separation offenses, autocorrect now inserts a single blank line before the next statement using the existing top-level-group scoping and heredoc/comment-aware separator logic. Added supports_autocorrect and focused insertion test; offense invariant remains 3992.","timestamp":1775781408002,"segment":1,"confidence":19.228571428571428,"iterationTokens":12445,"asi":{"hypothesis":"EmptyLineAfterSubject can safely gain autocorrect by inserting one newline at the computed missing-separator boundary for already-flagged subject offenses.","implemented_cop":"RSpec/EmptyLineAfterSubject","rubocop_reference":"vendor/rubocop-rspec/lib/rubocop/cop/rspec/empty_line_after_subject.rb","tests":"cargo test --lib --quiet -- cop::rspec::empty_line_after_subject","with_autocorrect_after":673,"missing_autocorrect_after":243,"offenses_benchmark":3992,"safety_guard":"Reuses existing offense guards: only inside top-level RSpec/shared groups, receiverless subject calls with blocks, and heredoc/comment-aware blank-line detection.","next_action_hint":"Continue fast low-risk sibling cops with same insertion pattern (EmptyLineAfterExampleGroup / EmptyLineAfterExample)."}}
{"run":508,"commit":"8bd651c","metric":674,"metrics":{},"status":"keep","description":"Added conservative RuboCop-aligned autocorrect support for RSpec/EmptyLineAfterExampleGroup. For flagged separation offenses, autocorrect now inserts a single blank line before the next statement using existing whitespace/comment/end-line guards. Added supports_autocorrect and focused insertion test; offense invariant remains 3992.","timestamp":1775781684701,"segment":1,"confidence":19.257142857142856,"iterationTokens":12445,"asi":{"hypothesis":"EmptyLineAfterExampleGroup can safely autocorrect by inserting one newline at the computed separator boundary for already-flagged group-separation offenses.","implemented_cop":"RSpec/EmptyLineAfterExampleGroup","rubocop_reference":"vendor/rubocop-rspec/lib/rubocop/cop/rspec/empty_line_after_example_group.rb","tests":"cargo test --lib --quiet -- cop::rspec::empty_line_after_example_group","with_autocorrect_after":674,"missing_autocorrect_after":242,"offenses_benchmark":3992,"safety_guard":"Reuses existing offense guards for RSpec receiver validation, comment/blank scanning, postfix conditional skip, and last-child closers."}}
{"run":509,"commit":"f887b14","metric":675,"metrics":{},"status":"keep","description":"Added conservative RuboCop-aligned autocorrect support for RSpec/EmptyLineAfterExample. For flagged example-separation offenses, autocorrect now inserts a single blank line before the next statement while reusing existing one-liner/comment/heredoc/last-child guards. Added supports_autocorrect and focused insertion test; offense invariant remains 3992.","timestamp":1775784469637,"segment":1,"confidence":18.75,"iterationTokens":48398,"asi":{"hypothesis":"EmptyLineAfterExample can safely gain autocorrect by inserting one newline at the existing missing-separator boundary for already-flagged example blocks.","implemented_cop":"RSpec/EmptyLineAfterExample","rubocop_reference":"vendor/rubocop-rspec/lib/rubocop/cop/rspec/empty_line_after_example.rb","tests":"cargo test --lib --quiet -- cop::rspec::empty_line_after_example","with_autocorrect_after":675,"missing_autocorrect_after":241,"offenses_benchmark":3992,"safety_guard":"Reuses existing detection constraints for consecutive one-liners, comment/enable-directive handling, heredoc end-location logic, and last-child-on-line suppression."}}
{"run":510,"commit":"48f6d47","metric":676,"metrics":{},"status":"keep","description":"Added conservative RuboCop-aligned autocorrect support for RSpec/AlignLeftLetBrace. For flagged misaligned single-line adjacent let groups, autocorrect now inserts left-padding spaces before opening braces to align with the group max column. Added supports_autocorrect and focused alignment test; offense invariant remains 3992.","timestamp":1775784679846,"segment":1,"confidence":18.77777777777778,"iterationTokens":22945,"asi":{"hypothesis":"AlignLeftLetBrace can safely gain autocorrect by inserting spaces before offending `{` tokens within already-detected adjacent let groups, matching RuboCop's token-aligner behavior.","implemented_cop":"RSpec/AlignLeftLetBrace","rubocop_reference":"vendor/rubocop-rspec/lib/rubocop/cop/rspec/align_left_let_brace.rb","tests":"cargo test --lib --quiet -- cop::rspec::align_left_let_brace","with_autocorrect_after":676,"missing_autocorrect_after":240,"offenses_benchmark":3992,"safety_guard":"Corrections are insertion-only padding at computed brace columns; no token deletion/rewrite, and only for existing offenses in grouped single-line let blocks."}}
{"run":511,"commit":"a97ab63","metric":677,"metrics":{},"status":"keep","description":"Added conservative RuboCop-aligned autocorrect support for RSpec/AlignRightLetBrace. For flagged misaligned single-line adjacent let groups, autocorrect now inserts right-padding spaces before closing braces to align with the group max closing-brace column. Added supports_autocorrect and focused alignment test; offense invariant remains 3992.","timestamp":1775784873345,"segment":1,"confidence":18.805555555555557,"iterationTokens":18020,"asi":{"hypothesis":"AlignRightLetBrace can safely gain autocorrect by insertion-only spacing before offending `}` tokens in already-detected adjacent let groups, mirroring RuboCop token alignment behavior.","implemented_cop":"RSpec/AlignRightLetBrace","rubocop_reference":"vendor/rubocop-rspec/lib/rubocop/cop/rspec/align_right_let_brace.rb","tests":"cargo test --lib --quiet -- cop::rspec::align_right_let_brace","with_autocorrect_after":677,"missing_autocorrect_after":239,"offenses_benchmark":3992,"safety_guard":"Insertion-only padding at computed closing-brace columns; no syntax rewrite/deletion and only applied to existing offenses in grouped single-line let blocks."}}
{"run":512,"commit":"d15fd1f","metric":678,"metrics":{},"status":"keep","description":"Added conservative RuboCop-aligned autocorrect support for RSpec/ExcessiveDocstringSpacing. Baseline autocorrect now strips leading/trailing blanks and squeezes repeated blanks in plain string example descriptions (interpolated forms remain diagnostic-only for safety). Added supports_autocorrect and focused spacing-normalization test; offense invariant remains 3992.","timestamp":1775785128100,"segment":1,"confidence":18.575342465753426,"iterationTokens":25501,"asi":{"hypothesis":"ExcessiveDocstringSpacing can safely gain baseline autocorrect via in-string content normalization on plain string description literals while leaving interpolated strings unmodified.","implemented_cop":"RSpec/ExcessiveDocstringSpacing","rubocop_reference":"vendor/rubocop-rspec/lib/rubocop/cop/rspec/excessive_docstring_spacing.rb","tests":"cargo test --lib --quiet -- cop::rspec::excessive_docstring_spacing","with_autocorrect_after":678,"missing_autocorrect_after":238,"offenses_benchmark":3992,"safety_guard":"Autocorrect is restricted to string-node content ranges only; no quote/token rewrites and no interpolated-string rewrites in this baseline."}}
{"run":513,"commit":"d056a8d","metric":679,"metrics":{},"status":"keep","description":"Added conservative RuboCop-aligned autocorrect support for RSpec/ExampleWording. Baseline autocorrect now removes leading `it ` prefix for offending plain descriptions by replacing description content range only; other wording branches remain diagnostic-only for safety/parity follow-up. Added supports_autocorrect and focused autocorrect test; offense invariant remains 3992.","timestamp":1775785371600,"segment":1,"confidence":18.35135135135135,"iterationTokens":19992,"asi":{"hypothesis":"ExampleWording can safely gain baseline autocorrect with content-only rewrite for `it ` prefix offenses while deferring should/will wording transforms to a later parity pass.","implemented_cop":"RSpec/ExampleWording","rubocop_reference":"vendor/rubocop-rspec/lib/rubocop/cop/rspec/example_wording.rb","tests":"cargo test --lib --quiet -- cop::rspec::example_wording","with_autocorrect_after":679,"missing_autocorrect_after":237,"offenses_benchmark":3992,"safety_guard":"Autocorrect is restricted to description content range replacement for `it ` prefix offenses; no quote/node reshaping and no should/will transform rewrites in this baseline."}}
{"run":514,"commit":"ab484d6","metric":680,"metrics":{},"status":"keep","description":"Added conservative RuboCop-aligned autocorrect support for RSpec/SortMetadata. Baseline autocorrect now replaces the metadata span with alphabetically sorted trailing symbols then keyword pairs (case-insensitive), using insertion-safe range replacement. Added supports_autocorrect and focused sort test; offense invariant remains 3992.","timestamp":1775785816264,"segment":1,"confidence":18.37837837837838,"iterationTokens":3222,"asi":{"hypothesis":"SortMetadata can safely gain autocorrect by sorting already-detected metadata tokens and replacing only the contiguous metadata range.","implemented_cop":"RSpec/SortMetadata","rubocop_reference":"vendor/rubocop-rspec/lib/rubocop/cop/rspec/sort_metadata.rb","tests":"cargo test --lib --quiet -- cop::rspec::sort_metadata","with_autocorrect_after":680,"missing_autocorrect_after":236,"offenses_benchmark":3992,"safety_guard":"Autocorrect is limited to contiguous metadata span replacement and preserves original token text snippets, only reordering symbols/pairs."}}
{"run":515,"commit":"d46edab","metric":681,"metrics":{},"status":"keep","description":"Added conservative RuboCop-aligned autocorrect support for RSpec/MetadataStyle (symbol style baseline). For `key: true` metadata offenses in keyword-hash metadata args, autocorrect now rewrites each offending pair to symbol form (`:key`) via pair-range replacement. Added supports_autocorrect and focused conversion test; offense invariant remains 3992.","timestamp":1775786199897,"segment":1,"confidence":18.405405405405407,"iterationTokens":31682,"asi":{"hypothesis":"MetadataStyle can safely gain baseline autocorrect by converting deterministic `key: true` metadata pairs to `:key` in symbol-enforced style while leaving ambiguous/explicit-hash cases for parity follow-up.","implemented_cop":"RSpec/MetadataStyle","rubocop_reference":"vendor/rubocop-rspec/lib/rubocop/cop/rspec/metadata_style.rb","tests":"cargo test --lib --quiet -- cop::rspec::metadata_style","with_autocorrect_after":681,"missing_autocorrect_after":235,"offenses_benchmark":3992,"safety_guard":"Autocorrect is limited to keyword-hash pair nodes with symbol key and true value; explicit hash braces and hash-style conversion remain deferred."}}
{"run":516,"commit":"d46edab","metric":0,"metrics":{},"status":"crash","description":"Attempted RSpec/VariableDefinition autocorrect baseline (symbol<->string variable name replacement) but compile failed with E0308 type mismatch passing Node by value instead of reference in autocorrect_replacement call.","timestamp":1775786591087,"segment":1,"confidence":18.405405405405407,"iterationTokens":31682,"asi":{"hypothesis":"VariableDefinition can safely gain RuboCop-aligned baseline autocorrect by replacing offending variable-name argument node text for symbols/strings styles.","rollback_reason":"Build crash: expected &Node<'_>, found Node<'_> at src/cop/rspec/variable_definition.rs:199.","next_action_hint":"Fix call-site to pass &arg into autocorrect_replacement, rerun targeted tests + count + offense invariant.","error":"error[E0308] mismatched types","file":"src/cop/rspec/variable_definition.rs","line":199}}
{"run":517,"commit":"2c0b710","metric":682,"metrics":{},"status":"keep","description":"Added RuboCop-aligned autocorrect support for RSpec/VariableDefinition. Offending variable-name args now autocorrect between string/symbol styles (`EnforcedStyle: symbols|strings`), including interpolated-symbol strings-style baseline via source-preserving colon removal. Added supports_autocorrect and focused autocorrect tests plus corrected fixture; offense invariant remained 3992.","timestamp":1775786754221,"segment":1,"confidence":18.43243243243243,"iterationTokens":7913,"asi":{"hypothesis":"VariableDefinition is low-risk for autocorrect because offenses are localized to a single variable-name argument node and can be corrected via direct node-range replacement.","implemented_cop":"RSpec/VariableDefinition","rubocop_reference":"vendor/rubocop-rspec/lib/rubocop/cop/rspec/variable_definition.rb","tests":"cargo test --lib --quiet -- cop::rspec::variable_definition","with_autocorrect_after":682,"missing_autocorrect_after":234,"offenses_benchmark":3992,"safety_guard":"Correction is limited to the first non-keyword metadata arg detected as offense; non-offense and unsupported node forms remain diagnostic-only."}}
{"run":518,"commit":"d828cb8","metric":683,"metrics":{},"status":"keep","description":"Added conservative RuboCop-aligned autocorrect support for RSpec/ImplicitSubject. Existing implicit-subject offenses (`is_expected`, `should`, `should_not`) now autocorrect by selector replacement to explicit-subject forms (`expect(subject)`, `.to`, `.not_to`). Added supports_autocorrect and focused autocorrect fixture/test; offense invariant stayed 3992.","timestamp":1775786941159,"segment":1,"confidence":18.45945945945946,"iterationTokens":11692,"asi":{"hypothesis":"ImplicitSubject is low-risk to autocorrect by replacing only the implicit-subject selector token for already-detected offenses, preserving surrounding matcher chains.","implemented_cop":"RSpec/ImplicitSubject","rubocop_reference":"vendor/rubocop-rspec/lib/rubocop/cop/rspec/implicit_subject.rb","tests":"cargo test --lib --quiet -- cop::rspec::implicit_subject","with_autocorrect_after":683,"missing_autocorrect_after":233,"offenses_benchmark":3992,"safety_guard":"Autocorrect only applies to currently-detected implicit-subject send selectors; no require_implicit style rewrites were added."}}
{"run":519,"commit":"83d2e60","metric":684,"metrics":{},"status":"keep","description":"Added RuboCop-aligned autocorrect support for RSpec/MultipleSubjects. Overwritten `subject(:name)` declarations now autocorrect selector `subject`->`let`; overwritten unnamed `subject { ... }` declarations are removed by node-range deletion; `subject!` remains diagnostic-only. Added supports_autocorrect and focused tests for both correction modes; offense invariant stayed 3992.","timestamp":1775788706995,"segment":1,"confidence":18.486486486486488,"iterationTokens":27483,"asi":{"hypothesis":"MultipleSubjects can safely gain baseline autocorrect by mirroring RuboCop’s two deterministic branches: rename overwritten named subjects to `let`, remove overwritten unnamed `subject` definitions, and skip `subject!`.","implemented_cop":"RSpec/MultipleSubjects","rubocop_reference":"vendor/rubocop-rspec/lib/rubocop/cop/rspec/multiple_subjects.rb","tests":"cargo test --lib --quiet -- cop::rspec::multiple_subjects","with_autocorrect_after":684,"missing_autocorrect_after":232,"offenses_benchmark":3992,"safety_guard":"Autocorrect only applies to overwritten declarations (all but last subject in group) and explicitly skips `subject!`."}}
{"run":520,"commit":"83d2e60","metric":0,"metrics":{},"status":"crash","description":"Attempted RSpec/IteratedExpectation autocorrect baseline (single each->all matcher rewrite), but compile crashed: used non-existent BlockNode::call() accessor while building replacement text.","timestamp":1775788877089,"segment":1,"confidence":18.486486486486488,"iterationTokens":16101,"asi":{"hypothesis":"IteratedExpectation can safely autocorrect deterministic single-expectation each blocks to `expect(collection).to all(matcher)` when matcher does not reference the block param.","rollback_reason":"Build crash E0599 at src/cop/rspec/iterated_expectation.rs:262 (BlockNode::call unavailable).","next_action_hint":"Pass the enclosing each CallNode into replacement helper instead of trying to access it from BlockNode; rerun targeted tests and guardrails.","error":"error[E0599] no method `call` for BlockNode","file":"src/cop/rspec/iterated_expectation.rs","line":262}}
{"run":521,"commit":"83d2e60","metric":0,"metrics":{},"status":"crash","description":"Follow-up IteratedExpectation attempt still crashed: helper returning prism Node lacked explicit lifetime, causing E0106 compile failure before tests.","timestamp":1775789040122,"segment":1,"confidence":18.486486486486488,"iterationTokens":2016,"asi":{"hypothesis":"Single-expression normalization for iterated expectation bodies enables reliable each->all autocorrect on both direct-call and single-statement block-body shapes.","rollback_reason":"Build crash E0106 missing lifetime specifier in single_expectation_node return type.","next_action_hint":"Avoid returning borrowed Node with elided lifetime; use explicit lifetime or refactor helper to return boolean/borrowed reference only.","error":"error[E0106] missing lifetime specifier","file":"src/cop/rspec/iterated_expectation.rs","line":229}}
{"run":522,"commit":"83d2e60","metric":0,"metrics":{},"status":"crash","description":"IteratedExpectation follow-up crashed again due prism Node move semantics (E0507/E0382) while trying to cache single-expression body for autocorrect rewrite.","timestamp":1775789122819,"segment":1,"confidence":18.486486486486488,"iterationTokens":3930,"asi":{"hypothesis":"IteratedExpectation single-expression autocorrect is feasible but requires borrow-safe handling of prism nodes without moving owned Node values.","rollback_reason":"Compile failure from moved Node values in single_expr/body handling.","next_action_hint":"Refactor to store offsets/text extracted immediately or borrow references via scoped matching; avoid moving Node into Option.","error":"error[E0507]/error[E0382] move semantics","file":"src/cop/rspec/iterated_expectation.rs","line":"142-146"}}
