{"run":29,"commit":"9390576","metric":484,"metrics":{},"status":"keep","description":"Added RuboCop-aligned autocorrect support for Rails/ActiveSupportAliases (starts_with?/ends_with?/prepend corrected; append intentionally left uncorrected to match RuboCop behavior), with fixture autocorrect coverage.","timestamp":1775669579038,"segment":1,"confidence":80.66666666666667,"iterationTokens":2404,"asi":{"hypothesis":"ActiveSupportAliases can safely autocorrect via selector replacement for start/end/prepend aliases, while skipping append correction to mirror RuboCop's no-autocorrect path for `append` -> `<<`.","rubocop_reference":"vendor/rubocop-rails/lib/rubocop/cop/rails/active_support_aliases.rb","implemented_cop":"Rails/ActiveSupportAliases","tests":"cargo test --lib -- cop::rails::active_support_aliases","runtime_ms":528.93,"offenses_benchmark":3992,"missing_autocorrect_after":432}}
{"run":30,"commit":"afa74d5","metric":485,"metrics":{},"status":"keep","description":"Added RuboCop-aligned autocorrect for RSpec/ReceiveNever by rewriting `.to` to `.not_to` and removing trailing `.never` from receive chains, with fixture autocorrect tests.","timestamp":1775670501482,"segment":1,"confidence":74.61538461538461,"iterationTokens":2404,"asi":{"hypothesis":"ReceiveNever can autocorrect safely by two localized edits (selector `to`->`not_to`, remove `.never`) on expect-based receive chains, matching RuboCop behavior.","rubocop_reference":"vendor/rubocop-rspec/lib/rubocop/cop/rspec/receive_never.rb","implemented_cop":"RSpec/ReceiveNever","tests":"cargo test --lib -- cop::rspec::receive_never","runtime_ms":518.5,"offenses_benchmark":3992,"missing_autocorrect_after":431}}
{"run":31,"commit":"78e66cb","metric":486,"metrics":{},"status":"keep","description":"Added RuboCop-aligned autocorrect for RSpec/ClassCheck by selector rewrite to preferred style (`be_a` or `be_kind_of`), with fixture autocorrect tests.","timestamp":1775670653729,"segment":1,"confidence":69.42857142857143,"iterationTokens":6914,"asi":{"hypothesis":"ClassCheck is a style-selector cop where replacing only matcher selector should safely match RuboCop autocorrect behavior.","rubocop_reference":"vendor/rubocop-rspec/lib/rubocop/cop/rspec/class_check.rb","implemented_cop":"RSpec/ClassCheck","tests":"cargo test --lib -- cop::rspec::class_check","runtime_ms":578.23,"offenses_benchmark":3992,"missing_autocorrect_after":430}}
{"run":32,"commit":"eba20c2","metric":487,"metrics":{},"status":"keep","description":"Added RuboCop-aligned autocorrect for RSpec/Dialect by replacing offending DSL selectors with configured PreferredMethods, with config-driven autocorrect tests.","timestamp":1775670795367,"segment":1,"confidence":69.57142857142857,"iterationTokens":5996,"asi":{"hypothesis":"Dialect can safely autocorrect via selector-only replacement using PreferredMethods mapping, matching RuboCop's on_send autocorrect behavior.","rubocop_reference":"vendor/rubocop-rspec/lib/rubocop/cop/rspec/dialect.rb","implemented_cop":"RSpec/Dialect","tests":"cargo test --lib -- cop::rspec::dialect","runtime_ms":518.14,"offenses_benchmark":3992,"missing_autocorrect_after":429}}
{"run":33,"commit":"cab3cbe","metric":488,"metrics":{},"status":"keep","description":"Added RuboCop-aligned autocorrect for Rails/MailerName by appending `Mailer` suffix to offending class constants, with fixture autocorrect coverage.","timestamp":1775670906365,"segment":1,"confidence":69.71428571428571,"iterationTokens":5804,"asi":{"hypothesis":"MailerName can be safely autocorrected (unsafe semantic category acknowledged) by renaming class constant to include `Mailer` suffix, matching RuboCop behavior.","rubocop_reference":"vendor/rubocop-rails/lib/rubocop/cop/rails/mailer_name.rb","implemented_cop":"Rails/MailerName","tests":"cargo test --lib -- cop::rails::mailer_name","runtime_ms":523.06,"offenses_benchmark":3992,"missing_autocorrect_after":428}}
{"run":34,"commit":"f7875e3","metric":489,"metrics":{},"status":"keep","description":"Added RuboCop-aligned autocorrect for RSpec/EmptyMetadata by removing trailing empty metadata hash argument with surrounding comma/space handling, plus fixture autocorrect tests.","timestamp":1775671007901,"segment":1,"confidence":65.2,"iterationTokens":2251,"asi":{"hypothesis":"EmptyMetadata offense cases can be safely autocorrected by deleting the empty trailing metadata hash and adjacent separator whitespace, matching RuboCop intent.","rubocop_reference":"vendor/rubocop-rspec/lib/rubocop/cop/rspec/empty_metadata.rb","implemented_cop":"RSpec/EmptyMetadata","tests":"cargo test --lib -- cop::rspec::empty_metadata","runtime_ms":508.97,"offenses_benchmark":3992,"missing_autocorrect_after":427}}
{"run":35,"commit":"a1e7862","metric":490,"metrics":{},"status":"keep","description":"Added RuboCop-aligned autocorrect for RSpec/RedundantPredicateMatcher via matcher selector rewrites (except `be_all`, which is intentionally not autocorrected), with fixture autocorrect tests.","timestamp":1775671269030,"segment":1,"confidence":61.25,"iterationTokens":2693,"asi":{"hypothesis":"RedundantPredicateMatcher can be safely autocorrected by selector replacement to built-in matcher names while preserving RuboCop's `be_all` no-autocorrect behavior.","rubocop_reference":"vendor/rubocop-rspec/lib/rubocop/cop/rspec/redundant_predicate_matcher.rb","implemented_cop":"RSpec/RedundantPredicateMatcher","tests":"cargo test --lib -- cop::rspec::redundant_predicate_matcher","runtime_ms":492.02,"offenses_benchmark":3992,"missing_autocorrect_after":426}}
{"run":36,"commit":"fc042ac","metric":491,"metrics":{},"status":"keep","description":"Added RuboCop-aligned autocorrect baseline for RSpec/SingleArgumentMessageChain by rewriting `receive_message_chain`/`stub_chain` selectors to `receive`/`stub` for single-arg offense cases, with fixture autocorrect tests.","timestamp":1775671390882,"segment":1,"confidence":61.375,"iterationTokens":4169,"asi":{"hypothesis":"SingleArgumentMessageChain can safely gain initial autocorrect via selector rewrite on current offense coverage while preserving argument/block shape.","rubocop_reference":"vendor/rubocop-rspec/lib/rubocop/cop/rspec/single_argument_message_chain.rb","implemented_cop":"RSpec/SingleArgumentMessageChain","tests":"cargo test --lib -- cop::rspec::single_argument_message_chain","runtime_ms":493.05,"offenses_benchmark":3992,"missing_autocorrect_after":425,"known_gap":"Does not yet implement RuboCop's single-key hash/array-arg rewrite helpers for hash-style chain arguments."}}
{"run":37,"commit":"70036ec","metric":492,"metrics":{},"status":"keep","description":"Added RuboCop-aligned autocorrect for RSpec/EmptyOutput by flipping runner selector (`to`/`not_to`) and rewriting `output('')` to `output`, with fixture autocorrect tests.","timestamp":1775671506259,"segment":1,"confidence":61.5,"iterationTokens":3824,"asi":{"hypothesis":"EmptyOutput offenses can be safely autocorrected with two local edits mirroring RuboCop: runner selector flip and output matcher argument removal.","rubocop_reference":"vendor/rubocop-rspec/lib/rubocop/cop/rspec/empty_output.rb","implemented_cop":"RSpec/EmptyOutput","tests":"cargo test --lib -- cop::rspec::empty_output","runtime_ms":506.22,"offenses_benchmark":3992,"missing_autocorrect_after":424}}
{"run":38,"commit":"6686098","metric":493,"metrics":{},"status":"keep","description":"Added RuboCop-aligned autocorrect for Rails/ActionControllerTestCase by replacing superclass `ActionController::TestCase` with `ActionDispatch::IntegrationTest`, with Rails-aware autocorrect tests.","timestamp":1775671664581,"segment":1,"confidence":58,"iterationTokens":5554,"asi":{"hypothesis":"ActionControllerTestCase can be safely autocorrected by replacing parent class node text to `ActionDispatch::IntegrationTest`, matching RuboCop behavior.","rubocop_reference":"vendor/rubocop-rails/lib/rubocop/cop/rails/action_controller_test_case.rb","implemented_cop":"Rails/ActionControllerTestCase","tests":"cargo test --lib -- cop::rails::action_controller_test_case","runtime_ms":526.59,"offenses_benchmark":3992,"missing_autocorrect_after":423}}
{"run":39,"commit":"06a3523","metric":494,"metrics":{},"status":"keep","description":"Added RuboCop-aligned autocorrect for Rails/ApplicationJob by replacing superclass `ActiveJob::Base` with `ApplicationJob`, with Rails-aware autocorrect tests.","timestamp":1775671773469,"segment":1,"confidence":54.888888888888886,"iterationTokens":2268,"asi":{"hypothesis":"ApplicationJob cop can safely autocorrect by replacing class superclass node text to `ApplicationJob`, matching RuboCop's EnforceSuperclass correction behavior.","rubocop_reference":"vendor/rubocop-rails/lib/rubocop/cop/rails/application_job.rb","implemented_cop":"Rails/ApplicationJob","tests":"cargo test --lib -- cop::rails::application_job","runtime_ms":518.59,"offenses_benchmark":3992,"missing_autocorrect_after":422}}
{"run":40,"commit":"ce6807d","metric":495,"metrics":{},"status":"keep","description":"Added RuboCop-aligned autocorrect for Rails/ApplicationMailer by replacing superclass `ActionMailer::Base` with `ApplicationMailer`, with Rails-aware autocorrect tests.","timestamp":1775671901654,"segment":1,"confidence":55,"iterationTokens":3264,"asi":{"hypothesis":"ApplicationMailer cop can safely autocorrect by replacing class superclass text to `ApplicationMailer`, matching RuboCop EnforceSuperclass behavior.","rubocop_reference":"vendor/rubocop-rails/lib/rubocop/cop/rails/application_mailer.rb","implemented_cop":"Rails/ApplicationMailer","tests":"cargo test --lib -- cop::rails::application_mailer","runtime_ms":503.05,"offenses_benchmark":3992,"missing_autocorrect_after":421}}
{"run":41,"commit":"9d19e26","metric":496,"metrics":{},"status":"keep","description":"Added RuboCop-aligned autocorrect for Rails/ApplicationRecord by replacing superclass `ActiveRecord::Base` (including `::ActiveRecord::Base`) with `ApplicationRecord`, with Rails-aware autocorrect tests.","timestamp":1775672124509,"segment":1,"confidence":55.111111111111114,"iterationTokens":3264,"asi":{"hypothesis":"ApplicationRecord can safely autocorrect by replacing the matched superclass node with `ApplicationRecord`, mirroring RuboCop EnforceSuperclass behavior.","rubocop_reference":"vendor/rubocop-rails/lib/rubocop/cop/rails/application_record.rb","implemented_cop":"Rails/ApplicationRecord","tests":"cargo test --lib -- cop::rails::application_record","runtime_ms":500.03,"offenses_benchmark":3992,"missing_autocorrect_after":420}}
{"run":42,"commit":"9eef5a2","metric":497,"metrics":{},"status":"keep","description":"Added RuboCop-aligned autocorrect for Rails/ApplicationController by replacing `ActionController::Base` superclass references (class inheritance and `Class.new(...)` argument) with `ApplicationController`, with autocorrect tests.","timestamp":1775672232108,"segment":1,"confidence":52.31578947368421,"iterationTokens":3274,"asi":{"hypothesis":"ApplicationController can mirror RuboCop EnforceSuperclass autocorrect by replacing matched `ActionController::Base` nodes in both class and Class.new patterns.","rubocop_reference":"vendor/rubocop-rails/lib/rubocop/cop/rails/application_controller.rb","implemented_cop":"Rails/ApplicationController","tests":"cargo test --lib -- cop::rails::application_controller","runtime_ms":509.24,"offenses_benchmark":3992,"missing_autocorrect_after":419}}
{"run":43,"commit":"9eef5a2","metric":0,"metrics":{},"status":"crash","description":"Attempted to add autocorrect for RSpec/HookArgument (implicit/explicit style argument rewrites), but introduced a syntax error in the Rust file causing test compilation failure.","timestamp":1775672374625,"segment":1,"confidence":52.31578947368421,"iterationTokens":15391,"asi":{"hypothesis":"HookArgument can autocorrect by replacing the argument segment between hook selector and block start.","rollback_reason":"Rust parser error due to mismatched delimiters/indentation after inserting new diagnostic/correction branches in hook_argument.rs.","next_action_hint":"Fix brace structure in check_node around explicit-style mismatch branch, then rerun cop::rspec::hook_argument tests and benchmark guard.","error_excerpt":"unexpected closing delimiter at src/cop/rspec/hook_argument.rs","rubocop_reference":"vendor/rubocop-rspec/lib/rubocop/cop/rspec/hook_argument.rb"}}
{"run":44,"commit":"1e3650e","metric":498,"metrics":{},"status":"keep","description":"Added RuboCop-aligned baseline autocorrect for RSpec/HookArgument in implicit style by removing default `(:each|:example)` hook arguments, with fixture autocorrect tests.","timestamp":1775672475047,"segment":1,"confidence":49.8,"iterationTokens":4211,"asi":{"hypothesis":"HookArgument can safely gain initial autocorrect by removing default scope arguments in implicit-style offenses.","rubocop_reference":"vendor/rubocop-rspec/lib/rubocop/cop/rspec/hook_argument.rb","implemented_cop":"RSpec/HookArgument","tests":"cargo test --lib -- cop::rspec::hook_argument","runtime_ms":497.95,"offenses_benchmark":3992,"missing_autocorrect_after":418,"known_gap":"Explicit styles (`EnforcedStyle: each|example`) diagnostics are not autocorrected yet."}}
{"run":45,"commit":"7e20896","metric":499,"metrics":{},"status":"keep","description":"Added RuboCop-aligned autocorrect for Rails/ActionControllerFlashBeforeRender by replacing `flash` receiver with `flash.now` at flagged assignment sites, with large fixture autocorrect coverage.","timestamp":1775673013821,"segment":1,"confidence":49.9,"iterationTokens":3050,"asi":{"hypothesis":"ActionControllerFlashBeforeRender can safely autocorrect by rewriting the `flash` receiver token to `flash.now` on detected flash assignment offenses.","rubocop_reference":"vendor/rubocop-rails/lib/rubocop/cop/rails/action_controller_flash_before_render.rb","implemented_cop":"Rails/ActionControllerFlashBeforeRender","tests":"cargo test --lib -- cop::rails::action_controller_flash_before_render","runtime_ms":519.86,"offenses_benchmark":3992,"missing_autocorrect_after":417,"failed_attempt":"Initial corrected fixture mistakenly retained offense annotation lines, causing autocorrect_fixture failure; regenerated corrected fixture by removing annotation lines.","recovered":"Yes, rerun passed with corrected fixture"}}
{"run":46,"commit":"ba5a177","metric":500,"metrics":{},"status":"keep","description":"Added RuboCop-aligned baseline autocorrect for RSpec/Focus by rewriting focused f-prefixed DSL selectors (e.g., `fit`→`it`, `fdescribe`→`describe`), with fixture autocorrect coverage.","timestamp":1775673143900,"segment":1,"confidence":50,"iterationTokens":6058,"asi":{"hypothesis":"Focus cop can safely gain partial autocorrect by selector rewrite for f-prefixed focused methods while leaving unsupported metadata/focus-call cases uncorrected.","rubocop_reference":"vendor/rubocop-rspec/lib/rubocop/cop/rspec/focus.rb","implemented_cop":"RSpec/Focus","tests":"cargo test --lib -- cop::rspec::focus","runtime_ms":516.02,"offenses_benchmark":3992,"missing_autocorrect_after":416,"known_gap":"Does not yet autocorrect focus metadata entries (`:focus`, `focus: true`) or `focus` calls, matching RuboCop's partial-support stance."}}
{"run":47,"commit":"ba5a177","metric":500,"metrics":{},"status":"discard","description":"Extended RSpec/HookArgument autocorrect to explicit styles (`EnforcedStyle: each|example`) with config-based tests; functionality is promising but does not improve the primary count metric (already counted), so discarded per objective.","timestamp":1775673307673,"segment":1,"confidence":47.61904761904762,"iterationTokens":5891,"asi":{"hypothesis":"HookArgument explicit-style offenses can be autocorrected by replacing/adding hook argument segment between selector and block.","rollback_reason":"Primary metric `with_autocorrect` unchanged at 500 despite additional behavior parity work; autoresearch objective is monotonic count increase.","next_action_hint":"Target another cop missing `supports_autocorrect` to move primary metric, then revisit parity improvements opportunistically.","rubocop_reference":"vendor/rubocop-rspec/lib/rubocop/cop/rspec/hook_argument.rb","tests":"cargo test --lib -- cop::rspec::hook_argument","runtime_ms":582.43,"offenses_benchmark":3992}}
{"run":48,"commit":"ba5a177","metric":0,"metrics":{},"status":"checks_failed","description":"Attempted baseline autocorrect for RSpec/ChangeByZero (`to change(...).by(0)` -> `not_to change(...)`), but autocorrect fixture failed because no corrections were produced due missing parent-runner access in current matcher path.","timestamp":1775673437196,"segment":1,"confidence":47.61904761904762,"iterationTokens":2957,"asi":{"hypothesis":"ChangeByZero could gain safe non-compound autocorrect by rewriting runner selector and removing trailing `.by(0)` segment.","rollback_reason":"Autocorrect pipeline didn't emit corrections for fixture offense forms; current implementation cannot reliably locate the outer expectation runner (`to`) from the matched `by` call node.","next_action_hint":"Pick another missing-autocorrect cop with direct selector/node replacement, or refactor this cop to inspect full expectation chain from source/parent context before retrying.","rubocop_reference":"vendor/rubocop-rspec/lib/rubocop/cop/rspec/change_by_zero.rb","tests":"cargo test --lib -- cop::rspec::change_by_zero","error":"autocorrect_fixture: Cop produced no corrections"}}
{"run":49,"commit":"662daac","metric":501,"metrics":{},"status":"keep","description":"Added RuboCop-aligned autocorrect for RSpec/MatchArray by rewriting `match_array([..])` calls to `contain_exactly(...)` for populated array literals, with fixture autocorrect coverage.","timestamp":1775673543618,"segment":1,"confidence":45.54545454545455,"iterationTokens":4848,"asi":{"hypothesis":"MatchArray can be safely autocorrected by replacing the full matcher call with `contain_exactly` and splatting literal array contents.","rubocop_reference":"vendor/rubocop-rspec/lib/rubocop/cop/rspec/match_array.rb","implemented_cop":"RSpec/MatchArray","tests":"cargo test --lib -- cop::rspec::match_array","runtime_ms":528.56,"offenses_benchmark":3992,"missing_autocorrect_after":415}}
{"run":50,"commit":"b69950d","metric":502,"metrics":{},"status":"keep","description":"Added RuboCop-aligned autocorrect for RSpec/EmptyHook by removing empty hook block nodes (before/after/around variants), with fixture autocorrect coverage.","timestamp":1775673761517,"segment":1,"confidence":45.63636363636363,"iterationTokens":1149,"asi":{"hypothesis":"EmptyHook can safely autocorrect by removing the full empty hook expression range for block-form hook calls.","rubocop_reference":"vendor/rubocop-rspec/lib/rubocop/cop/rspec/empty_hook.rb","implemented_cop":"RSpec/EmptyHook","tests":"cargo test --lib -- cop::rspec::empty_hook","runtime_ms":522.31,"offenses_benchmark":3992,"missing_autocorrect_after":414,"iteration_note":"Initial removal only deleted block body (left hook selectors); adjusted correction range to remove call+block and aligned corrected fixture newline shape."}}
{"run":51,"commit":"71e8b05","metric":503,"metrics":{},"status":"keep","description":"Added RuboCop-aligned autocorrect for Rails/FindById by replacing `find_by_id!`, `find_by!(id: ...)`, and `where(id: ...).take!` call segments with `find(...)`, with fixture autocorrect coverage including safe navigation forms.","timestamp":1775673938078,"segment":1,"confidence":45.72727272727273,"iterationTokens":9801,"asi":{"hypothesis":"FindById can safely autocorrect by replacing the offense method-call range with `find(<id_value>)` while preserving the original receiver/safe-navigation context.","rubocop_reference":"vendor/rubocop-rails/lib/rubocop/cop/rails/find_by_id.rb","implemented_cop":"Rails/FindById","tests":"cargo test --lib -- cop::rails::find_by_id","runtime_ms":524.92,"offenses_benchmark":3992,"missing_autocorrect_after":413}}
{"run":52,"commit":"9dabe1f","metric":504,"metrics":{},"status":"keep","description":"Added RuboCop-aligned autocorrect for Rails/DynamicFindBy by rewriting dynamic finder calls (`find_by_<attrs>` / `find_by_<attrs>!`) to static `find_by` / `find_by!` with explicit keyword arguments.","timestamp":1775674054139,"segment":1,"confidence":43.82608695652174,"iterationTokens":6499,"asi":{"hypothesis":"DynamicFindBy offenses can be safely autocorrected by replacing selector+arg range with static find_by invocation built from parsed dynamic attribute segments.","rubocop_reference":"vendor/rubocop-rails/lib/rubocop/cop/rails/dynamic_find_by.rb","implemented_cop":"Rails/DynamicFindBy","tests":"cargo test --lib -- cop::rails::dynamic_find_by","runtime_ms":526.2,"offenses_benchmark":3992,"missing_autocorrect_after":412}}
{"run":53,"commit":"aabe93c","metric":505,"metrics":{},"status":"keep","description":"Added RuboCop-aligned autocorrect for Rails/FindBy by rewriting `where(...).take` chains to `find_by(...)` and removing trailing `.take`, with fixture autocorrect tests.","timestamp":1775674286928,"segment":1,"confidence":42.083333333333336,"iterationTokens":6499,"asi":{"hypothesis":"FindBy can safely autocorrect offense forms by replacing inner `where` selector with `find_by` and deleting the outer `.take` segment.","rubocop_reference":"vendor/rubocop-rails/lib/rubocop/cop/rails/find_by.rb","implemented_cop":"Rails/FindBy","tests":"cargo test --lib -- cop::rails::find_by","runtime_ms":532.62,"offenses_benchmark":3992,"missing_autocorrect_after":411,"parity_note":"Matches RuboCop partial autocorrect behavior by not autocorrecting where.first offenses."}}
