{"run":100,"commit":"88ba932","metric":0,"metrics":{},"status":"crash","description":"BigDecimal inline run aborted at preflight: dirty set swapped to RedundantEqualityComparisonBlock source plus new corrected fixtures before tests began.","timestamp":1775712797905,"segment":0,"confidence":null,"iterationTokens":4991,"asi":{"hypothesis":"Land BigDecimalWithNumericArgument autocorrect in an isolated 2-file run.","rollback_reason":"Preflight guard failed after concurrent file-set mutation replaced expected BigDecimal source change.","next_action_hint":"Either isolate execution context or run against currently stable dirty set only after confirming it can improve primary metric.","error_signature":"preflight dirty-set swap to redundant_equality_comparison_block"}}
{"run":45,"commit":"88ba932","metric":0,"metrics":{},"status":"crash","description":"RedundantEqualityComparisonBlock attempt could not start validation: pre-run attribution guard failed because expected target file/fixture edits disappeared before execution.","timestamp":1775712816791,"segment":0,"confidence":null,"iterationTokens":12032,"asi":{"hypothesis":"Land RuboCop-aligned autocorrect for Performance/RedundantEqualityComparisonBlock (`all?/any?/one?/none?` block comparisons -> argument form).","rollback_reason":"Worktree drift removed prepared RedundantEqualityComparisonBlock edits before run; no attributable patch remained to validate.","next_action_hint":"Re-apply patch and run immediately in an isolated worktree or pick a target file that remains stable through preflight in this environment.","error_signature":"pre-run guard failed: expected target diffs missing"}}
{"run":105,"commit":"88ba932","metric":314,"metrics":{},"status":"discard","description":"BigDecimalWithNumericArgument autocorrect run achieved 602/314 with invariant 3992, but post-run diff set included multiple unrelated churn files (array_semi_infinite_range_slice/casecmp/double_start_end_with/squeeze/where_range), so attribution was confounded and discarded.","timestamp":1775712960566,"segment":0,"confidence":9.08,"iterationTokens":5803,"asi":{"hypothesis":"Add RuboCop-style BigDecimalWithNumericArgument autocorrect and reduce missing_autocorrect by one.","rollback_reason":"Unexpected concurrent source diffs made the observed metric improvement non-attributable to the intended isolated patch.","next_action_hint":"Retry in a clean/isolated workspace and log keep only when diff set is limited to intended cop + fixture (+autoresearch files).","tests":"cargo test --lib --quiet -- cop::performance::big_decimal_with_numeric_argument","with_autocorrect_parsed":602,"missing_autocorrect_parsed":314,"offenses_benchmark":3992,"confounders":"src/cop/performance/array_semi_infinite_range_slice.rs, src/cop/performance/casecmp.rs, src/cop/performance/double_start_end_with.rs, src/cop/performance/squeeze.rs, src/cop/rails/where_range.rs"}}
{"run":101,"commit":"88ba932","metric":0,"metrics":{},"status":"crash","description":"BigDecimalWithNumericArgument run passed targeted tests and offense invariant, but post-run guard failed because source+fixture disappeared before logging (reverted to 601/315 baseline).","timestamp":1775712994356,"segment":0,"confidence":null,"iterationTokens":6162,"asi":{"hypothesis":"Add RuboCop-aligned BigDecimalWithNumericArgument autocorrect (+1 coverage) with corrected fixture tests.","rollback_reason":"Post-run dirty-file set collapsed to baseline, so metrics were non-attributable.","next_action_hint":"Retry only if dirty files remain stable through post-check, or move experimentation to isolated worktree to prevent churn.","tests":"cargo test --lib --quiet -- cop::performance::big_decimal_with_numeric_argument","offenses_benchmark_expected":3992,"with_autocorrect_rechecked":601,"missing_autocorrect_rechecked":315,"error_signature":"post-run dirty-set collapse"}}
{"run":46,"commit":"88ba932","metric":0,"metrics":{},"status":"crash","description":"BigDecimalWithNumericArgument autocorrect attempt passed targeted tests but failed post-run attribution guard because expected source/fixture edits vanished before logging.","timestamp":1775713021752,"segment":0,"confidence":null,"iterationTokens":8524,"asi":{"hypothesis":"Keep RuboCop-aligned Performance/BigDecimalWithNumericArgument autocorrect if patch remains persistent through validation.","rollback_reason":"Post-run status guard found `src/cop/performance/big_decimal_with_numeric_argument.rs` and its corrected fixture no longer dirty, so metrics were non-attributable.","next_action_hint":"Continue only with targets whose diffs remain stable through the full cycle (or isolate in dedicated worktree) before accepting keep.","tests":"cargo test --lib --quiet -- cop::performance::big_decimal_with_numeric_argument","error_signature":"post-run attribution guard failed: BigDecimalWithNumericArgument edits vanished","offenses_benchmark_expected":3992}}
{"run":106,"commit":"88ba932","metric":315,"metrics":{},"status":"discard","description":"Post-ideas-prune control run confirmed baseline unchanged at 601/315 with offense invariant 3992; no new attributable code delta this cycle.","timestamp":1775713047416,"segment":0,"confidence":8.73076923076923,"iterationTokens":2715,"asi":{"hypothesis":"Verify stable baseline while waiting for an attribution-clean window for next cop patch.","rollback_reason":"No optimization patch applied in this run.","next_action_hint":"Retry BigDecimalWithNumericArgument or CompareWithBlock only when required-path guard can pass without concurrent confounders.","with_autocorrect_observed":601,"missing_autocorrect_observed":315,"offenses_benchmark":3992}}
{"run":102,"commit":"88ba932","metric":0,"metrics":{},"status":"crash","description":"BigDecimal inline retry passed tests/invariant but attribution failed: expected BigDecimal files disappeared and dirty set switched to MapCompact source+fixture before post-check.","timestamp":1775713116473,"segment":0,"confidence":null,"iterationTokens":3638,"asi":{"hypothesis":"Use a fast benchmark command to keep BigDecimal patch stable through post-run guard.","rollback_reason":"Post-run file-set swap invalidated attribution for BigDecimal changes.","next_action_hint":"Validate the currently stable MapCompact source+corrected fixture pair in isolation.","error_signature":"post-run dirty-set swap big_decimal -> map_compact","offenses_benchmark_expected":3992}}
{"run":107,"commit":"88ba932","metric":0,"metrics":{},"status":"crash","description":"Validation attempt on observed BigDecimal local diff failed guard because intended source path disappeared during run before metric collection, despite targeted tests passing.","timestamp":1775713134715,"segment":0,"confidence":8.73076923076923,"iterationTokens":1580,"asi":{"hypothesis":"Confirm and attribute BigDecimalWithNumericArgument autocorrect only if intended patch files persist through full validation.","rollback_reason":"Guard failure (`src/cop/performance/big_decimal_with_numeric_argument.rs` missing) indicates workspace churn erased patch mid-run.","next_action_hint":"Keep guarding; avoid attribution until required files survive post-test check.","tests":"cargo test --lib --quiet -- cop::performance::big_decimal_with_numeric_argument","guard_failure":"Required path missing: src/cop/performance/big_decimal_with_numeric_argument.rs"}}
{"run":47,"commit":"88ba932","metric":0,"metrics":{},"status":"crash","description":"MapCompact autocorrect patch passed targeted tests but failed post-run attribution guard because MapCompact source/fixture edits disappeared before logging.","timestamp":1775713180162,"segment":0,"confidence":null,"iterationTokens":5070,"asi":{"hypothesis":"Land RuboCop-aligned Performance/MapCompact autocorrect by rewriting `map/collect ... .compact` to `filter_map` with compact-segment removal.","rollback_reason":"Post-run status guard found expected `map_compact` edits vanished, so run metrics were non-attributable.","next_action_hint":"Prioritize files that remain stable through the full cycle (as with Caller/BlockGivenWithExplicitBlock) or run in isolated worktree to prevent disappearing diffs.","tests":"cargo test --lib --quiet -- cop::performance::map_compact","error_signature":"post-run attribution guard failed: MapCompact edits vanished","offenses_benchmark_expected":3992}}
{"run":108,"commit":"88ba932","metric":315,"metrics":{},"status":"discard","description":"Control baseline run after failed BigDecimal persistence attempt stayed at 601/315 with offense invariant 3992; no attributable local change this cycle.","timestamp":1775713203736,"segment":0,"confidence":8.407407407407407,"iterationTokens":1269,"asi":{"hypothesis":"Confirm baseline stability between guarded patch attempts in a churn-prone workspace.","rollback_reason":"No optimization patch applied.","next_action_hint":"Keep ideas focused on unresolved cops and continue guarded retries only when required paths survive.","with_autocorrect_observed":601,"missing_autocorrect_observed":315,"offenses_benchmark":3992}}
{"run":103,"commit":"88ba932","metric":0,"metrics":{},"status":"crash","description":"Fast BigDecimal retry again passed tests/invariant but post-run guard failed: BigDecimal source+fixture disappeared and tree returned to clean baseline (601/315).","timestamp":1775713239636,"segment":0,"confidence":null,"iterationTokens":3937,"asi":{"hypothesis":"Shortening benchmark step to `target/debug/nitrocop` would preserve BigDecimal patch long enough for attribution.","rollback_reason":"Despite shorter run, dirty files still vanished before post-check, so result remained non-attributable.","next_action_hint":"Pause BigDecimal retries until workspace churn is controlled; target whichever file remains dirty immediately before run.","tests":"cargo test --lib --quiet -- cop::performance::big_decimal_with_numeric_argument","offenses_benchmark_expected":3992,"with_autocorrect_rechecked":601,"missing_autocorrect_rechecked":315,"error_signature":"post-run dirty files vanished to baseline"}}
{"run":104,"commit":"88ba932","metric":601,"metrics":{},"status":"discard","description":"Baseline recheck on current HEAD confirms stable 601/315 and offense invariant 3992; no attributable implementation delta in this cycle.","timestamp":1775713346381,"segment":0,"confidence":null,"iterationTokens":3644,"asi":{"hypothesis":"Quick baseline rechecks help detect when concurrent churn has settled before attempting another autocorrect patch.","rollback_reason":"No new cop/fixture changes were present, so this run cannot be kept as an improvement.","next_action_hint":"Wait for a stable dirty candidate (or isolated workspace) before next implementation run; prioritize BigDecimalWithNumericArgument or CompareWithBlock when files persist.","with_autocorrect_observed":601,"missing_autocorrect_observed":315,"offenses_benchmark":3992,"benchmark_command":"target/debug/nitrocop ~/Dev/wt-gph-rspec-rip-out"}}
{"run":48,"commit":"88ba932","metric":602,"metrics":{},"status":"discard","description":"Performance/MapCompact autocorrect patch (selector rewrite + compact removal) passed tests and offense invariant, but primary metric stayed flat at 602/314, so discarded per optimization target.","timestamp":1775713470002,"segment":0,"confidence":null,"iterationTokens":4200,"asi":{"hypothesis":"Adding RuboCop-aligned autocorrect for Performance/MapCompact should increase `with_autocorrect` by +1 via deterministic `map/collect ... .compact` -> `filter_map` rewrite.","rollback_reason":"Primary metric did not improve in this run despite valid tests/invariant, indicating no net optimization movement for the configured target.","next_action_hint":"Pivot to another missing-autocorrect cop that is not already represented in current count, and preflight with `count_missing_autocorrect` before investing in implementation.","tests":"cargo test --lib --quiet -- cop::performance::map_compact","with_autocorrect_observed":602,"missing_autocorrect_observed":314,"offenses_benchmark":3992}}
{"run":420,"commit":"51ca75f","metric":602,"metrics":{},"status":"keep","description":"Added RuboCop-aligned autocorrect for Performance/MapCompact by rewriting `map/collect ... .compact` offense chains to `filter_map`, with corrected fixture coverage; targeted tests pass and benchmark offense invariant remains 3992.","timestamp":1775753681753,"segment":1,"confidence":21.5,"iterationTokens":4200,"asi":{"hypothesis":"MapCompact offense shapes are deterministic (`map/collect` with compact tail), so localized selector/tail rewrite to `filter_map` should increase autocorrect coverage by +1 without offense drift.","rubocop_reference":"vendor/rubocop-performance/lib/rubocop/cop/performance/map_compact.rb","implemented_cop":"Performance/MapCompact","tests":"cargo test --lib --quiet -- cop::performance::map_compact","with_autocorrect_after":602,"missing_autocorrect_after":314,"offenses_benchmark":3992}}
{"run":421,"commit":"c0872d2","metric":603,"metrics":{},"status":"keep","description":"Added RuboCop-aligned autocorrect for Performance/BigDecimalWithNumericArgument: wraps float literal BigDecimal args in strings, converts digit-only string args to integers, and rewrites float/string `to_d` literal receivers to RuboCop-style forms; corrected fixture coverage added and offense invariant remains 3992.","timestamp":1775753867720,"segment":1,"confidence":21.535714285714285,"iterationTokens":1528,"asi":{"hypothesis":"BigDecimalWithNumericArgument has deterministic literal rewrites that can safely enable supports_autocorrect and raise coverage by +1.","rubocop_reference":"vendor/rubocop-performance/lib/rubocop/cop/performance/big_decimal_with_numeric_argument.rb","implemented_cop":"Performance/BigDecimalWithNumericArgument","tests":"cargo test --lib --quiet -- cop::performance::big_decimal_with_numeric_argument","with_autocorrect_after":603,"missing_autocorrect_after":313,"offenses_benchmark":3992}}
{"run":422,"commit":"3a1fef0","metric":604,"metrics":{},"status":"keep","description":"Added RuboCop-aligned autocorrect for Performance/CompareWithBlock by rewriting flagged comparator blocks to `sort_by`/`sort_by!`/`min_by`/`max_by`/`minmax_by` forms (including literal `[]` key blocks), with corrected fixture coverage and offense invariant kept at 3992.","timestamp":1775754059143,"segment":1,"confidence":21.571428571428573,"iterationTokens":27072,"asi":{"hypothesis":"CompareWithBlock offenses already constrain to deterministic comparator block shapes, so replacing from selector through block end with the corresponding `*_by` form should safely add autocorrect support.","rubocop_reference":"vendor/rubocop-performance/lib/rubocop/cop/performance/compare_with_block.rb","implemented_cop":"Performance/CompareWithBlock","tests":"cargo test --lib --quiet -- cop::performance::compare_with_block","with_autocorrect_after":604,"missing_autocorrect_after":312,"offenses_benchmark":3992}}
{"run":423,"commit":"8590792","metric":605,"metrics":{},"status":"keep","description":"Added RuboCop-aligned autocorrect for Performance/RedundantEqualityComparisonBlock by replacing flagged `all?/any?/one?/none?` comparison blocks with direct argument forms, including `is_a?/kind_of?` cases and corrected fixture coverage; offense invariant remains 3992.","timestamp":1775754174730,"segment":1,"confidence":21.607142857142858,"iterationTokens":5370,"asi":{"hypothesis":"RedundantEqualityComparisonBlock offenses already satisfy strict parameter/operand guards, so replacing from selector through block end with direct-argument predicate calls should safely add autocorrect support.","rubocop_reference":"vendor/rubocop-performance/lib/rubocop/cop/performance/redundant_equality_comparison_block.rb","implemented_cop":"Performance/RedundantEqualityComparisonBlock","tests":"cargo test --lib --quiet -- cop::performance::redundant_equality_comparison_block","with_autocorrect_after":605,"missing_autocorrect_after":311,"offenses_benchmark":3992}}
{"run":424,"commit":"a798fbf","metric":606,"metrics":{},"status":"keep","description":"Added RuboCop-aligned autocorrect for Performance/ZipWithoutBlock by replacing flagged `map/collect { ... [param] ... }` chains with `zip` selector rewrite, with corrected fixture coverage and offense invariant preserved at 3992.","timestamp":1775754411240,"segment":1,"confidence":21.642857142857142,"iterationTokens":39048,"asi":{"hypothesis":"ZipWithoutBlock offenses are deterministic selector+block-tail rewrites (`map/collect` block returning one-element array) so replacing from selector through block end with `zip` should safely add autocorrect support.","rubocop_reference":"vendor/rubocop-performance/lib/rubocop/cop/performance/zip_without_block.rb","implemented_cop":"Performance/ZipWithoutBlock","tests":"cargo test --lib --quiet -- cop::performance::zip_without_block","with_autocorrect_after":606,"missing_autocorrect_after":310,"offenses_benchmark":3992}}
{"run":425,"commit":"03b7fcb","metric":607,"metrics":{},"status":"keep","description":"Added RuboCop-aligned autocorrect for Performance/IoReadlines by rewriting instance `readlines` chains to `each_line` (preserving args and chained enumerable calls) while intentionally skipping unsafe class/implicit-receiver cases, with corrected fixture coverage; offense invariant remains 3992.","timestamp":1775754527219,"segment":1,"confidence":21.678571428571427,"iterationTokens":6812,"asi":{"hypothesis":"IoReadlines can safely add partial RuboCop-style autocorrect by replacing the `readlines` segment with `each_line` only for explicit instance receivers, avoiding class/implicit receiver rewrites.","rubocop_reference":"vendor/rubocop-performance/lib/rubocop/cop/performance/io_readlines.rb","implemented_cop":"Performance/IoReadlines","tests":"cargo test --lib --quiet -- cop::performance::io_readlines","with_autocorrect_after":607,"missing_autocorrect_after":309,"offenses_benchmark":3992}}
{"run":426,"commit":"b69029b","metric":608,"metrics":{},"status":"keep","description":"Added RuboCop-aligned autocorrect for Performance/RedundantBlockCall by rewriting flagged `&block` receiver calls (`block.call(...)`) to `yield(...)`, with corrected fixture coverage; benchmark offense invariant remains 3992.","timestamp":1775754788311,"segment":1,"confidence":21.714285714285715,"iterationTokens":2186,"asi":{"hypothesis":"RedundantBlockCall offenses are explicit local receiver `.call` invocations on the method blockarg and can be safely rewritten to `yield` with preserved arguments.","rubocop_reference":"vendor/rubocop-performance/lib/rubocop/cop/performance/redundant_block_call.rb","implemented_cop":"Performance/RedundantBlockCall","tests":"cargo test --lib --quiet -- cop::performance::redundant_block_call","with_autocorrect_after":608,"missing_autocorrect_after":308,"offenses_benchmark":3992}}
{"run":427,"commit":"043d076","metric":609,"metrics":{},"status":"keep","description":"Added RuboCop-aligned autocorrect for Performance/RedundantMatch by rewriting flagged `match` calls to `=~` when regexp-literal autocorrect is safe, with corrected fixture coverage and benchmark offense invariant preserved at 3992.","timestamp":1775755023120,"segment":1,"confidence":21.75,"iterationTokens":7617,"asi":{"hypothesis":"RedundantMatch offense nodes can safely gain partial RuboCop-style autocorrect by converting `receiver.match(arg)` to `receiver =~ arg` only when either side is regexp-literal, mirroring RuboCop autocorrectability constraints.","rubocop_reference":"vendor/rubocop-performance/lib/rubocop/cop/performance/redundant_match.rb","implemented_cop":"Performance/RedundantMatch","tests":"cargo test --lib --quiet -- cop::performance::redundant_match","with_autocorrect_after":609,"missing_autocorrect_after":307,"offenses_benchmark":3992}}
{"run":428,"commit":"4e19329","metric":610,"metrics":{},"status":"keep","description":"Added conservative RuboCop-aligned autocorrect for Performance/StringReplacement by rewriting string-literal `gsub/gsub!` single-char replacements to `tr/tr!` or `delete/delete!`, with corrected fixture coverage; offense invariant remains 3992.","timestamp":1775755149523,"segment":1,"confidence":21.403508771929825,"iterationTokens":11021,"asi":{"hypothesis":"StringReplacement can safely gain baseline autocorrect via deterministic string-literal first-arg rewrites while leaving regex-first-arg offenses diagnostic-only for now.","rubocop_reference":"vendor/rubocop-performance/lib/rubocop/cop/performance/string_replacement.rb","implemented_cop":"Performance/StringReplacement","tests":"cargo test --lib --quiet -- cop::performance::string_replacement","with_autocorrect_after":610,"missing_autocorrect_after":306,"offenses_benchmark":3992,"known_gap":"Regex-first-argument autocorrect paths are deferred; current support intentionally targets string-first-arg offenses only."}}
{"run":429,"commit":"4e19329","metric":610,"metrics":{},"status":"discard","description":"Baseline checkpoint after context-resume and ideas pruning: with_autocorrect remains 610 (306 missing) with offense invariant 3992; no implementation delta in this cycle.","timestamp":1775755362325,"segment":1,"confidence":21.03448275862069,"iterationTokens":18953,"asi":{"hypothesis":"Re-anchor post-resume baseline before next parity-focused implementation attempt.","rollback_reason":"No new code change was introduced in this iteration, so this run does not advance the primary metric.","next_action_hint":"Implement next deferred parity candidate (StringReplacement regex-first-arg autocorrect or RegexpMatch) in an attribution-clean single-cop cycle.","with_autocorrect_observed":610,"missing_autocorrect_observed":306,"offenses_benchmark":3992}}
