{"run":10,"commit":"2a7183b","metric":577,"metrics":{},"status":"keep","description":"Implemented RuboCop-aligned autocorrect for Performance/UnfreezeString (`String.new` / `String.new(str|dstr)` -> unary plus string literal) with corrected fixture coverage and offense invariant 3992.","timestamp":1775693066661,"segment":0,"confidence":null,"iterationTokens":3642,"asi":{"hypothesis":"UnfreezeString has deterministic replacements for current offense shapes, so enabling autocorrect should increase coverage while preserving offense count.","rubocop_reference":"vendor/rubocop-performance/lib/rubocop/cop/performance/unfreeze_string.rb","implemented_cop":"Performance/UnfreezeString","tests":"cargo test --lib --quiet -- cop::performance::unfreeze_string","with_autocorrect_after":577,"missing_autocorrect_after":339,"offenses_benchmark":3992,"safety_guard":"Wrap correction in parentheses when immediate chaining follows (`(+str).foo`) to preserve call precedence."}}
{"run":36,"commit":"8b62e0f","metric":577,"metrics":{},"status":"discard","description":"Validation run reached with_autocorrect=577 / missing=339 / offenses=3992, but this workspace state was already carrying in-flight AncestorsInclude+UnfreezeString autocorrect implementations; this run only adjusted fixture offense message text, so attribution is not clean.","timestamp":1775693202269,"segment":0,"confidence":null,"iterationTokens":13267,"asi":{"hypothesis":"Bundle AncestorsInclude and UnfreezeString autocorrect support for a +2 coverage step.","rollback_reason":"No attribution-clean implementation delta in this run (only fixture message wording changed), so metric gain cannot be credited to this experiment.","next_action_hint":"Pick next missing cop from clean baseline and implement code + fixtures in the same run before benchmarking.","with_autocorrect":577,"missing_autocorrect":339,"offenses_benchmark":3992}}
{"run":45,"commit":"2a7183b","metric":577,"metrics":{},"status":"discard","description":"Validation run for AncestorsInclude + UnfreezeString passed with benchmark invariant 3992, but this cycle introduced no new autocorrect-count delta (state already at 577) and only left fixture-text drift.","timestamp":1775693216549,"segment":0,"confidence":null,"iterationTokens":19644,"asi":{"hypothesis":"Revalidate latest in-flight Performance autocorrect bundle with full invariant guard before selecting next target.","rollback_reason":"No new attributable primary-metric improvement this iteration; run reflected already-landed branch state.","next_action_hint":"Pick a fresh missing autocorrect cop not already landed (e.g., IndexBy/IndexWith or another Performance candidate) and run an isolated implementation cycle.","tests":"cargo test --lib --quiet -- cop::performance::ancestors_include; cargo test --lib --quiet -- cop::performance::unfreeze_string","with_autocorrect_observed":577,"missing_autocorrect_observed":339,"offenses_benchmark":3992}}
{"run":37,"commit":"3456c26","metric":578,"metrics":{},"status":"keep","description":"Added RuboCop-aligned autocorrect for Performance/InefficientHashSearch by rewriting `hash.keys.include?(x)`/`hash.values.include?(x)` to `hash.key?(x)`/`hash.value?(x)`, with corrected fixture coverage.","timestamp":1775693437838,"segment":0,"confidence":null,"iterationTokens":17208,"asi":{"hypothesis":"InefficientHashSearch is a deterministic whole-call rewrite and should safely add +1 autocorrect support while preserving offense invariant.","rubocop_reference":"vendor/rubocop-performance/lib/rubocop/cop/performance/inefficient_hash_search.rb","implemented_cop":"Performance/InefficientHashSearch","tests":"cargo test --lib -- cop::performance::inefficient_hash_search","with_autocorrect_after":578,"missing_autocorrect_after":338,"offenses_benchmark":3992}}
{"run":38,"commit":"3456c26","metric":0,"metrics":{},"status":"crash","description":"RangeInclude autocorrect attempt was blocked by unrelated compile error: missing `tests/fixtures/cops/performance/sort_reverse/corrected.rb` required by existing SortReverse autocorrect fixture macro.","timestamp":1775693534923,"segment":0,"confidence":null,"iterationTokens":4162,"asi":{"hypothesis":"Add selector-level autocorrect for Performance/RangeInclude (`include?`/`member?` -> `cover?`) to gain +1 support safely.","rollback_reason":"`cargo test` failed before target cop tests due missing SortReverse corrected fixture include_bytes path.","next_action_hint":"Add the missing SortReverse corrected fixture file (or remove broken macro) to restore test compilation, then rerun RangeInclude experiment.","error_details":"include_bytes! missing src/cop/performance/../../../tests/fixtures/cops/performance/sort_reverse/corrected.rb","tests":"cargo test --lib -- cop::performance::range_include"}}
{"run":39,"commit":"3456c26","metric":0,"metrics":{},"status":"crash","description":"RangeInclude autocorrect rerun was blocked by new unrelated compile drift in Rails/IndexWith (partial autocorrect plumbing references undefined helpers and `corrections` binding).","timestamp":1775693687736,"segment":0,"confidence":null,"iterationTokens":5910,"asi":{"hypothesis":"Add selector autocorrect for Performance/RangeInclude and validate +1 support.","rollback_reason":"`cargo test` failed before target cop execution due IndexWith compile errors (E0425/E0282).","next_action_hint":"Stabilize `src/cop/rails/index_with.rs` to a compiling state (either complete helper implementation or revert partial edits), then rerun RangeInclude.","error_details":"Undefined `index_with_block_parts`, `build_index_with_replacement`, `each_with_object_index_with_parts`, and missing `corrections` binding in index_with.rs","tests":"cargo test --lib -- cop::performance::range_include"}}
{"run":11,"commit":"3456c26","metric":0,"metrics":{},"status":"checks_failed","description":"SortReverse/RangeInclude validation run failed to compile due unrelated in-flight Rails/IndexWith autocorrect edits (missing helper functions and corrections binding), so results were attribution-confounded.","timestamp":1775693695779,"segment":0,"confidence":null,"iterationTokens":8513,"asi":{"hypothesis":"Validate and keep in-flight performance autocorrect additions for SortReverse and RangeInclude with benchmark invariant guard.","rollback_reason":"Compilation failed from `rails/index_with.rs` unresolved symbols and variable naming (`corrections`), blocking targeted test execution.","next_action_hint":"Let rollback clear confounded in-flight IndexWith/RangeInclude state, then rerun an attribution-clean single-cop experiment.","error":"E0425/E0282 in src/cop/rails/index_with.rs (missing index_with_block_parts/build_index_with_replacement; corrections binding mismatch)"}}
{"run":46,"commit":"3456c26","metric":578,"metrics":{},"status":"discard","description":"IndexWith validation cycle passed targeted tests and offense invariant 3992, but primary metric stayed flat at 578 and the tree contained unrelated in-flight RangeInclude edits, so no attribution-clean gain.","timestamp":1775693817376,"segment":0,"confidence":null,"iterationTokens":19644,"asi":{"hypothesis":"Implement and validate Rails/IndexWith autocorrect as next +1 candidate from ideas backlog.","rollback_reason":"No measurable primary-metric improvement in this run; concurrent unvalidated Performance/RangeInclude drift made attribution ambiguous.","next_action_hint":"Start from the reverted clean tree, pick one missing cop, and keep scope to that cop’s file + fixture only before rerunning.","tests":"cargo test --lib --quiet -- cop::rails::index_with","with_autocorrect_observed":578,"missing_autocorrect_observed":338,"offenses_benchmark":3992,"confounding_files":"src/cop/performance/range_include.rs; tests/fixtures/cops/performance/range_include/corrected.rb"}}
{"run":12,"commit":"c6e8aa3","metric":578,"metrics":{},"status":"keep","description":"Added RuboCop-aligned autocorrect for Performance/SortReverse and Performance/RangeInclude with corrected fixture coverage; targeted tests pass and offense invariant remains 3992.","timestamp":1775693844300,"segment":0,"confidence":null,"iterationTokens":4588,"asi":{"hypothesis":"These two selector-level rewrites are deterministic on existing offense shapes (`sort { b <=> a }` -> `sort.reverse`; `Range#include?/===` -> `cover?`) and should increase autocorrect coverage safely.","rubocop_reference":"vendor/rubocop-performance/lib/rubocop/cop/performance/sort_reverse.rb; vendor/rubocop-performance/lib/rubocop/cop/performance/range_include.rb","implemented_cops":"Performance/SortReverse, Performance/RangeInclude","tests":"cargo test --lib --quiet -- cop::performance::sort_reverse cop::performance::range_include","with_autocorrect_after":578,"missing_autocorrect_after":338,"offenses_benchmark":3992}}
{"run":40,"commit":"3456c26","metric":579,"metrics":{},"status":"discard","description":"RangeInclude run achieved with_autocorrect=579 / missing=337 / offenses=3992, but attribution was confounded by concurrent in-flight changes to Performance/RedundantSplitRegexpArgument appearing during the run.","timestamp":1775693939061,"segment":0,"confidence":null,"iterationTokens":5033,"asi":{"hypothesis":"Add selector autocorrect for Performance/RangeInclude (`include?`/`member?` -> `cover?`).","rollback_reason":"Unrelated cop modifications (`redundant_split_regexp_argument`) were present in worktree at measurement time, so metric gain is not isolated.","next_action_hint":"Rerun RangeInclude from a clean tree with only range_include.rs and its corrected fixture changed.","with_autocorrect":579,"missing_autocorrect":337,"offenses_benchmark":3992}}
{"run":13,"commit":"8e438dd","metric":579,"metrics":{},"status":"keep","description":"Added RuboCop-aligned autocorrect for Performance/RangeInclude (`include?/===` -> `cover?`) and Performance/RedundantSplitRegexpArgument (deterministic regex split arg -> string literal) with corrected fixtures; tests pass and offense invariant stays 3992.","timestamp":1775694025625,"segment":0,"confidence":null,"iterationTokens":9789,"asi":{"hypothesis":"These two deterministic rewrites are low-risk and should increase autocorrect coverage while preserving benchmark offense count.","rubocop_reference":"vendor/rubocop-performance/lib/rubocop/cop/performance/range_include.rb; vendor/rubocop-performance/lib/rubocop/cop/performance/redundant_split_regexp_argument.rb","implemented_cops":"Performance/RangeInclude, Performance/RedundantSplitRegexpArgument","tests":"cargo test --lib --quiet -- cop::performance::range_include cop::performance::redundant_split_regexp_argument","with_autocorrect_after":579,"missing_autocorrect_after":337,"offenses_benchmark":3992,"safety_guard":"Regex rewrite only when existing deterministic-literal matcher passes and /i flag is absent."}}
{"run":47,"commit":"3456c26","metric":578,"metrics":{},"status":"discard","description":"RangeInclude validation cycle passed targeted tests and offense invariant 3992, but with_autocorrect stayed at 578 and concurrent in-flight Performance/RedundantSplitRegexpArgument drift made attribution non-clean.","timestamp":1775694036085,"segment":0,"confidence":null,"iterationTokens":11265,"asi":{"hypothesis":"Add selector-only autocorrect for Performance/RangeInclude (`include?`/`member?` -> `cover?`) to raise autocorrect coverage by +1.","rollback_reason":"No measurable primary-metric increase in this run; unrelated modified cop files were present during execution.","next_action_hint":"After revert, inspect current modified cop drift and either validate that exact bundle or isolate one fresh cop change in a tight edit→run cycle.","tests":"cargo test --lib --quiet -- cop::performance::range_include","with_autocorrect_observed":578,"missing_autocorrect_observed":338,"offenses_benchmark":3992,"confounding_files":"src/cop/performance/redundant_split_regexp_argument.rs; tests/fixtures/cops/performance/redundant_split_regexp_argument/corrected.rb"}}
{"run":41,"commit":"3456c26","metric":580,"metrics":{},"status":"discard","description":"RedundantSplitRegexpArgument run reached with_autocorrect=580 / missing=336 / offenses=3992, but attribution was confounded by concurrent in-flight changes (RangeInclude and StringIdentifierArgument) appearing in worktree during validation.","timestamp":1775694156627,"segment":0,"confidence":null,"iterationTokens":7289,"asi":{"hypothesis":"Enable RuboCop-aligned autocorrect for Performance/RedundantSplitRegexpArgument by replacing deterministic regex split args with string literals.","rollback_reason":"Worktree gained unrelated cop changes during the run, so metric movement cannot be cleanly attributed to this experiment.","next_action_hint":"Repeat from a clean tree and isolate a single cop change before benchmarking.","with_autocorrect":580,"missing_autocorrect":336,"offenses_benchmark":3992}}
{"run":14,"commit":"4f8b270","metric":581,"metrics":{},"status":"keep","description":"Implemented RuboCop-aligned autocorrect for Performance/StringIdentifierArgument by replacing string identifier args with symbol literals across supported method sets (single/two/all-arg variants), with corrected fixture coverage and invariant 3992.","timestamp":1775694170645,"segment":0,"confidence":null,"iterationTokens":6102,"asi":{"hypothesis":"StringIdentifierArgument corrections are direct argument-token rewrites to symbol literals on already-detected offenses, so autocorrect enablement should safely increase coverage.","rubocop_reference":"vendor/rubocop-performance/lib/rubocop/cop/performance/string_identifier_argument.rb","implemented_cop":"Performance/StringIdentifierArgument","tests":"cargo test --lib --quiet -- cop::performance::string_identifier_argument","with_autocorrect_after":581,"missing_autocorrect_after":335,"offenses_benchmark":3992,"safety_guard":"Skip strings containing spaces/::, safe-navigation calls, and non-UTF-8 content to mirror existing offense guards."}}
{"run":15,"commit":"4b39330","metric":580,"metrics":{},"status":"keep","description":"Landed RuboCop-aligned autocorrect for Performance/RangeInclude by rewriting `include?/member?` selector to `cover?`, with corrected fixture coverage and invariant offenses 3992.","timestamp":1775694350860,"segment":0,"confidence":null,"iterationTokens":5238,"asi":{"hypothesis":"RangeInclude is a selector-only rewrite on deterministic offense shapes, so enabling autocorrect should safely improve coverage.","rubocop_reference":"vendor/rubocop-performance/lib/rubocop/cop/performance/range_include.rb","implemented_cop":"Performance/RangeInclude","tests":"cargo test --lib --quiet -- cop::performance::range_include","with_autocorrect_after":580,"missing_autocorrect_after":336,"offenses_benchmark":3992}}
{"run":42,"commit":"4b39330","metric":580,"metrics":{},"status":"discard","description":"RangeInclude validation produced with_autocorrect=580 / missing=336 / offenses=3992, but during run the branch advanced with an upstream commit already landing RangeInclude autocorrect; no local attribution delta remained.","timestamp":1775694390866,"segment":0,"confidence":null,"iterationTokens":30362,"asi":{"hypothesis":"Add Performance/RangeInclude supports_autocorrect via selector rewrite to `cover?`.","rollback_reason":"By logging time, worktree was clean and commit history showed RangeInclude already landed externally, so this run cannot be uniquely attributed.","next_action_hint":"Select a different still-missing cop and rerun from new HEAD.","with_autocorrect":580,"missing_autocorrect":336,"offenses_benchmark":3992}}
{"run":48,"commit":"4b39330","metric":580,"metrics":{},"status":"discard","description":"Revalidation run observed with_autocorrect=580 and offense invariant 3992 after head advanced with RangeInclude/StringIdentifierArgument autocorrect commits, but this cycle introduced no new local delta.","timestamp":1775694414250,"segment":0,"confidence":null,"iterationTokens":1041,"asi":{"hypothesis":"Confirm whether the in-flight Performance autocorrect bundle (RangeInclude + StringIdentifierArgument) is stable and attribution-clean.","rollback_reason":"Run validated already-landed head state rather than a new experiment patch in this iteration.","next_action_hint":"Use 580/336 as the new baseline and target a fresh missing autocorrect cop in an isolated single-cop cycle.","tests":"cargo test --lib --quiet -- cop::performance::range_include","with_autocorrect_observed":580,"missing_autocorrect_observed":336,"offenses_benchmark":3992,"head_commit_validated":"4b393305b"}}
{"run":16,"commit":"4b39330","metric":580,"metrics":{},"status":"discard","description":"Performance/SortReverse autocorrect implementation passed targeted tests and offense invariant, but primary metric did not improve (with_autocorrect remained 580).","timestamp":1775694447230,"segment":0,"confidence":null,"iterationTokens":2975,"asi":{"hypothesis":"Enable RuboCop-aligned SortReverse autocorrect (`sort { |a,b| b <=> a }` -> `sort.reverse`) and increase autocorrect coverage by +1.","rollback_reason":"Count metric stayed flat at with_autocorrect=580 despite passing tests, indicating no net metric movement in this iteration.","next_action_hint":"Pivot to another confirmed missing cop (e.g., Performance/DeletePrefix or Performance/DeleteSuffix) and rerun in an attribution-clean cycle.","tests":"cargo test --lib --quiet -- cop::performance::sort_reverse","with_autocorrect_observed":580,"missing_autocorrect_observed":336,"offenses_benchmark":3992}}
{"run":43,"commit":"4b39330","metric":582,"metrics":{},"status":"discard","description":"SortReverse run reached with_autocorrect=582 / missing=334 / offenses=3992, but worktree included concurrent in-flight changes for Performance/StringIdentifierArgument, so attribution is not isolated.","timestamp":1775694602509,"segment":0,"confidence":null,"iterationTokens":8183,"asi":{"hypothesis":"Add autocorrect for Performance/SortReverse by rewriting `sort { |a,b| b <=> a }` chains to `sort.reverse`.","rollback_reason":"Unrelated `string_identifier_argument` modifications were present alongside SortReverse changes at measurement time.","next_action_hint":"Rerun from clean tree after restoring `string_identifier_argument` changes, or bundle both cops intentionally in one attributed experiment.","with_autocorrect":582,"missing_autocorrect":334,"offenses_benchmark":3992}}
{"run":17,"commit":"4b39330","metric":582,"metrics":{},"status":"discard","description":"StringIdentifierArgument + SortReverse validation run produced improved metric in-command, but no surviving code delta remained in working tree afterward, so attribution was not keep-safe.","timestamp":1775694661930,"segment":0,"confidence":null,"iterationTokens":4126,"asi":{"hypothesis":"Land autocorrect for Performance/StringIdentifierArgument and Performance/SortReverse together for +2 coverage.","rollback_reason":"Post-run working tree contained no corresponding source/fixture changes for these cops, so the metric increase could not be attributed to a persistent patch.","next_action_hint":"Reapply one cop at a time (prefer StringIdentifierArgument first), verify `git status` still shows the edited files immediately before logging keep, then rerun.","with_autocorrect_observed":582,"missing_autocorrect_observed":334,"offenses_benchmark":3992}}
{"run":49,"commit":"4b39330","metric":0,"metrics":{},"status":"checks_failed","description":"SortReverse+StringIdentifierArgument bundle validation failed at compile stage due unrelated in-flight Rails/WhereRange drift (`build_anonymous_autocorrect` missing), so no reliable metric could be kept.","timestamp":1775694679876,"segment":0,"confidence":null,"iterationTokens":878,"asi":{"hypothesis":"Validate full modified-performance bundle attribution-clean after SortReverse autocorrect implementation.","rollback_reason":"Compilation blocked by unrelated `src/cop/rails/where_range.rs` error (E0425 missing `build_anonymous_autocorrect`) before benchmark/metrics completed.","next_action_hint":"Re-run from clean tree after rollback and isolate one cop with no external drift, or include/fix WhereRange in scope before attempting another keep.","error_details":"error[E0425] cannot find function `build_anonymous_autocorrect` in src/cop/rails/where_range.rs:118","tests":"cargo test --lib --quiet -- cop::performance::sort_reverse; cargo test --lib --quiet -- cop::performance::string_identifier_argument"}}
{"run":50,"commit":"4b39330","metric":580,"metrics":{},"status":"discard","description":"Quick compile-gate run for Performance/SortReverse tests passed, but this was a validation-only check without new code or benchmark metrics.","timestamp":1775694751193,"segment":0,"confidence":null,"iterationTokens":10439,"asi":{"hypothesis":"Verify compile/test health before next isolated autocorrect implementation cycle.","rollback_reason":"No implementation delta and no primary-metric measurement emitted in this run.","next_action_hint":"Apply a concrete single-cop patch, then rerun full test + count + benchmark command with METRIC output.","tests":"cargo test --lib --quiet -- cop::performance::sort_reverse","with_autocorrect_observed":580,"missing_autocorrect_observed":336}}
