{"run":564,"commit":"677fd9e","metric":724,"metrics":{},"status":"keep","description":"Added conservative autocorrect support for Lint/DuplicateCaseCondition by removing duplicate conditions within multi-condition `when` lists; cross-branch duplicates remain diagnostic-only.","timestamp":1775833582581,"segment":1,"confidence":15.56989247311828,"iterationTokens":8760,"asi":{"hypothesis":"A safe baseline autocorrect can remove duplicate condition tokens in the same `when` condition list without restructuring case branch order.","implemented_cop":"Lint/DuplicateCaseCondition","rubocop_reference":"vendor/rubocop/lib/rubocop/cop/lint/duplicate_case_condition.rb","tests":"cargo test --lib --quiet -- cop::lint::duplicate_case_condition","missing_autocorrect_after":192,"offenses_benchmark":3992,"known_gap":"Duplicates appearing as standalone conditions in later `when` branches are not auto-removed in this baseline."}}
{"run":565,"commit":"1bfa91e","metric":725,"metrics":{},"status":"keep","description":"Added conservative autocorrect support for Lint/DuplicateHashKey by removing earlier duplicate literal-value pairs to preserve last-key semantics; non-literal-value duplicates remain diagnostic-only.","timestamp":1775833820679,"segment":1,"confidence":15.425531914893616,"iterationTokens":16111,"asi":{"hypothesis":"A safe baseline autocorrect can preserve Ruby hash-result semantics by deleting earlier duplicate-key pairs only when both conflicting values are literals (no side effects).","implemented_cop":"Lint/DuplicateHashKey","rubocop_reference":"vendor/rubocop/lib/rubocop/cop/lint/duplicate_hash_key.rb","tests":"cargo test --lib --quiet -- cop::lint::duplicate_hash_key","missing_autocorrect_after":191,"offenses_benchmark":3992,"known_gap":"Duplicates involving non-literal values are not auto-corrected to avoid side-effect changes."}}
{"run":566,"commit":"1bfa91e","metric":0,"metrics":{},"status":"crash","description":"Attempted DuplicateMatchPattern autocorrect experiment run but run_experiment returned no result/output under context pressure before verification completed.","timestamp":1775834141945,"segment":1,"confidence":15.425531914893616,"iterationTokens":18439,"asi":{"hypothesis":"Duplicate `in` branches can be safely autocorrected by deleting later unreachable `in` clauses.","rollback_reason":"Experiment execution did not produce a timed result, so benchmark/test verification could not be trusted.","next_action_hint":"Re-read session context files, then rerun the experiment command cleanly and log based on actual outputs.","error_detail":"run_experiment returned 'No result provided'"}}
{"run":567,"commit":"1bfa91e","metric":726,"metrics":{},"status":"keep","description":"Added conservative autocorrect support for Lint/DuplicateMatchPattern by removing later duplicate `in` clauses in case-match blocks (unreachable branch deletion).","timestamp":1775834302476,"segment":1,"confidence":15.446808510638299,"iterationTokens":18439,"asi":{"hypothesis":"For duplicate `in` patterns, deleting the later duplicate clause is semantics-preserving because first matching pattern already handles those values.","implemented_cop":"Lint/DuplicateMatchPattern","rubocop_alignment":"RuboCop detects duplicates but does not autocorrect; nitrocop uses conservative unreachable-branch deletion baseline.","tests":"cargo test --lib --quiet -- cop::lint::duplicate_match_pattern","missing_autocorrect_after":190,"offenses_benchmark":3992,"safety_guard":"Only clauses already flagged as duplicate by existing detector are removed; first occurrence preserved."}}
{"run":568,"commit":"7fd1c34","metric":726,"metrics":{},"status":"keep","description":"Retry keep for Lint/DuplicateMatchPattern after transient git index-lock; conservative autocorrect deletes later duplicate `in` clauses and preserves offense invariant.","timestamp":1775834330529,"segment":1,"confidence":15.446808510638299,"iterationTokens":18439,"asi":{"hypothesis":"Later duplicate `in` clauses are unreachable and can be removed safely as baseline autocorrect.","retry_reason":"Previous keep logging hit transient .git/index.lock during auto-commit.","implemented_cop":"Lint/DuplicateMatchPattern","missing_autocorrect_after":190,"offenses_benchmark":3992,"next_action_hint":"Continue with conservative missing-autocorrect cops; prefer deterministic range edits with strong fixture coverage."}}
{"run":569,"commit":"7fd1c34","metric":727,"metrics":{},"status":"keep","description":"Added conservative autocorrect support for Lint/DuplicateElsifCondition by removing only final duplicate `elsif` branches with side-effect-free predicates, leaving complex/side-effectful cases diagnostic-only.","timestamp":1775834788872,"segment":1,"confidence":15.305263157894737,"iterationTokens":1796,"asi":{"hypothesis":"A narrowly scoped autocorrect for duplicate elsif can be safe if limited to side-effect-free predicates and final elsif branches so control-flow structure is preserved.","implemented_cop":"Lint/DuplicateElsifCondition","rubocop_alignment":"RuboCop detects duplicates but does not autocorrect; nitrocop adds conservative unreachable-branch removal only in low-risk cases.","tests":"cargo test --lib --quiet -- cop::lint::duplicate_elsif_condition","missing_autocorrect_after":189,"offenses_benchmark":3992,"safety_guard":"Only autocorrect when duplicate elsif has no subsequent branch and predicate is variable/constant/literal read.","known_gap":"No autocorrect for duplicate conditions involving calls/comparisons or branches with trailing else/elsif."}}
{"run":570,"commit":"8a160ae","metric":727,"metrics":{},"status":"keep","description":"Retry keep for Lint/DuplicateElsifCondition after transient git index-lock; conservative final-elsif autocorrect retained with benchmark invariant intact.","timestamp":1775834802764,"segment":1,"confidence":15.145833333333334,"iterationTokens":1796,"asi":{"hypothesis":"Final duplicate elsif branches with side-effect-free predicates can be removed safely as a conservative autocorrect baseline.","retry_reason":"Previous keep logging hit transient .git/index.lock during auto-commit.","implemented_cop":"Lint/DuplicateElsifCondition","missing_autocorrect_after":189,"offenses_benchmark":3992,"next_action_hint":"Continue with conservative missing-autocorrect cops; avoid branches where condition reevaluation could have side effects."}}
{"run":571,"commit":"11f30f2","metric":728,"metrics":{},"status":"keep","description":"Added conservative autocorrect support for Lint/CopDirectiveSyntax for malformed disable/enable/todo directives missing commas between cop names; rewrites space-separated cop list to comma-separated form.","timestamp":1775835304051,"segment":1,"confidence":15.326315789473684,"iterationTokens":21992,"asi":{"hypothesis":"Because this cop operates on directive comments, we can safely autocorrect a narrow malformed-list case (`A/B C/D`) to `A/B, C/D` without touching code semantics.","implemented_cop":"Lint/CopDirectiveSyntax","rubocop_alignment":"RuboCop reports this syntax issue but does not autocorrect; nitrocop adds conservative formatting fix only for unambiguous cop-list spacing case.","tests":"cargo test --lib --quiet -- cop::lint::cop_directive_syntax","missing_autocorrect_after":188,"offenses_benchmark":3992,"safety_guard":"Only autocorrect when no existing commas/comment marker and all whitespace-separated tokens are valid cop names (or all).","known_gap":"No autocorrect for invalid mode names, missing cop names, invalid cop tokens, or directives with free-form comments."}}
{"run":572,"commit":"23c31b4","metric":729,"metrics":{},"status":"keep","description":"Added conservative autocorrect support for Lint/DuplicateBranch by removing only final duplicate `elsif` branches with side-effect-free predicates; other branch types remain diagnostic-only.","timestamp":1775835637548,"segment":1,"confidence":15.51063829787234,"iterationTokens":14985,"asi":{"hypothesis":"A safe baseline for DuplicateBranch is to delete only final duplicate elsif branches when predicate reevaluation is side-effect-free, preserving `end` and control-flow structure.","implemented_cop":"Lint/DuplicateBranch","rubocop_alignment":"RuboCop reports duplicate branches but does not autocorrect; nitrocop applies a narrowly scoped unreachable-branch deletion baseline.","tests":"cargo test --lib --quiet -- cop::lint::duplicate_branch","missing_autocorrect_after":187,"offenses_benchmark":3992,"safety_guard":"Autocorrect only for final elsif without trailing else/elsif and predicate limited to simple variable/constant/literal reads.","known_gap":"No autocorrect for duplicate else/case/rescue branches or call/comparison predicates."}}
{"run":571,"commit":"23c31b4","metric":0,"metrics":{},"status":"crash","description":"Style/Send autocorrect experiment command crashed because benchmark guard used `set -e` with `cargo run` that exits non-zero on offenses, so METRIC lines were never emitted.","timestamp":1775837003331,"segment":1,"confidence":15.347368421052632,"iterationTokens":14985,"asi":{"hypothesis":"Add deterministic selector autocorrect for Style/Send (`send` -> `__send__`) and verify with targeted tests + offense invariant.","rollback_reason":"Experiment harness treated expected offense exit from `cargo run` as fatal due `set -e`, aborting before metrics collection.","next_action_hint":"Rerun with tolerant benchmark capture (`set +e` or `|| true`) so offense count can be parsed and METRIC lines emitted.","error_detail":"run_experiment exited 1 after benchmark invocation despite tests passing."}}
{"run":572,"commit":"23c31b4","metric":0,"metrics":{},"status":"crash","description":"Style/Send experiment rerun crashed because offense parser extracted `6143` from summary line (`6143 files inspected, 3992 offenses detected`) and failed invariant check expecting 3992.","timestamp":1775837172649,"segment":1,"confidence":15.347368421052632,"iterationTokens":5363,"asi":{"hypothesis":"Add Style/Send selector autocorrect and validate via targeted tests plus offense-count invariant.","rollback_reason":"Benchmark parsing logic used first field on summary line, capturing file count instead of offense count.","next_action_hint":"Parse the token immediately before `offenses` in the summary line, then rerun the experiment.","error_detail":"awk pattern returned files-inspected count rather than offenses-detected count."}}
{"run":573,"commit":"53fa2ec","metric":730,"metrics":{},"status":"keep","description":"Added deterministic autocorrect support for Style/Send by rewriting offending selector `send` to `__send__`, with fixture autocorrect coverage and offense-count invariant preserved.","timestamp":1775837311695,"segment":1,"confidence":15.53191489361702,"iterationTokens":19287,"asi":{"hypothesis":"Style/Send offenses can safely autocorrect via selector-only rewrite (`send` -> `__send__`) because both methods share dispatch semantics while avoiding method-name shadowing.","implemented_cop":"Style/Send","rubocop_reference":"vendor/rubocop/lib/rubocop/cop/style/send.rb","tests":"cargo test --lib --quiet -- cop::style::send","missing_autocorrect_after":186,"offenses_benchmark":3992,"autocorrect_strategy":"Replace call selector token only; preserve receiver, arguments, call operator, and surrounding expression layout."}}
{"run":574,"commit":"53fa2ec","metric":0,"metrics":{},"status":"crash","description":"RequireDependency autocorrect attempt failed tests because Rails-version gate was not enabled in the new autocorrect unit config, so no correction path executed.","timestamp":1775837514585,"segment":1,"confidence":15.53191489361702,"iterationTokens":9824,"asi":{"hypothesis":"Conservative selector rewrite (`require_dependency` -> `require`) for Rails/RequireDependency should safely add autocorrect coverage.","rollback_reason":"Autocorrect test config missed Rails lockfile gate (`__RailtiesInLockfile`), causing `rails_version_at_least` to short-circuit and emit no corrections.","next_action_hint":"Set `__RailtiesInLockfile: true` alongside TargetRailsVersion in test config, then rerun targeted tests + benchmark guard.","implemented_cop":"Rails/RequireDependency","error_detail":"assert_cop_autocorrect_with_config reported no corrections produced."}}
{"run":575,"commit":"c15fe1f","metric":731,"metrics":{},"status":"keep","description":"Added conservative autocorrect support for Rails/RequireDependency by rewriting selector `require_dependency` to `require` on existing offense shapes (Rails>=6 Zeitwerk), with tests and offense invariant preserved.","timestamp":1775837695003,"segment":1,"confidence":15.389473684210527,"iterationTokens":4705,"asi":{"hypothesis":"For Zeitwerk-targeted Rails/RequireDependency offenses, selector-only rewrite (`require_dependency` -> `require`) provides a safe baseline autocorrect.","implemented_cop":"Rails/RequireDependency","rubocop_reference":"vendor/rubocop-rails/lib/rubocop/cop/rails/require_dependency.rb","tests":"cargo test --lib --quiet -- cop::rails::require_dependency","missing_autocorrect_after":185,"offenses_benchmark":3992,"autocorrect_strategy":"Replace call selector token only; preserve receiver and arguments."}}
{"run":576,"commit":"02a9ead","metric":732,"metrics":{},"status":"keep","description":"Added conservative autocorrect support for Lint/AmbiguousAssignment by rewriting mistyped operator spans (`=+`, `=-`, `=*`, `=!`) to intended operators (`+=`, `-=`, `*=`, `!=`) with corrected fixture coverage.","timestamp":1775837936453,"segment":1,"confidence":15.25,"iterationTokens":6034,"asi":{"hypothesis":"The exact offense span already isolates ambiguous typo tokens, so replacing that span with the suggested operator is a deterministic and safe baseline autocorrect.","implemented_cop":"Lint/AmbiguousAssignment","rubocop_reference":"vendor/rubocop/lib/rubocop/cop/lint/ambiguous_assignment.rb","tests":"cargo test --lib --quiet -- cop::lint::ambiguous_assignment","missing_autocorrect_after":184,"offenses_benchmark":3992,"autocorrect_strategy":"Replace offense token range from assignment operator tail to first RHS char using MISTAKES mapping."}}
{"run":577,"commit":"02a9ead","metric":733,"metrics":{},"status":"keep","description":"Added autocorrect support for RSpec/MessageExpectation by selector rewrite between `expect` and `allow` according to EnforcedStyle, including fixture and config-driven autocorrect tests.","timestamp":1775838264629,"segment":1,"confidence":15.270833333333334,"iterationTokens":13701,"asi":{"hypothesis":"MessageExpectation offenses are style-only and can be safely autocorrected by replacing the root expectation selector (`expect`<->`allow`) while preserving the receive matcher chain.","implemented_cop":"RSpec/MessageExpectation","rubocop_reference":"vendor/rubocop-rspec/lib/rubocop/cop/rspec/message_expectation.rb","tests":"cargo test --lib --quiet -- cop::rspec::message_expectation","missing_autocorrect_after":183,"offenses_benchmark":3992,"autocorrect_strategy":"Replace selector token of the receiver call to preferred style; keep args, `.to`, and nested matcher structure unchanged."}}
{"run":578,"commit":"02a9ead","metric":733,"metrics":{},"status":"keep","description":"Retry keep for RSpec/MessageExpectation after transient git index-lock; selector-rewrite autocorrect remains valid with tests passing and offense invariant unchanged.","timestamp":1775838284869,"segment":1,"confidence":15.270833333333334,"iterationTokens":13701,"asi":{"hypothesis":"Previous keep result for RSpec/MessageExpectation is valid; rerun keep to complete auto-commit after transient index-lock contention.","retry_reason":"log_experiment auto-commit previously failed with .git/index.lock contention.","implemented_cop":"RSpec/MessageExpectation","tests":"cargo test --lib --quiet -- cop::rspec::message_expectation","missing_autocorrect_after":183,"offenses_benchmark":3992,"next_action_hint":"Continue with another deterministic selector/style autocorrect candidate from remaining missing list."}}
{"run":579,"commit":"708628b","metric":733,"metrics":{},"status":"keep","description":"Second retry keep for RSpec/MessageExpectation after intermittent git index-lock contention; no code changes from prior validated run.","timestamp":1775838297397,"segment":1,"confidence":15.11340206185567,"iterationTokens":13701,"asi":{"hypothesis":"The measured improvement is already validated; this retry is only to persist the keep commit once index lock contention clears.","retry_reason":"Previous keep retries failed during auto git add/commit due transient .git/index.lock contention.","implemented_cop":"RSpec/MessageExpectation","missing_autocorrect_after":183,"offenses_benchmark":3992,"next_action_hint":"If lock contention persists, pause briefly and retry keep again."}}
{"run":580,"commit":"708628b","metric":734,"metrics":{},"status":"keep","description":"Added autocorrect support for RSpec/MessageSpies by rewriting matcher selectors (`receive` <-> `have_received`) per EnforcedStyle, including compound-matcher fixture coverage and config-driven autocorrect test.","timestamp":1775838548156,"segment":1,"confidence":14.979591836734693,"iterationTokens":8458,"asi":{"hypothesis":"MessageSpies offenses are style-only matcher-name differences, so selector-level replacement on each matched matcher call should be safe and deterministic.","implemented_cop":"RSpec/MessageSpies","rubocop_reference":"vendor/rubocop-rspec/lib/rubocop/cop/rspec/message_spies.rb","tests":"cargo test --lib --quiet -- cop::rspec::message_spies","missing_autocorrect_after":182,"offenses_benchmark":3992,"autocorrect_strategy":"Collect matched matcher selector locations and replace token text with preferred style (`have_received` or `receive`) without altering expectation runners/chains."}}
{"run":581,"commit":"9de34dc","metric":734,"metrics":{},"status":"keep","description":"Retry keep for RSpec/MessageSpies after transient git index-lock contention; validated selector-only matcher rewrites remain unchanged.","timestamp":1775838558997,"segment":1,"confidence":14.828282828282829,"iterationTokens":8458,"asi":{"hypothesis":"Prior keep result is valid; retry only to persist commit after transient lock error.","retry_reason":"Previous keep failed during auto git add/commit due intermittent .git/index.lock contention.","implemented_cop":"RSpec/MessageSpies","missing_autocorrect_after":182,"offenses_benchmark":3992,"next_action_hint":"Proceed to next style-selector autocorrect candidate once commit persists."}}
{"run":582,"commit":"3bd8ef9","metric":735,"metrics":{},"status":"keep","description":"Added autocorrect support for RSpec/StubbedMock by rewriting expectation selectors (`expect`->`allow`, `expect_any_instance_of`->`allow_any_instance_of`, `is_expected`->`allow(subject)`) on flagged response-configuring expectations.","timestamp":1775838992781,"segment":1,"confidence":14.7,"iterationTokens":8458,"asi":{"hypothesis":"StubbedMock offenses are style-only expectation-entrypoint choices, so selector replacement at the expectation call should safely preserve matcher/response semantics.","implemented_cop":"RSpec/StubbedMock","rubocop_reference":"vendor/rubocop-rspec/lib/rubocop/cop/rspec/stubbed_mock.rb","tests":"cargo test --lib --quiet -- cop::rspec::stubbed_mock","missing_autocorrect_after":181,"offenses_benchmark":3992,"autocorrect_strategy":"Replace expectation selector token only for detected top-level `.to` offense forms; preserve matcher chain (`receive...and_return`, hash/block/blockpass)."}}
{"run":583,"commit":"3bd8ef9","metric":736,"metrics":{},"status":"keep","description":"Added conservative autocorrect support for Lint/NextWithoutAccumulator by rewriting bare `next` in reduce/inject blocks to `next <accumulator_name>` when a named first block parameter exists.","timestamp":1775839480044,"segment":1,"confidence":14.72,"iterationTokens":60015,"asi":{"hypothesis":"For reduce/inject blocks with explicit accumulator parameter names, replacing bare `next` keyword with `next <acc>` is deterministic and preserves accumulator flow semantics.","implemented_cop":"Lint/NextWithoutAccumulator","rubocop_reference":"vendor/rubocop/lib/rubocop/cop/lint/next_without_accumulator.rb","tests":"cargo test --lib --quiet -- cop::lint::next_without_accumulator","missing_autocorrect_after":180,"offenses_benchmark":3992,"autocorrect_strategy":"Track first required block parameter for reduce/inject block context; replace bare `next` token with `next <param>`."}}
{"run":584,"commit":"3bd8ef9","metric":736,"metrics":{},"status":"keep","description":"Retry keep for Lint/NextWithoutAccumulator after transient git index-lock contention; validated `next <acc>` autocorrect remains unchanged.","timestamp":1775839486044,"segment":1,"confidence":14.72,"iterationTokens":60015,"asi":{"hypothesis":"Prior successful run is valid; retry is only to persist keep commit after transient lock issue.","retry_reason":"Previous keep failed during auto git add/commit due intermittent .git/index.lock contention.","implemented_cop":"Lint/NextWithoutAccumulator","missing_autocorrect_after":180,"offenses_benchmark":3992,"next_action_hint":"Continue with another conservative, deterministic missing-autocorrect cop once commit persists."}}
{"run":585,"commit":"87a6da4","metric":736,"metrics":{},"status":"keep","description":"Second retry keep for Lint/NextWithoutAccumulator after transient index-lock contention.","timestamp":1775839492811,"segment":1,"confidence":14.574257425742575,"iterationTokens":60015,"asi":{"hypothesis":"No code/metric changes since validated run; retry solely for commit persistence.","retry_reason":"Intermittent .git/index.lock prevented previous keep auto-commit.","implemented_cop":"Lint/NextWithoutAccumulator","missing_autocorrect_after":180,"offenses_benchmark":3992}}
