{"run":115,"commit":"e392860","metric":566,"metrics":{},"status":"keep","description":"Added conservative RuboCop-aligned autocorrect for Rails/ExpandedDateRange (`beginning_of_day..end_of_day` -> `.all_day`) with fixture and unit coverage; targeted tests pass and offense invariant remains 3992.","timestamp":1775688778857,"segment":1,"confidence":22.64,"iterationTokens":6714,"asi":{"hypothesis":"ExpandedDateRange can safely gain baseline autocorrect for same-receiver day-range expansions with no arguments, increasing with_autocorrect by +1.","rubocop_reference":"vendor/rubocop-rails/lib/rubocop/cop/rails/expanded_date_range.rb","implemented_cop":"Rails/ExpandedDateRange","tests":"cargo test --lib -- cop::rails::expanded_date_range","with_autocorrect_after":566,"missing_autocorrect_after":350,"offenses_benchmark":3992,"scope_guard":"Autocorrect limited to no-argument beginning_of_day..end_of_day with identical receiver source."}}
{"run":18,"commit":"18bb0e2","metric":566,"metrics":{},"status":"keep","description":"Added baseline RuboCop-aligned autocorrect for Rails/ExpandedDateRange by rewriting detected `beginning_of_day..end_of_day` same-receiver ranges to `.all_day`, with corrected fixture coverage and preserved offense invariant 3992.","timestamp":1775688783903,"segment":0,"confidence":null,"iterationTokens":7729,"asi":{"hypothesis":"ExpandedDateRange can safely gain +1 autocorrect support by correcting currently detected no-argument day-range expansions to `receiver.all_day`.","rubocop_reference":"vendor/rubocop-rails/lib/rubocop/cop/rails/expanded_date_range.rb","implemented_cop":"Rails/ExpandedDateRange","tests":"cargo test --lib -- cop::rails::expanded_date_range","with_autocorrect_after":566,"missing_autocorrect_after":350,"offenses_benchmark":3992,"safety_guard":"Autocorrect intentionally limited to current day-range matcher with matching receivers and no arguments."}}
{"run":30,"commit":"a17efbb","metric":566,"metrics":{},"status":"keep","description":"Validated latest Rails autocorrect bundle (ExpandedDateRange, EagerEvaluationLogMessage, HttpPositionalArguments, LinkToBlank, RootJoinChain): targeted tests pass, with_autocorrect=566 (350 missing), and benchmark offense invariant stays 3992.","timestamp":1775688796579,"segment":0,"confidence":null,"iterationTokens":1797,"asi":{"hypothesis":"Re-anchor on the newest landed Rails autocorrect additions only if all recently touched cops pass targeted tests and offense count remains invariant.","validated_cops":"Rails/ExpandedDateRange, Rails/EagerEvaluationLogMessage, Rails/HttpPositionalArguments, Rails/LinkToBlank, Rails/RootJoinChain","tests":"cargo test --lib --quiet -- cop::rails::expanded_date_range; cargo test --lib --quiet -- cop::rails::eager_evaluation_log_message; cargo test --lib --quiet -- cop::rails::http_positional_arguments; cargo test --lib --quiet -- cop::rails::link_to_blank; cargo test --lib --quiet -- cop::rails::root_join_chain","with_autocorrect_after":566,"missing_autocorrect_after":350,"offenses_benchmark":3992,"ideas_review":"Pruned stale items during churn; current backlog keeps actionable WhereNot and WhereEquals candidates only."}}
{"run":19,"commit":"93e0252","metric":568,"metrics":{},"status":"keep","description":"Added RuboCop-aligned autocorrect for Rails/OrderArguments by replacing string order arguments with preferred symbol/hash order syntax and removing empty-string args, with corrected fixture coverage and offense invariant 3992 preserved.","timestamp":1775688969999,"segment":0,"confidence":null,"iterationTokens":4762,"asi":{"hypothesis":"OrderArguments can safely gain autocorrect by reusing existing preferred-order rendering and replacing the first..last order-arg source range.","rubocop_reference":"vendor/rubocop-rails/lib/rubocop/cop/rails/order_arguments.rb","implemented_cop":"Rails/OrderArguments","tests":"cargo test --lib -- cop::rails::order_arguments","with_autocorrect_after":568,"missing_autocorrect_after":348,"offenses_benchmark":3992,"safety_guard":"Correction only runs when all string args are convertible and non-positional per existing matcher guards."}}
{"run":116,"commit":"93e0252","metric":0,"metrics":{},"status":"checks_failed","description":"WhereEquals validation run was attribution-confounded: working tree contained in-flight Rails/DurationArithmetic autocorrect changes not covered by targeted tests, so result is not keep-safe.","timestamp":1775689072270,"segment":1,"confidence":22.64,"iterationTokens":1764,"asi":{"hypothesis":"Validate and keep a WhereEquals autocorrect improvement if targeted tests and offense invariant pass.","rollback_reason":"Run executed while unrelated `src/cop/rails/duration_arithmetic.rs` + fixture changes were present, and those edits were not included in the test scope.","next_action_hint":"Restart from clean tree and run a single-cop DurationArithmetic experiment with its own targeted tests plus benchmark invariant before considering keep.","with_autocorrect_observed":569,"missing_autocorrect_observed":347,"offenses_benchmark":3992,"drift_files":"src/cop/rails/duration_arithmetic.rs; tests/fixtures/cops/rails/duration_arithmetic/corrected.rb"}}
{"run":31,"commit":"93e0252","metric":0,"metrics":{},"status":"checks_failed","description":"WhereEquals autocorrect attempt failed targeted tests: offense fixture expects generic RuboCop-style guidance message, but implementation emitted concrete replacement string in diagnostic message.","timestamp":1775689124035,"segment":0,"confidence":null,"iterationTokens":7396,"asi":{"hypothesis":"Enable conservative RuboCop-aligned autocorrect for Rails/WhereEquals across deterministic SQL templates (`= ?`, `IN (?)`, named placeholders, `IS NULL`).","rollback_reason":"`cop::rails::where_equals::tests::offense_fixture` failed due diagnostic message mismatch (expected generic `where(attribute: value)` guidance).","next_action_hint":"Keep autocorrect rewrite logic but restore generic offense message to match fixture contract, then rerun targeted tests + benchmark invariant.","failed_test":"cop::rails::where_equals::tests::offense_fixture","error_excerpt":"expected message `Use `where(attribute: value)` ...`; actual `Use `where(name: 'Gabe')` ...`"}}
{"run":117,"commit":"93e0252","metric":0,"metrics":{},"status":"checks_failed","description":"DurationArithmetic validation run was confounded by unrelated in-flight Rails/WhereEquals edits not included in targeted tests, so result is not attribution-clean.","timestamp":1775689204520,"segment":1,"confidence":22.64,"iterationTokens":5683,"asi":{"hypothesis":"Add conservative autocorrect for Rails/DurationArithmetic (`Time.current +/- duration` to `duration.from_now/ago`) and keep if tests+invariant pass.","rollback_reason":"Working tree at log time contained unvalidated `src/cop/rails/where_equals.rs` changes while DurationArithmetic files were not the only delta.","next_action_hint":"Start from clean tree and isolate one cop (WhereEquals or DurationArithmetic) with matching targeted tests before rerunning metric guard.","with_autocorrect_observed":568,"missing_autocorrect_observed":348,"offenses_benchmark":3992,"drift_file":"src/cop/rails/where_equals.rs"}}
{"run":20,"commit":"93e0252","metric":568,"metrics":{},"status":"discard","description":"DurationArithmetic autocorrect implementation passed targeted tests and offense invariant, but primary metric stayed flat at with_autocorrect=568 so no measurable improvement.","timestamp":1775689207941,"segment":0,"confidence":null,"iterationTokens":5397,"asi":{"hypothesis":"Enable RuboCop-aligned autocorrect for `Time.current/Time.zone.now +/- duration` by rewriting to `.from_now`/`.ago`.","rollback_reason":"Primary metric unchanged (with_autocorrect remained 568), so this iteration did not move the configured objective.","next_action_hint":"Pick a confirmed missing cop with AutoCorrector in RuboCop (e.g., where_not / where_equals family) and run an isolated implementation.","tests":"cargo test --lib -- cop::rails::duration_arithmetic","with_autocorrect_observed":568,"missing_autocorrect_observed":348,"offenses_benchmark":3992}}
{"run":32,"commit":"93e0252","metric":0,"metrics":{},"status":"checks_failed","description":"WhereEquals/OrderArguments targeted tests passed, but experiment harness exited before metric emission because strict `set -euo pipefail` caused benchmark offense parsing pipeline to fail when the expected offense string was missing/mismatched.","timestamp":1775689317652,"segment":0,"confidence":null,"iterationTokens":4450,"asi":{"hypothesis":"Validate in-flight WhereEquals message fix alongside OrderArguments and keep if offense invariant remains 3992.","rollback_reason":"Metric extraction script was brittle: grep pipeline failure under `pipefail` aborted run before METRIC output.","next_action_hint":"Rerun with robust offense extraction (`grep ... || true` + explicit empty check) and include benchmark raw fallback diagnostics.","tests":"cargo test --lib --quiet -- cop::rails::where_equals; cargo test --lib --quiet -- cop::rails::order_arguments","harness_issue":"offense parse pipeline under pipefail exited early"}}
{"run":33,"commit":"a29077f","metric":568,"metrics":{},"status":"keep","description":"Fixed Rails/WhereEquals autocorrect regression by restoring fixture-compatible generic offense message while keeping autocorrect rewrites; validated WhereEquals + OrderArguments tests and benchmark invariant (3992). with_autocorrect now 568 (348 missing).","timestamp":1775689435237,"segment":0,"confidence":null,"iterationTokens":3786,"asi":{"hypothesis":"Complete and stabilize Rails/WhereEquals autocorrect (already in-flight on HEAD) by fixing message parity without changing rewrite behavior, then validate against benchmark invariants.","rubocop_reference":"vendor/rubocop-rails/lib/rubocop/cop/rails/where_equals.rb","implemented_cop":"Rails/WhereEquals (stabilization pass)","tests":"cargo test --lib --quiet -- cop::rails::where_equals; cargo test --lib --quiet -- cop::rails::order_arguments","with_autocorrect_after":568,"missing_autocorrect_after":348,"offenses_benchmark":3992,"ideas_pruned":"Removed stale Rails/WhereEquals idea after implementation; retained Rails/WhereNot as next candidate."}}
{"run":21,"commit":"a29077f","metric":568,"metrics":{},"status":"discard","description":"Calibration rerun on clean tree (no implementation delta): targeted WhereNot tests and benchmark invariant passed, with_autocorrect remained 568.","timestamp":1775689466071,"segment":0,"confidence":null,"iterationTokens":17097,"asi":{"hypothesis":"Re-validate current head metric/invariant before selecting next missing-autocorrect target.","rollback_reason":"No code changes were present in this iteration and primary metric was unchanged.","next_action_hint":"Implement an isolated missing cop with RuboCop AutoCorrector support (candidate: Rails/WhereNot or Rails/MatchRoute) and rerun.","tests":"cargo test --lib -- cop::rails::where_not","with_autocorrect_observed":568,"missing_autocorrect_observed":348,"offenses_benchmark":3992}}
{"run":118,"commit":"a29077f","metric":568,"metrics":{},"status":"discard","description":"WhereNot validation run passed targeted tests and offense invariant, but there was no surviving code delta in the working tree for this iteration, so no attributable improvement to keep.","timestamp":1775689508124,"segment":1,"confidence":23.102040816326532,"iterationTokens":9346,"asi":{"hypothesis":"Add conservative RuboCop-aligned autocorrect for Rails/WhereNot on deterministic negated SQL forms.","rollback_reason":"Post-run tree contained no WhereNot implementation changes (validation-only result).","next_action_hint":"Apply a single-cop WhereNot patch and immediately rerun in the same cycle to avoid continuation drift.","tests":"cargo test --lib -- cop::rails::where_not","with_autocorrect_observed":568,"missing_autocorrect_observed":348,"offenses_benchmark":3992}}
{"run":119,"commit":"b8a5101","metric":570,"metrics":{},"status":"keep","description":"Added RuboCop-aligned autocorrect for Rails/DurationArithmetic (`Time.current +/- duration` -> `duration.from_now/ago`) and Rails/WhereNot (negated SQL `where(...)` -> `where.not(...)`) with fixture coverage; targeted tests passed and offense invariant stayed 3992.","timestamp":1775689750930,"segment":1,"confidence":23.75,"iterationTokens":5077,"asi":{"hypothesis":"A clean two-cop bundle (DurationArithmetic + WhereNot) provides deterministic rewrites and should improve autocorrect coverage without offense drift.","rubocop_reference":"vendor/rubocop-rails/lib/rubocop/cop/rails/duration_arithmetic.rb; vendor/rubocop-rails/lib/rubocop/cop/rails/where_not.rb","implemented_cops":"Rails/DurationArithmetic, Rails/WhereNot","tests":"cargo test --lib -- cop::rails::duration_arithmetic cop::rails::where_not","with_autocorrect_after":570,"missing_autocorrect_after":346,"offenses_benchmark":3992,"scope_guard":"WhereNot corrections limited to simple !=/<>/NOT IN/IS NOT NULL templates with required value-shape checks; DurationArithmetic limited to Time.current/Time.zone.now ± literal durations."}}
{"run":34,"commit":"b8a5101","metric":570,"metrics":{},"status":"discard","description":"Revalidation run on current HEAD after the DurationArithmetic+WhereNot keep: targeted tests passed and offense invariant held at 3992, but this cycle introduced no additional code delta.","timestamp":1775689785781,"segment":0,"confidence":null,"iterationTokens":20991,"asi":{"hypothesis":"Confirm newly landed WhereNot/DurationArithmetic bundle remains stable before selecting the next missing-autocorrect target.","rollback_reason":"Validation-only iteration; no new implementation changes beyond already-kept commit b8a5101.","next_action_hint":"Move to next missing candidate from backlog (e.g., WhereRange/another RuboCop AutoCorrector cop) and keep scope attribution-clean.","tests":"cargo test --lib --quiet -- cop::rails::where_not; cargo test --lib --quiet -- cop::rails::duration_arithmetic","with_autocorrect_observed":570,"missing_autocorrect_observed":346,"offenses_benchmark":3992}}
{"run":35,"commit":"a6b6586","metric":570,"metrics":{},"status":"keep","description":"Finalized Rails/DurationArithmetic autocorrect (supports_autocorrect + replacement to `.from_now`/`.ago` + corrected fixture/tests). Targeted tests pass and benchmark offense invariant remains 3992; with_autocorrect=570 (346 missing).","timestamp":1775689888603,"segment":0,"confidence":null,"iterationTokens":8860,"asi":{"hypothesis":"Land leftover deterministic DurationArithmetic autocorrect delta cleanly on top of WhereNot state and validate it in isolation.","rubocop_reference":"vendor/rubocop-rails/lib/rubocop/cop/rails/duration_arithmetic.rb","implemented_cop":"Rails/DurationArithmetic","tests":"cargo test --lib --quiet -- cop::rails::duration_arithmetic","with_autocorrect_after":570,"missing_autocorrect_after":346,"offenses_benchmark":3992,"scope_guard":"Rewrite only for `Time.current`/`Time.zone.now` ± literal-duration offense shapes."}}
{"run":24,"commit":"366ef5b","metric":0,"metrics":{},"status":"crash","description":"Bundled WhereNot/WhereRange autocorrect attempt failed compile in WhereNot due moved CallNode ownership in helper invocation.","timestamp":1775690505244,"segment":0,"confidence":null,"iterationTokens":19847,"asi":{"hypothesis":"Enable conservative RuboCop-aligned autocorrect for WhereNot (and in-flight WhereRange drift) to increase autocorrect coverage while keeping offense invariant.","rollback_reason":"`extract_template_and_values(call)` consumed `call`, causing E0382 when later borrowing `call` for replacement construction.","next_action_hint":"Change helper signature to borrow `&CallNode` (or clone before passing), then rerun isolated where_not/where_range tests.","error_details":"E0382 borrow of moved value `call` in src/cop/rails/where_not.rs:131","tests":"cargo test --lib -- cop::rails::where_not cop::rails::where_range"}}
{"run":37,"commit":"366ef5b","metric":0,"metrics":{},"status":"checks_failed","description":"WhereRange autocorrect attempt failed tests immediately because Rust regex backend does not support backreferences (`\\1`) used in range pattern matching; this poisoned lazy regex initialization and cascaded test failures.","timestamp":1775690519288,"segment":0,"confidence":null,"iterationTokens":15443,"asi":{"hypothesis":"Enable conservative WhereRange autocorrect using RuboCop-like SQL range regex patterns and selector-range replacement.","rollback_reason":"Regex construction panic: backreferences unsupported in Rust `regex` crate (`RANGE_*` patterns using `\\1`).","next_action_hint":"Replace backreference-based patterns with explicit duplicate-column captures and enforce equality in code, then rerun WhereRange (and any in-flight confounding cop tests).","failed_tests":"cop::rails::where_range::{offense_fixture,no_offense_fixture,autocorrect_fixture,does_not_flag_*}"}}
{"run":25,"commit":"366ef5b","metric":0,"metrics":{},"status":"crash","description":"WhereNot autocorrect run could not compile tests because `where_range.rs` currently includes an autocorrect fixture test referencing a missing file (`tests/fixtures/cops/rails/where_range/corrected.rb`).","timestamp":1775690642906,"segment":0,"confidence":null,"iterationTokens":5704,"asi":{"hypothesis":"Implement WhereNot autocorrect and validate with targeted tests plus benchmark invariant.","rollback_reason":"Compilation failed before WhereNot tests ran due missing fixture include for another in-flight cop (`where_range`).","next_action_hint":"Add the missing `tests/fixtures/cops/rails/where_range/corrected.rb` fixture (matching current where_range offense expectations), then rerun targeted where_not experiment.","error_details":"include_bytes! failed for where_range/corrected.rb in src/cop/rails/where_range.rs:416","tests":"cargo test --lib -- cop::rails::where_not"}}
{"run":38,"commit":"366ef5b","metric":570,"metrics":{},"status":"discard","description":"WhereNot+WhereRange validation run passed targeted tests and offense invariant 3992, but primary metric from this run remained 570 (no measured improvement).","timestamp":1775690767555,"segment":0,"confidence":null,"iterationTokens":12008,"asi":{"hypothesis":"Re-attempt WhereRange while validating any concurrent in-flight WhereNot drift to keep attribution clean.","rollback_reason":"Primary metric unchanged in run output (`with_autocorrect=570`), so no keep candidate under current objective.","next_action_hint":"Re-run immediately from a stable tree and confirm current measured count before deciding whether WhereNot drift should be kept or reverted.","tests":"cargo test --lib --quiet -- cop::rails::where_not; cargo test --lib --quiet -- cop::rails::where_range","with_autocorrect_observed":570,"missing_autocorrect_observed":346,"offenses_benchmark":3992}}
{"run":26,"commit":"366ef5b","metric":570,"metrics":{},"status":"discard","description":"Validation run with in-flight where_range fixture restoration passed tests/invariant but primary metric stayed at with_autocorrect=570 (no measurable gain).","timestamp":1775690878316,"segment":0,"confidence":null,"iterationTokens":5797,"asi":{"hypothesis":"Bundle where_not autocorrect enablement with where_range fixture restoration and validate counts/invariant.","rollback_reason":"Primary metric unchanged at 570; additionally, effective code delta remained in where_range fixture/support path rather than producing a new counted autocorrect cop.","next_action_hint":"Choose a different missing cop with stable file attribution (e.g., select_map or active_record_callbacks_order) and implement autocorrect in an isolated patch.","tests":"cargo test --lib -- cop::rails::where_not cop::rails::where_range","with_autocorrect_observed":570,"missing_autocorrect_observed":346,"offenses_benchmark":3992}}
{"run":27,"commit":"366ef5b","metric":570,"metrics":{},"status":"discard","description":"Quick compile-gate check for Rails/WhereNot tests only (no implementation delta, no benchmark/count stage).","timestamp":1775690960465,"segment":0,"confidence":null,"iterationTokens":4885,"asi":{"hypothesis":"Verify baseline where_not test health before another autocorrect implementation pass.","rollback_reason":"Run was a diagnostic gate without primary-metric measurement; no attributable optimization change.","next_action_hint":"Implement where_not autocorrect in a single patch and run full test+count+benchmark experiment command.","tests":"cargo test --lib -- cop::rails::where_not"}}
{"run":39,"commit":"366ef5b","metric":570,"metrics":{},"status":"discard","description":"WhereRange validation run passed targeted tests and offense invariant 3992, but no measurable primary-metric improvement was observed (`with_autocorrect` stayed 570) and no surviving code delta remained.","timestamp":1775691010175,"segment":0,"confidence":null,"iterationTokens":7144,"asi":{"hypothesis":"Enable WhereRange autocorrect and improve count by +1 while preserving benchmark invariant.","rollback_reason":"Primary metric unchanged and working tree ended clean for WhereRange code after run, indicating no attributable count gain this cycle.","next_action_hint":"Pivot to a different confirmed missing cop (or investigate why WhereRange edits are not persisting/counting before retrying).","tests":"cargo test --lib --quiet -- cop::rails::where_range","with_autocorrect_observed":570,"missing_autocorrect_observed":346,"offenses_benchmark":3992}}
