{"run":18,"commit":"4b39330","metric":582,"metrics":{},"status":"discard","description":"BindCall run passed with improved metric, but working tree also contained unvalidated SortReverse edits/fixture, so attribution for +2 was not clean.","timestamp":1775694857848,"segment":0,"confidence":null,"iterationTokens":10546,"asi":{"hypothesis":"Land Performance/BindCall autocorrect (`bind(obj).call(...)` -> `bind_call(obj, ...)`) for +1 coverage.","rollback_reason":"Scope mismatch after run: unexpected in-flight SortReverse source/fixture changes were present and not covered by this run's targeted tests.","next_action_hint":"Rerun with both cops in scope (`bind_call` + `sort_reverse`) or isolate tree to BindCall-only before retrying.","tests":"cargo test --lib --quiet -- cop::performance::bind_call","with_autocorrect_observed":582,"missing_autocorrect_observed":334,"offenses_benchmark":3992}}
{"run":51,"commit":"4b39330","metric":582,"metrics":{},"status":"discard","description":"BindCall+SortReverse validation initially measured 582 with offenses invariant 3992, but post-run tree dropped SortReverse deltas and current count rechecks lower, so this result was not reproducible/attribution-clean.","timestamp":1775694920121,"segment":0,"confidence":null,"iterationTokens":5524,"asi":{"hypothesis":"Validate a two-cop performance bundle (BindCall + SortReverse) for a clean +2 autocorrect gain.","rollback_reason":"Measured metric depended on transient in-flight changes that did not persist after the run, so improvement cannot be reliably attributed.","next_action_hint":"Rerun from the current stable tree validating only surviving modified cop(s), starting with BindCall, then keep/discard on reproducible counts.","tests":"cargo test --lib --quiet -- cop::performance::sort_reverse; cargo test --lib --quiet -- cop::performance::bind_call","with_autocorrect_observed":582,"with_autocorrect_rechecked":581,"missing_autocorrect_rechecked":335,"offenses_benchmark":3992}}
{"run":44,"commit":"4854bce","metric":582,"metrics":{},"status":"keep","description":"Added RuboCop-aligned autocorrect for Performance/BindCall (`bind(...).call(...)` -> `bind_call(...)`) and Performance/SortReverse (`sort { |a,b| b <=> a }` -> `sort.reverse`) with corrected fixture coverage.","timestamp":1775694943450,"segment":0,"confidence":null,"iterationTokens":8183,"asi":{"hypothesis":"Both cops are deterministic local rewrites with explicit node-shape guards, so enabling supports_autocorrect should safely raise coverage by +2 while preserving offense invariant.","rubocop_reference":"vendor/rubocop-performance/lib/rubocop/cop/performance/bind_call.rb and sort_reverse.rb","implemented_cops":"Performance/BindCall, Performance/SortReverse","tests":"cargo test --lib -- cop::performance::bind_call && cargo test --lib -- cop::performance::sort_reverse","with_autocorrect_after":582,"missing_autocorrect_after":334,"offenses_benchmark":3992}}
{"run":52,"commit":"0f40b2c","metric":581,"metrics":{},"status":"keep","description":"Added RuboCop-aligned autocorrect for Performance/BindCall by rewriting `bind(obj).call(args...)` to `bind_call(obj, args...)` (including block-pass args), with fixture autocorrect coverage and offense invariant preserved.","timestamp":1775695118048,"segment":0,"confidence":null,"iterationTokens":5309,"asi":{"hypothesis":"Performance/BindCall is a deterministic range rewrite from `.bind(...).call(...)` to `.bind_call(...)`, so enabling supports_autocorrect should increase coverage by +1 safely.","rubocop_reference":"vendor/rubocop-performance/lib/rubocop/cop/performance/bind_call.rb","implemented_cop":"Performance/BindCall","tests":"cargo test --lib --quiet -- cop::performance::bind_call","with_autocorrect_after":581,"missing_autocorrect_after":335,"offenses_benchmark":3992,"correction_scope":"Replace from `bind` selector through trailing `.call(...)`, preserving positional and block-pass call arguments."}}
{"run":45,"commit":"4b84d1c","metric":581,"metrics":{},"status":"keep","description":"Finalized RuboCop-aligned autocorrect for Performance/BindCall by rewriting `.bind(...).call(...)` ranges to `bind_call(...)` (including block-pass args) and enabling autocorrect fixtures.","timestamp":1775695126734,"segment":0,"confidence":null,"iterationTokens":4255,"asi":{"hypothesis":"BindCall has a direct one-range rewrite equivalent to RuboCop, so adding supports_autocorrect should yield +1 without changing offense totals.","rubocop_reference":"vendor/rubocop-performance/lib/rubocop/cop/performance/bind_call.rb","implemented_cop":"Performance/BindCall","tests":"cargo test --lib -- cop::performance::bind_call","with_autocorrect_after":581,"missing_autocorrect_after":335,"offenses_benchmark":3992}}
{"run":53,"commit":"d1bc147","metric":582,"metrics":{},"status":"keep","description":"Added RuboCop-aligned autocorrect for Performance/SortReverse (`sort { |a,b| b <=> a }` -> `sort.reverse`) including numbered-parameter (`_2 <=> _1`) coverage, with corrected fixtures and offense invariant 3992.","timestamp":1775695311493,"segment":0,"confidence":null,"iterationTokens":4064,"asi":{"hypothesis":"SortReverse is a deterministic method-range rewrite from `sort` selector through block end to `sort.reverse`, so enabling supports_autocorrect should safely raise coverage.","rubocop_reference":"vendor/rubocop-performance/lib/rubocop/cop/performance/sort_reverse.rb","implemented_cop":"Performance/SortReverse","tests":"cargo test --lib --quiet -- cop::performance::sort_reverse","with_autocorrect_after":582,"missing_autocorrect_after":334,"offenses_benchmark":3992,"correction_scope":"Replace from `sort` selector to call end, preserving dot/safe-nav operator and handling regular + numbered block parameters."}}
{"run":19,"commit":"d1bc147","metric":0,"metrics":{},"status":"checks_failed","description":"SortReverse autocorrect+numblock attempt failed autocorrect fixture due expected file missing an output blank line.","timestamp":1775695319650,"segment":0,"confidence":null,"iterationTokens":7862,"asi":{"hypothesis":"Enable Performance/SortReverse autocorrect (including numblock `_2 <=> _1`) should increase autocorrect coverage by +1 without offense-count drift.","rollback_reason":"`cop::performance::sort_reverse::tests::autocorrect_fixture` failed because actual autocorrect output inserted a blank line before `nums.sort.reverse`.","next_action_hint":"Align corrected fixture to actual output shape (retain blank line), rerun targeted tests + count + offense invariant.","failing_test":"cop::performance::sort_reverse::tests::autocorrect_fixture","error_signature":"Autocorrect output does not match expected (blank-line diff)"}}
{"run":46,"commit":"4b84d1c","metric":0,"metrics":{},"status":"crash","description":"SortReverse autocorrect attempt failed fixture parity due corrected.rb newline mismatch around numblock case (`nums.sort { _2 <=> _1 }`).","timestamp":1775695329685,"segment":0,"confidence":null,"iterationTokens":6885,"asi":{"hypothesis":"Enable RuboCop-aligned SortReverse selector-range autocorrect (`sort { b <=> a }` -> `sort.reverse`).","rollback_reason":"autocorrect_fixture failed: output inserted an empty line before numblock case while fixture expected no gap.","next_action_hint":"Adjust `tests/fixtures/cops/performance/sort_reverse/corrected.rb` to include blank line matching offense fixture layout and rerun.","error_details":"cop::performance::sort_reverse::tests::autocorrect_fixture mismatch at lines 6-7","tests":"cargo test --lib -- cop::performance::sort_reverse"}}
{"run":47,"commit":"d1bc147","metric":583,"metrics":{},"status":"discard","description":"StringIdentifierArgument validation reached with_autocorrect=583 / missing=333 / offenses=3992, but worktree included concurrent in-flight Performance/DeletePrefix changes, so attribution was not isolated.","timestamp":1775695522397,"segment":0,"confidence":null,"iterationTokens":10099,"asi":{"hypothesis":"Enable RuboCop-aligned autocorrect for Performance/StringIdentifierArgument by replacing flagged string identifier args with symbol literals.","rollback_reason":"Unrelated `delete_prefix` implementation drift appeared during the run, confounding metric attribution.","next_action_hint":"Rerun from clean tree (or validate and intentionally bundle DeletePrefix + StringIdentifierArgument in one run).","with_autocorrect":583,"missing_autocorrect":333,"offenses_benchmark":3992}}
{"run":54,"commit":"d1bc147","metric":583,"metrics":{},"status":"discard","description":"StringIdentifierArgument run measured 583 with invariant 3992, but post-run tree had no surviving code delta and count rechecked at 582, so result was transient/non-attributable.","timestamp":1775695578280,"segment":0,"confidence":null,"iterationTokens":7205,"asi":{"hypothesis":"Enable RuboCop-aligned autocorrect for Performance/StringIdentifierArgument by replacing string identifier args with symbol literals.","rollback_reason":"Measured improvement did not persist in working tree after run; no reproducible implementation delta to keep.","next_action_hint":"Rerun on a stable tree and keep only when modified files remain present immediately before logging.","tests":"cargo test --lib --quiet -- cop::performance::string_identifier_argument","with_autocorrect_observed":583,"with_autocorrect_rechecked":582,"missing_autocorrect_rechecked":334,"offenses_benchmark":3992}}
{"run":20,"commit":"d1bc147","metric":0,"metrics":{},"status":"checks_failed","description":"DeletePrefix + StringIdentifierArgument batch failed delete_prefix autocorrect fixture due multiline receiver expectation mismatch.","timestamp":1775695583154,"segment":0,"confidence":null,"iterationTokens":39683,"asi":{"hypothesis":"Add autocorrect for Performance/DeletePrefix and Performance/StringIdentifierArgument to raise with_autocorrect by +2 while preserving 3992 offenses.","rollback_reason":"`cop::performance::delete_prefix::tests::autocorrect_fixture` expected multiline `something.` chain, but actual replacement collapses to `something.delete_prefix(...)`.","next_action_hint":"Update DeletePrefix corrected fixture to RuboCop-style whole-call replacement shape, rerun targeted tests and invariant benchmark.","failing_test":"cop::performance::delete_prefix::tests::autocorrect_fixture","with_autocorrect_precheck":584,"missing_autocorrect_precheck":332}}
{"run":48,"commit":"d1bc147","metric":0,"metrics":{},"status":"crash","description":"StringIdentifierArgument autocorrect fixture failed on corrected.rb comment text mismatch (quote count) for empty-symbol explanatory comment.","timestamp":1775695720633,"segment":0,"confidence":null,"iterationTokens":9477,"asi":{"hypothesis":"Add supports_autocorrect and symbol-literal replacements for Performance/StringIdentifierArgument.","rollback_reason":"autocorrect_fixture mismatch due corrected fixture comment typo, not code logic.","next_action_hint":"Fix `tests/fixtures/cops/performance/string_identifier_argument/corrected.rb` comment line to exactly match expected offense commentary and rerun.","error_details":"cop::performance::string_identifier_argument::tests::autocorrect_fixture line 13 comment mismatch","tests":"cargo test --lib -- cop::performance::string_identifier_argument"}}
{"run":55,"commit":"d1bc147","metric":0,"metrics":{},"status":"checks_failed","description":"DeletePrefix+StringIdentifierArgument bundle run failed to compile tests because `cop_autocorrect_fixture_tests!` for DeletePrefix could not find `tests/fixtures/cops/performance/delete_prefix/corrected.rb` at build time.","timestamp":1775695816790,"segment":0,"confidence":null,"iterationTokens":6443,"asi":{"hypothesis":"Enable DeletePrefix autocorrect (`sub|gsub` anchored prefix regex + empty replacement -> `delete_prefix`) and optionally co-validate in-flight StringIdentifierArgument work.","rollback_reason":"Compile-time include_bytes failure for missing corrected fixture blocked targeted validation and metric capture.","next_action_hint":"Ensure DeletePrefix corrected fixture exists in-tree immediately before run and retry isolated DeletePrefix-only cycle.","error_details":"include_bytes failed for tests/fixtures/cops/performance/delete_prefix/corrected.rb from cop_autocorrect_fixture_tests macro","tests":"cargo test --lib --quiet -- cop::performance::delete_prefix; cargo test --lib --quiet -- cop::performance::string_identifier_argument"}}
{"run":21,"commit":"b8dcd90","metric":583,"metrics":{},"status":"keep","description":"Added RuboCop-aligned autocorrect for Performance/DeletePrefix (`sub/gsub(/\\Aprefix/, '')` -> `delete_prefix('prefix')`) with corrected fixture coverage; offense invariant remained 3992.","timestamp":1775695825054,"segment":0,"confidence":null,"iterationTokens":8321,"asi":{"hypothesis":"DeletePrefix has deterministic offense shapes (anchored literal regex + empty replacement), so whole-call rewrite to `delete_prefix` should safely increase autocorrect coverage by +1.","rubocop_reference":"vendor/rubocop-performance/lib/rubocop/cop/performance/delete_prefix.rb","implemented_cop":"Performance/DeletePrefix","tests":"cargo test --lib --quiet -- cop::performance::delete_prefix cop::performance::string_identifier_argument","with_autocorrect_after":583,"missing_autocorrect_after":333,"offenses_benchmark":3992,"notes":"Also pruned autoresearch ideas by removing stale IndexBy/IndexWith placeholder and adding concrete Performance candidates."}}
{"run":49,"commit":"d1bc147","metric":582,"metrics":{},"status":"discard","description":"DeletePrefix validation run was attribution-confounded by concurrent branch updates; during execution upstream commit landed DeletePrefix and worktree shifted to unrelated in-flight DeleteSuffix/StringIdentifierArgument changes.","timestamp":1775695896147,"segment":0,"confidence":null,"iterationTokens":5156,"asi":{"hypothesis":"Add RuboCop-aligned autocorrect for Performance/DeletePrefix via anchored-regex + empty replacement rewrite.","rollback_reason":"Metric capture became inconsistent with pre-run state due concurrent code movement (parsed 582 while branch advanced and local count shifted).","next_action_hint":"Rebaseline from current HEAD, then run a clean isolated experiment on one remaining missing cop.","with_autocorrect_reported":582,"offenses_benchmark":3992}}
{"run":50,"commit":"b8dcd90","metric":0,"metrics":{},"status":"crash","description":"Bundled DeleteSuffix+StringIdentifierArgument run failed because StringIdentifierArgument corrected fixture comment text did not match expected quote count.","timestamp":1775696077717,"segment":0,"confidence":null,"iterationTokens":7824,"asi":{"hypothesis":"Validate +2 bundle by enabling autocorrect for Performance/DeleteSuffix and Performance/StringIdentifierArgument together.","rollback_reason":"`cop::performance::string_identifier_argument::tests::autocorrect_fixture` failed on comment-line mismatch; no benchmark metrics emitted.","next_action_hint":"Fix corrected.rb comment to `# Empty strings are valid symbols (:\"\"\"\")` and rerun bundle.","error_details":"autocorrect_fixture mismatch line 13 in tests/fixtures/cops/performance/string_identifier_argument/corrected.rb","tests":"cargo test --lib -- cop::performance::delete_suffix && cargo test --lib -- cop::performance::string_identifier_argument"}}
{"run":56,"commit":"d1bc147","metric":0,"metrics":{},"status":"checks_failed","description":"DeleteSuffix+StringIdentifierArgument bundle failed targeted checks: StringIdentifierArgument autocorrect fixture mismatched expected comment text for the empty-string case.","timestamp":1775696080914,"segment":0,"confidence":null,"iterationTokens":4658,"asi":{"hypothesis":"Validate +2 coverage bundle by enabling autocorrect for Performance/DeleteSuffix and Performance/StringIdentifierArgument.","rollback_reason":"`cop::performance::string_identifier_argument::tests::autocorrect_fixture` failed due corrected fixture comment mismatch (implementation output had one fewer quote in comment literal).","next_action_hint":"Fix only the corrected fixture comment line to match actual output, then rerun the same two-cop validation command.","failed_test":"cop::performance::string_identifier_argument::tests::autocorrect_fixture","tests":"cargo test --lib --quiet -- cop::performance::delete_suffix; cargo test --lib --quiet -- cop::performance::string_identifier_argument"}}
{"run":22,"commit":"1472161","metric":584,"metrics":{},"status":"keep","description":"Added RuboCop-aligned autocorrect for Performance/DeleteSuffix and Performance/StringIdentifierArgument, with corrected fixture coverage; offense invariant remained 3992.","timestamp":1775696185219,"segment":0,"confidence":null,"iterationTokens":13881,"asi":{"hypothesis":"DeleteSuffix and StringIdentifierArgument are deterministic rewrites (anchored literal regex suffix removal and string->symbol identifier args), so enabling autocorrect should safely increase coverage.","rubocop_references":["vendor/rubocop-performance/lib/rubocop/cop/performance/delete_suffix.rb","vendor/rubocop-performance/lib/rubocop/cop/performance/string_identifier_argument.rb"],"implemented_cops":["Performance/DeleteSuffix","Performance/StringIdentifierArgument"],"tests":"cargo test --lib --quiet -- cop::performance::delete_suffix cop::performance::string_identifier_argument","with_autocorrect_after":584,"missing_autocorrect_after":332,"offenses_benchmark":3992}}
{"run":51,"commit":"b8dcd90","metric":0,"metrics":{},"status":"crash","description":"DeleteSuffix+StringIdentifier bundle failed because corrected fixture for StringIdentifierArgument used four quotes in empty-string comment while offense source preserves three-quote comment text.","timestamp":1775696262144,"segment":0,"confidence":null,"iterationTokens":5356,"asi":{"hypothesis":"Bundle two deterministic autocorrect additions (DeleteSuffix and StringIdentifierArgument) for a +2 support increase.","rollback_reason":"`cop::performance::string_identifier_argument::tests::autocorrect_fixture` mismatch on comment text at line 13 (`:\"\"\"\"` vs preserved `:\"\"\"`).","next_action_hint":"Set corrected fixture comment to exactly `# Empty strings are valid symbols (:\"\"\")` and rerun bundle.","error_details":"string_identifier autocorrect_fixture expected/got mismatch line 13 comment","tests":"cargo test --lib -- cop::performance::delete_suffix && cargo test --lib -- cop::performance::string_identifier_argument"}}
{"run":23,"commit":"f908d27","metric":585,"metrics":{},"status":"keep","description":"Added RuboCop-aligned autocorrect for Performance/DeletePrefix by rewriting anchored empty-replacement `sub/gsub` calls to `delete_prefix/delete_prefix!`, with corrected fixture coverage and invariant offenses 3992.","timestamp":1775696403629,"segment":0,"confidence":null,"iterationTokens":8938,"asi":{"hypothesis":"DeletePrefix offense shapes are deterministic (literal-start anchored regex with empty replacement), so full-call replacement to delete_prefix methods should safely increase autocorrect coverage by +1.","rubocop_reference":"vendor/rubocop-performance/lib/rubocop/cop/performance/delete_prefix.rb","implemented_cop":"Performance/DeletePrefix","tests":"cargo test --lib --quiet -- cop::performance::delete_prefix","with_autocorrect_after":585,"missing_autocorrect_after":331,"offenses_benchmark":3992}}
{"run":57,"commit":"d1bc147","metric":0,"metrics":{},"status":"checks_failed","description":"DeleteSuffix+StringIdentifierArgument retry still failed on `string_identifier_argument` autocorrect fixture; corrected fixture line for empty-string comment keeps diverging from runtime output under concurrent file churn.","timestamp":1775696429463,"segment":0,"confidence":null,"iterationTokens":1846,"asi":{"hypothesis":"Land +2 via DeleteSuffix and StringIdentifierArgument autocorrect in one attribution-clean bundle.","rollback_reason":"Repeated fixture mismatch in `cops/performance/string_identifier_argument/corrected.rb` (expected comment line reverts to stale quote shape during run), preventing stable test pass.","next_action_hint":"Pause this bundle; pivot to a different single-cop target with deterministic fixtures and no churned files.","failed_test":"cop::performance::string_identifier_argument::tests::autocorrect_fixture","tests":"cargo test --lib --quiet -- cop::performance::delete_suffix; cargo test --lib --quiet -- cop::performance::string_identifier_argument"}}
{"run":52,"commit":"1472161","metric":585,"metrics":{},"status":"discard","description":"DeletePrefix validation reached with_autocorrect=585 / missing=331 / offenses=3992, but before logging the branch advanced and the DeletePrefix implementation was already landed upstream (`f908d27e6`), leaving no local code delta to attribute.","timestamp":1775696473424,"segment":0,"confidence":null,"iterationTokens":8843,"asi":{"hypothesis":"Add supports_autocorrect for Performance/DeletePrefix with anchored-regex to delete_prefix rewrite.","rollback_reason":"At log time, worktree contained no DeletePrefix code changes (only autoresearch files); change was already committed on branch by concurrent activity.","next_action_hint":"Rebaseline from new HEAD (`f908d27`) and target next missing autocorrect cop in a fresh isolated run.","with_autocorrect":585,"missing_autocorrect":331,"offenses_benchmark":3992}}
