{"type":"config","name":"Implement missing cop autocorrects with runtime guard","metricName":"missing_autocorrect","metricUnit":"","bestDirection":"lower"}
{"run":1,"commit":"5651361","metric":0,"metrics":{},"status":"crash","description":"Baseline harness failed due unavailable bare python binary; need uv/python3-compatible timing path before measuring runtime guard and missing autocorrect metric.","timestamp":1775664384551,"segment":0,"confidence":null,"iterationTokens":637,"asi":{"hypothesis":"Establish baseline missing autocorrect count plus runtime guard metric in one command.","rollback_reason":"Experiment command crashed because `python` executable is not configured in this repo environment.","next_action_hint":"Switch timing snippets to `uv run python` (or avoid Python entirely) and rerun baseline.","error":"No version is set for command python"}}
{"type":"config","name":"Implement missing cop autocorrects with runtime guard","metricName":"with_autocorrect","metricUnit":"","bestDirection":"higher"}
{"run":2,"commit":"5651361","metric":0,"metrics":{},"status":"crash","description":"Baseline rerun failed because benchmark command likely exited non-zero on offenses under `set -e`; need tolerant benchmark capture so METRIC lines emit reliably.","timestamp":1775664436417,"segment":1,"confidence":null,"iterationTokens":485,"asi":{"hypothesis":"Measure baseline with_autocorrect while recording runtime guard metric.","rollback_reason":"Experiment command exited non-zero before emitting metrics due strict shell error handling around linter benchmark.","next_action_hint":"Wrap benchmark invocation with `set +e` or `|| true`, parse offense summary, and continue emitting METRIC lines."}}
{"run":3,"commit":"5651361","metric":0,"metrics":{},"status":"crash","description":"Baseline harness still crashed because bare python3 is unavailable in this repo toolchain; need uv-run timing or pure shell timing.","timestamp":1775664473622,"segment":1,"confidence":null,"iterationTokens":1476,"asi":{"hypothesis":"Produce first valid baseline with with_autocorrect metric and runtime guard output.","rollback_reason":"Command invoked python3 directly; environment requires uv-managed python.","next_action_hint":"Use `uv run python` for timing snippets and rerun baseline; keep benchmark non-fatal on offense exit code."}}
{"run":4,"commit":"4cfee7c","metric":460,"metrics":{},"status":"keep","description":"Established valid baseline: 460 cops currently implement supports_autocorrect out of 916 total (456 missing).","timestamp":1775664500162,"segment":1,"confidence":null,"iterationTokens":910,"asi":{"hypothesis":"Use a robust uv-python scanner to get reliable baseline metric values before implementation work.","baseline_missing_autocorrect":456,"baseline_total_cops":916}}
{"run":5,"commit":"f23a6a3","metric":461,"metrics":{},"status":"keep","description":"Implemented real autocorrect for Performance/ReverseEach (reverse.each -> reverse_each) with fixture autocorrect coverage and kept offense invariant on runtime guard workload.","timestamp":1775664743532,"segment":1,"confidence":null,"iterationTokens":19554,"asi":{"hypothesis":"Performance/ReverseEach has a deterministic one-to-one replacement (`reverse.each` to `reverse_each`) for already-safe offense cases, so adding autocorrect should reduce missing count by 1 with no runtime regression.","implemented_cop":"Performance/ReverseEach","tests":"cargo test --lib -- cop::performance::reverse_each","runtime_ms":556.55,"offenses_benchmark":3992,"missing_autocorrect_after":455}}
{"run":6,"commit":"a6a4fee","metric":462,"metrics":{},"status":"keep","description":"Implemented autocorrect for Performance/UriDefaultParser by mirroring RuboCop behavior (URI::Parser.new -> URI::DEFAULT_PARSER, preserving optional leading ::) with corrected fixture coverage.","timestamp":1775666030875,"segment":1,"confidence":462,"iterationTokens":9470,"asi":{"hypothesis":"A whole-node replacement for URI::Parser.new is deterministic and RuboCop-aligned, so it should safely increase autocorrect coverage by +1 without runtime impact.","rubocop_reference":"vendor/rubocop-performance/lib/rubocop/cop/performance/uri_default_parser.rb","implemented_cop":"Performance/UriDefaultParser","tests":"cargo test --lib -- cop::performance::uri_default_parser","runtime_ms":552.81,"offenses_benchmark":3992,"missing_autocorrect_after":454}}
{"run":7,"commit":"8fb11fd","metric":463,"metrics":{},"status":"keep","description":"Added autocorrect for Performance/Size by following RuboCop selector replacement semantics (`count` -> `size`) only on existing safe receiver patterns, with corrected fixture coverage.","timestamp":1775666158618,"segment":1,"confidence":463,"iterationTokens":6362,"asi":{"hypothesis":"Performance/Size can safely autocorrect by replacing only the selector token (`count` -> `size`) on already-flagged nodes, matching RuboCop and avoiding semantic drift.","rubocop_reference":"vendor/rubocop-performance/lib/rubocop/cop/performance/size.rb","implemented_cop":"Performance/Size","tests":"cargo test --lib -- cop::performance::size","runtime_ms":534.18,"offenses_benchmark":3992,"missing_autocorrect_after":453}}
{"run":8,"commit":"5558083","metric":464,"metrics":{},"status":"keep","description":"Implemented autocorrect for Performance/ReverseFirst by mirroring RuboCop range replacement semantics (`reverse.first` -> `last`, `reverse.first(n)` -> `last(n).reverse`) with fixture autocorrect tests.","timestamp":1775666296448,"segment":1,"confidence":464,"iterationTokens":6297,"asi":{"hypothesis":"ReverseFirst offenses are deterministic and can be corrected by replacing the `reverse...first(...)` segment exactly as RuboCop does, preserving call operator semantics.","rubocop_reference":"vendor/rubocop-performance/lib/rubocop/cop/performance/reverse_first.rb","implemented_cop":"Performance/ReverseFirst","tests":"cargo test --lib -- cop::performance::reverse_first","runtime_ms":507.38,"offenses_benchmark":3992,"missing_autocorrect_after":452}}
{"run":9,"commit":"ba149a2","metric":465,"metrics":{},"status":"keep","description":"Added autocorrect for RSpec/NotToNot with RuboCop-aligned selector replacement (`to_not`<->`not_to` by EnforcedStyle) plus fixture autocorrect tests including receiverless expect_it cases.","timestamp":1775666399247,"segment":1,"confidence":310,"iterationTokens":3777,"asi":{"hypothesis":"NotToNot can be safely autocorrected by replacing only the expectation method selector, matching RuboCop's send-selector correction semantics.","rubocop_reference":"vendor/rubocop-rspec/lib/rubocop/cop/rspec/not_to_not.rb","implemented_cop":"RSpec/NotToNot","tests":"cargo test --lib -- cop::rspec::not_to_not","runtime_ms":557.39,"offenses_benchmark":3992,"missing_autocorrect_after":451}}
{"run":10,"commit":"4b8f61e","metric":466,"metrics":{},"status":"keep","description":"Resumed loop: added RuboCop-aligned autocorrect for RSpec/ContextMethod by rewriting `context` selector to `describe` for method-style context blocks, with corrected fixture coverage.","timestamp":1775666546158,"segment":1,"confidence":233,"iterationTokens":5190,"asi":{"hypothesis":"RSpec/ContextMethod can safely autocorrect by replacing only the DSL selector (`context` -> `describe`) under existing method-name/block/receiver guards.","rubocop_reference":"vendor/rubocop-rspec/lib/rubocop/cop/rspec/context_method.rb","implemented_cop":"RSpec/ContextMethod","tests":"cargo test --lib -- cop::rspec::context_method","runtime_ms":560.28,"offenses_benchmark":3992,"missing_autocorrect_after":450}}
{"run":11,"commit":"26d0073","metric":467,"metrics":{},"status":"keep","description":"Added RuboCop-aligned autocorrect for RSpec/IsExpectedSpecify by replacing selector `specify` with `it` on one-line is_expected/are_expected blocks, with corrected fixture tests.","timestamp":1775666653425,"segment":1,"confidence":233.5,"iterationTokens":3668,"asi":{"hypothesis":"RSpec/IsExpectedSpecify can be safely autocorrected by selector-only rewrite (`specify` -> `it`) under existing one-line/no-description/is_expected guards.","rubocop_reference":"vendor/rubocop-rspec/lib/rubocop/cop/rspec/is_expected_specify.rb","implemented_cop":"RSpec/IsExpectedSpecify","tests":"cargo test --lib -- cop::rspec::is_expected_specify","runtime_ms":533.5,"offenses_benchmark":3992,"missing_autocorrect_after":449}}
{"run":12,"commit":"26d0073","metric":0,"metrics":{},"status":"crash","description":"Attempt to add autocorrect for Rails/RequestReferer failed to compile due using nonexistent MethodChain field (`outer_call`) in correction path.","timestamp":1775666756159,"segment":1,"confidence":233.5,"iterationTokens":3857,"asi":{"hypothesis":"Rails/RequestReferer can safely autocorrect by replacing `referer`/`referrer` selector under existing receiverless request guard.","rollback_reason":"Compile failure: MethodChain has no `outer_call` field; correction attempted to reference unavailable struct member.","next_action_hint":"Re-implement correction by reading outer call from `node.as_call_node()` and then rerun targeted tests + benchmark guard.","error":"E0609 no field `outer_call` on MethodChain"}}
{"run":13,"commit":"e4e8aee","metric":468,"metrics":{},"status":"keep","description":"Added RuboCop-aligned autocorrect for Rails/RequestReferer by rewriting only `referer/referrer` selector on receiverless `request` chains, with fixture autocorrect coverage.","timestamp":1775666853379,"segment":1,"confidence":234,"iterationTokens":5803,"asi":{"hypothesis":"RequestReferer is a safe selector-rewrite cop: converting only the selector token to preferred style should match RuboCop autocorrect while preserving surrounding expression.","rubocop_reference":"vendor/rubocop-rails/lib/rubocop/cop/rails/request_referer.rb","implemented_cop":"Rails/RequestReferer","tests":"cargo test --lib -- cop::rails::request_referer","runtime_ms":505.14,"offenses_benchmark":3992,"missing_autocorrect_after":448}}
{"run":14,"commit":"c7caa61","metric":469,"metrics":{},"status":"keep","description":"Added RuboCop-aligned autocorrect for Rails/ToFormattedS with selector-only rewrite (`to_formatted_s`<->`to_fs`) plus Rails-aware autocorrect unit tests.","timestamp":1775667170375,"segment":1,"confidence":187.6,"iterationTokens":2916,"asi":{"hypothesis":"ToFormattedS is safe for selector-level autocorrect mirroring RuboCop as long as Rails version gating remains enforced in tests/config.","rubocop_reference":"vendor/rubocop-rails/lib/rubocop/cop/rails/to_formatted_s.rb","implemented_cop":"Rails/ToFormattedS","tests":"cargo test --lib -- cop::rails::to_formatted_s","runtime_ms":596.55,"offenses_benchmark":3992,"missing_autocorrect_after":447}}
{"run":15,"commit":"af1d11e","metric":470,"metrics":{},"status":"keep","description":"Added RuboCop-aligned autocorrect for Rails/ActiveRecordAliases by replacing `update_attributes`/`update_attributes!` selectors with `update`/`update!` on existing offense cases.","timestamp":1775667278826,"segment":1,"confidence":156.66666666666666,"iterationTokens":3316,"asi":{"hypothesis":"ActiveRecordAliases should safely autocorrect via selector-only replacement, matching RuboCop's alias mapping and existing no-args guard.","rubocop_reference":"vendor/rubocop-rails/lib/rubocop/cop/rails/active_record_aliases.rb","implemented_cop":"Rails/ActiveRecordAliases","tests":"cargo test --lib -- cop::rails::active_record_aliases","runtime_ms":583.22,"offenses_benchmark":3992,"missing_autocorrect_after":446}}
{"run":16,"commit":"1c69378","metric":471,"metrics":{},"status":"keep","description":"Added RuboCop-aligned autocorrect for Rails/ActionFilter by rewriting deprecated `*_filter` selectors to preferred `*_action` variants (style-aware) with fixture autocorrect tests.","timestamp":1775667383306,"segment":1,"confidence":157,"iterationTokens":4076,"asi":{"hypothesis":"ActionFilter offenses are selector alias migrations, so selector-only autocorrect should be safe and match RuboCop behavior under existing receiverless guard.","rubocop_reference":"vendor/rubocop-rails/lib/rubocop/cop/rails/action_filter.rb","implemented_cop":"Rails/ActionFilter","tests":"cargo test --lib -- cop::rails::action_filter","runtime_ms":512.45,"offenses_benchmark":3992,"missing_autocorrect_after":445}}
{"run":17,"commit":"9afb2c2","metric":472,"metrics":{},"status":"keep","description":"Added RuboCop-aligned autocorrect for Rails/AssertNot by transforming `assert !...` to `assert_not ...` on offense cases, with fixture autocorrect tests.","timestamp":1775667543820,"segment":1,"confidence":157.33333333333334,"iterationTokens":7651,"asi":{"hypothesis":"AssertNot can safely autocorrect by applying the same anchored source rewrite RuboCop uses for `assert !` forms.","rubocop_reference":"vendor/rubocop-rails/lib/rubocop/cop/rails/assert_not.rb","implemented_cop":"Rails/AssertNot","tests":"cargo test --lib -- cop::rails::assert_not","runtime_ms":499.81,"offenses_benchmark":3992,"missing_autocorrect_after":444}}
{"run":18,"commit":"500109c","metric":473,"metrics":{},"status":"keep","description":"Added RuboCop-aligned autocorrect for Rails/RefuteMethods by replacing refute/assert_not method selectors according to style mapping, with fixture autocorrect coverage.","timestamp":1775667705398,"segment":1,"confidence":135.14285714285714,"iterationTokens":7141,"asi":{"hypothesis":"RefuteMethods is a pure selector-map cop; replacing only selector tokens using RuboCop's CORRECTIONS mapping should be safe and deterministic.","rubocop_reference":"vendor/rubocop-rails/lib/rubocop/cop/rails/refute_methods.rb","implemented_cop":"Rails/RefuteMethods","tests":"cargo test --lib -- cop::rails::refute_methods","runtime_ms":497.7,"offenses_benchmark":3992,"missing_autocorrect_after":443}}
{"run":19,"commit":"35b9efb","metric":474,"metrics":{},"status":"keep","description":"Added RuboCop-aligned autocorrect for RSpec/ContainExactly by converting all-splat `contain_exactly(*...)` calls to `match_array(... + ...)`, with fixture autocorrect tests.","timestamp":1775667846119,"segment":1,"confidence":118.5,"iterationTokens":7258,"asi":{"hypothesis":"ContainExactly offenses with all splat args can be safely rewritten to `match_array` by joining splat expressions with `+`, matching RuboCop logic.","rubocop_reference":"vendor/rubocop-rspec/lib/rubocop/cop/rspec/contain_exactly.rb","implemented_cop":"RSpec/ContainExactly","tests":"cargo test --lib -- cop::rspec::contain_exactly","runtime_ms":497.14,"offenses_benchmark":3992,"missing_autocorrect_after":442}}
{"run":20,"commit":"2fe9f83","metric":475,"metrics":{},"status":"keep","description":"Added RuboCop-aligned autocorrect for Rails/EnvLocal by replacing `Rails.env.development? || Rails.env.test?` variants with `Rails.env.local?`, with Rails-version-aware autocorrect tests.","timestamp":1775668129742,"segment":1,"confidence":118.75,"iterationTokens":5004,"asi":{"hypothesis":"EnvLocal offenses can be safely whole-expression autocorrected to `Rails.env.local?` under Rails>=7.1 gate, matching RuboCop behavior.","rubocop_reference":"vendor/rubocop-rails/lib/rubocop/cop/rails/env_local.rb","implemented_cop":"Rails/EnvLocal","tests":"cargo test --lib -- cop::rails::env_local","runtime_ms":515.22,"offenses_benchmark":3992,"missing_autocorrect_after":441}}
{"run":21,"commit":"2aaf569","metric":476,"metrics":{},"status":"keep","description":"Added autocorrect for Rails/EnvironmentComparison by rewriting Rails.env string/symbol comparisons into predicate calls (including negated `!=`), with fixture autocorrect tests.","timestamp":1775668247920,"segment":1,"confidence":119,"iterationTokens":4683,"asi":{"hypothesis":"EnvironmentComparison offense cases can be safely transformed into `Rails.env.<env>?` predicates by preserving the original Rails.env receiver and comparison direction.","rubocop_reference":"vendor/rubocop-rails/lib/rubocop/cop/rails/environment_comparison.rb","implemented_cop":"Rails/EnvironmentComparison","tests":"cargo test --lib -- cop::rails::environment_comparison","runtime_ms":545.55,"offenses_benchmark":3992,"missing_autocorrect_after":440}}
{"run":22,"commit":"522f521","metric":477,"metrics":{},"status":"keep","description":"Added RuboCop-aligned autocorrect for RSpec/ItBehavesLike by replacing `it_should_behave_like`/`it_behaves_like` selectors according to EnforcedStyle, including receiver calls.","timestamp":1775668370512,"segment":1,"confidence":106,"iterationTokens":4843,"asi":{"hypothesis":"ItBehavesLike is a selector-style cop and can safely autocorrect by replacing only send selector with configured preferred style.","rubocop_reference":"vendor/rubocop-rspec/lib/rubocop/cop/rspec/it_behaves_like.rb","implemented_cop":"RSpec/ItBehavesLike","tests":"cargo test --lib -- cop::rspec::it_behaves_like","runtime_ms":562.56,"offenses_benchmark":3992,"missing_autocorrect_after":439}}
{"run":23,"commit":"236e6bc","metric":478,"metrics":{},"status":"keep","description":"Added RuboCop-aligned autocorrect for Rails/ToSWithArgument by rewriting `to_s(:format)` selector to `to_formatted_s` under Rails>=7.0 gate, plus Rails-aware autocorrect tests.","timestamp":1775668536806,"segment":1,"confidence":95.6,"iterationTokens":3653,"asi":{"hypothesis":"ToSWithArgument can safely autocorrect by selector rewrite (`to_s` -> `to_formatted_s`) when first argument is symbol format, matching RuboCop behavior.","rubocop_reference":"vendor/rubocop-rails/lib/rubocop/cop/rails/to_s_with_argument.rb","implemented_cop":"Rails/ToSWithArgument","tests":"cargo test --lib -- cop::rails::to_s_with_argument","runtime_ms":599.25,"offenses_benchmark":3992,"missing_autocorrect_after":438}}
{"run":24,"commit":"46b55ae","metric":479,"metrics":{},"status":"keep","description":"Added RuboCop-aligned autocorrect for RSpec/Eq by rewriting matcher segment `be ==` to `eq`, with fixture autocorrect tests.","timestamp":1775668651633,"segment":1,"confidence":95.8,"iterationTokens":3689,"asi":{"hypothesis":"Eq offense range can be safely autocorrected by replacing only `be ==` with `eq`, mirroring RuboCop's range strategy and preserving compared value.","rubocop_reference":"vendor/rubocop-rspec/lib/rubocop/cop/rspec/eq.rb","implemented_cop":"RSpec/Eq","tests":"cargo test --lib -- cop::rspec::eq","runtime_ms":533.98,"offenses_benchmark":3992,"missing_autocorrect_after":437}}
{"run":25,"commit":"996ed51","metric":480,"metrics":{},"status":"keep","description":"Added RuboCop-aligned autocorrect for RSpec/BeEq by replacing `eq` matcher selector with `be` for true/false/nil argument cases.","timestamp":1775669097260,"segment":1,"confidence":96,"iterationTokens":2864,"asi":{"hypothesis":"BeEq can be safely autocorrected using selector-only rewrite (`eq` -> `be`) on boolean/nil literals, matching RuboCop behavior.","rubocop_reference":"vendor/rubocop-rspec/lib/rubocop/cop/rspec/be_eq.rb","implemented_cop":"RSpec/BeEq","tests":"cargo test --lib -- cop::rspec::be_eq","runtime_ms":712.86,"offenses_benchmark":3992,"note":"Runtime spike observed; treated as benchmark variance since offense invariant held and primary metric improved."}}
{"run":26,"commit":"81fde47","metric":481,"metrics":{},"status":"keep","description":"Added RuboCop-aligned autocorrect for RSpec/BeNil for both styles (`be(nil)`<->`be_nil`) with fixture autocorrect coverage and style-specific unit test.","timestamp":1775669206822,"segment":1,"confidence":87.45454545454545,"iterationTokens":4420,"asi":{"hypothesis":"BeNil can safely autocorrect as whole-matcher replacement (`be(nil)` <-> `be_nil`) because offense patterns are exact send forms with nil receiver.","rubocop_reference":"vendor/rubocop-rspec/lib/rubocop/cop/rspec/be_nil.rb","implemented_cop":"RSpec/BeNil","tests":"cargo test --lib -- cop::rspec::be_nil","runtime_ms":956.95,"offenses_benchmark":3992,"missing_autocorrect_after":435,"note":"Runtime sample spiked; treated as noise since offense invariant held and primary metric improved."}}
{"run":27,"commit":"00437bf","metric":482,"metrics":{},"status":"keep","description":"Added RuboCop-aligned autocorrect for RSpec/BeEql by replacing `eql` matcher selector with `be` for identity-comparable literals.","timestamp":1775669316861,"segment":1,"confidence":80.33333333333333,"iterationTokens":3818,"asi":{"hypothesis":"BeEql offense cases can be safely autocorrected via selector-only `eql` -> `be`, matching RuboCop logic while preserving matcher arguments.","rubocop_reference":"vendor/rubocop-rspec/lib/rubocop/cop/rspec/be_eql.rb","implemented_cop":"RSpec/BeEql","tests":"cargo test --lib -- cop::rspec::be_eql","runtime_ms":522.46,"offenses_benchmark":3992,"missing_autocorrect_after":434}}
{"run":28,"commit":"bbd166f","metric":483,"metrics":{},"status":"keep","description":"Added RuboCop-aligned autocorrect for RSpec/BeEmpty by rewriting empty `contain_exactly`/`match_array([])` matcher calls to `be_empty`, with fixture autocorrect tests.","timestamp":1775669468690,"segment":1,"confidence":80.5,"iterationTokens":4452,"asi":{"hypothesis":"BeEmpty offenses can be safely autocorrected by replacing only the matcher send node with `be_empty`, preserving surrounding expectation syntax and optional message args.","rubocop_reference":"vendor/rubocop-rspec/lib/rubocop/cop/rspec/be_empty.rb","implemented_cop":"RSpec/BeEmpty","tests":"cargo test --lib -- cop::rspec::be_empty","runtime_ms":560.1,"offenses_benchmark":3992,"missing_autocorrect_after":433}}
