{"run":54,"commit":"389117b","metric":506,"metrics":{},"status":"keep","description":"Added RuboCop-aligned autocorrect for Rails/FindEach by rewriting flagged `.each` selectors to `.find_each` on AR scope chains, with fixture autocorrect coverage.","timestamp":1775674417295,"segment":1,"confidence":42.166666666666664,"iterationTokens":9058,"asi":{"hypothesis":"FindEach can be safely autocorrected via selector-only replacement (`each` -> `find_each`) for already-detected offense nodes.","rubocop_reference":"vendor/rubocop-rails/lib/rubocop/cop/rails/find_each.rb","implemented_cop":"Rails/FindEach","tests":"cargo test --lib -- cop::rails::find_each","runtime_ms":522.97,"offenses_benchmark":3992,"missing_autocorrect_after":410}}
{"run":55,"commit":"4b031f6","metric":507,"metrics":{},"status":"keep","description":"Added RuboCop-aligned autocorrect for Rails/RedundantActiveRecordAllMethod by removing redundant `all` receiver segments (`.all` / `all.`) from flagged query chains, with fixture autocorrect coverage.","timestamp":1775674746163,"segment":1,"confidence":42.25,"iterationTokens":2627,"asi":{"hypothesis":"RedundantActiveRecordAllMethod can be safely autocorrected via targeted range removal of the redundant `all` call segment while preserving the surrounding receiver/query method syntax.","rubocop_reference":"vendor/rubocop-rails/lib/rubocop/cop/rails/redundant_active_record_all_method.rb","implemented_cop":"Rails/RedundantActiveRecordAllMethod","tests":"cargo test --lib -- cop::rails::redundant_active_record_all_method","runtime_ms":511.83,"offenses_benchmark":3992,"missing_autocorrect_after":409,"iteration_note":"First autocorrect attempt produced double-dot chains; fixed removal range boundaries for receiverful vs receiverless `all` forms."}}
{"run":56,"commit":"31780c4","metric":508,"metrics":{},"status":"keep","description":"Added RuboCop-aligned autocorrect for Rails/PluckId by replacing offense-range `pluck(:id)` / `pluck(primary_key)` segments with `ids`, with enabled-config autocorrect tests.","timestamp":1775674867159,"segment":1,"confidence":40.64,"iterationTokens":6140,"asi":{"hypothesis":"PluckId can safely autocorrect by replacing from the `pluck` selector through call end with `ids`, matching RuboCop offense range semantics.","rubocop_reference":"vendor/rubocop-rails/lib/rubocop/cop/rails/pluck_id.rb","implemented_cop":"Rails/PluckId","tests":"cargo test --lib -- cop::rails::pluck_id","runtime_ms":514.37,"offenses_benchmark":3992,"missing_autocorrect_after":408}}
{"run":57,"commit":"e42f4f3","metric":509,"metrics":{},"status":"keep","description":"Added RuboCop-aligned autocorrect for Rails/Pluck by replacing offense-range `map/collect { |x| x[:key] }` blocks with `pluck(:key)`, with Rails-config autocorrect tests.","timestamp":1775675038551,"segment":1,"confidence":39.15384615384615,"iterationTokens":20226,"asi":{"hypothesis":"Pluck offenses can be safely autocorrected by rewriting from `map/collect` selector through block end into `pluck(<extracted_key>)`.","rubocop_reference":"vendor/rubocop-rails/lib/rubocop/cop/rails/pluck.rb","implemented_cop":"Rails/Pluck","tests":"cargo test --lib -- cop::rails::pluck","runtime_ms":517.91,"offenses_benchmark":3992,"missing_autocorrect_after":407}}
{"run":58,"commit":"9e53f21","metric":510,"metrics":{},"status":"keep","description":"Added RuboCop-aligned autocorrect for Rails/Pick by rewriting `pluck(...).first` to `pick(...)` (selector swap + `.first` removal), with Rails-config autocorrect test coverage.","timestamp":1775675160011,"segment":1,"confidence":39.23076923076923,"iterationTokens":3720,"asi":{"hypothesis":"Pick offenses can be safely autocorrected by replacing inner `pluck` selector with `pick` and removing trailing `.first` segment.","rubocop_reference":"vendor/rubocop-rails/lib/rubocop/cop/rails/pick.rb","implemented_cop":"Rails/Pick","tests":"cargo test --lib -- cop::rails::pick","runtime_ms":570.9,"offenses_benchmark":3992,"missing_autocorrect_after":406}}
{"run":59,"commit":"c2794cc","metric":511,"metrics":{},"status":"keep","description":"Added RuboCop-aligned autocorrect for Rails/RedundantAllowNil by removing redundant `allow_nil` key-value pairs with sibling-aware comma/whitespace range handling, including nested validator hash cases.","timestamp":1775675994900,"segment":1,"confidence":39.30769230769231,"iterationTokens":3720,"asi":{"hypothesis":"RedundantAllowNil can safely autocorrect by deleting the `allow_nil` pair range and adjacent separator based on sibling positions in the containing hash scope.","rubocop_reference":"vendor/rubocop-rails/lib/rubocop/cop/rails/redundant_allow_nil.rb","implemented_cop":"Rails/RedundantAllowNil","tests":"cargo test --lib -- cop::rails::redundant_allow_nil","runtime_ms":506.92,"offenses_benchmark":3992,"missing_autocorrect_after":405}}
{"run":60,"commit":"eab60c0","metric":512,"metrics":{},"status":"keep","description":"Added RuboCop-aligned baseline autocorrect for RSpec/ExpectActual by swapping literal expect actuals with non-literal matcher expected values for correctable matchers (`eq`/`eql`/`equal`/`be`).","timestamp":1775676206238,"segment":1,"confidence":37.925925925925924,"iterationTokens":1633,"asi":{"hypothesis":"ExpectActual offenses can be baseline-autocorrected by swapping `expect(literal)` argument with matcher expected expression when expected is non-literal and matcher is correctable.","rubocop_reference":"vendor/rubocop-rspec/lib/rubocop/cop/rspec/expect_actual.rb","implemented_cop":"RSpec/ExpectActual","tests":"cargo test --lib -- cop::rspec::expect_actual","runtime_ms":530.72,"offenses_benchmark":3992,"missing_autocorrect_after":404,"known_gap":"Does not yet rewrite matcher call form itself beyond argument swapping in all RuboCop-correctable permutations."}}
{"run":61,"commit":"fcefb6e","metric":513,"metrics":{},"status":"keep","description":"Added RuboCop-aligned autocorrect for Rails/CompactBlank by rewriting offense ranges from `reject/select/filter/delete_if/keep_if` with blank?/present? block forms to `compact_blank`/`compact_blank!`, with Rails-config autocorrect tests.","timestamp":1775676454550,"segment":1,"confidence":39.46153846153846,"iterationTokens":8816,"asi":{"hypothesis":"CompactBlank can be safely autocorrected by replacing from offending method selector through block/pass expression with compact_blank variant based on destructive method family.","rubocop_reference":"vendor/rubocop-rails/lib/rubocop/cop/rails/compact_blank.rb","implemented_cop":"Rails/CompactBlank","tests":"cargo test --lib -- cop::rails::compact_blank","runtime_ms":532.19,"offenses_benchmark":3992,"missing_autocorrect_after":403}}
{"run":62,"commit":"4048c5b","metric":514,"metrics":{},"status":"keep","description":"Added RuboCop-aligned autocorrect for Rails/Output by replacing offense ranges with `Rails.logger.debug` for both receiverless output methods and IO write calls, with focused autocorrect tests.","timestamp":1775676577505,"segment":1,"confidence":38.074074074074076,"iterationTokens":8584,"asi":{"hypothesis":"Output offenses can be safely baseline-autocorrected by replacing RuboCop-equivalent offense ranges (`selector` or `receiver..selector`) with `Rails.logger.debug`.","rubocop_reference":"vendor/rubocop-rails/lib/rubocop/cop/rails/output.rb","implemented_cop":"Rails/Output","tests":"cargo test --lib -- cop::rails::output","runtime_ms":498.45,"offenses_benchmark":3992,"missing_autocorrect_after":402}}
{"run":63,"commit":"62650d2","metric":515,"metrics":{},"status":"keep","description":"Added RuboCop-aligned autocorrect for Rails/Presence by replacing full flagged conditional expressions with computed `presence`/`presence || ...`/`presence&.chain` replacements, with focused autocorrect tests.","timestamp":1775676874347,"segment":1,"confidence":36.785714285714285,"iterationTokens":8584,"asi":{"hypothesis":"Presence offenses are autocorrect-safe at offense node range by replacing entire matched if/unless expression with existing computed replacement string.","rubocop_reference":"vendor/rubocop-rails/lib/rubocop/cop/rails/presence.rb","implemented_cop":"Rails/Presence","tests":"cargo test --lib -- cop::rails::presence","runtime_ms":496.47,"offenses_benchmark":3992,"missing_autocorrect_after":401}}
{"run":64,"commit":"2a65dca","metric":516,"metrics":{},"status":"keep","description":"Added RuboCop-aligned autocorrect for Rails/Present across `!blank?`, `unless ...blank?`, and `!nil? && !empty?` patterns by replacing offense ranges with `present?` equivalents and flipping `unless`→`if` where needed.","timestamp":1775677000247,"segment":1,"confidence":36.857142857142854,"iterationTokens":3898,"asi":{"hypothesis":"Present offenses can be autocorrected by mirroring RuboCop replacements: whole-expression replacement for bang/and patterns plus keyword+predicate replacement for unless patterns.","rubocop_reference":"vendor/rubocop-rails/lib/rubocop/cop/rails/present.rb","implemented_cop":"Rails/Present","tests":"cargo test --lib -- cop::rails::present","runtime_ms":499.77,"offenses_benchmark":3992,"missing_autocorrect_after":400}}
{"run":65,"commit":"abe9c5c","metric":517,"metrics":{},"status":"keep","description":"Added RuboCop-aligned autocorrect for Rails/Blank across `!present?`, `nil?/empty?` OR patterns, and `unless ...present?` by replacing offense ranges with `blank?` equivalents and flipping `unless`→`if` when needed.","timestamp":1775677130010,"segment":1,"confidence":36.92857142857143,"iterationTokens":3711,"asi":{"hypothesis":"Blank offenses can be autocorrected by mirroring RuboCop replacement strategy: whole-expression replacement for bang/or patterns plus keyword+predicate replacement for unless patterns.","rubocop_reference":"vendor/rubocop-rails/lib/rubocop/cop/rails/blank.rb","implemented_cop":"Rails/Blank","tests":"cargo test --lib -- cop::rails::blank","runtime_ms":557.47,"offenses_benchmark":3992,"missing_autocorrect_after":399}}
{"run":66,"commit":"89d03df","metric":518,"metrics":{},"status":"keep","description":"Added RuboCop-aligned autocorrect for Rails/AttributeDefaultBlockValue by wrapping flagged default expressions in `-> { ... }`, with fixture autocorrect coverage.","timestamp":1775677448764,"segment":1,"confidence":35.724137931034484,"iterationTokens":5419,"asi":{"hypothesis":"AttributeDefaultBlockValue offenses can be corrected by replacing only the `default:` value node with `-> { <original_expr> }`, matching RuboCop expression wrapping.","rubocop_reference":"vendor/rubocop-rails/lib/rubocop/cop/rails/attribute_default_block_value.rb","implemented_cop":"Rails/AttributeDefaultBlockValue","tests":"cargo test --lib -- cop::rails::attribute_default_block_value","runtime_ms":631.22,"offenses_benchmark":3992,"missing_autocorrect_after":398}}
{"run":67,"commit":"b05d0c7","metric":519,"metrics":{},"status":"keep","description":"Added RuboCop-aligned autocorrect for Rails/ArelStar by replacing the offending `\"*\"` string arg inside `[]` with `Arel.star`, with fixture autocorrect coverage.","timestamp":1775677570481,"segment":1,"confidence":34.6,"iterationTokens":11258,"asi":{"hypothesis":"ArelStar offenses can be corrected safely by replacing only the flagged string literal `\"*\"` node with `Arel.star`.","rubocop_reference":"vendor/rubocop-rails/lib/rubocop/cop/rails/arel_star.rb","implemented_cop":"Rails/ArelStar","tests":"cargo test --lib -- cop::rails::arel_star","runtime_ms":547.89,"offenses_benchmark":3992,"missing_autocorrect_after":397}}
{"run":68,"commit":"775d864","metric":520,"metrics":{},"status":"keep","description":"Added RuboCop-aligned autocorrect for RSpec/DescribedClass by replacing each offending reference range with `described_class` (or explicit class name in explicit style), with focused autocorrect tests for both styles.","timestamp":1775677704993,"segment":1,"confidence":34.666666666666664,"iterationTokens":20921,"asi":{"hypothesis":"DescribedClass offenses can be autocorrected at each offending constant/send range using the same style-dependent replacement used in messages.","rubocop_reference":"vendor/rubocop-rspec/lib/rubocop/cop/rspec/described_class.rb","implemented_cop":"RSpec/DescribedClass","tests":"cargo test --lib -- cop::rspec::described_class","runtime_ms":510.71,"offenses_benchmark":3992,"missing_autocorrect_after":396}}
{"run":69,"commit":"4d9f608","metric":521,"metrics":{},"status":"keep","description":"Added RuboCop-aligned autocorrect for Rails/Date: rewrote `Date.today` receiver to `Time.zone` and renamed deprecated `to_time_in_current_zone` selector to `in_time_zone`, with fixture autocorrect coverage.","timestamp":1775677950009,"segment":1,"confidence":34.733333333333334,"iterationTokens":3211,"asi":{"hypothesis":"Date offenses can be corrected via targeted receiver/selector replacement matching RuboCop autocorrect behavior while leaving strict `to_time` warning uncorrected.","rubocop_reference":"vendor/rubocop-rails/lib/rubocop/cop/rails/date.rb","implemented_cop":"Rails/Date","tests":"cargo test --lib -- cop::rails::date","runtime_ms":535.63,"offenses_benchmark":3992,"missing_autocorrect_after":395}}
{"run":70,"commit":"0b729dd","metric":522,"metrics":{},"status":"keep","description":"Added RuboCop-aligned autocorrect for RSpec/Output by removing flagged stdout call expressions (`puts`/`print`/`p` and IO write calls), with focused autocorrect tests.","timestamp":1775678081176,"segment":1,"confidence":33.67741935483871,"iterationTokens":4060,"asi":{"hypothesis":"RSpec/Output can mirror RuboCop AutoCorrector by deleting whole offending send node ranges for flagged output calls.","rubocop_reference":"vendor/rubocop-rspec/lib/rubocop/cop/rspec/output.rb","implemented_cop":"RSpec/Output","tests":"cargo test --lib -- cop::rspec::output","runtime_ms":551.15,"offenses_benchmark":3992,"missing_autocorrect_after":394}}
{"run":71,"commit":"3aa6e2f","metric":523,"metrics":{},"status":"keep","description":"Added RuboCop-aligned autocorrect for Rails/ContentTag by rewriting `tag(:name, ...)` to `tag.name(...)` via selector-to-call-end replacement, with Rails-config autocorrect tests.","timestamp":1775678542146,"segment":1,"confidence":32.6875,"iterationTokens":4060,"asi":{"hypothesis":"ContentTag offenses can be autocorrected by replacing from `tag` selector through call end with method-call form `tag.<underscored_name>(rest_args)`.","rubocop_reference":"vendor/rubocop-rails/lib/rubocop/cop/rails/content_tag.rb","implemented_cop":"Rails/ContentTag","tests":"cargo test --lib -- cop::rails::content_tag","runtime_ms":504.42,"offenses_benchmark":3992,"missing_autocorrect_after":393}}
{"run":72,"commit":"7df536f","metric":524,"metrics":{},"status":"keep","description":"Added RuboCop-aligned autocorrect for Rails/ActiveSupportOnLoad by replacing direct framework patch calls with `ActiveSupport.on_load(:hook) { method args }` wrappers, with focused config-based autocorrect tests.","timestamp":1775678668827,"segment":1,"confidence":32.75,"iterationTokens":9535,"asi":{"hypothesis":"ActiveSupportOnLoad offenses can be corrected by replacing the full direct patch call expression with an `ActiveSupport.on_load` block using the resolved hook and original arguments.","rubocop_reference":"vendor/rubocop-rails/lib/rubocop/cop/rails/active_support_on_load.rb","implemented_cop":"Rails/ActiveSupportOnLoad","tests":"cargo test --lib -- cop::rails::active_support_on_load","runtime_ms":503.38,"offenses_benchmark":3992,"missing_autocorrect_after":392}}
{"run":73,"commit":"7df536f","metric":0,"metrics":{},"status":"crash","description":"Attempted to add autocorrect support for Rails/BelongsTo and Rails/DelegateAllowBlank, but build failed due to lifetime/type inference errors in new BelongsTo keyword-pair helper.","timestamp":1775678891566,"segment":1,"confidence":32.75,"iterationTokens":14215,"asi":{"hypothesis":"BelongsTo/DelegateAllowBlank can be safely autocorrected by replacing offending keyword pair/key ranges.","rollback_reason":"Compilation failed in src/cop/rails/belongs_to.rs (`E0106` missing lifetime specifier on helper return type and follow-on `E0282` type inference failure).","next_action_hint":"Re-implement BelongsTo helper using explicit lifetime parameters (or avoid returning Node by returning bool/replacement directly) and rerun targeted tests before counting metrics.","error_details":"error[E0106] missing lifetime specifier at keyword_arg_pair_range_and_value return type; error[E0282] type annotations needed for required_value usage."}}
{"run":74,"commit":"5f8c083","metric":527,"metrics":{},"status":"keep","description":"Added RuboCop-aligned autocorrect for Rails/BelongsTo (`required:`→`optional:` pair replacement) and Rails/DelegateAllowBlank (`allow_blank` key→`allow_nil`), with focused autocorrect tests.","timestamp":1775679026709,"segment":1,"confidence":32.9375,"iterationTokens":5843,"asi":{"hypothesis":"Both cops can autocorrect by replacing only offending keyword pair/key ranges without changing surrounding DSL call structure.","rubocop_references":"vendor/rubocop-rails/lib/rubocop/cop/rails/belongs_to.rb; vendor/rubocop-rails/lib/rubocop/cop/rails/delegate_allow_blank.rb","implemented_cops":"Rails/BelongsTo, Rails/DelegateAllowBlank","tests":"cargo test --lib -- cop::rails::belongs_to cop::rails::delegate_allow_blank","runtime_ms":636.63,"offenses_benchmark":3992,"missing_autocorrect_after":389,"learning":"First attempt failed due lifetime-heavy helper in BelongsTo; inlined pair-range scan avoided borrow/lifetime complexity and compiled cleanly."}}
{"run":75,"commit":"8fd2e32","metric":528,"metrics":{},"status":"keep","description":"Added RuboCop-aligned autocorrect for RSpec/ChangeByZero by converting `to change(...).by(0)` to `not_to change(...)` (or block form) via `to` selector and trailing `.by(0)` removal, with focused autocorrect tests.","timestamp":1775679219115,"segment":1,"confidence":32,"iterationTokens":2577,"asi":{"hypothesis":"ChangeByZero offenses can be baseline-autocorrected by removing `.by(0)` and switching expectation operator to `not_to` for standard non-compound forms.","rubocop_reference":"vendor/rubocop-rspec/lib/rubocop/cop/rspec/change_by_zero.rb","implemented_cop":"RSpec/ChangeByZero","tests":"cargo test --lib -- cop::rspec::change_by_zero","runtime_ms":527.8,"offenses_benchmark":3992,"missing_autocorrect_after":388,"learning":"Direct AST parent lookup is unavailable in Prism nodes here; source-window selector replacement was used for the `to`→`not_to` rewrite."}}
{"run":1,"commit":"f65cce6","metric":528,"metrics":{},"status":"keep","description":"Validated continuation state after context-stop: current HEAD includes newly kept Rails/BelongsTo, Rails/DelegateAllowBlank, and RSpec/ChangeByZero autocorrect support; with_autocorrect is now 528 (388 missing) and benchmark offense invariant remains 3992.","timestamp":1775679286404,"segment":0,"confidence":null,"iterationTokens":null,"asi":{"hypothesis":"First recovery experiment should validate the current continuation commit state end-to-end (targeted cop tests + count script + workload offense invariant) before adding new cops.","validated_head":"8fd2e326c","validated_with_autocorrect":528,"validated_missing_autocorrect":388,"offenses_benchmark":3992,"ideas_review":"RSpec/Focus metadata parity remains actionable but does not move primary metric by itself."}}
{"run":1,"commit":"f65cce6","metric":0,"metrics":{},"status":"crash","description":"RootPublicPath experiment command crashed after successful test/lint run due non-portable awk capture (`match(..., ..., array)` not supported), so offense parsing failed before metric emission.","timestamp":1775679494055,"segment":0,"confidence":null,"iterationTokens":null,"asi":{"hypothesis":"Add RuboCop-aligned autocorrect for Rails/RootPublicPath and validate with targeted tests + autocorrect count + offense invariant guard.","rollback_reason":"Experiment harness parsing used gawk-specific third-arg match API and exited before METRIC output, forcing crash rollback.","next_action_hint":"Rerun the same code path with portable offense parsing (sed/grep) and explicit METRIC lines so run_experiment can complete.","error_details":"awk syntax error at match(...) when extracting `3992 offenses detected`."}}
{"run":2,"commit":"5a0758e","metric":529,"metrics":{},"status":"keep","description":"Added RuboCop-aligned autocorrect for Rails/RootPublicPath by rewriting `Rails.root.join('public...')` forms to `Rails.public_path` / `Rails.public_path.join(...)`, with focused autocorrect tests and offense invariant preserved.","timestamp":1775679525495,"segment":0,"confidence":null,"iterationTokens":8332,"asi":{"hypothesis":"Rails/RootPublicPath is a deterministic whole-expression rewrite from `Rails.root.join('public...')` into `Rails.public_path` forms, so adding autocorrect should increase with_autocorrect by +1 safely.","rubocop_reference":"vendor/rubocop-rails/lib/rubocop/cop/rails/root_public_path.rb","implemented_cop":"Rails/RootPublicPath","tests":"cargo test --lib -- cop::rails::root_public_path","with_autocorrect_after":529,"missing_autocorrect_after":387,"offenses_benchmark":3992,"ideas_review":"Checked autoresearch.ideas.md; RSpec/Focus metadata parity remains actionable and not stale for parity work."}}
