{"run":11,"commit":"ff0396e","metric":560,"metrics":{},"status":"discard","description":"Baseline revalidation run on clean tree: with_autocorrect=560, missing=356, offense invariant 3992.","timestamp":1775687062808,"segment":0,"confidence":null,"iterationTokens":4012,"asi":{"hypothesis":"Re-anchor actual head metric after attribution drift and revert cycles before next isolated cop experiment.","rollback_reason":"No new implementation delta in working tree; this run is calibration only and not a keep candidate.","next_action_hint":"Select one confirmed missing-autocorrect cop and run isolated implementation + targeted tests + benchmark guard.","with_autocorrect_observed":560,"missing_autocorrect_observed":356,"offenses_benchmark":3992,"learning":"Current branch baseline is 560/356, not the stale 557 shown in tool header; use fresh count each run for keep/discard decisions."}}
{"run":21,"commit":"ff0396e","metric":562,"metrics":{},"status":"discard","description":"DotSeparatedKeys + WhereMissing tests and benchmark guard passed, but working tree also contained unvalidated in-flight I18nLazyLookup changes, so the +2 count gain is not attribution-clean.","timestamp":1775687291163,"segment":0,"confidence":null,"iterationTokens":8337,"asi":{"hypothesis":"Enable and validate autocorrect for Rails/DotSeparatedKeys and Rails/WhereMissing to increase with_autocorrect while preserving offense invariant.","rollback_reason":"Additional modified cop (`i18n_lazy_lookup.rs`) was present but not validated in this run, making metric attribution ambiguous.","next_action_hint":"Rerun as a combined validation including I18nLazyLookup (or isolate a clean tree) before keeping.","tests":"cargo test --lib -- cop::rails::dot_separated_keys; cargo test --lib -- cop::rails::where_missing","with_autocorrect_observed":562,"missing_autocorrect_observed":354,"offenses_benchmark":3992}}
{"run":12,"commit":"ff0396e","metric":0,"metrics":{},"status":"checks_failed","description":"DotSeparatedKeys autocorrect implementation compiled, but fixture autocorrect failed: scope-pair removal leaves trailing `, ` (`t('foo', )`) after deleting `scope:` option.","timestamp":1775687321653,"segment":0,"confidence":null,"iterationTokens":52959,"asi":{"hypothesis":"Add RuboCop-aligned DotSeparatedKeys autocorrect by rewriting key to dot-separated string and removing `scope:` keyword pair.","rollback_reason":"Current removal range logic does not consume the separator when `scope` is the only hash pair, producing invalid trailing comma artifacts.","next_action_hint":"Adjust scope-pair removal range to also remove surrounding comma/space or clean empty hash-argument separators, then rerun DotSeparatedKeys targeted tests and benchmark guard.","failed_test":"cop::rails::dot_separated_keys::tests::autocorrect_fixture","tests":"cargo test --lib -- cop::rails::dot_separated_keys","offenses_benchmark":"not reached"}}
{"run":109,"commit":"68d255b","metric":561,"metrics":{},"status":"keep","description":"Re-enabled Rails/I18nLazyLookup autocorrect path (lazy/explicit key rewrites with fixture coverage) and validated in-flight Rails bundle (DotSeparatedKeys/WhereMissing/I18nLazyLookup); offense invariant remains 3992.","timestamp":1775687401705,"segment":1,"confidence":24.391304347826086,"iterationTokens":1231,"asi":{"hypothesis":"Restoring RuboCop-aligned autocorrect plumbing in I18nLazyLookup should recover +1 autocorrect coverage without offense drift.","implemented_cop":"Rails/I18nLazyLookup","bundle_validated":"Rails/DotSeparatedKeys, Rails/WhereMissing, Rails/I18nLazyLookup","tests":"cargo test --lib -- cop::rails::i18n_lazy_lookup cop::rails::dot_separated_keys cop::rails::where_missing","with_autocorrect_after":561,"missing_autocorrect_after":355,"offenses_benchmark":3992,"overfitting_guard":"Validated full workload offense invariant after targeted cop tests."}}
{"run":13,"commit":"ff0396e","metric":562,"metrics":{},"status":"discard","description":"DotSeparatedKeys validation run passed tests/invariant, but measured +2 was confounded by concurrent in-flight RootJoinChain autocorrect changes in the working tree.","timestamp":1775687527602,"segment":0,"confidence":null,"iterationTokens":4449,"asi":{"hypothesis":"Land DotSeparatedKeys autocorrect by rewriting scope-based translation keys into dot-separated key strings.","rollback_reason":"Attribution not clean: RootJoinChain source + corrected fixture were modified concurrently and not part of the targeted test scope.","next_action_hint":"Run an isolated RootJoinChain validation on the current tree (or clear it), then re-run DotSeparatedKeys separately for clean attribution.","with_autocorrect_observed":562,"missing_autocorrect_observed":354,"offenses_benchmark":3992,"tests":"cargo test --lib -- cop::rails::dot_separated_keys","confounding_files":"src/cop/rails/root_join_chain.rs, tests/fixtures/cops/rails/root_join_chain/corrected.rb"}}
{"run":22,"commit":"68d255b","metric":0,"metrics":{},"status":"crash","description":"Combined DotSeparatedKeys/I18nLazyLookup/WhereMissing validation ran all targeted tests successfully but experiment command exited before METRIC emission during post-test metric/benchmark step.","timestamp":1775687530292,"segment":0,"confidence":null,"iterationTokens":4750,"asi":{"hypothesis":"Validate three in-flight autocorrect cops together and keep if count improves with offense invariant intact.","rollback_reason":"Harness failed after tests and before metric output (likely benchmark/count parsing stage), so run produced no reliable primary metric.","next_action_hint":"Rerun the same validation with explicit debug echoes around count/benchmark parsing and robust offense extraction to ensure METRIC lines are emitted.","tests_passed":"cop::rails::dot_separated_keys, cop::rails::i18n_lazy_lookup, cop::rails::where_missing"}}
{"run":110,"commit":"68d255b","metric":0,"metrics":{},"status":"checks_failed","description":"RootJoinChain autocorrect attempt failed targeted tests due corrected fixture newline mismatch (expected trailing newline absent in actual output).","timestamp":1775687659058,"segment":1,"confidence":24.391304347826086,"iterationTokens":4238,"asi":{"hypothesis":"Enable conservative RootJoinChain autocorrect by flattening chained joins while preserving existing offense behavior.","rollback_reason":"`cop::rails::root_join_chain::tests::autocorrect_fixture` failed with 1-byte mismatch (expected 117 vs got 116).","next_action_hint":"Update corrected fixture newline parity (no trailing newline), then rerun targeted tests + benchmark invariant.","failed_test":"cop::rails::root_join_chain::tests::autocorrect_fixture"}}
{"run":14,"commit":"ff0396e","metric":0,"metrics":{},"status":"checks_failed","description":"RootJoinChain autocorrect logic compiled and tests nearly passed; fixture mismatch was 1-byte newline-shape difference in corrected fixture output.","timestamp":1775687665155,"segment":0,"confidence":null,"iterationTokens":5451,"asi":{"hypothesis":"Enable RootJoinChain autocorrect by flattening chained joins into a single `Rails.root/public_path.join(...)` call.","rollback_reason":"`cop::rails::root_join_chain::tests::autocorrect_fixture` failed only on trailing newline mismatch (expected 117 bytes vs got 116).","next_action_hint":"Align `tests/fixtures/cops/rails/root_join_chain/corrected.rb` newline shape with emitted output (remove final newline) and rerun isolated RootJoinChain validation.","failed_test":"cop::rails::root_join_chain::tests::autocorrect_fixture","tests":"cargo test --lib -- cop::rails::root_join_chain","offenses_benchmark":"not reached"}}
{"run":23,"commit":"68d255b","metric":563,"metrics":{},"status":"discard","description":"Validation rerun (dot/i18n/where) succeeded with offense invariant 3992, but an additional unvalidated in-flight RootJoinChain autocorrect change was present in the working tree, so +3 attribution is ambiguous.","timestamp":1775687711735,"segment":0,"confidence":null,"iterationTokens":4707,"asi":{"hypothesis":"Revalidate current autocorrect bundle with robust metric parsing and keep only if all modified cops are in-scope.","rollback_reason":"Working tree included extra modified cop (`root_join_chain.rs`) not covered by this run's targeted tests.","next_action_hint":"Run a full attribution-clean cycle including RootJoinChain tests (or isolate to clean tree) before keeping.","tests":"cargo test --lib --quiet -- cop::rails::dot_separated_keys; cargo test --lib --quiet -- cop::rails::i18n_lazy_lookup; cargo test --lib --quiet -- cop::rails::where_missing","with_autocorrect_observed":563,"missing_autocorrect_observed":353,"offenses_benchmark":3992}}
{"run":111,"commit":"68d255b","metric":562,"metrics":{},"status":"discard","description":"RootJoinChain autocorrect reimplementation passed targeted tests and offense invariant but did not improve primary metric (with_autocorrect stayed 562).","timestamp":1775687812624,"segment":1,"confidence":23.375,"iterationTokens":4525,"asi":{"hypothesis":"Adding supports_autocorrect and fixture-backed correction for Rails/RootJoinChain should increase with_autocorrect by +1.","rollback_reason":"Primary metric unchanged after successful validation run.","next_action_hint":"Prioritize a cop still counted as missing by script with no in-flight drift, likely Rails/RootPathnameMethods or Rails/HttpPositionalArguments.","tests":"cargo test --lib -- cop::rails::root_join_chain","with_autocorrect_observed":562,"missing_autocorrect_observed":354,"offenses_benchmark":3992}}
{"run":24,"commit":"0c0f2ec","metric":562,"metrics":{},"status":"keep","description":"Validated current Rails autocorrect bundle state: DotSeparatedKeys, I18nLazyLookup, and WhereMissing autocorrect paths pass targeted tests, with_autocorrect is 562 (354 missing), and benchmark offense invariant remains 3992.","timestamp":1775687886937,"segment":0,"confidence":null,"iterationTokens":2168,"asi":{"hypothesis":"Re-anchor on the latest committed bundle state and keep only if targeted tests and offense invariant confirm the measured count improvement.","validated_cops":"Rails/DotSeparatedKeys, Rails/I18nLazyLookup, Rails/WhereMissing","tests":"cargo test --lib --quiet -- cop::rails::dot_separated_keys; cargo test --lib --quiet -- cop::rails::i18n_lazy_lookup; cargo test --lib --quiet -- cop::rails::where_missing","with_autocorrect_after":562,"missing_autocorrect_after":354,"offenses_benchmark":3992,"ideas_review":"Pruned stale I18nLazyLookup idea after implementation; RootJoinChain remains actionable deferred path."}}
{"run":25,"commit":"0c0f2ec","metric":0,"metrics":{},"status":"crash","description":"RootJoinChain experiment crashed during compilation because in-flight RootJoinChain refactor introduced unresolved Prism-parent/lifetime/type issues and referenced a missing corrected fixture include.","timestamp":1775688007436,"segment":0,"confidence":null,"iterationTokens":4852,"asi":{"hypothesis":"Enable conservative RootJoinChain autocorrect for Rails.root/public_path join chains and gain +1 with stable fixture coverage.","rollback_reason":"Compile failures (E0106/E0282/E0599) in root_join_chain.rs plus missing `tests/fixtures/cops/rails/root_join_chain/corrected.rb` required by an in-flight autocorrect fixture macro.","next_action_hint":"Rework RootJoinChain without parent-node APIs, simplify evidence collection with explicit lifetimes, and either provide corrected fixture or drop fixture macro before rerunning.","error_details":"root_join_chain.rs compile errors + missing corrected fixture include_bytes"}}
{"run":15,"commit":"be50637","metric":562,"metrics":{},"status":"keep","description":"Added RuboCop-aligned autocorrect for Rails/RootJoinChain by collapsing chained `join` calls on `Rails.root`/`Rails.public_path` into a single multi-arg `join(...)`; added corrected fixture coverage; targeted tests passed and offense invariant stayed 3992.","timestamp":1775688087519,"segment":0,"confidence":null,"iterationTokens":3817,"asi":{"hypothesis":"RootJoinChain can safely enable autocorrect by mirroring RuboCop evidence traversal: only outermost chained join on Rails.root/public_path and rewrite range from root selector to chain end.","rubocop_reference":"vendor/rubocop-rails/lib/rubocop/cop/rails/root_join_chain.rb","implemented_cop":"Rails/RootJoinChain","tests":"cargo test --lib -- cop::rails::root_join_chain","with_autocorrect_after":562,"missing_autocorrect_after":354,"offenses_benchmark":3992,"ideas_review":"Pruned stale/tried ideas focus and refreshed backlog to RootJoinChain + DotSeparatedKeys."}}
{"run":26,"commit":"be50637","metric":564,"metrics":{},"status":"discard","description":"Validation of LinkToBlank + RootJoinChain passed with offense invariant 3992, but working tree included an additional unvalidated in-flight change (`http_positional_arguments.rs`), so +4 attribution is not clean.","timestamp":1775688227116,"segment":0,"confidence":null,"iterationTokens":7701,"asi":{"hypothesis":"Revalidate latest Rails autocorrect gains (including RootJoinChain and LinkToBlank) with robust benchmark parsing.","rollback_reason":"Another modified cop appeared in working tree during run (`Rails/HttpPositionalArguments`) outside the validated test scope.","next_action_hint":"Run the next cycle with a scope that includes all modified cops (add `cop::rails::http_positional_arguments`) or isolate to a clean tree before keeping.","tests":"cargo test --lib --quiet -- cop::rails::link_to_blank; cargo test --lib --quiet -- cop::rails::root_join_chain","with_autocorrect_observed":564,"missing_autocorrect_observed":352,"offenses_benchmark":3992}}
{"run":112,"commit":"be50637","metric":564,"metrics":{},"status":"discard","description":"Baseline revalidation run on current HEAD (RootJoinChain + LinkToBlank autocorrect already landed) passed targeted tests and offense invariant, but introduced no new code delta this iteration.","timestamp":1775688237638,"segment":1,"confidence":23.375,"iterationTokens":8912,"asi":{"hypothesis":"Confirm current head remains stable before attempting the next missing-autocorrect cop.","rollback_reason":"No new implementation change in this iteration; run was validation-only on already-landed state.","next_action_hint":"Pick a fresh missing autocorrect cop not yet landed and run an attribution-clean single-cop experiment.","tests":"cargo test --lib -- cop::rails::root_join_chain cop::rails::link_to_blank","with_autocorrect_observed":564,"missing_autocorrect_observed":352,"offenses_benchmark":3992}}
{"run":16,"commit":"be50637","metric":0,"metrics":{},"status":"checks_failed","description":"Initial Rails/HttpPositionalArguments autocorrect attempt failed targeted tests: cop still reported no autocorrect support/corrections for fixture expectations.","timestamp":1775688403984,"segment":0,"confidence":null,"iterationTokens":45750,"asi":{"hypothesis":"Enable conservative RuboCop-aligned autocorrect for positional HTTP args by rewriting second arg to `params:` and optional third arg to `session:` under existing offense guards.","rollback_reason":"`cop::rails::http_positional_arguments::tests::supports_autocorrect` and `autocorrect_fixture` failed because autocorrect plumbing was incomplete at run time.","next_action_hint":"Wire `supports_autocorrect`, collect corrections in `check_source` visitor, and rerun targeted cop tests before benchmark guard.","failed_tests":"cop::rails::http_positional_arguments::tests::supports_autocorrect; cop::rails::http_positional_arguments::tests::autocorrect_fixture"}}
{"run":113,"commit":"be50637","metric":0,"metrics":{},"status":"checks_failed","description":"Bundled EagerEvaluationLogMessage + HttpPositionalArguments attempt failed targeted tests; HttpPositionalArguments still lacks working autocorrect implementation despite fixture/test scaffolding.","timestamp":1775688429500,"segment":1,"confidence":23.375,"iterationTokens":14623,"asi":{"hypothesis":"Land +1/+2 autocorrect coverage by enabling deterministic rewrites for EagerEvaluationLogMessage and HttpPositionalArguments.","rollback_reason":"Targeted tests failed at `cop::rails::http_positional_arguments::tests::{supports_autocorrect,autocorrect_fixture}` before invariant benchmark stage.","next_action_hint":"Start from clean tree and isolate one cop. Either fully implement HttpPositionalArguments autocorrect parity or strip its in-flight scaffolding and pursue EagerEvaluationLogMessage alone.","failed_tests":"cop::rails::http_positional_arguments::tests::autocorrect_fixture; cop::rails::http_positional_arguments::tests::supports_autocorrect"}}
{"run":27,"commit":"be50637","metric":565,"metrics":{},"status":"discard","description":"RootJoinChain + LinkToBlank validation passed and offense invariant held, but an additional unvalidated in-flight change (`http_positional_arguments.rs` + corrected fixture) was present, so the +5 gain is not attribution-clean.","timestamp":1775688434284,"segment":0,"confidence":null,"iterationTokens":1993,"asi":{"hypothesis":"Revalidate latest RootJoinChain/LinkToBlank state and keep only if all modified cops are covered.","rollback_reason":"Unexpected extra modified cop (`Rails/HttpPositionalArguments`) appeared during run outside the tested scope.","next_action_hint":"Rerun including `cop::rails::http_positional_arguments` (and benchmark guard) so all modified files are validated together before keeping.","tests":"cargo test --lib --quiet -- cop::rails::link_to_blank; cargo test --lib --quiet -- cop::rails::root_join_chain","with_autocorrect_observed":565,"missing_autocorrect_observed":351,"offenses_benchmark":3992}}
{"run":17,"commit":"3400203","metric":565,"metrics":{},"status":"keep","description":"Added conservative RuboCop-aligned autocorrect for Rails/HttpPositionalArguments: rewrites detected positional HTTP args to `params:` with optional `session:` and adds fixture autocorrect coverage; targeted tests passed and offense invariant remained 3992.","timestamp":1775688561584,"segment":0,"confidence":null,"iterationTokens":7509,"asi":{"hypothesis":"Rails/HttpPositionalArguments can safely gain baseline autocorrect for already-detected positional hash args by converting arg2 to `params:` and arg3 to `session:` while keeping Rack::Test and Rails-version gates.","rubocop_reference":"vendor/rubocop-rails/lib/rubocop/cop/rails/http_positional_arguments.rb","implemented_cop":"Rails/HttpPositionalArguments","tests":"cargo test --lib -- cop::rails::http_positional_arguments","with_autocorrect_after":565,"missing_autocorrect_after":351,"offenses_benchmark":3992,"safety_guard":"Autocorrect intentionally limited to current offense shape (second positional HashNode, optional third arg) to avoid semantic drift."}}
{"run":28,"commit":"3400203","metric":565,"metrics":{},"status":"discard","description":"Validation run covered LinkToBlank and RootJoinChain with invariant 3992, but latest HEAD also includes new HttpPositionalArguments autocorrect work that was not in this test scope.","timestamp":1775688576722,"segment":0,"confidence":null,"iterationTokens":2149,"asi":{"hypothesis":"Re-anchor latest RootJoinChain/LinkToBlank state while tracking count progression.","rollback_reason":"Scope mismatch: HEAD advanced with HttpPositionalArguments autocorrect, so observed metric gain is not fully validated by this run.","next_action_hint":"Rerun including `cop::rails::http_positional_arguments` alongside LinkToBlank/RootJoinChain before keeping.","tests":"cargo test --lib --quiet -- cop::rails::link_to_blank; cargo test --lib --quiet -- cop::rails::root_join_chain","with_autocorrect_observed":565,"missing_autocorrect_observed":351,"offenses_benchmark":3992}}
{"run":114,"commit":"25e70d8","metric":565,"metrics":{},"status":"keep","description":"Added RuboCop-aligned autocorrect for Rails/EagerEvaluationLogMessage by rewriting interpolated `Rails.logger.debug` args to lazy block form (`debug { ... }`) with fixture coverage; targeted tests pass and offense invariant remains 3992.","timestamp":1775688604926,"segment":1,"confidence":23.541666666666668,"iterationTokens":3482,"asi":{"hypothesis":"EagerEvaluationLogMessage supports deterministic selector-to-call-end replacement for interpolated debug messages, yielding +1 autocorrect coverage without behavior drift.","rubocop_reference":"vendor/rubocop-rails/lib/rubocop/cop/rails/eager_evaluation_log_message.rb","implemented_cop":"Rails/EagerEvaluationLogMessage","tests":"cargo test --lib -- cop::rails::eager_evaluation_log_message","with_autocorrect_after":565,"missing_autocorrect_after":351,"offenses_benchmark":3992,"scope_guard":"Autocorrect only for `Rails.logger.debug` calls with interpolated first argument and no existing block."}}
{"run":29,"commit":"25e70d8","metric":565,"metrics":{},"status":"discard","description":"Validation covered HttpPositionalArguments/LinkToBlank/RootJoinChain and invariant 3992, but HEAD advanced with a new EagerEvaluationLogMessage autocorrect commit outside this run's test scope.","timestamp":1775688619865,"segment":0,"confidence":null,"iterationTokens":1587,"asi":{"hypothesis":"Re-anchor latest Rails autocorrect state by validating all recently landed cops together.","rollback_reason":"Scope mismatch: unvalidated `Rails/EagerEvaluationLogMessage` autocorrect changes were present in HEAD, so this run did not fully validate the observed metric.","next_action_hint":"Rerun with `cop::rails::eager_evaluation_log_message` included (and prune stale idea entry afterward).","tests":"cargo test --lib --quiet -- cop::rails::http_positional_arguments; cargo test --lib --quiet -- cop::rails::link_to_blank; cargo test --lib --quiet -- cop::rails::root_join_chain","with_autocorrect_observed":565,"missing_autocorrect_observed":351,"offenses_benchmark":3992}}
