{"run":37,"commit":"cb5662d","metric":0,"metrics":{},"status":"crash","description":"Casecmp autocorrect validation run failed due transient Cargo archive/object-file build failure (`failed to build archive ... .rlib: No such file or directory`), before tests executed.","timestamp":1775701341160,"segment":0,"confidence":null,"iterationTokens":16839,"asi":{"hypothesis":"Add RuboCop-aligned autocorrect for Performance/Casecmp and validate with targeted tests + invariant benchmark.","rollback_reason":"Environment/toolchain build failure (missing rlib object file) interrupted compilation before code-level validation could run.","next_action_hint":"Immediately rerun the same Casecmp validation command; if archive error repeats, run a clean rebuild of debug artifacts and retry.","error":"Cargo archive build error for getrandom/aho-corasick rlib object file (os error 2)"}}
{"run":38,"commit":"cb5662d","metric":0,"metrics":{},"status":"crash","description":"Casecmp autocorrect run failed before validation because test compile could not find `tests/fixtures/cops/performance/double_start_end_with/corrected.rb` required by an existing macro in `double_start_end_with.rs`.","timestamp":1775701553941,"segment":0,"confidence":null,"iterationTokens":7018,"asi":{"hypothesis":"Validate and land Performance/Casecmp autocorrect with targeted tests and invariant benchmark.","rollback_reason":"Compilation aborted on unrelated missing fixture include (`double_start_end_with/corrected.rb`), so Casecmp changes were not evaluated.","next_action_hint":"Add the missing `double_start_end_with/corrected.rb` fixture (or otherwise resolve that compile-time include), then rerun Casecmp experiment.","error":"include_bytes missing tests/fixtures/cops/performance/double_start_end_with/corrected.rb"}}
{"run":76,"commit":"cb5662d","metric":326,"metrics":{},"status":"discard","description":"DoubleStartEndWith run passed tests and benchmark invariant at 590/326, but edited cop/fixture files did not persist after the run (no surviving worktree diff), so result is non-attributable.","timestamp":1775701620561,"segment":0,"confidence":16.46153846153846,"iterationTokens":19053,"asi":{"hypothesis":"Add RuboCop-aligned autocorrect for Performance/DoubleStartEndWith by merging duplicate start/end predicate chains into multi-arg calls and preserving negated && semantics.","rollback_reason":"Post-run tree returned to baseline without cop/fixture edits, preventing attribution.","next_action_hint":"Use an isolated worktree for implementation runs to avoid external churn wiping local diffs before logging.","tests":"cargo test --lib --quiet -- cop::performance::double_start_end_with","with_autocorrect_observed":590,"missing_autocorrect_observed":326,"offenses_benchmark":3992}}
{"run":68,"commit":"cb5662d","metric":590,"metrics":{},"status":"discard","description":"DoubleStartEndWith run passed tests and benchmark invariant but autocorrect count stayed at baseline (590/326) and post-run file state showed no DoubleStartEndWith autocorrect/fixture changes, so result was non-attributable.","timestamp":1775701648326,"segment":0,"confidence":null,"iterationTokens":14586,"asi":{"hypothesis":"Enable autocorrect for Performance/DoubleStartEndWith with multi-arg rewrite and negated-&& handling.","rollback_reason":"DoubleStartEndWith source/fixture edits did not persist through run; post-run tree had baseline file content and no corrected fixture.","next_action_hint":"Pivot to whichever cop edits remain present immediately before run (currently likely StringInclude) and require pre/post dirty-file guards.","with_autocorrect_observed":590,"missing_autocorrect_observed":326,"offenses_benchmark":3992,"attribution_issue":"expected modified files absent after run"}}
{"run":39,"commit":"cb5662d","metric":0,"metrics":{},"status":"crash","description":"StringInclude autocorrect validation failed to compile due E0308 borrow mismatches in `is_simple_regex_node` calls inside `=~` and `!~` branches.","timestamp":1775701817572,"segment":0,"confidence":null,"iterationTokens":18674,"asi":{"hypothesis":"Validate pending Performance/StringInclude autocorrect patch against targeted tests, count script, and offense invariant benchmark.","rollback_reason":"Compile failed before tests/metrics because `is_simple_regex_node` expected `&Node` but two branches passed owned `Node` values.","next_action_hint":"Patch `is_simple_regex_node` callsites to pass references (`&first_arg`) in all affected branches, then rerun the same validation command.","error":"E0308 mismatched types at string_include.rs lines 339 and 387"}}
{"run":69,"commit":"cb5662d","metric":0,"metrics":{},"status":"crash","description":"StringInclude autocorrect attempt failed compilation in `cop::performance::string_include` due borrowed-node mismatches (`is_simple_regex_node(first_arg)` needed reference).","timestamp":1775701884906,"segment":0,"confidence":null,"iterationTokens":6530,"asi":{"hypothesis":"Add RuboCop-aligned autocorrect for Performance/StringInclude with literal regex decoding and orientation-aware rewrites.","rollback_reason":"Compile errors E0308 on non-borrowed `first_arg` in `=~` and `!~` branches blocked test run.","next_action_hint":"Use `&first_arg` at matcher calls, rerun targeted tests, then benchmark with offense invariant guard.","error_signature":"E0308 expected &Node, found Node at string_include.rs lines ~339 and ~387"}}
{"run":70,"commit":"cb5662d","metric":0,"metrics":{},"status":"crash","description":"Casecmp guarded run passed targeted tests and benchmark invariant but failed post-run status guard: cop/fixture edits vanished before logging (POST_STATUS empty), so attribution invalid.","timestamp":1775702060515,"segment":0,"confidence":null,"iterationTokens":7497,"asi":{"hypothesis":"Land Performance/Casecmp autocorrect with replacement builder for ==/!=/eql? forms.","rollback_reason":"Post-run dirty-file guard failed; expected casecmp files were not present after benchmark.","next_action_hint":"If concurrent reverts persist, avoid keep decisions unless post-run status still shows expected files.","error_signature":"POST_STATUS empty after successful tests+benchmark"}}
{"run":77,"commit":"cb5662d","metric":326,"metrics":{},"status":"discard","description":"Baseline validation run for current HEAD (StringInclude untouched) confirmed stable counts 590/326 and offense invariant 3992; no attributable code delta in this cycle.","timestamp":1775702063909,"segment":0,"confidence":16.46153846153846,"iterationTokens":14077,"asi":{"hypothesis":"Reconfirm stable baseline before the next isolated autocorrect implementation attempt.","rollback_reason":"No implementation changes were present, so primary metric was unchanged.","next_action_hint":"Proceed with an isolated edit+validate cycle for Performance/StringInclude or Performance/DoubleStartEndWith, verifying diffs persist before logging.","tests":"cargo test --lib --quiet -- cop::performance::string_include","with_autocorrect_observed":590,"missing_autocorrect_observed":326,"offenses_benchmark":3992}}
{"run":40,"commit":"cb5662d","metric":590,"metrics":{},"status":"discard","description":"Casecmp autocorrect attempt passed targeted tests and offense invariant but yielded flat metrics (590/326); post-run check showed no surviving Casecmp code/fixture diff, so result is non-attributable.","timestamp":1775702066695,"segment":0,"confidence":null,"iterationTokens":9500,"asi":{"hypothesis":"Add RuboCop-aligned autocorrect for Performance/Casecmp (`downcase/upcase` comparisons -> `casecmp(...).zero?`) to increase autocorrect coverage by +1.","rollback_reason":"Primary metric did not improve and the Casecmp edits were absent from the worktree immediately after run, indicating attribution drift.","next_action_hint":"Run next experiment only after confirming expected dirty files exist both before and after run_experiment; prefer the already-pending StringInclude path in one isolated patch.","tests":"cargo test --lib --quiet -- cop::performance::casecmp","with_autocorrect_observed":590,"missing_autocorrect_observed":326,"offenses_benchmark":3992}}
{"run":71,"commit":"cb5662d","metric":592,"metrics":{},"status":"discard","description":"Run measured 592/324 with invariant 3992, but post-run worktree no longer had Casecmp edits; it had StringInclude deltas instead. Since command only tested Casecmp, result is non-attributable/untested for active changes.","timestamp":1775702240044,"segment":0,"confidence":null,"iterationTokens":6423,"asi":{"hypothesis":"Validate Casecmp autocorrect (+1) with benchmark guard.","rollback_reason":"Post-run file swap from Casecmp -> StringInclude invalidated attribution and targeted-test coverage.","next_action_hint":"While StringInclude files are present, immediately run StringInclude-targeted tests + benchmark guard for a clean attribution attempt.","with_autocorrect_observed":592,"missing_autocorrect_observed":324,"offenses_benchmark":3992,"attribution_issue":"changed cop under test differed from post-run dirty files"}}
{"run":41,"commit":"cb5662d","metric":0,"metrics":{},"status":"crash","description":"StringInclude guarded run passed targeted tests, but post-run attribution guard failed because expected StringInclude source/fixture edits vanished before logging.","timestamp":1775702272852,"segment":0,"confidence":null,"iterationTokens":7479,"asi":{"hypothesis":"Land RuboCop-aligned Performance/StringInclude autocorrect and keep only if dirty files survive end-to-end validation.","rollback_reason":"Post-run status guard detected that `src/cop/performance/string_include.rs` and `tests/fixtures/cops/performance/string_include/corrected.rb` were no longer dirty, making metrics non-attributable.","next_action_hint":"Investigate/avoid concurrent worktree mutation (e.g., isolated worktree) and rerun only when pre/post status for target files is stable.","tests":"cargo test --lib --quiet -- cop::performance::string_include","error_signature":"post-run attribution guard failed: StringInclude edits vanished","offenses_benchmark_expected":3992}}
{"run":78,"commit":"cb5662d","metric":325,"metrics":{},"status":"discard","description":"Casecmp validation run initially reported 591/325 with invariant 3992, but immediate recheck returned to 590/326 and the source edit vanished (only orphan corrected fixture remained), so attribution is unstable.","timestamp":1775702472310,"segment":0,"confidence":15.851851851851851,"iterationTokens":1485,"asi":{"hypothesis":"Add RuboCop-aligned autocorrect for Performance/Casecmp by rewriting downcase/upcase comparisons to `casecmp(...).zero?` (negated for `!=`).","rollback_reason":"Post-run working tree lost `src/cop/performance/casecmp.rs` changes while metrics reverted to baseline.","next_action_hint":"Isolate Casecmp edits in a dedicated worktree and verify both source + corrected fixture persist before logging keep.","tests":"cargo test --lib --quiet -- cop::performance::casecmp","with_autocorrect_observed":591,"with_autocorrect_rechecked":590,"missing_autocorrect_observed":325,"missing_autocorrect_rechecked":326,"offenses_benchmark":3992}}
{"run":72,"commit":"cb5662d","metric":591,"metrics":{},"status":"discard","description":"Measured temporary improvement to 591/325 with invariant 3992, but post-run worktree returned to baseline (no surviving Casecmp/StringInclude autocorrect deltas; count back to 590/326), so not attributable/persistent.","timestamp":1775702509285,"segment":0,"confidence":null,"iterationTokens":6291,"asi":{"hypothesis":"Add autocorrect for Performance/Casecmp (and validate alongside StringInclude to tolerate file-swap churn).","rollback_reason":"Improved count was transient during run; by post-check the source/fixture deltas had disappeared and baseline count restored.","next_action_hint":"Treat environment as concurrently mutating; only keep when post-run count and file diffs still reflect the tested change at log time.","with_autocorrect_observed":591,"missing_autocorrect_observed":325,"offenses_benchmark":3992,"post_run_count_reverted_to":590}}
{"run":79,"commit":"c67acc1","metric":325,"metrics":{},"status":"keep","description":"Added RuboCop-aligned autocorrect for Performance/StringInclude by rewriting literal-only regex `match/match?/=~/!~` forms to `include?`/`!include?` across receiver orientations, including control/meta escape decoding (`\\c`, `\\C-`, `\\M-`), with corrected fixture coverage; benchmark invariant remained 3992.","timestamp":1775702810024,"segment":0,"confidence":15.5,"iterationTokens":6548,"asi":{"hypothesis":"StringInclude offense forms are deterministic whole-node rewrites once literal-only regex guards pass, so adding autocorrect should safely reduce missing_autocorrect by 1 while preserving offense counts.","rubocop_reference":"vendor/rubocop-performance/lib/rubocop/cop/performance/string_include.rb","implemented_cop":"Performance/StringInclude","tests":"cargo test --lib --quiet -- cop::performance::string_include","with_autocorrect_after":591,"missing_autocorrect_after":325,"offenses_benchmark":3992}}
{"run":73,"commit":"0ca7fdb","metric":591,"metrics":{},"status":"keep","description":"Added RuboCop-aligned autocorrect for Performance/StringInclude by rewriting literal-regex `match/match?/=~/!~/===` forms to `include?`/`!include?` with conservative escape decoding (including control/meta escapes), plus corrected fixture coverage; targeted tests pass and benchmark offenses remain 3992.","timestamp":1775702817073,"segment":0,"confidence":null,"iterationTokens":6291,"asi":{"hypothesis":"Implement StringInclude autocorrect with receiver-orientation parity and RuboCop-style escape interpretation while preserving literal-only safety checks.","validation":"cargo test --lib --quiet -- cop::performance::string_include; count_missing_autocorrect; release benchmark invariant guard","with_autocorrect_observed":591,"missing_autocorrect_observed":325,"offenses_benchmark":3992,"notes":"Pre/post dirty-file guards remained stable for string_include.rs and corrected fixture during run."}}
{"run":74,"commit":"6e281e2","metric":593,"metrics":{},"status":"keep","description":"Added RuboCop-aligned autocorrect for Performance/DoubleStartEndWith by combining duplicate `start_with?`/`end_with?` `||` chains and negated `&&` forms into multi-argument calls, with purity/receiver guards and corrected fixture coverage; targeted tests pass and benchmark offenses remain 3992.","timestamp":1775703025024,"segment":0,"confidence":null,"iterationTokens":9542,"asi":{"hypothesis":"Enable safe autocorrect for DoubleStartEndWith by rewriting only same-receiver pairs with pure second-call arguments, preserving method/operator forms.","validation":"cargo test --lib --quiet -- cop::performance::double_start_end_with; count_missing_autocorrect; release benchmark offense guard","with_autocorrect_observed":593,"missing_autocorrect_observed":323,"offenses_benchmark":3992,"notes":"Pre/post dirty-file guards stayed stable for double_start_end_with.rs and corrected fixture during run."}}
{"run":80,"commit":"6e281e2","metric":593,"metrics":{},"status":"discard","description":"DoubleStartEndWith validation run passed tests and benchmark invariant, but branch advanced mid-cycle (DoubleStartEndWith already committed at HEAD and unrelated Caller edits appeared), and post-run count moved to 594/322; datapoint is non-attributable/stale.","timestamp":1775703076123,"segment":0,"confidence":14.96551724137931,"iterationTokens":6621,"asi":{"hypothesis":"Add autocorrect for Performance/DoubleStartEndWith by combining duplicate `start_with?`/`end_with?` chains into multi-arg forms (including negated `&&`).","rollback_reason":"Run metrics (593/323) no longer matched immediate post-run state (594/322) after concurrent branch churn introduced additional changes.","next_action_hint":"Rebaseline from current HEAD 6e281e2 (and isolate work) before attempting next cop; keep only runs where measured metrics match immediate recheck.","tests":"cargo test --lib --quiet -- cop::performance::double_start_end_with","with_autocorrect_observed":593,"with_autocorrect_rechecked":594,"missing_autocorrect_observed":323,"missing_autocorrect_rechecked":322,"offenses_benchmark":3992,"attribution_issue":"unrelated src/cop/performance/caller.rs edits present post-run"}}
{"run":75,"commit":"6e281e2","metric":0,"metrics":{},"status":"crash","description":"Caller experiment aborted at preflight: expected caller source/fixture dirty files disappeared before tests, so attribution was unsafe.","timestamp":1775703106815,"segment":0,"confidence":null,"iterationTokens":5086,"asi":{"hypothesis":"Validate Performance/Caller autocorrect changes currently appearing in worktree (+1 with_autocorrect).","rollback_reason":"Pre-run guard failed because `src/cop/performance/caller.rs` and corrected fixture were no longer present by execution time.","next_action_hint":"Only run experiments against files confirmed present immediately before run; if drift persists, wait for stable candidate or switch to hand-authored isolated patch.","error_signature":"preflight dirty-file mismatch (caller files vanished)"}}
{"run":42,"commit":"030b46a","metric":594,"metrics":{},"status":"keep","description":"Added RuboCop-aligned autocorrect for Performance/Caller by rewriting `caller.first`/`caller[n]` and `caller_locations` variants to `caller(m..m).first` with index arithmetic parity, plus corrected fixture coverage; targeted tests pass and offense invariant remains 3992.","timestamp":1775703268490,"segment":0,"confidence":null,"iterationTokens":41340,"asi":{"hypothesis":"Performance/Caller offense shapes are deterministic and can be safely autocorrected to range-form `caller(...).first` exactly as RuboCop computes offsets.","rubocop_reference":"vendor/rubocop-performance/lib/rubocop/cop/performance/caller.rb","implemented_cop":"Performance/Caller","tests":"cargo test --lib --quiet -- cop::performance::caller","with_autocorrect_after":594,"missing_autocorrect_after":322,"offenses_benchmark":3992}}
{"run":81,"commit":"030b46a","metric":322,"metrics":{},"status":"discard","description":"Validation run on advanced HEAD passed Caller tests and benchmark invariant at 594/322, but the Caller autocorrect patch was already committed on branch before logging; this cycle had no fresh local delta to attribute.","timestamp":1775703316110,"segment":0,"confidence":14.466666666666667,"iterationTokens":8161,"asi":{"hypothesis":"Verify newly landed Performance/Caller autocorrect stability and offense-invariant safety.","rollback_reason":"Primary metric movement originated from already-landed commit `030b46a79`, not a new isolated patch in this logged iteration.","next_action_hint":"Use 594/322 as new baseline and continue with next missing-autocorrect candidate after pruning ideas.","tests":"cargo test --lib --quiet -- cop::performance::caller","with_autocorrect_observed":594,"missing_autocorrect_observed":322,"offenses_benchmark":3992,"head_commit_validated":"030b46a79"}}
{"run":76,"commit":"030b46a","metric":0,"metrics":{},"status":"crash","description":"Caller validation command exited before metric emission due post-run attribution guard; targeted tests passed, but dirty files disappeared during run. Environment concurrently advanced to new HEAD with Caller autocorrect landed.","timestamp":1775703328338,"segment":0,"confidence":null,"iterationTokens":4880,"asi":{"hypothesis":"Land Performance/Caller autocorrect with `caller(m..m).first` rewrites and corrected fixtures.","rollback_reason":"Post-run file-presence guard failed (expected caller dirty files vanished), causing command exit 1.","next_action_hint":"Rebaseline from new HEAD and run a pure validation experiment to confirm invariant/metrics on stable tree.","error_signature":"guard failure after tests; no METRIC lines emitted","head_after_run":"030b46a79","with_autocorrect_after_run":594,"missing_autocorrect_after_run":322}}
{"run":82,"commit":"592996c","metric":321,"metrics":{},"status":"keep","description":"Added RuboCop-aligned autocorrect for Performance/RedundantStringChars (first/last/[]/slice/take/length/size/empty? rewrites with safe-nav and arg-shape guards), added corrected fixture coverage, and pruned stale Caller idea; targeted tests pass and offense invariant remains 3992.","timestamp":1775703655004,"segment":0,"confidence":15.241379310344827,"iterationTokens":8161,"asi":{"hypothesis":"Implement autocorrect for Performance/RedundantStringChars to reduce missing_autocorrect by 1 without changing detected offenses.","tests":"cargo test --lib --quiet -- cop::performance::redundant_string_chars","with_autocorrect_observed":595,"missing_autocorrect_observed":321,"offenses_benchmark":3992,"ruboCop_alignment":"Mirrors vendor replacement patterns for []/slice/first/last/take/length/size/empty? and keeps RuboCop exclusions for safe-nav and last(n)/two-arg []"}}
{"run":77,"commit":"030b46a","metric":0,"metrics":{},"status":"crash","description":"Bundled validation run for multiple pending cops failed attribution guards: dirty-file set collapsed mid-run to only RedundantStringChars, so bundled result could not be trusted.","timestamp":1775703660726,"segment":0,"confidence":null,"iterationTokens":17483,"asi":{"hypothesis":"Validate combined autocorrect batch (Casecmp/DoubleStartEndWith/RedundantStringChars/Squeeze/WhereRange).","rollback_reason":"Post-run file set no longer matched pre-run multi-file batch; concurrent mutation left only RedundantStringChars edits.","next_action_hint":"Run an isolated guarded experiment for RedundantStringChars immediately while those files are present.","error_signature":"mid-run dirty-file set collapse to redundant_string_chars only","with_autocorrect_after_failure":595,"missing_autocorrect_after_failure":321}}
