{"run":490,"commit":"e4534a2","metric":657,"metrics":{},"status":"keep","description":"Added conservative RuboCop-aligned autocorrect support for RSpec/ImplicitExpect. Baseline autocorrect now rewrites `should`/`should_not` to `is_expected.to`/`is_expected.to_not` in default style, and rewrites `is_expected.to|not_to|to_not` runners back to `should`/`should_not` in should-style config. Added supports_autocorrect and focused bidirectional tests; offense invariant remains 3992.","timestamp":1775776219032,"segment":1,"confidence":20.53125,"iterationTokens":1687,"asi":{"hypothesis":"ImplicitExpect can safely gain autocorrect via runner-token replacement, mirroring RuboCop's enforced replacement mapping for should/is_expected forms.","implemented_cop":"RSpec/ImplicitExpect","rubocop_reference":"vendor/rubocop-rspec/lib/rubocop/cop/rspec/implicit_expect.rb","tests":"cargo test --lib --quiet -- cop::rspec::implicit_expect","with_autocorrect_after":657,"missing_autocorrect_after":259,"offenses_benchmark":3992,"dead_end_note":"First attempt accidentally kept a receiverless guard that prevented should-style `is_expected.to` detection; fixed by allowing receivered `to/not_to/to_not` path.","next_action_hint":"Continue with low-risk RSpec token/range rewrites (e.g., ImplicitSubject or metadata style) before structural aggregation cops."}}
{"run":491,"commit":"89ed5c5","metric":658,"metrics":{},"status":"keep","description":"Added conservative RuboCop-aligned autocorrect support for FactoryBot/SyntaxMethods. For FactoryBot DSL calls inside example groups, autocorrect now removes the `FactoryBot.` receiver prefix (e.g., `FactoryBot.create(:x)` -> `create(:x)`). Added supports_autocorrect and focused autocorrect test coverage; offense invariant remains 3992.","timestamp":1775776428891,"segment":1,"confidence":20.5625,"iterationTokens":16867,"asi":{"hypothesis":"SyntaxMethods can safely gain autocorrect by deleting only the receiver-prefix range before the method selector on already-detected FactoryBot calls in example groups.","implemented_cop":"FactoryBot/SyntaxMethods","rubocop_reference":"vendor/rubocop-factory_bot/lib/rubocop/cop/factory_bot/syntax_methods.rb","tests":"cargo test --lib --quiet -- cop::factory_bot::syntax_methods","with_autocorrect_after":658,"missing_autocorrect_after":258,"offenses_benchmark":3992,"safety_guard":"Autocorrect only when call receiver matches FactoryBot and node is inside detected RSpec example groups.","next_action_hint":"Continue with other factory_bot token-level cops with upstream AutoCorrector support (e.g., association_style/factory_name_style) before riskier structural RSpec cops."}}
{"run":492,"commit":"501ec74","metric":659,"metrics":{},"status":"keep","description":"Added conservative RuboCop-aligned autocorrect support for FactoryBot/AssociationStyle. Baseline autocorrect converts deterministic `association :name` forms (implicit style enforcement) to bare implicit association calls (`name`). Added supports_autocorrect and focused autocorrect test coverage; offense invariant remains 3992.","timestamp":1775778063856,"segment":1,"confidence":20.59375,"iterationTokens":10287,"asi":{"hypothesis":"AssociationStyle can safely gain initial autocorrect with a narrow conversion of single-symbol explicit associations to implicit style while deferring complex options/trait/factory rewrites.","implemented_cop":"FactoryBot/AssociationStyle","rubocop_reference":"vendor/rubocop-factory_bot/lib/rubocop/cop/factory_bot/association_style.rb","tests":"cargo test --lib --quiet -- cop::factory_bot::association_style","with_autocorrect_after":659,"missing_autocorrect_after":257,"offenses_benchmark":3992,"safety_guard":"Autocorrect only when offense node is exact `association :symbol` with no extra args/options.","next_action_hint":"Follow up with broader AssociationStyle parity for factory/trait option rewriting and explicit-style conversion paths."}}
{"run":493,"commit":"75e38a4","metric":660,"metrics":{},"status":"keep","description":"Added conservative RuboCop-aligned autocorrect support for FactoryBot/FactoryNameStyle. Baseline autocorrect rewrites flagged factory name arguments between string/symbol style by replacing only the first-argument token (`'user'` -> `:user`, `:user` -> \"user\"), while preserving namespaced-string exclusions. Added supports_autocorrect and focused autocorrect tests; offense invariant remains 3992.","timestamp":1775778251413,"segment":1,"confidence":20.625,"iterationTokens":6658,"asi":{"hypothesis":"FactoryNameStyle can safely gain autocorrect through first-argument token substitution on already-flagged calls, matching style-config intent with minimal range risk.","implemented_cop":"FactoryBot/FactoryNameStyle","rubocop_reference":"vendor/rubocop-factory_bot/lib/rubocop/cop/factory_bot/factory_name_style.rb","tests":"cargo test --lib --quiet -- cop::factory_bot::factory_name_style","with_autocorrect_after":660,"missing_autocorrect_after":256,"offenses_benchmark":3992,"safety_guard":"Autocorrect only on first-arg string/symbol offenses; namespaced strings (`users/internal`) remain excluded as before.","next_action_hint":"Continue with factory_bot cops that have AutoCorrector and similarly local edits (e.g., consistent_parentheses_style/factory_class_name) before heavier structural rewrites."}}
{"run":494,"commit":"057d51e","metric":661,"metrics":{},"status":"keep","description":"Added conservative RuboCop-aligned autocorrect support for FactoryBot/FactoryClassName. For `factory ... class: CONST` offenses, autocorrect now rewrites only the constant value token to a quoted string (`Foo` -> `'Foo'`, `Foo::Bar` -> `'Foo::Bar'`), preserving existing allowed constants and detection behavior. Added supports_autocorrect and focused autocorrect tests; offense invariant remains 3992.","timestamp":1775778530884,"segment":1,"confidence":20.65625,"iterationTokens":14293,"asi":{"hypothesis":"FactoryClassName can safely gain autocorrect via local value-token replacement for class constants, matching RuboCop's string-literal recommendation without structural edits.","implemented_cop":"FactoryBot/FactoryClassName","rubocop_reference":"vendor/rubocop-factory_bot/lib/rubocop/cop/factory_bot/factory_class_name.rb","tests":"cargo test --lib --quiet -- cop::factory_bot::factory_class_name","with_autocorrect_after":661,"missing_autocorrect_after":255,"offenses_benchmark":3992,"safety_guard":"Correction only replaces the `class:` value node; allowed constants (Hash/OpenStruct) remain uncorrected.","next_action_hint":"Continue low-risk FactoryBot cops with local edits (e.g., IdSequence / RedundantFactoryOption), then prune ideas for already-landed work."}}
{"run":495,"commit":"0e75063","metric":662,"metrics":{},"status":"keep","description":"Added conservative RuboCop-aligned autocorrect support for FactoryBot/IdSequence. For `sequence :id` offenses, autocorrect now removes the offending sequence call statement range (including indentation/newline when safe), preserving surrounding factory body content. Added supports_autocorrect and focused autocorrect test; offense invariant remains 3992.","timestamp":1775778649430,"segment":1,"confidence":20.369230769230768,"iterationTokens":10458,"asi":{"hypothesis":"IdSequence can safely gain autocorrect by deleting the offending sequence call node/line for deterministic `sequence :id` usage.","implemented_cop":"FactoryBot/IdSequence","rubocop_reference":"vendor/rubocop-factory_bot/lib/rubocop/cop/factory_bot/id_sequence.rb","tests":"cargo test --lib --quiet -- cop::factory_bot::id_sequence","with_autocorrect_after":662,"missing_autocorrect_after":254,"offenses_benchmark":3992,"safety_guard":"Only triggers for receiver nil/FactoryBot and first arg symbol `:id`; correction is local range delete.","next_action_hint":"Continue low-risk FactoryBot cops with deterministic token/range edits (e.g., RedundantFactoryOption) and prune stale idea entries for already-landed keeps."}}
{"run":496,"commit":"422a734","metric":663,"metrics":{},"status":"keep","description":"Added conservative RuboCop-aligned autocorrect support for FactoryBot/RedundantFactoryOption. For matching `association :name, factory: :name` (and `%i[name]`) offenses, autocorrect now removes just the redundant `factory:` pair with surrounding comma/space handling (left-comma preferred, right-comma fallback), preserving other options. Added supports_autocorrect and focused autocorrect tests; offense invariant remains 3992.","timestamp":1775778768483,"segment":1,"confidence":20.09090909090909,"iterationTokens":4659,"asi":{"hypothesis":"RedundantFactoryOption can safely autocorrect by deleting the redundant hash pair range with comma-aware trimming, mirroring RuboCop behavior.","implemented_cop":"FactoryBot/RedundantFactoryOption","rubocop_reference":"vendor/rubocop-factory_bot/lib/rubocop/cop/factory_bot/redundant_factory_option.rb","tests":"cargo test --lib --quiet -- cop::factory_bot::redundant_factory_option","with_autocorrect_after":663,"missing_autocorrect_after":253,"offenses_benchmark":3992,"safety_guard":"Correction only emitted when association/factory names match current offense criteria; only offending pair and adjacent comma/space are removed.","next_action_hint":"Continue with remaining low-risk FactoryBot cops (e.g., CreateList) and keep parity-deepening ideas scoped to tested deterministic rewrites."}}
{"run":497,"commit":"8e69632","metric":664,"metrics":{},"status":"keep","description":"Added conservative RuboCop-aligned autocorrect support for FactoryBot/AttributeDefinedStatically. For deterministic single-argument static attribute calls, autocorrect now wraps the value in a block (`title \"x\"` -> `title { \"x\" }`, and parenthesized calls convert parens to braces). Kept a safety guard to skip hash-without-braces argument forms. Added supports_autocorrect and focused autocorrect test; offense invariant remains 3992.","timestamp":1775778985450,"segment":1,"confidence":19.82089552238806,"iterationTokens":56320,"asi":{"hypothesis":"AttributeDefinedStatically can safely gain baseline autocorrect by local brace-wrapping of single static attribute values while skipping ambiguous hash-without-braces forms.","implemented_cop":"FactoryBot/AttributeDefinedStatically","rubocop_reference":"vendor/rubocop-factory_bot/lib/rubocop/cop/factory_bot/attribute_defined_statically.rb","tests":"cargo test --lib --quiet -- cop::factory_bot::attribute_defined_statically","with_autocorrect_after":664,"missing_autocorrect_after":252,"offenses_benchmark":3992,"safety_guard":"Autocorrect only for single-argument calls; skips bare hash-arg shape requiring nested brace transform.","next_action_hint":"Continue with low-risk FactoryBot cops; consider parity expansion for bare-hash arg wrapping (`foo key: val` -> `foo { { key: val } }`) in a follow-up with explicit fixture coverage."}}
{"run":498,"commit":"8e69632","metric":0,"metrics":{},"status":"checks_failed","description":"Attempted to add baseline autocorrect for FactoryBot/ConsistentParenthesesStyle (require/omit styles) by inserting/removing parentheses around arguments. Targeted tests failed due formatting mismatch (`create( :user)` extra space) in require-parentheses correction output.","timestamp":1775779271805,"segment":1,"confidence":19.82089552238806,"iterationTokens":14846,"asi":{"hypothesis":"ConsistentParenthesesStyle can gain safe autocorrect via local token edits around call arguments.","rollback_reason":"Autocorrect formatting bug: replacement inserted `(` without consuming existing inter-token whitespace, producing `create( :user)` instead of `create(:user)`.","next_action_hint":"Reapply with range replacement from selector-end to first-arg-start (`\" \" -> \"(\"`) and rerun targeted cop tests + benchmark invariant checks.","error_excerpt":"autocorrects_require_parentheses_style expected create(:user) got create( :user)"}}
{"run":499,"commit":"036acc7","metric":665,"metrics":{},"status":"keep","description":"Added conservative RuboCop-aligned autocorrect support for FactoryBot/ConsistentParenthesesStyle. Baseline corrections now (a) add parentheses for require style by replacing inter-token gap before first arg and appending closing paren after args, and (b) remove opening/closing parens for omit style when existing offense guards pass (same-line arg, no value-omission hash). Added supports_autocorrect and focused style-specific autocorrect tests; offense invariant remains 3992.","timestamp":1775779401256,"segment":1,"confidence":19.558823529411764,"iterationTokens":6580,"asi":{"hypothesis":"ConsistentParenthesesStyle can safely autocorrect via local parenthesis-token edits on already-flagged calls, respecting existing ambiguity/hash guards.","implemented_cop":"FactoryBot/ConsistentParenthesesStyle","rubocop_reference":"vendor/rubocop-factory_bot/lib/rubocop/cop/factory_bot/consistent_parentheses_style.rb","tests":"cargo test --lib --quiet -- cop::factory_bot::consistent_parentheses_style","with_autocorrect_after":665,"missing_autocorrect_after":251,"offenses_benchmark":3992,"safety_guard":"Reuse existing offense filters (ambiguous-parent skip, generate-args exclusion, same-line/omit-hash checks) and apply only local token edits.","iteration_note":"First attempt failed due extra-space formatting (`create( :user)`); fixed by replacing selector-end..first-arg-start range with '('."}}
{"run":500,"commit":"7909c95","metric":666,"metrics":{},"status":"keep","description":"Added conservative RuboCop-aligned autocorrect support for FactoryBot/CreateList (n_times style baseline). For deterministic `create_list(...)` offenses under `EnforcedStyle: n_times`, autocorrect now rewrites whole call to `N.times.map { create(...) }`, preserving receiver prefix and argument list text. Added supports_autocorrect and focused n_times autocorrect test; offense invariant remains 3992.","timestamp":1775779630235,"segment":1,"confidence":19.58823529411765,"iterationTokens":14054,"asi":{"hypothesis":"CreateList can gain safe baseline autocorrect by converting only n_times-style `create_list` offenses to equivalent `times.map` forms.","implemented_cop":"FactoryBot/CreateList","rubocop_reference":"vendor/rubocop-factory_bot/lib/rubocop/cop/factory_bot/create_list.rb","tests":"cargo test --lib --quiet -- cop::factory_bot::create_list","with_autocorrect_after":666,"missing_autocorrect_after":250,"offenses_benchmark":3992,"safety_guard":"Only autocorrect for `EnforcedStyle: n_times`, integer count >= 2, and no block on create_list call; leaves create_list-style/array/block rewrites for parity follow-up.","next_action_hint":"Finish remaining missing FactoryBot cops: evaluate conservative no-autocorrect parity stance for ExcessiveCreateList and implement deterministic baseline for FactoryAssociationWithStrategy if safe transform is identifiable."}}
{"run":501,"commit":"2842c63","metric":667,"metrics":{},"status":"keep","description":"Added conservative RuboCop-aligned autocorrect support for RSpec/EmptyExampleGroup. For flagged empty example-group calls with blocks, autocorrect now removes the whole group node range (including leading indentation and trailing newline when safe), preserving surrounding examples/groups. Added supports_autocorrect and focused removal test coverage; offense invariant remains 3992.","timestamp":1775779804901,"segment":1,"confidence":19.61764705882353,"iterationTokens":27735,"asi":{"hypothesis":"EmptyExampleGroup can safely autocorrect by deleting the offending empty group block range, matching RuboCop whole-node removal behavior.","implemented_cop":"RSpec/EmptyExampleGroup","rubocop_reference":"vendor/rubocop-rspec/lib/rubocop/cop/rspec/empty_example_group.rb","tests":"cargo test --lib --quiet -- cop::rspec::empty_example_group","with_autocorrect_after":667,"missing_autocorrect_after":249,"offenses_benchmark":3992,"safety_guard":"Autocorrect emitted only for already-flagged empty groups; range expansion to line start/newline is whitespace-aware.","next_action_hint":"Continue with deterministic RSpec candidates with node-level rewrites/removals (e.g., ReceiveMessages grouping baseline) and validate against fixture edge scenarios."}}
{"run":502,"commit":"b70e5f0","metric":668,"metrics":{},"status":"keep","description":"Added conservative nitrocop autocorrect baseline for FactoryBot/FactoryAssociationWithStrategy. For deterministic single-argument hardcoded strategy calls inside association blocks (`create|build|build_stubbed(:profile)`), autocorrect now rewrites inner call to `association(:profile)` while preserving offense detection behavior. Added supports_autocorrect and focused autocorrect test; offense invariant remains 3992.","timestamp":1775780076486,"segment":1,"confidence":19.647058823529413,"iterationTokens":12661,"asi":{"hypothesis":"FactoryAssociationWithStrategy can safely gain baseline autocorrect for the narrowest deterministic case by replacing hardcoded strategy calls with inline `association(...)`.","implemented_cop":"FactoryBot/FactoryAssociationWithStrategy","rubocop_reference":"vendor/rubocop-factory_bot/lib/rubocop/cop/factory_bot/factory_association_with_strategy.rb","tests":"cargo test --lib --quiet -- cop::factory_bot::factory_association_with_strategy","with_autocorrect_after":668,"missing_autocorrect_after":248,"offenses_benchmark":3992,"safety_guard":"Correction only applies to single symbol/string argument strategy calls; multi-arg/procedural forms remain diagnostic-only.","next_action_hint":"Only FactoryBot/ExcessiveCreateList remains missing in factory_bot. Decide whether to leave it diagnostic-only (upstream no autocorrect) or add explicit nitrocop policy for unsafe correction."}}
{"run":503,"commit":"3e3f592","metric":669,"metrics":{},"status":"keep","description":"Added conservative RuboCop-aligned autocorrect baseline for RSpec/ReceiveMessages. For deterministic repeated-stub groups (same receiver, unique symbol message keys, multi-line), autocorrect now collapses stubs into a single `allow(...).to receive_messages(...)` statement and removes the redundant sibling stub lines. Added supports_autocorrect and focused autocorrect test; offense invariant remains 3992.","timestamp":1775780265268,"segment":1,"confidence":19.676470588235293,"iterationTokens":1300,"asi":{"hypothesis":"ReceiveMessages can gain safe baseline autocorrect by collapsing only straightforward repeated `allow(...).to receive(:sym).and_return(...)` groups into `receive_messages` while preserving existing offense filtering.","implemented_cop":"RSpec/ReceiveMessages","rubocop_reference":"vendor/rubocop-rspec/lib/rubocop/cop/rspec/receive_messages.rb","tests":"cargo test --lib --quiet -- cop::rspec::receive_messages","with_autocorrect_after":669,"missing_autocorrect_after":247,"offenses_benchmark":3992,"safety_guard":"Correction requires at least two correction-eligible unique symbol keys and multi-line grouping; complex/non-symbol forms remain diagnostic-only.","error_recovery":"Initial compile failed (E0507 move out of vec index for return arg); fixed by borrowing node reference.","next_action_hint":"Broaden parity toward RuboCop line-selection/order semantics and quoted-key normalization for non-identifier symbols, with fixture-level corrected snapshots."}}
{"run":504,"commit":"8aa0d59","metric":670,"metrics":{},"status":"keep","description":"Added conservative autocorrect baseline for RSpec/VerifiedDoubles. For deterministic named double/spy offenses with string or constant first argument, autocorrect now rewrites selector token (`double` -> `instance_double`, `spy` -> `instance_spy`) while preserving arguments and existing IgnoreNameless/IgnoreSymbolicNames behavior. Added supports_autocorrect and focused autocorrect test; offense invariant remains 3992.","timestamp":1775780473993,"segment":1,"confidence":19.420289855072465,"iterationTokens":8066,"asi":{"hypothesis":"VerifiedDoubles can safely gain baseline autocorrect via selector-only rewrites for clearly class/object-named doubles without changing argument structure.","implemented_cop":"RSpec/VerifiedDoubles","rubocop_reference":"vendor/rubocop-rspec/lib/rubocop/cop/rspec/verified_doubles.rb","tests":"cargo test --lib --quiet -- cop::rspec::verified_doubles","with_autocorrect_after":670,"missing_autocorrect_after":246,"offenses_benchmark":3992,"safety_guard":"Autocorrect restricted to first arg string/constant forms; symbolic/nameless/hash-name cases remain diagnostic-only.","next_action_hint":"Continue with low-risk RSpec candidates and add parity follow-up for whether class_double/object_double mapping should be introduced under configurable strategy."}}
