{"run":91,"commit":"aad5169","metric":597,"metrics":{},"status":"discard","description":"Baseline calibration: switched offense-invariant guard to faster debug invocation (`cargo run --quiet`) and confirmed stable 597/319 with 3992 offenses; no implementation delta in this cycle.","timestamp":1775706451852,"segment":0,"confidence":null,"iterationTokens":1401,"asi":{"hypothesis":"A faster invariant guard command may reduce shared-tree churn exposure during experiments.","rollback_reason":"No code changes were introduced; this run only established a quicker validation path.","next_action_hint":"Use `cargo run --quiet -- ~/Dev/wt-gph-rspec-rip-out` for invariant checks in subsequent isolated autocorrect experiments.","with_autocorrect_observed":597,"missing_autocorrect_observed":319,"offenses_benchmark":3992,"benchmark_command":"cargo run --quiet -- ~/Dev/wt-gph-rspec-rip-out"}}
{"run":93,"commit":"aad5169","metric":0,"metrics":{},"status":"crash","description":"RedundantSortBlock reattempt failed pre-test persistence guard immediately: both source and corrected fixture disappeared before execution, so run was aborted to avoid misattributed benchmark data.","timestamp":1775706470699,"segment":0,"confidence":11.736842105263158,"iterationTokens":6571,"asi":{"hypothesis":"Re-land Performance/RedundantSortBlock autocorrect with strict pre/post persistence guards to ensure attribution integrity.","rollback_reason":"Pre-run guard failed because expected edits (`supports_autocorrect` + corrected fixture) were absent before tests started, indicating active workspace churn.","next_action_hint":"Do not attempt new behavior patches in this shared tree until isolation is established; prioritize workspace stability experiment path first.","guard":"pre-test persistence guard on src/cop/performance/redundant_sort_block.rs and corrected fixture"}}
{"run":94,"commit":"aad5169","metric":319,"metrics":{},"status":"discard","description":"Workspace-stability probe run (hash sampling on frequently churned cop files) found no spontaneous content flips during the short probe window; baseline remains 597/319 with offense invariant 3992.","timestamp":1775706545753,"segment":0,"confidence":11.435897435897436,"iterationTokens":1419,"asi":{"hypothesis":"Measure whether shared-tree file churn can be detected without intentional edits before attempting more autocorrect patches.","rollback_reason":"No primary-metric improvement; this was a diagnostic control run.","next_action_hint":"Proceed with next cop attempt but keep strict pre/post persistence guards and allow only intended diffs.","probe_files":"redundant_sort_block.rs, flat_map.rs, array_semi_infinite_range_slice.rs, where_range.rs","with_autocorrect_observed":597,"missing_autocorrect_observed":319,"offenses_benchmark":3992}}
{"run":92,"commit":"aad5169","metric":0,"metrics":{},"status":"crash","description":"WhereRange rerun aborted at preflight: `src/cop/rails/where_range.rs` disappeared before tests could start, returning to baseline state.","timestamp":1775706557346,"segment":0,"confidence":null,"iterationTokens":4879,"asi":{"hypothesis":"Validate updated WhereRange autocorrect patch with faster debug invariant check to outrun churn.","rollback_reason":"Preflight guard failed because target file was no longer dirty at execution time.","next_action_hint":"Wait for a stable dirty-file window or move to isolated worktree execution; shared tree churn is erasing patches before run start.","error_signature":"preflight missing where_range.rs"}}
{"run":95,"commit":"aad5169","metric":0,"metrics":{},"status":"crash","description":"RedundantSortBlock guarded run aborted due guard bug: it checked `git diff --name-only` (which omits untracked files), so the required new corrected fixture was falsely reported missing despite existing.","timestamp":1775706670602,"segment":0,"confidence":11.435897435897436,"iterationTokens":3861,"asi":{"hypothesis":"Validate RedundantSortBlock autocorrect with strict persistence guard before logging keep.","rollback_reason":"Guard implementation error (used `git diff` for untracked fixture detection) caused false failure.","next_action_hint":"Re-run immediately with `git status --porcelain`-based guard that accepts `?? tests/.../corrected.rb` as expected.","tests":"cargo test --lib --quiet -- cop::performance::redundant_sort_block","guard_failure":"Required diff missing: tests/fixtures/cops/performance/redundant_sort_block/corrected.rb"}}
{"run":93,"commit":"aad5169","metric":0,"metrics":{},"status":"crash","description":"Inline-applied RedundantSortBlock patch passed targeted tests and offense invariant, but both source and corrected fixture vanished before post-run guard, reverting to baseline state.","timestamp":1775706702664,"segment":0,"confidence":null,"iterationTokens":3315,"asi":{"hypothesis":"Applying patch inside run command would avoid preflight churn and allow an attribution-clean keep.","rollback_reason":"Post-run shared-tree mutation still removed all patch files before logging, so result remained non-attributable.","next_action_hint":"Require isolated worktree/process lock; shared branch is mutating faster than a full test+benchmark cycle.","tests":"cargo test --lib --quiet -- cop::performance::redundant_sort_block","with_autocorrect_observed_during_run":598,"missing_autocorrect_observed_during_run":318,"offenses_benchmark":3992,"error_signature":"post-run dirty-set collapsed to empty"}}
{"run":94,"commit":"aad5169","metric":598,"metrics":{},"status":"discard","description":"Fast invariant-command calibration (`target/debug/nitrocop`) showed 598/318 with 3992 offenses, but this run did not execute targeted cop tests for the concurrently dirty RedundantSortBlock patch, so result is not keep-eligible.","timestamp":1775706736291,"segment":0,"confidence":null,"iterationTokens":1227,"asi":{"hypothesis":"Using the built debug binary directly could shrink benchmark time enough to beat shared-tree churn.","rollback_reason":"Run lacked required targeted test validation for active cop/fixture changes; metrics are observational only.","next_action_hint":"If RedundantSortBlock files persist, rerun immediately with `cargo test --lib --quiet -- cop::performance::redundant_sort_block` plus fast `target/debug/nitrocop` guard.","with_autocorrect_observed":598,"missing_autocorrect_observed":318,"offenses_benchmark":3992,"benchmark_command":"target/debug/nitrocop ~/Dev/wt-gph-rspec-rip-out"}}
{"run":96,"commit":"aad5169","metric":0,"metrics":{},"status":"crash","description":"RedundantSortBlock reattempt with improved porcelain-based guard still failed: intended source and fixture paths disappeared during test run before metric collection, so attribution was blocked.","timestamp":1775706789230,"segment":0,"confidence":11.435897435897436,"iterationTokens":3580,"asi":{"hypothesis":"Land RedundantSortBlock autocorrect with robust persistence/confounder guards and keep only if intended paths survive through full run.","rollback_reason":"Guard failed (`src/cop/performance/redundant_sort_block.rs` missing) because patch state vanished mid-run under active workspace churn.","next_action_hint":"Suspend cop-level implementation attempts in this workspace; only baseline/control runs until isolation is available.","tests":"cargo test --lib --quiet -- cop::performance::redundant_sort_block","guard_failure":"Required path missing: src/cop/performance/redundant_sort_block.rs"}}
{"run":95,"commit":"cc443d1","metric":598,"metrics":{},"status":"keep","description":"Added RuboCop-aligned autocorrect for Performance/RedundantSortBlock by rewriting `sort { |a, b| a <=> b }` (and `_1 <=> _2`) to `sort`, with corrected fixture coverage; targeted tests pass and offense invariant remains 3992.","timestamp":1775706845883,"segment":0,"confidence":null,"iterationTokens":3801,"asi":{"hypothesis":"RedundantSortBlock offenses are deterministic selector-range rewrites, so replacing the block form with bare `sort` should safely increase autocorrect coverage by +1.","rubocop_reference":"vendor/rubocop-performance/lib/rubocop/cop/performance/redundant_sort_block.rb","implemented_cop":"Performance/RedundantSortBlock","tests":"cargo test --lib --quiet -- cop::performance::redundant_sort_block","with_autocorrect_after":598,"missing_autocorrect_after":318,"offenses_benchmark":3992,"benchmark_command":"target/debug/nitrocop ~/Dev/wt-gph-rspec-rip-out","pre_post_guard":"redundant_sort_block.rs + corrected.rb stable"}}
{"run":97,"commit":"cc443d1","metric":318,"metrics":{},"status":"discard","description":"Baseline validation on advanced HEAD confirmed branch moved to 598/318 with invariant 3992 (RedundantSortBlock autocorrect now present in history), but this cycle had no fresh local delta to attribute.","timestamp":1775706879589,"segment":0,"confidence":10.619047619047619,"iterationTokens":1211,"asi":{"hypothesis":"Reconfirm primary metric and offense invariant after repeated churn incidents before attributing any keep.","rollback_reason":"Observed improvement came from already-landed commit `cc443d18a`, not a new isolated patch in this logged run.","next_action_hint":"Treat 598/318 as new baseline and target next unresolved cop after pruning ideas.","with_autocorrect_observed":598,"missing_autocorrect_observed":318,"offenses_benchmark":3992,"head_commit_validated":"cc443d18a"}}
{"run":96,"commit":"71e9106","metric":600,"metrics":{},"status":"keep","description":"Landed two autocorrect additions in one attribution-clean run: Performance/FlatMap (`map/collect...flatten(1)` -> `flat_map`) and Rails/WhereRange (simple SQL range conditions -> hash ranges), with fixture coverage and passing targeted tests; offense invariant remains 3992.","timestamp":1775707012146,"segment":0,"confidence":null,"iterationTokens":965,"asi":{"hypothesis":"Combining surviving FlatMap+WhereRange patches in one fast validation run can safely improve coverage by +2 when guarded pre/post file sets remain stable.","implemented_cops":["Performance/FlatMap","Rails/WhereRange"],"tests":"cargo test --lib --quiet -- cop::performance::flat_map && cargo test --lib --quiet -- cop::rails::where_range","with_autocorrect_after":600,"missing_autocorrect_after":316,"offenses_benchmark":3992,"benchmark_command":"target/debug/nitrocop ~/Dev/wt-gph-rspec-rip-out","pre_post_guard":"flat_map.rs + where_range.rs + flat_map/corrected.rb stable"}}
{"run":98,"commit":"cc443d1","metric":0,"metrics":{},"status":"crash","description":"FlatMap attempt passed targeted tests but attribution guard aborted due unexpected concurrent diff in `src/cop/rails/where_range.rs`; run treated as confounded and unusable for keep/discard metric comparison.","timestamp":1775707017192,"segment":0,"confidence":10.619047619047619,"iterationTokens":5277,"asi":{"hypothesis":"Land Performance/FlatMap autocorrect with persistence guard and keep only with clean, attributable diff set.","rollback_reason":"Guard detected unrelated `where_range` mutation during run, confounding attribution.","next_action_hint":"Require clean diff set before cop attempts or explicitly isolate in a dedicated worktree to avoid cross-cop churn.","tests":"cargo test --lib --quiet -- cop::performance::flat_map","confounder":"src/cop/rails/where_range.rs","local_counts_after_failure":"with_autocorrect=600 missing_autocorrect=316 (confounded state)"}}
{"run":99,"commit":"71e9106","metric":316,"metrics":{},"status":"discard","description":"Long baseline validation run on advanced HEAD confirmed stable 600/316 with benchmark offense invariant 3992 after landed FlatMap+WhereRange commit; no new isolated local delta in this cycle.","timestamp":1775712085067,"segment":0,"confidence":10.372093023255815,"iterationTokens":9935,"asi":{"hypothesis":"Confirm new post-landing baseline and invariant before starting next cop attempt.","rollback_reason":"Control run only; no fresh optimization patch was applied in this logged cycle.","next_action_hint":"Use 600/316 as the working baseline and proceed with next unresolved autocorrect candidate from ideas.","with_autocorrect_observed":600,"missing_autocorrect_observed":316,"offenses_benchmark":3992,"head_commit_validated":"71e91065f"}}
{"run":100,"commit":"adabd97","metric":315,"metrics":{},"status":"keep","description":"Added RuboCop-aligned autocorrect for Performance/ArraySemiInfiniteRangeSlice (`[]/slice` with semi-infinite ranges -> `drop/take`) including hex/binary/octal literal handling and corrected fixture coverage; targeted tests pass and offense invariant remains 3992.","timestamp":1775712293945,"segment":0,"confidence":10.318181818181818,"iterationTokens":7162,"asi":{"hypothesis":"Implement ArraySemiInfiniteRangeSlice autocorrect to reduce missing_autocorrect by 1 while preserving offense count.","tests":"cargo test --lib --quiet -- cop::performance::array_semi_infinite_range_slice","with_autocorrect_observed":601,"missing_autocorrect_observed":315,"offenses_benchmark":3992,"recheck_with_autocorrect":601,"recheck_missing_autocorrect":315,"ruboCop_alignment":"Matches RuboCop replacements: endless ranges -> drop(n), beginless inclusive/exclusive -> take(n+1)/take(n)"}}
{"run":97,"commit":"adabd97","metric":0,"metrics":{},"status":"crash","description":"Inline ArraySemiInfiniteRangeSlice run passed tests/invariant but failed strict post-run dirty-file guard because the patch was committed on HEAD mid-run (`adabd97ea`), leaving no dirty files to attribute in this cycle.","timestamp":1775712345201,"segment":0,"confidence":null,"iterationTokens":965,"asi":{"hypothesis":"Land RuboCop-style autocorrect for Performance/ArraySemiInfiniteRangeSlice via inline patch + fixture and keep only with stable pre/post file set.","rollback_reason":"Post-run guard expected dirty source+fixture, but branch advanced to committed state during run so guard failed.","next_action_hint":"Rebaseline from new HEAD (601/315) and run the next isolated missing-autocorrect candidate.","with_autocorrect_rechecked":601,"missing_autocorrect_rechecked":315,"offenses_benchmark_expected":3992,"attribution_issue":"patch committed externally during run"}}
{"run":101,"commit":"adabd97","metric":0,"metrics":{},"status":"crash","description":"RedundantEqualityComparisonBlock autocorrect attempt passed targeted tests but failed persistence guard: intended source path disappeared during run before metric collection, so attribution was blocked.","timestamp":1775712443678,"segment":0,"confidence":10.318181818181818,"iterationTokens":5477,"asi":{"hypothesis":"Add RuboCop-style autocorrect for RedundantEqualityComparisonBlock and reduce missing_autocorrect by one.","rollback_reason":"Guard failure (`src/cop/performance/redundant_equality_comparison_block.rs` missing) indicates active workspace churn erased intended patch mid-run.","next_action_hint":"Continue only with guarded runs and consider waiting for externally landed commits before attribution in this environment.","tests":"cargo test --lib --quiet -- cop::performance::redundant_equality_comparison_block","guard_failure":"Required path missing: src/cop/performance/redundant_equality_comparison_block.rs"}}
{"run":98,"commit":"adabd97","metric":0,"metrics":{},"status":"crash","description":"BigDecimal isolated run aborted at preflight: expected 2-file dirty set expanded to include CompareWithBlock source+fixture before tests started.","timestamp":1775712464381,"segment":0,"confidence":null,"iterationTokens":10959,"asi":{"hypothesis":"Land BigDecimalWithNumericArgument autocorrect in isolation (+1 coverage).","rollback_reason":"Concurrent mutation introduced additional dirty files (`compare_with_block.rs` + corrected fixture), invalidating isolation guards.","next_action_hint":"Validate the currently stable 4-file batch (BigDecimalWithNumericArgument + CompareWithBlock) together with targeted tests and invariant check.","error_signature":"preflight dirty-set expansion"}}
{"run":43,"commit":"030b46a","metric":0,"metrics":{},"status":"crash","description":"CompareWithBlock autocorrect implementation passed targeted tests but post-run attribution guard failed because expected CompareWithBlock source/fixture edits vanished before logging.","timestamp":1775712490897,"segment":0,"confidence":null,"iterationTokens":22861,"asi":{"hypothesis":"Land RuboCop-aligned Performance/CompareWithBlock autocorrect (`sort/min/max/minmax` compare blocks -> `*_by`) and keep only with persistent pre/post diffs.","rollback_reason":"Post-run status guard detected vanished `src/cop/performance/compare_with_block.rs` and `tests/fixtures/cops/performance/compare_with_block/corrected.rb` edits, making run non-attributable.","next_action_hint":"Prefer cops whose edits persist through targeted tests in current environment (as with Performance/Caller), or isolate experiments in a dedicated worktree to avoid disappearing diffs.","tests":"cargo test --lib --quiet -- cop::performance::compare_with_block","error_signature":"post-run attribution guard failed: CompareWithBlock edits vanished","offenses_benchmark_expected":3992}}
{"run":102,"commit":"adabd97","metric":315,"metrics":{},"status":"discard","description":"Control run after pruning ideas confirmed stable baseline 601/315 with offense invariant 3992 and no new attributable code delta.","timestamp":1775712522845,"segment":0,"confidence":9.869565217391305,"iterationTokens":1731,"asi":{"hypothesis":"Reconfirm baseline after guarded RedundantEqualityComparisonBlock attempts before trying next attribution-safe experiment.","rollback_reason":"No optimization patch applied in this cycle; measurement-only run.","next_action_hint":"Next cycle should either (a) run in isolated workspace for RedundantEqualityComparisonBlock, or (b) wait for new attributable landed commit before logging keep.","with_autocorrect_observed":601,"missing_autocorrect_observed":315,"offenses_benchmark":3992}}
{"run":103,"commit":"adabd97","metric":0,"metrics":{},"status":"crash","description":"CompareWithBlock autocorrect attempt passed targeted tests but failed persistence guard because intended source path disappeared during run before metric collection.","timestamp":1775712645987,"segment":0,"confidence":9.869565217391305,"iterationTokens":7608,"asi":{"hypothesis":"Add RuboCop-aligned autocorrect for CompareWithBlock (`sort/min/max/minmax` comparator blocks -> `*_by`) and reduce missing_autocorrect by 1.","rollback_reason":"Guard failure (`src/cop/performance/compare_with_block.rs` missing) indicates patch was not persistent in this workspace.","next_action_hint":"Continue with guarded attempts only; attribute keeps only when required paths survive through post-test guard.","tests":"cargo test --lib --quiet -- cop::performance::compare_with_block","guard_failure":"Required path missing: src/cop/performance/compare_with_block.rs"}}
{"run":44,"commit":"88ba932","metric":602,"metrics":{},"status":"keep","description":"Added RuboCop-aligned autocorrect for Performance/BlockGivenWithExplicitBlock by replacing `block_given?`/`Kernel.block_given?` calls with explicit block-param checks (including defaults/keyword-value positions), with corrected fixture coverage; targeted tests pass and offense invariant remains 3992.","timestamp":1775712650779,"segment":0,"confidence":null,"iterationTokens":7798,"asi":{"hypothesis":"Performance/BlockGivenWithExplicitBlock can safely autocorrect by replacing each offense call node with the method’s explicit `&block` parameter name, matching RuboCop’s replacement semantics.","rubocop_reference":"vendor/rubocop-performance/lib/rubocop/cop/performance/block_given_with_explicit_block.rb","implemented_cop":"Performance/BlockGivenWithExplicitBlock","tests":"cargo test --lib --quiet -- cop::performance::block_given_with_explicit_block","with_autocorrect_after":602,"missing_autocorrect_after":314,"offenses_benchmark":3992}}
{"run":99,"commit":"88ba932","metric":0,"metrics":{},"status":"crash","description":"BlockGivenWithExplicitBlock run passed targeted tests/invariant but failed strict post-run guard because the patch committed to HEAD (`88ba932b0`) during execution, leaving no dirty files.","timestamp":1775712689809,"segment":0,"confidence":null,"iterationTokens":16043,"asi":{"hypothesis":"Land RuboCop-aligned autocorrect for BlockGivenWithExplicitBlock with corrected fixture and guarded attribution.","rollback_reason":"Post-run expected dirty files were absent because branch advanced to committed state mid-run.","next_action_hint":"Rebaseline at 601/315 and target the next surviving missing-autocorrect cop.","with_autocorrect_rechecked":601,"missing_autocorrect_rechecked":315,"offenses_benchmark_expected":3992,"attribution_issue":"patch committed externally during run"}}
{"run":104,"commit":"88ba932","metric":315,"metrics":{},"status":"discard","description":"Baseline validation on advanced HEAD (including newly landed BlockGivenWithExplicitBlock autocorrect commit) shows stable 601/315 with offense invariant 3992; no fresh local delta to attribute.","timestamp":1775712720046,"segment":0,"confidence":9.458333333333334,"iterationTokens":1603,"asi":{"hypothesis":"Reconfirm primary metric and invariant after external head advancement before next guarded cop attempt.","rollback_reason":"Control run only; no new isolated optimization patch in this cycle.","next_action_hint":"Select next unresolved candidate (e.g., RedundantEqualityComparisonBlock) and keep strict persistence guards.","with_autocorrect_observed":601,"missing_autocorrect_observed":315,"offenses_benchmark":3992,"head_commit_validated":"88ba932b0"}}
