{"run":4,"commit":"46b191d","metric":551,"metrics":{},"status":"keep","description":"Added RuboCop-aligned autocorrect for Rails/EnumHash by converting enum array syntax to explicit index hash (`{... => 0, ...}`) for old and new enum call forms; targeted tests passed and benchmark offense invariant remained 3992.","timestamp":1775683226851,"segment":0,"confidence":null,"iterationTokens":5125,"asi":{"hypothesis":"Rails/EnumHash is a deterministic array-node replacement and should safely increase with_autocorrect by +1 without offense drift.","rubocop_reference":"vendor/rubocop-rails/lib/rubocop/cop/rails/enum_hash.rb","implemented_cop":"Rails/EnumHash","tests":"cargo test --lib -- cop::rails::enum_hash","with_autocorrect_after":551,"missing_autocorrect_after":365,"offenses_benchmark":3992,"ideas_review":"Pruned stale completed idea for Rails/ReflectionClassName; retained actionable Rails/I18nLazyLookup and Rails/WhereMissing items."}}
{"run":101,"commit":"713039e","metric":554,"metrics":{},"status":"keep","description":"Added RuboCop-aligned autocorrect for Rails/ReflectionClassName (constant/constant.name/constant.to_s to string literals) and validated continuation autocorrect updates for Rails/EnumSyntax and Rails/HttpStatusNameConsistency; offense invariant stayed 3992.","timestamp":1775683544514,"segment":1,"confidence":24.08695652173913,"iterationTokens":10109,"asi":{"hypothesis":"ReflectionClassName can safely autocorrect only deterministic constant-derived class_name values, and pending continuation Rails cop updates should be kept once each modified cop test suite passes.","rubocop_references":"vendor/rubocop-rails/lib/rubocop/cop/rails/reflection_class_name.rb; vendor/rubocop-rails/lib/rubocop/cop/rails/enum_syntax.rb; vendor/rubocop-rails/lib/rubocop/cop/rails/http_status_name_consistency.rb","implemented_cops":"Rails/ReflectionClassName, Rails/EnumSyntax, Rails/HttpStatusNameConsistency","tests":"cargo test --lib -- cop::rails::reflection_class_name; cargo test --lib -- cop::rails::enum_syntax; cargo test --lib -- cop::rails::http_status_name_consistency","with_autocorrect_after":554,"missing_autocorrect_after":362,"offenses_benchmark":3992,"learning":"Continuation drift can inject additional modified cops mid-iteration; keep decisions must validate every modified cop explicitly before logging."}}
{"run":1,"commit":"46b191d","metric":554,"metrics":{},"status":"discard","description":"ReflectionClassName validation run passed targeted tests and invariant checks, but the measured +3 jump was confounded by unrelated in-flight changes (enum_syntax/http_status_name_consistency + fixture), so attribution is not clean for a keep decision.","timestamp":1775683551069,"segment":0,"confidence":null,"iterationTokens":null,"asi":{"hypothesis":"Validate Rails/ReflectionClassName autocorrect support and move with_autocorrect by +1 while preserving offense invariant 3992.","rollback_reason":"Primary metric increase was not attributable to the intended single-cop change because additional modified cops/files were present but not validated in this run.","next_action_hint":"Run an attribution-clean bundle validation covering reflection_class_name, enum_syntax, and http_status_name_consistency (plus fixture autocorrect), then keep only if all targeted tests and invariant checks pass.","tests":"cargo test --lib -- cop::rails::reflection_class_name","with_autocorrect_observed":554,"missing_autocorrect_observed":362,"offenses_benchmark":3992,"confounding_files":"src/cop/rails/enum_syntax.rs, src/cop/rails/http_status_name_consistency.rs, tests/fixtures/cops/rails/http_status_name_consistency/corrected.rb"}}
{"run":3,"commit":"19a07e2","metric":554,"metrics":{},"status":"keep","description":"Kept bundled Rails autocorrect additions for EnumSyntax, ReflectionClassName, and HttpStatusNameConsistency with config-aware fixture/tests; with_autocorrect advanced to 554 and offense invariant remained 3992.","timestamp":1775683571095,"segment":0,"confidence":null,"iterationTokens":36983,"asi":{"hypothesis":"A clean bundled validation of pending Rails cop autocorrect implementations (EnumSyntax, ReflectionClassName, HttpStatusNameConsistency) should produce an attribution-clean metric jump while preserving benchmark offenses.","rubocop_references":"vendor/rubocop-rails/lib/rubocop/cop/rails/enum_syntax.rb; vendor/rubocop-rails/lib/rubocop/cop/rails/reflection_class_name.rb; vendor/rubocop-rails/lib/rubocop/cop/rails/http_status_name_consistency.rb","implemented_cops":"Rails/EnumSyntax, Rails/ReflectionClassName, Rails/HttpStatusNameConsistency","tests":"cargo test --lib -- cop::rails::enum_syntax cop::rails::reflection_class_name cop::rails::http_status_name_consistency","with_autocorrect_after":554,"missing_autocorrect_after":362,"total_cops":916,"offenses_benchmark":3992,"learning":"Config-gated Rails/Rack cops require config-aware autocorrect tests; fixture-level corrected.rb coverage is useful for regression safety.","ideas_review":"Checked autoresearch.ideas.md; retained RSpec/Focus metadata parity and found no stale/tried ideas to prune this iteration."}}
{"run":5,"commit":"19a07e2","metric":554,"metrics":{},"status":"discard","description":"Validation-only run on advanced HEAD passed Rails/HttpStatusNameConsistency tests and preserved offense invariant 3992, but measured gain was from already-landed bundled commits (no new local experiment delta).","timestamp":1775683582186,"segment":0,"confidence":null,"iterationTokens":22821,"asi":{"hypothesis":"Adding supports_autocorrect and symbol replacement correction in Rails/HttpStatusNameConsistency should increase with_autocorrect while preserving behavior.","rollback_reason":"Branch moved ahead with bundled keeps before this run; there was no attribution-clean local code delta to keep from this experiment.","next_action_hint":"Select a still-missing cop from current HEAD and run an isolated implementation+validation cycle to attribute the next metric increase cleanly.","tests":"cargo test --lib -- cop::rails::http_status_name_consistency","with_autocorrect_observed":554,"missing_autocorrect_observed":362,"offenses_benchmark":3992,"head_commit_validated":"19a07e250"}}
{"run":102,"commit":"862b510","metric":556,"metrics":{},"status":"keep","description":"Added RuboCop-aligned autocorrect for Rails/SafeNavigationWithBlank (replace `&.` with `.` on `blank?` conditionals) and validated continuation autocorrect updates in Rails/HttpStatus; benchmark offense invariant remained 3992.","timestamp":1775683928573,"segment":1,"confidence":24.17391304347826,"iterationTokens":9427,"asi":{"hypothesis":"SafeNavigationWithBlank is a deterministic operator-token rewrite (`&.` -> `.`) and should safely increase with_autocorrect; any concurrent cop deltas must be validated before keep.","rubocop_references":"vendor/rubocop-rails/lib/rubocop/cop/rails/safe_navigation_with_blank.rb; vendor/rubocop-rails/lib/rubocop/cop/rails/http_status.rb","implemented_cops":"Rails/SafeNavigationWithBlank, Rails/HttpStatus","tests":"cargo test --lib -- cop::rails::safe_navigation_with_blank; cargo test --lib -- cop::rails::http_status","with_autocorrect_after":556,"missing_autocorrect_after":360,"offenses_benchmark":3992,"learning":"Autoresearch continuation can add large co-changes unexpectedly; running each modified cop’s focused tests before keep preserves attribution integrity."}}
{"run":6,"commit":"7c8c5ea","metric":556,"metrics":{},"status":"keep","description":"Kept bundled Rails autocorrect additions for Rails/HttpStatus (replace deprecated status symbols with preferred Rack 3.1 names) and Rails/SafeNavigationWithBlank (`&.blank?` -> `.blank?` in if/unless predicates); targeted tests passed and workload offense invariant remained 3992.","timestamp":1775683938417,"segment":0,"confidence":null,"iterationTokens":1710,"asi":{"hypothesis":"Both pending Rails cops are deterministic token/range rewrites and should safely raise with_autocorrect while preserving offense counts.","rubocop_references":"vendor/rubocop-rails/lib/rubocop/cop/rails/http_status.rb; vendor/rubocop-rails/lib/rubocop/cop/rails/safe_navigation_with_blank.rb","implemented_cops":"Rails/HttpStatus, Rails/SafeNavigationWithBlank","tests":"cargo test --lib -- cop::rails::http_status; cargo test --lib -- cop::rails::safe_navigation_with_blank","with_autocorrect_after":556,"missing_autocorrect_after":360,"offenses_benchmark":3992,"ideas_review":"Checked autoresearch.ideas.md: retained actionable Rails/I18nLazyLookup and Rails/WhereMissing items; no new stale entries detected."}}
{"run":4,"commit":"909a10d","metric":556,"metrics":{},"status":"keep","description":"Kept Rails autocorrect additions for HttpStatus and SafeNavigationWithBlank (status style rewrites + safe-nav `&.` to `.` on `blank?` predicates); with_autocorrect reached 556 and offense invariant remained 3992.","timestamp":1775683949079,"segment":0,"confidence":null,"iterationTokens":19195,"asi":{"hypothesis":"Bundling pending Rails/HttpStatus and Rails/SafeNavigationWithBlank autocorrect implementations should produce a clean +2 coverage gain while keeping benchmark offenses unchanged.","rubocop_references":"vendor/rubocop-rails/lib/rubocop/cop/rails/http_status.rb; vendor/rubocop-rails/lib/rubocop/cop/rails/safe_navigation_with_blank.rb","implemented_cops":"Rails/HttpStatus, Rails/SafeNavigationWithBlank","tests":"cargo test --lib -- cop::rails::safe_navigation_with_blank; cargo test --lib -- cop::rails::http_status cop::rails::safe_navigation_with_blank","with_autocorrect_after":556,"missing_autocorrect_after":360,"total_cops":916,"offenses_benchmark":3992,"learning":"When transient pending edits surface together, validate all touched cops before keep to avoid attribution drift.","ideas_review":"Checked autoresearch.ideas.md; retained RSpec/Focus metadata parity and pruned no stale/tried entries in this iteration."}}
{"run":2,"commit":"feb64c9","metric":556,"metrics":{},"status":"keep","description":"Added RuboCop-aligned autocorrect support for Rails/HttpStatus (symbolic/numeric replacements on offensive status nodes) with corrected fixture + unit coverage; continuation also included in-flight SafeNavigationWithBlank autocorrect updates, and offense invariant remained 3992.","timestamp":1775683959074,"segment":0,"confidence":null,"iterationTokens":38417,"asi":{"hypothesis":"HttpStatus can safely autocorrect by replacing only the offending status literal node with preferred symbolic/numeric style while preserving existing Rack reason-phrase guards.","implemented_cop":"Rails/HttpStatus","rubocop_reference":"vendor/rubocop-rails/lib/rubocop/cop/rails/http_status.rb","tests":"cargo test --lib -- cop::rails::http_status","with_autocorrect_after":556,"missing_autocorrect_after":360,"offenses_benchmark":3992,"co_committed_files":"src/cop/rails/safe_navigation_with_blank.rs, tests/fixtures/cops/rails/safe_navigation_with_blank/corrected.rb","ideas_review":"Reviewed autoresearch.ideas.md earlier this turn; retained Rails/I18nLazyLookup and Rails/WhereMissing as still-actionable, no stale removals."}}
{"run":3,"commit":"feb64c9","metric":0,"metrics":{},"status":"crash","description":"Bundle validation for Rails/I18nLazyLookup + Rails/RootJoinChain + Rails/FreezeTime failed at compile time (E0507 move out of Vec index in i18n_lazy_lookup visitor), so no reliable metric was produced.","timestamp":1775684080672,"segment":0,"confidence":null,"iterationTokens":10791,"asi":{"hypothesis":"Validate in-flight Rails autocorrect bundle (i18n_lazy_lookup/root_join_chain/freeze_time) with targeted tests and benchmark guard before deciding keep/discard.","rollback_reason":"Compilation failed in src/cop/rails/i18n_lazy_lookup.rs (`let key_node = arg_list[0];` moved non-Copy Node out of Vec index) before tests/metrics completed.","next_action_hint":"Re-run bundle with borrow fix (`let key_node = &arg_list[0]`) and then execute targeted rails tests + metric/invariant guard.","error":"E0507 cannot move out of index of Vec<Node<'_>> in i18n_lazy_lookup.rs:137","tests":"cargo test --lib -- cop::rails::i18n_lazy_lookup cop::rails::root_join_chain cop::rails::freeze_time"}}
{"run":7,"commit":"feb64c9","metric":0,"metrics":{},"status":"crash","description":"Bundled i18n/freeze_time/root_join_chain run crashed at compile time: i18n_lazy_lookup autocorrect patch moved `Node` out of `Vec` index (`E0507`) before tests could execute.","timestamp":1775684085341,"segment":0,"confidence":null,"iterationTokens":5567,"asi":{"hypothesis":"Implement autocorrect support for Rails/I18nLazyLookup and validate alongside other in-flight Rails cop changes.","rollback_reason":"Compile failure in `src/cop/rails/i18n_lazy_lookup.rs` at `let key_node = arg_list[0];` (cannot move out of indexed Vec).","next_action_hint":"Borrow the node (`let key_node = &arg_list[0]`) and rerun targeted tests + count/benchmark guard for modified cops.","error_details":"error[E0507]: cannot move out of index of Vec<Node<'_>>","affected_command":"cargo test --lib -- cop::rails::i18n_lazy_lookup; cargo test --lib -- cop::rails::freeze_time; cargo test --lib -- cop::rails::root_join_chain"}}
{"run":8,"commit":"feb64c9","metric":0,"metrics":{},"status":"checks_failed","description":"I18nLazyLookup autocorrect implementation compiled but fixture/unit autocorrect assertions failed because expected outputs incorrectly retained `# nitrocop-filename` directive lines.","timestamp":1775684281251,"segment":0,"confidence":null,"iterationTokens":10182,"asi":{"hypothesis":"Add autocorrect support for Rails/I18nLazyLookup (lazy<->explicit key rewrites) and validate with fixture + explicit-style tests, alongside in-flight FreezeTime autocorrect work.","rollback_reason":"Autocorrect tests failed due expectation mismatch: parse_fixture strips filename directives from input, so corrected output should not include directive lines.","next_action_hint":"Update i18n corrected fixture and explicit autocorrect test expected strings to exclude `# nitrocop-filename` lines, then rerun targeted tests + metric guard.","failed_tests":"cop::rails::i18n_lazy_lookup::tests::autocorrect_fixture, autocorrects_explicit_key_to_lazy_lookup, autocorrects_lazy_key_to_explicit_lookup"}}
{"run":4,"commit":"feb64c9","metric":0,"metrics":{},"status":"checks_failed","description":"I18nLazyLookup autocorrect implementation compiled but targeted tests failed due autocorrect expectation mismatch around `# nitrocop-filename` directive handling (corrected output dropped directive lines).","timestamp":1775684311614,"segment":0,"confidence":null,"iterationTokens":10250,"asi":{"hypothesis":"Add RuboCop-aligned autocorrect for Rails/I18nLazyLookup (explicit→lazy and lazy→explicit) and increase with_autocorrect by +1 with fixture coverage.","rollback_reason":"Autocorrect tests expected directive comment lines to persist, but corrected output omitted `# nitrocop-filename`, causing fixture and unit autocorrect assertions to fail.","next_action_hint":"Reapply i18n_lazy_lookup autocorrect with expected outputs/fixtures that omit the filename directive in corrected output, then rerun targeted tests + metric guard.","error":"cop::rails::i18n_lazy_lookup autocorrect tests failed (autocorrect_fixture + two unit autocorrect tests)","tests":"cargo test --lib -- cop::rails::i18n_lazy_lookup"}}
{"run":5,"commit":"feb64c9","metric":0,"metrics":{},"status":"checks_failed","description":"Validation of in-flight Rails/FreezeTime + Rails/RootJoinChain autocorrect bundle failed targeted tests (FreezeTime block-pass autocorrect case and RootJoinChain autocorrect fixture mismatch), so no reliable metric was produced.","timestamp":1775684463737,"segment":0,"confidence":null,"iterationTokens":10372,"asi":{"hypothesis":"Keep pending FreezeTime and RootJoinChain autocorrect additions if targeted tests and offense invariant pass.","rollback_reason":"Targeted cop tests failed before metric/invariant stage, indicating autocorrect output mismatch in at least one FreezeTime unit test and the RootJoinChain corrected fixture.","next_action_hint":"Fix expected corrected output/format for FreezeTime block-pass case and RootJoinChain fixture, then rerun targeted tests + count/benchmark guard.","error":"cargo test --lib -- cop::rails::freeze_time cop::rails::root_join_chain failed","tests":"cop::rails::freeze_time::tests::autocorrects_travel_to_with_block_pass; cop::rails::root_join_chain::tests::autocorrect_fixture"}}
{"run":103,"commit":"feb64c9","metric":558,"metrics":{},"status":"checks_failed","description":"Validation run detected additional in-flight cop edits (FreezeTime and RootJoinChain) with failing autocorrect tests, so the measured +2 with_autocorrect increase is not safe to keep yet.","timestamp":1775684467864,"segment":1,"confidence":23.659574468085108,"iterationTokens":30484,"asi":{"hypothesis":"Rebaseline latest HEAD after continuation drift and keep only if all modified cop tests pass with offense invariant unchanged.","rollback_reason":"Post-run validation found failing tests: `cop::rails::freeze_time::tests::autocorrect_fixture`, `cop::rails::freeze_time::tests::autocorrects_travel_to_with_block_pass`, and `cop::rails::root_join_chain::tests::autocorrect_fixture` (newline mismatch).","next_action_hint":"Re-implement/repair FreezeTime block-pass autocorrect and RootJoinChain corrected fixture newline handling, rerun targeted tests for both cops, then rerun metric+benchmark experiment.","tests_failed":"cargo test --lib -- cop::rails::freeze_time::tests:: cop::rails::root_join_chain::tests::","with_autocorrect_observed":558,"missing_autocorrect_observed":358,"offenses_benchmark":3992}}
{"run":9,"commit":"feb64c9","metric":0,"metrics":{},"status":"checks_failed","description":"FreezeTime autocorrect attempt failed tests: fixture emitted no corrections (rails-version-gated config mismatch in autocorrect fixture path) and block-pass case incorrectly rewrote `travel_to(..., &block)` to bare `freeze_time`.","timestamp":1775684473847,"segment":0,"confidence":null,"iterationTokens":9247,"asi":{"hypothesis":"FreezeTime can gain deterministic autocorrect by replacing full `travel_to(current_time_expr)` calls with `freeze_time` (preserving block pass when present).","rollback_reason":"Autocorrect fixture used default config (no target Rails version), so cop skipped corrections; block-pass extraction also missed `&block` argument shape and dropped it.","next_action_hint":"Add config-aware autocorrect fixture test path (or explicit with-config fixture assertions) and detect block-pass from call arguments robustly before rerunning.","failed_tests":"cop::rails::freeze_time::tests::autocorrect_fixture, autocorrects_travel_to_with_block_pass"}}
{"run":6,"commit":"feb64c9","metric":560,"metrics":{},"status":"discard","description":"RelativeDateConstant run passed targeted tests and offense invariant, but the +4 metric jump was confounded by unrelated in-flight cop edits (freeze_time/i18n_lazy_lookup/root_join_chain + corrected fixtures) that were not all passing in prior targeted runs.","timestamp":1775684678569,"segment":0,"confidence":1,"iterationTokens":12283,"asi":{"hypothesis":"Add RuboCop-aligned unsafe autocorrect for Rails/RelativeDateConstant (constant assignment -> class method) and gain +1 with fixture coverage.","rollback_reason":"Measured primary improvement was not attribution-clean; additional co-modified cops/files were present, and earlier runs showed failing targeted tests for those co-modified cops.","next_action_hint":"Re-run with an isolated working tree containing only relative_date_constant changes, or fully fix/validate freeze_time + i18n_lazy_lookup + root_join_chain before attempting a bundled keep.","implemented_cop":"Rails/RelativeDateConstant","tests":"cargo test --lib -- cop::rails::relative_date_constant","with_autocorrect_observed":560,"missing_autocorrect_observed":356,"offenses_benchmark":3992,"confounding_files":"src/cop/rails/freeze_time.rs, src/cop/rails/i18n_lazy_lookup.rs, src/cop/rails/root_join_chain.rs + corrected fixtures"}}
{"run":10,"commit":"feb64c9","metric":560,"metrics":{},"status":"discard","description":"Bundle validation for i18n/freeze_time/root_join_chain passed with offense invariant 3992, but run included an additional unvalidated modified cop (`Rails/RelativeDateConstant`), so metric jump was not attribution-clean for keep.","timestamp":1775684688590,"segment":0,"confidence":null,"iterationTokens":5547,"asi":{"hypothesis":"I18nLazyLookup, FreezeTime, and RootJoinChain autocorrect additions could jointly increase with_autocorrect while preserving benchmark offenses.","rollback_reason":"Working tree contained an extra modified cop (`relative_date_constant.rs`) that was not part of the validated test scope, so keeping would risk bundling unverified behavior.","next_action_hint":"Rerun with full validation of every modified cop in working tree (including RelativeDateConstant) before considering a keep.","tests":"cargo test --lib -- cop::rails::i18n_lazy_lookup; cargo test --lib -- cop::rails::freeze_time; cargo test --lib -- cop::rails::root_join_chain","with_autocorrect_observed":560,"missing_autocorrect_observed":356,"offenses_benchmark":3992}}
