{"run":1,"commit":"86df26a","metric":542,"metrics":{},"status":"keep","description":"Kept pending Rails autocorrect additions for ResponseParsedBody and SquishedSQLHeredocs after targeted tests passed; with_autocorrect advanced to 542 (374 missing) and benchmark offense invariant remained 3992.","timestamp":1775681273815,"segment":0,"confidence":null,"iterationTokens":null,"asi":{"hypothesis":"The in-flight Rails/ResponseParsedBody and Rails/SquishedSQLHeredocs supports_autocorrect implementations are RuboCop-aligned and should raise with_autocorrect while preserving offense count.","implemented_cops":"Rails/ResponseParsedBody, Rails/SquishedSQLHeredocs","tests":"cargo test --lib -- cop::rails::response_parsed_body cop::rails::squished_sql_heredocs","with_autocorrect_after":542,"missing_autocorrect_after":374,"offenses_benchmark":3992,"rubocop_references":"vendor/rubocop-rails/lib/rubocop/cop/rails/response_parsed_body.rb; vendor/rubocop-rails/lib/rubocop/cop/rails/squished_sql_heredocs.rb","ideas_review":"Checked autoresearch.ideas.md; RSpec/Focus metadata parity remains actionable and no stale/tried idea removals this pass."}}
{"run":10,"commit":"d2dca49","metric":542,"metrics":{},"status":"keep","description":"Added RuboCop-aligned autocorrect for Rails/ResponseParsedBody (`JSON.parse(response.body)` / `Nokogiri::HTML(5).parse(response.body)` -> `response.parsed_body`) and kept continuation work for Rails/SquishedSqlHeredocs after targeted tests passed; offense invariant stayed 3992.","timestamp":1775681369664,"segment":0,"confidence":132.5,"iterationTokens":4224,"asi":{"hypothesis":"ResponseParsedBody is a safe full-expression replacement to `response.parsed_body`, and pending continuation Rails cop work should be validated before keep.","rubocop_references":"vendor/rubocop-rails/lib/rubocop/cop/rails/response_parsed_body.rb; vendor/rubocop-rails/lib/rubocop/cop/rails/squished_sql_heredocs.rb","implemented_cops":"Rails/ResponseParsedBody, Rails/SquishedSqlHeredocs","tests":"cargo test --lib -- cop::rails::response_parsed_body; cargo test --lib -- cop::rails::squished_sql_heredocs","offenses_benchmark":3992,"with_autocorrect_after":542,"missing_autocorrect_after":374,"learning":"Config-gated cops require config-aware autocorrect tests; otherwise corrections appear absent even when implementation is correct."}}
{"run":7,"commit":"d2dca49","metric":544,"metrics":{},"status":"discard","description":"Validation-only run on current HEAD (already includes SquishedSQLHeredocs autocorrect); no new code delta was introduced in this iteration, so discarded as a non-experiment datapoint.","timestamp":1775681431042,"segment":0,"confidence":null,"iterationTokens":2785,"asi":{"hypothesis":"Confirm SquishedSQLHeredocs autocorrect state and invariant after continuation commits.","rollback_reason":"No new implementation delta in working tree; run does not represent a distinct optimization step to keep.","next_action_hint":"Select a new missing-autocorrect cop and run a clean one-cop implementation/validation cycle.","tests":"cargo test --lib -- cop::rails::squished_sql_heredocs","offenses_benchmark":3992,"with_autocorrect_observed":544,"missing_autocorrect_observed":372}}
{"run":11,"commit":"d2dca49","metric":0,"metrics":{},"status":"checks_failed","description":"RedirectBackOrTo autocorrect attempt failed: offense tests passed but autocorrect tests produced no corrections because correction path only handled KeywordHashNode argument form.","timestamp":1775681561823,"segment":0,"confidence":132.5,"iterationTokens":6390,"asi":{"hypothesis":"Rewrite `redirect_back(fallback_location: ...)` to `redirect_back_or_to(...)` by moving fallback value to first positional argument and preserving remaining options.","rollback_reason":"Correction builder didn’t detect fallback pair in Prism argument shape used by tests (hash-form args), so no corrections were emitted.","next_action_hint":"Re-implement correction arg extraction for both KeywordHashNode and HashNode pairs, then rerun targeted tests and benchmark guard.","error_details":"cop::rails::redirect_back_or_to autocorrect tests: 'produced no corrections'"}}
{"run":98,"commit":"002941b","metric":544,"metrics":{},"status":"keep","description":"Validated continuation head state after branch advanced: targeted RedundantTravelBack tests pass, with_autocorrect=544 (372 missing), and workload offense invariant remains 3992.","timestamp":1775681590230,"segment":1,"confidence":25.904761904761905,"iterationTokens":10202,"asi":{"hypothesis":"Before new cop work, confirm the current HEAD metric and offense invariant are stable after branch state drift.","validated_cop":"Rails/RedundantTravelBack","tests":"cargo test --lib -- cop::rails::redundant_travel_back","with_autocorrect_after":544,"missing_autocorrect_after":372,"offenses_benchmark":3992,"learning":"HEAD moved from prior observed commit; always revalidate current baseline before attributing new improvements."}}
{"run":8,"commit":"d2dca49","metric":546,"metrics":{},"status":"discard","description":"WhereExists run was confounded by unrelated in-flight RedirectBackOrTo changes in the working tree, so the +2 metric jump is not attribution-clean.","timestamp":1775681690799,"segment":0,"confidence":null,"iterationTokens":30625,"asi":{"hypothesis":"Add RuboCop-aligned autocorrect for Rails/WhereExists and improve count by +1.","rollback_reason":"Primary metric reflected multiple modified cops (WhereExists + RedirectBackOrTo), but only WhereExists was validated in this run.","next_action_hint":"Re-run as a combined clean experiment validating both WhereExists and RedirectBackOrTo together, then keep/discard based on that isolated bundle.","tests":"cargo test --lib -- cop::rails::where_exists","offenses_benchmark":3992,"with_autocorrect_observed":546,"missing_autocorrect_observed":370}}
{"run":9,"commit":"c0b4fb3","metric":546,"metrics":{},"status":"keep","description":"Added RuboCop-aligned autocorrect for Rails/RedirectBackOrTo (rename `redirect_back` + rewrite `fallback_location:` into first positional arg) and Rails/WhereExists (style-aware `where(...).exists?` ⇄ `exists?(...)` conversion preserving safe-navigation operator); targeted tests passed and offense invariant remained 3992.","timestamp":1775681829788,"segment":0,"confidence":null,"iterationTokens":4311,"asi":{"hypothesis":"Implementing missing autocorrect in both RedirectBackOrTo and WhereExists should yield a clean +2 with deterministic selector/range rewrites.","rubocop_references":"vendor/rubocop-rails/lib/rubocop/cop/rails/redirect_back_or_to.rb; vendor/rubocop-rails/lib/rubocop/cop/rails/where_exists.rb","implemented_cops":"Rails/RedirectBackOrTo, Rails/WhereExists","tests":"cargo test --lib -- cop::rails::redirect_back_or_to cop::rails::where_exists","with_autocorrect_after":546,"missing_autocorrect_after":370,"offenses_benchmark":3992,"ideas_review":"Reviewed autoresearch.ideas.md; RSpec/Focus metadata parity remains actionable and no stale entries were removed this pass."}}
{"run":10,"commit":"c0b4fb3","metric":0,"metrics":{},"status":"crash","description":"Combined redirect_back_or_to/where_exists/uniq_before_pluck test run crashed during compilation with a transient SaveBangVisitor struct-field mismatch error (E0560), so no reliable metric was produced.","timestamp":1775682106952,"segment":0,"confidence":null,"iterationTokens":19505,"asi":{"hypothesis":"Validate and keep a three-cop autocorrect bundle (RedirectBackOrTo + WhereExists + UniqBeforePluck) in one clean run.","rollback_reason":"Compilation failed before measurements completed (`error[E0560]` in `save_bang.rs`), so this run is invalid.","next_action_hint":"Rerun after clean compile to confirm transient toolchain/state issue; if reproducible, isolate and fix the compile break before continuing cop work.","error":"error[E0560]: struct `SaveBangVisitor<'_, '_>` has no field named `corrections`","offenses_benchmark":"not reached"}}
{"run":12,"commit":"ba77b17","metric":546,"metrics":{},"status":"keep","description":"Added RuboCop-aligned autocorrect for Rails/RedirectBackOrTo (fallback_location extraction + redirect_back_or_to rewrite) and stabilized continuation autocorrect work for Rails/WhereExists, Rails/SaveBang, and Rails/UniqBeforePluck; targeted tests passed with offense invariant 3992.","timestamp":1775682113105,"segment":0,"confidence":106,"iterationTokens":4797,"asi":{"hypothesis":"RedirectBackOrTo and pending continuation Rails cops can be kept safely once each modified cop’s focused tests pass and benchmark offenses stay invariant.","rubocop_references":"vendor/rubocop-rails/lib/rubocop/cop/rails/redirect_back_or_to.rb; vendor/rubocop-rails/lib/rubocop/cop/rails/where_exists.rb; vendor/rubocop-rails/lib/rubocop/cop/rails/save_bang.rb; vendor/rubocop-rails/lib/rubocop/cop/rails/uniq_before_pluck.rb","implemented_cops":"Rails/RedirectBackOrTo, Rails/WhereExists, Rails/SaveBang, Rails/UniqBeforePluck","tests":"cargo test --lib -- cop::rails::redirect_back_or_to; cargo test --lib -- cop::rails::where_exists; cargo test --lib -- cop::rails::save_bang; cargo test --lib -- cop::rails::uniq_before_pluck","offenses_benchmark":3992,"with_autocorrect_after":546,"missing_autocorrect_after":370,"learning":"When continuation introduces multiple modified cop files, keep decisions must be gated on per-cop test passes before committing bundled improvements."}}
{"run":13,"commit":"72c30e8","metric":549,"metrics":{},"status":"keep","description":"Added RuboCop-aligned autocorrect for Rails/ReadWriteAttribute (`read_attribute`/`write_attribute` -> `self[:attr]` forms) and validated continuation updates in Rails/SaveBang and Rails/UniqBeforePluck; offense invariant remained 3992.","timestamp":1775682333346,"segment":0,"confidence":96.36363636363636,"iterationTokens":24137,"asi":{"hypothesis":"ReadWriteAttribute can safely autocorrect whole call expressions to bracket access forms, and pending continuation Rails cop edits should be kept only after focused test passes.","rubocop_references":"vendor/rubocop-rails/lib/rubocop/cop/rails/read_write_attribute.rb; vendor/rubocop-rails/lib/rubocop/cop/rails/save_bang.rb; vendor/rubocop-rails/lib/rubocop/cop/rails/uniq_before_pluck.rb","implemented_cops":"Rails/ReadWriteAttribute, Rails/SaveBang, Rails/UniqBeforePluck","tests":"cargo test --lib -- cop::rails::read_write_attribute; cargo test --lib -- cop::rails::save_bang; cargo test --lib -- cop::rails::uniq_before_pluck","offenses_benchmark":3992,"with_autocorrect_after":549,"missing_autocorrect_after":367,"learning":"For check_source-based cops, collect corrections in visitor state and append to framework corrections at the end to enable autocorrect reliably."}}
{"run":11,"commit":"ba77b17","metric":549,"metrics":{},"status":"discard","description":"ReadWriteAttribute + UniqBeforePluck run was confounded by recurring in-flight SaveBang file changes, so the +3 metric jump is not attribution-clean for keep.","timestamp":1775682344912,"segment":0,"confidence":null,"iterationTokens":10675,"asi":{"hypothesis":"Add autocorrect support for Rails/ReadWriteAttribute and Rails/UniqBeforePluck in one bundle.","rollback_reason":"Observed metric improvement included an additional unexpected SaveBang working-tree delta that was not part of the validated scope.","next_action_hint":"Rerun with an explicit three-file validation scope (ReadWriteAttribute, UniqBeforePluck, SaveBang) or isolate by first removing SaveBang drift before testing.","tests":"cargo test --lib -- cop::rails::read_write_attribute cop::rails::uniq_before_pluck","offenses_benchmark":3992,"with_autocorrect_observed":549,"missing_autocorrect_observed":367}}
{"run":12,"commit":"72c30e8","metric":550,"metrics":{},"status":"discard","description":"EnumHash run was confounded by unrelated in-flight NegateInclude changes (including a new corrected fixture), so the +1 result is not attribution-clean for keep.","timestamp":1775682534907,"segment":0,"confidence":null,"iterationTokens":18252,"asi":{"hypothesis":"Add RuboCop-aligned autocorrect for Rails/EnumHash by converting enum array literals to explicit hash mappings.","rollback_reason":"Unexpected additional file deltas (`src/cop/rails/negate_include.rs` + fixture) appeared during the run, outside the validated scope.","next_action_hint":"Rerun as a clean combined validation that includes both EnumHash and NegateInclude, or first remove NegateInclude drift and rerun EnumHash alone.","tests":"cargo test --lib -- cop::rails::enum_hash","offenses_benchmark":3992,"with_autocorrect_observed":550,"missing_autocorrect_observed":366}}
{"run":13,"commit":"4e43929","metric":550,"metrics":{},"status":"keep","description":"Added RuboCop-aligned autocorrect for Rails/NegateInclude by replacing `!receiver.include?(arg)` with `receiver.exclude?(arg)`, with focused autocorrect tests; offense invariant remained 3992.","timestamp":1775682667168,"segment":0,"confidence":null,"iterationTokens":5040,"asi":{"hypothesis":"NegateInclude can be safely autocorrected as a full-expression rewrite from negated include? to exclude?.","rubocop_reference":"vendor/rubocop-rails/lib/rubocop/cop/rails/negate_include.rb","implemented_cop":"Rails/NegateInclude","tests":"cargo test --lib -- cop::rails::negate_include","with_autocorrect_after":550,"missing_autocorrect_after":366,"offenses_benchmark":3992,"ideas_review":"Reviewed autoresearch.ideas.md; RSpec/Focus metadata parity remains actionable and no stale ideas were pruned in this pass."}}
{"run":2,"commit":"041ac36","metric":550,"metrics":{},"status":"keep","description":"Added RuboCop-aligned autocorrect for Rails/EnumHash by converting enum array syntax to explicit index hash (`{... => 0, ...}`) for both old/new enum forms; targeted tests passed and workload offense invariant remained 3992.","timestamp":1775682673007,"segment":0,"confidence":null,"iterationTokens":101321,"asi":{"hypothesis":"Rails/EnumHash is a deterministic array-to-hash replacement and should safely increase with_autocorrect by +1 with no offense drift.","rubocop_reference":"vendor/rubocop-rails/lib/rubocop/cop/rails/enum_hash.rb","implemented_cop":"Rails/EnumHash","tests":"cargo test --lib -- cop::rails::enum_hash","with_autocorrect_after":550,"missing_autocorrect_after":366,"offenses_benchmark":3992,"ideas_review":"Reviewed autoresearch.ideas.md; RSpec/Focus metadata parity remains actionable and no stale/tried idea removals in this pass."}}
{"run":14,"commit":"4e43929","metric":552,"metrics":{},"status":"discard","description":"EnumHash + ReflectionClassName run was confounded by additional in-flight NegateInclude + corrected fixture deltas, so the +2 jump is not attribution-clean for keep.","timestamp":1775682797909,"segment":0,"confidence":null,"iterationTokens":6886,"asi":{"hypothesis":"Add RuboCop-aligned autocorrect for EnumHash and ReflectionClassName in one validated bundle.","rollback_reason":"Unexpected extra modified files (`negate_include` and new corrected fixtures) were present but not included in this run’s test scope.","next_action_hint":"Rerun as an explicit combined validation including EnumHash, ReflectionClassName, and NegateInclude plus fixture coverage before keeping.","tests":"cargo test --lib -- cop::rails::enum_hash cop::rails::reflection_class_name","offenses_benchmark":3992,"with_autocorrect_observed":552,"missing_autocorrect_observed":364}}
{"run":15,"commit":"041ac36","metric":552,"metrics":{},"status":"discard","description":"ReflectionClassName run was confounded by additional in-flight I18nLazyLookup changes (including a new corrected fixture), so the +2 result is not attribution-clean for keep.","timestamp":1775682920091,"segment":0,"confidence":null,"iterationTokens":4093,"asi":{"hypothesis":"Add partial RuboCop-aligned autocorrect for ReflectionClassName constant/class-name call values.","rollback_reason":"Unexpected extra modified files (`i18n_lazy_lookup` and corrected fixture) appeared outside validated scope.","next_action_hint":"Rerun as a combined validation for ReflectionClassName + I18nLazyLookup (or isolate by removing I18nLazyLookup drift first).","tests":"cargo test --lib -- cop::rails::reflection_class_name","offenses_benchmark":3992,"with_autocorrect_observed":552,"missing_autocorrect_observed":364}}
{"run":1,"commit":"9583ef0","metric":550,"metrics":{},"status":"keep","description":"Added RuboCop-aligned autocorrect for Rails/ReflectionClassName by converting constant/constant.name/constant.to_s class_name values to string literals; targeted tests passed and offense invariant remained 3992.","timestamp":1775683028343,"segment":0,"confidence":null,"iterationTokens":null,"asi":{"hypothesis":"Rails/ReflectionClassName can safely gain partial RuboCop-aligned autocorrect for deterministic constant-derived class_name values, increasing with_autocorrect by +1 without changing offenses.","rubocop_reference":"vendor/rubocop-rails/lib/rubocop/cop/rails/reflection_class_name.rb","implemented_cop":"Rails/ReflectionClassName","tests":"cargo test --lib -- cop::rails::reflection_class_name","with_autocorrect_after":550,"missing_autocorrect_after":366,"total_cops":916,"offenses_benchmark":3992,"ideas_review":"Checked autoresearch.ideas.md; retained RSpec/Focus metadata parity idea as still actionable and pruned no stale/tried entries this pass."}}
{"run":99,"commit":"77dfd25","metric":550,"metrics":{},"status":"keep","description":"Validated current continuation state after background churn: EnumHash and NegateInclude targeted tests pass, with_autocorrect=550 (366 missing), and benchmark offense invariant remains 3992.","timestamp":1775683035422,"segment":1,"confidence":25.58139534883721,"iterationTokens":76851,"asi":{"hypothesis":"Before applying another cop autocorrect, re-establish a clean measured baseline on the latest HEAD after concurrent continuation updates.","validated_cops":"Rails/EnumHash, Rails/NegateInclude","tests":"cargo test --lib -- cop::rails::enum_hash cop::rails::negate_include","with_autocorrect_after":550,"missing_autocorrect_after":366,"offenses_benchmark":3992,"learning":"Autoresearch continuation introduced rapid branch drift; explicit baseline validations prevent mis-attributed keep decisions."}}
{"run":3,"commit":"77dfd25","metric":550,"metrics":{},"status":"discard","description":"Validation-only I18nLazyLookup run passed targeted tests and preserved offense invariant 3992, but with_autocorrect stayed at 550 (no primary metric gain this iteration).","timestamp":1775683069148,"segment":0,"confidence":null,"iterationTokens":32690,"asi":{"hypothesis":"I18nLazyLookup could be a candidate for adding supports_autocorrect and key-node rewrites for lazy/explicit styles.","rollback_reason":"This iteration introduced no durable code delta and produced no primary metric increase, so it is discarded per objective.","next_action_hint":"Implement and verify an attribution-clean missing-autocorrect cop change (single cop or explicitly validated bundle) before rerunning metric guard.","tests":"cargo test --lib -- cop::rails::i18n_lazy_lookup","with_autocorrect_observed":550,"missing_autocorrect_observed":366,"offenses_benchmark":3992}}
{"run":2,"commit":"c3af29b","metric":551,"metrics":{},"status":"keep","description":"Added RuboCop-aligned autocorrect for Rails/EnumHash by converting enum array literals to explicit hash mappings (`elem => index`) in both legacy keyword and new positional enum syntaxes; targeted tests passed and offense invariant remained 3992.","timestamp":1775683206649,"segment":0,"confidence":null,"iterationTokens":4408,"asi":{"hypothesis":"EnumHash offenses are deterministic array-to-hash rewrites, so replacing array nodes with explicit index hashes should safely improve autocorrect coverage by +1 without changing offense count.","rubocop_reference":"vendor/rubocop-rails/lib/rubocop/cop/rails/enum_hash.rb","implemented_cop":"Rails/EnumHash","tests":"cargo test --lib -- cop::rails::enum_hash","with_autocorrect_after":551,"missing_autocorrect_after":365,"total_cops":916,"offenses_benchmark":3992,"ideas_review":"Checked autoresearch.ideas.md; retained RSpec/Focus metadata parity as actionable and found no stale/tried entries to prune this pass."}}
{"run":100,"commit":"c1b3c4d","metric":551,"metrics":{},"status":"keep","description":"Added RuboCop-aligned autocorrect for Rails/EnumHash by converting enum array syntax to explicit index-hash mappings, with fixture autocorrect coverage; with_autocorrect increased to 551 while offense invariant stayed 3992.","timestamp":1775683208950,"segment":1,"confidence":25.045454545454547,"iterationTokens":76851,"asi":{"hypothesis":"EnumHash has deterministic array->hash replacement semantics, so enabling supports_autocorrect with targeted replacements should safely raise with_autocorrect by +1.","rubocop_reference":"vendor/rubocop-rails/lib/rubocop/cop/rails/enum_hash.rb","implemented_cop":"Rails/EnumHash","tests":"cargo test --lib -- cop::rails::enum_hash","with_autocorrect_after":551,"missing_autocorrect_after":365,"offenses_benchmark":3992,"ideas_pruned":"Removed stale RSpec/Focus metadata parity idea (non-metric-moving for current objective) and refreshed backlog with metric-moving Rails candidates."}}
