{"run":5,"commit":"cd64ae6","metric":560,"metrics":{},"status":"keep","description":"Kept bundled Rails autocorrect additions for FreezeTime, I18nLazyLookup, RelativeDateConstant, and RootJoinChain; validated targeted tests for all touched cops and preserved offense invariant 3992.","timestamp":1775684691208,"segment":0,"confidence":null,"iterationTokens":32251,"asi":{"hypothesis":"Pending Rails autocorrect implementations for FreezeTime, I18nLazyLookup, RelativeDateConstant, and RootJoinChain can be validated as an attribution-clean +4 bundle while preserving benchmark offenses.","rubocop_references":"vendor/rubocop-rails/lib/rubocop/cop/rails/freeze_time.rb; vendor/rubocop-rails/lib/rubocop/cop/rails/i18n_lazy_lookup.rb; vendor/rubocop-rails/lib/rubocop/cop/rails/relative_date_constant.rb; vendor/rubocop-rails/lib/rubocop/cop/rails/root_join_chain.rb","implemented_cops":"Rails/FreezeTime, Rails/I18nLazyLookup, Rails/RelativeDateConstant, Rails/RootJoinChain","tests":"cargo test --lib -- cop::rails::root_join_chain; cargo test --lib -- cop::rails::freeze_time cop::rails::i18n_lazy_lookup cop::rails::relative_date_constant cop::rails::root_join_chain","with_autocorrect_after":560,"missing_autocorrect_after":356,"total_cops":916,"offenses_benchmark":3992,"learning":"Config-aware autocorrect tests are required for Rails-gated cops; keep decisions should validate all touched cops when multiple pending edits surface together.","ideas_review":"Checked autoresearch.ideas.md; retained RSpec/Focus metadata parity and found no stale/tried entries to prune."}}
{"run":6,"commit":"cd64ae6","metric":560,"metrics":{},"status":"discard","description":"Run showed a transient +4 jump (560) from multiple in-flight Rails autocorrect edits, but post-run state collapsed to a non-reproducible subset, so attribution is unstable.","timestamp":1775684754961,"segment":0,"confidence":null,"iterationTokens":32251,"asi":{"hypothesis":"Validate bundled pending Rails autocorrect edits and keep if metric improves with offense invariant preserved.","rollback_reason":"After validation, the working tree no longer matched the measured +4 state (count dropped to 557), so this run is not reproducible/attribution-clean for a keep decision.","next_action_hint":"Rerun from the current stable tree with explicit per-cop scoped changes and tests so the measured metric matches committed state.","with_autocorrect_observed":560,"with_autocorrect_rechecked":557,"missing_autocorrect_rechecked":359,"offenses_benchmark":3992,"tests":"cargo test --lib -- cop::rails::root_join_chain (run), plus subsequent targeted validation on touched cops","ideas_review":"Checked autoresearch.ideas.md; retained RSpec/Focus metadata parity; no stale/tried idea prunes this pass."}}
{"run":11,"commit":"cd64ae6","metric":0,"metrics":{},"status":"crash","description":"RootJoinChain autocorrect run crashed at compile-time because `RelativeDateConstant` test macro references missing fixture file `tests/fixtures/cops/rails/relative_date_constant/corrected.rb`.","timestamp":1775684851016,"segment":0,"confidence":null,"iterationTokens":7749,"asi":{"hypothesis":"RootJoinChain autocorrect should be a clean +1 via join-chain flattening and fixture coverage.","rollback_reason":"`cargo test` failed before running root_join_chain tests due unrelated missing corrected fixture required by existing `cop_autocorrect_fixture_tests!` in RelativeDateConstant.","next_action_hint":"Create `tests/fixtures/cops/rails/relative_date_constant/corrected.rb` with expected corrected output to restore test compilation, then rerun targeted experiment.","error_details":"include_bytes! failed: No such file or directory for relative_date_constant/corrected.rb"}}
{"run":7,"commit":"9159f2d","metric":558,"metrics":{},"status":"keep","description":"Revalidated and kept Rails/RelativeDateConstant autocorrect (constant assignment -> `def self.<const_downcase>` method rewrite) with fixture autocorrect coverage; continuation state also included RootJoinChain autocorrect updates, and offense invariant stayed 3992.","timestamp":1775684872046,"segment":0,"confidence":1,"iterationTokens":3159,"asi":{"hypothesis":"RelativeDateConstant can safely mirror RuboCop unsafe autocorrect for simple constant writes by rewriting to class methods, increasing with_autocorrect while preserving offense invariant.","implemented_cop":"Rails/RelativeDateConstant","rubocop_reference":"vendor/rubocop-rails/lib/rubocop/cop/rails/relative_date_constant.rb","tests":"cargo test --lib -- cop::rails::relative_date_constant","with_autocorrect_after":558,"missing_autocorrect_after":358,"offenses_benchmark":3992,"co_committed_files":"src/cop/rails/root_join_chain.rs, tests/fixtures/cops/rails/root_join_chain/corrected.rb","ideas_review":"Ideas backlog reviewed this session; retained Rails/I18nLazyLookup and Rails/WhereMissing as actionable, no stale removals."}}
{"run":104,"commit":"cd64ae6","metric":557,"metrics":{},"status":"checks_failed","description":"Bundle rerun was invalidated by in-flight RootJoinChain autocorrect fixture mismatch (newline handling) after run; cannot safely keep the observed +1 metric yet.","timestamp":1775684897125,"segment":1,"confidence":24.17391304347826,"iterationTokens":8940,"asi":{"hypothesis":"Validate and keep latest continuation bundle touching FreezeTime/I18nLazyLookup/RelativeDateConstant/RootJoinChain only if all modified cop tests pass and offense invariant remains 3992.","rollback_reason":"`cop::rails::root_join_chain::tests::autocorrect_fixture` failed (expected one-line-separated output; got extra blank lines).","next_action_hint":"Normalize RootJoinChain corrected fixture/output formatting to match actual autocorrect emission, rerun targeted root_join_chain + relative_date_constant tests, then rerun full metric experiment.","tests_failed":"cargo test --lib -- cop::rails::relative_date_constant::tests:: cop::rails::root_join_chain::tests::","with_autocorrect_observed":557,"missing_autocorrect_observed":359,"offenses_benchmark":3992}}
{"run":7,"commit":"cd64ae6","metric":557,"metrics":{},"status":"discard","description":"RelativeDateConstant autocorrect run improved metric to 557, but additional in-flight RootJoinChain changes surfaced after the run and failed fixture autocorrect verification, so this datapoint is not clean.","timestamp":1775685013927,"segment":0,"confidence":null,"iterationTokens":12816,"asi":{"hypothesis":"Add deterministic autocorrect for Rails/RelativeDateConstant and keep a +1 metric gain with offense invariant preserved.","rollback_reason":"Post-run validation revealed an unexpected additional modified cop (RootJoinChain) with failing autocorrect fixture, so the measured state is confounded.","next_action_hint":"Rerun with an explicitly scoped bundle (RelativeDateConstant + RootJoinChain) after fixing RootJoinChain corrected fixture expectations, then re-measure and keep/discard on reproducible output.","with_autocorrect_observed":557,"with_autocorrect_rechecked":558,"offenses_benchmark":3992,"tests":"cargo test --lib -- cop::rails::relative_date_constant cop::rails::root_join_chain (RootJoinChain autocorrect_fixture failed)","ideas_review":"Checked autoresearch.ideas.md; retained RSpec/Focus metadata parity; no stale/tried idea removals this pass."}}
{"run":8,"commit":"9159f2d","metric":0,"metrics":{},"status":"checks_failed","description":"Isolated bundle validation for RelativeDateConstant + RootJoinChain failed because RootJoinChain autocorrect fixture still mismatches expected output.","timestamp":1775685015443,"segment":0,"confidence":1,"iterationTokens":4843,"asi":{"hypothesis":"Keep a clean two-cop bundle (RelativeDateConstant + RootJoinChain) once both targeted autocorrect fixtures pass and offense invariant remains 3992.","rollback_reason":"Targeted tests failed on cop::rails::root_join_chain::tests::autocorrect_fixture before metric/invariant stage.","next_action_hint":"Fix RootJoinChain correction range/replacement to match corrected fixture exactly, then rerun the same isolated two-cop experiment.","error":"root_join_chain autocorrect_fixture failure","tests":"cargo test --lib -- cop::rails::relative_date_constant cop::rails::root_join_chain"}}
{"run":12,"commit":"cd64ae6","metric":0,"metrics":{},"status":"checks_failed","description":"RootJoinChain autocorrect implementation passed targeted unit test but fixture autocorrect expected failed due newline-shape mismatch (correct output keeps blank lines between corrected statements).","timestamp":1775685015936,"segment":0,"confidence":null,"iterationTokens":6469,"asi":{"hypothesis":"RootJoinChain can safely autocorrect by flattening chained joins into one `.join(...)` call while preserving argument order.","rollback_reason":"`autocorrect_fixture` mismatch was formatting-only: corrected output retained blank separator lines from fixture source, while expected fixture omitted them.","next_action_hint":"Update `tests/fixtures/cops/rails/root_join_chain/corrected.rb` to preserve blank lines matching corrected output, then rerun tests + metric guard.","failed_test":"cop::rails::root_join_chain::tests::autocorrect_fixture"}}
{"run":1,"commit":"9159f2d","metric":0,"metrics":{},"status":"checks_failed","description":"Validation of in-flight Rails/RootJoinChain + RelativeDateConstant autocorrect state failed targeted tests (`root_join_chain` autocorrect fixture mismatch), so continuation bundle is not yet keep-safe.","timestamp":1775685167013,"segment":0,"confidence":null,"iterationTokens":null,"asi":{"hypothesis":"The pending RootJoinChain/RelativeDateConstant changes might be a clean +2 if targeted tests and offense invariant pass.","rollback_reason":"`cargo test --lib -- cop::rails::relative_date_constant cop::rails::root_join_chain` failed on `cop::rails::root_join_chain::tests::autocorrect_fixture` before metric/invariant validation could complete.","next_action_hint":"Fix RootJoinChain corrected fixture/output parity (newline-shape mismatch), rerun targeted tests, then rerun count+offense invariant benchmark.","tests_failed":"cop::rails::root_join_chain::tests::autocorrect_fixture"}}
{"run":8,"commit":"cd64ae6","metric":0,"metrics":{},"status":"checks_failed","description":"Bundled RelativeDateConstant + RootJoinChain autocorrect attempt failed targeted checks: RootJoinChain autocorrect fixture mismatch.","timestamp":1775685169202,"segment":0,"confidence":null,"iterationTokens":7990,"asi":{"hypothesis":"Enable reproducible autocorrect for RelativeDateConstant and RootJoinChain and validate both cops plus offense invariant in one run.","rollback_reason":"Targeted test run failed (`cop::rails::root_join_chain::tests::autocorrect_fixture`), so the implementation bundle is not ready to keep.","next_action_hint":"Inspect RootJoinChain fixture output mismatch and align corrected fixture/rewrite behavior, then rerun the same bundled experiment.","failing_test":"cop::rails::root_join_chain::tests::autocorrect_fixture","offenses_benchmark":"not reached","ideas_review":"Checked autoresearch.ideas.md; retained RSpec/Focus metadata parity and no stale/tried entries were pruned this pass."}}
{"run":13,"commit":"cd64ae6","metric":0,"metrics":{},"status":"checks_failed","description":"RelativeDateConstant autocorrect path passed, but RootJoinChain fixture autocorrect still failed due a 1-byte newline mismatch in corrected fixture content.","timestamp":1775685174063,"segment":0,"confidence":null,"iterationTokens":6085,"asi":{"hypothesis":"Combined RootJoinChain + RelativeDateConstant autocorrect bundle should be keepable once fixture expectations align exactly.","rollback_reason":"RootJoinChain `autocorrect_fixture` mismatch remained purely formatting-related (expected 117 bytes vs got 116).","next_action_hint":"Adjust `tests/fixtures/cops/rails/root_join_chain/corrected.rb` newline shape (drop trailing newline) and rerun full bundle validation.","failed_test":"cop::rails::root_join_chain::tests::autocorrect_fixture"}}
{"run":1,"commit":"54a9847","metric":557,"metrics":{},"status":"keep","description":"Added RuboCop-aligned autocorrect for Rails/RelativeDateConstant (constant assignment -> `def self.<const_downcase>` class method rewrite) with fixture autocorrect coverage; targeted tests pass and benchmark offense invariant remains 3992.","timestamp":1775685330247,"segment":0,"confidence":null,"iterationTokens":null,"asi":{"hypothesis":"RelativeDateConstant supports deterministic unsafe autocorrect for simple constant assignments, so enabling supports_autocorrect with class-method rewrite should raise with_autocorrect by +1 while preserving offense count.","rubocop_reference":"vendor/rubocop-rails/lib/rubocop/cop/rails/relative_date_constant.rb","implemented_cop":"Rails/RelativeDateConstant","tests":"cargo test --lib -- cop::rails::relative_date_constant","with_autocorrect_after":557,"missing_autocorrect_after":359,"offenses_benchmark":3992,"overfitting_guard":"Used full workload offense invariant check on built release binary after targeted cop tests."}}
{"run":14,"commit":"3454028","metric":557,"metrics":{},"status":"keep","description":"Added RuboCop-aligned baseline autocorrect for Rails/RelativeDateConstant by rewriting simple constant assignments to class-method wrappers (`def self.<const_name_downcase> ... end`), with fixture autocorrect coverage.","timestamp":1775685338398,"segment":0,"confidence":null,"iterationTokens":4024,"asi":{"hypothesis":"RelativeDateConstant can safely gain baseline autocorrect on plain constant writes by replacing assignment nodes with deterministic method definitions while leaving constant-path writes uncorrected.","rubocop_reference":"vendor/rubocop-rails/lib/rubocop/cop/rails/relative_date_constant.rb","implemented_cop":"Rails/RelativeDateConstant","tests":"cargo test --lib -- cop::rails::relative_date_constant","with_autocorrect_after":557,"missing_autocorrect_after":359,"offenses_benchmark":3992,"ideas_review":"Checked autoresearch.ideas.md; FreezeTime and WhereMissing remain actionable, I18nLazyLookup remains deferred pending cleaner parity path."}}
{"run":9,"commit":"cd64ae6","metric":557,"metrics":{},"status":"discard","description":"RelativeDateConstant run measured +1 (557) with invariant 3992, but post-run tree had no surviving code delta to commit, so the result is non-reproducible for keep.","timestamp":1775685352745,"segment":0,"confidence":null,"iterationTokens":2745,"asi":{"hypothesis":"Add autocorrect support for Rails/RelativeDateConstant and keep a clean +1 improvement.","rollback_reason":"After run completion, the code changes were no longer present in the working tree (only autoresearch artifacts remained), so there is no attributable implementation to keep.","next_action_hint":"Reapply the cop change in a single tight edit→run_experiment→log cycle and verify the modified file still exists before logging keep.","with_autocorrect_observed":557,"offenses_benchmark":3992,"recheck_worktree":"no code deltas present after run","ideas_review":"Checked autoresearch.ideas.md; retained RSpec/Focus metadata parity and no stale/tried ideas removed."}}
{"run":105,"commit":"3454028","metric":557,"metrics":{},"status":"checks_failed","description":"RelativeDateConstant metric run became non-keepable after continuation drift introduced a compile-breaking FreezeTime test helper collision (`rails_config` duplicate), so this iteration cannot be safely kept.","timestamp":1775685424048,"segment":1,"confidence":23.659574468085108,"iterationTokens":11544,"asi":{"hypothesis":"Isolate and keep RelativeDateConstant autocorrect (+1 with_autocorrect) while preserving benchmark offense invariant 3992.","rollback_reason":"Post-run validation hit compile failure in `cop::rails::freeze_time::tests::` (`E0428`: duplicate `rails_config` function defined alongside macro-generated helper).","next_action_hint":"Rename/customize FreezeTime test config helper (avoid `rails_config` collision), rerun FreezeTime tests, then rerun a clean metric experiment.","error_details":"error[E0428]: the name `rails_config` is defined multiple times in src/cop/rails/freeze_time.rs","with_autocorrect_observed":557,"missing_autocorrect_observed":359,"offenses_benchmark":3992}}
{"run":2,"commit":"9159f2d","metric":0,"metrics":{},"status":"checks_failed","description":"FreezeTime autocorrect attempt was blocked by continuation drift: unrelated in-flight `i18n_lazy_lookup` edits failed compilation (`key_str` scope error), so this run is not attribution-clean.","timestamp":1775685521781,"segment":0,"confidence":null,"iterationTokens":5227,"asi":{"hypothesis":"Add Rails/FreezeTime autocorrect (+1) with config-aware fixture tests and block-pass preservation while maintaining offense invariant.","rollback_reason":"`cargo test --lib -- cop::rails::freeze_time` failed to compile because `src/cop/rails/i18n_lazy_lookup.rs` had an unrelated E0425 (`key_str` not in scope).","next_action_hint":"Start from a clean tree (drop drifted i18n files), then rerun isolated FreezeTime implementation + targeted tests + metric guard.","error":"E0425 in src/cop/rails/i18n_lazy_lookup.rs: cannot find value `key_str`","drift_files":"src/cop/rails/i18n_lazy_lookup.rs, tests/fixtures/cops/rails/i18n_lazy_lookup/corrected.rb"}}
{"run":15,"commit":"3454028","metric":557,"metrics":{},"status":"discard","description":"FreezeTime validation run passed offense/no-offense tests and benchmark invariant, but with_autocorrect remained 557 (no primary metric gain and no durable autocorrect code delta).","timestamp":1775685568005,"segment":0,"confidence":null,"iterationTokens":5376,"asi":{"hypothesis":"FreezeTime could provide a +1 by adding RuboCop-aligned `travel_to(...)` -> `freeze_time` autocorrect support.","rollback_reason":"Observed metric was unchanged and working tree did not contain a stable supports_autocorrect implementation for FreezeTime at log time.","next_action_hint":"Re-implement FreezeTime autocorrect in an attribution-clean patch (supports method + config-aware autocorrect tests) and rerun.","tests":"cargo test --lib -- cop::rails::freeze_time","with_autocorrect_observed":557,"missing_autocorrect_observed":359,"offenses_benchmark":3992}}
{"run":3,"commit":"9159f2d","metric":0,"metrics":{},"status":"checks_failed","description":"FreezeTime autocorrect trial failed targeted tests: block-pass parity case corrected to bare `freeze_time` instead of preserving `&method(...)`.","timestamp":1775685697591,"segment":0,"confidence":null,"iterationTokens":4368,"asi":{"hypothesis":"Rails/FreezeTime can safely gain +1 autocorrect support by replacing full `travel_to(...)` calls and preserving block-pass arguments.","rollback_reason":"`cop::rails::freeze_time::tests::autocorrects_travel_to_with_block_pass_argument` failed (`expected freeze_time(&method(:do_something))`, got `freeze_time`).","next_action_hint":"Implement replacement logic that detects trailing `BlockArgumentNode` in call arguments and emits `freeze_time(<block_pass_src>)`, then rerun targeted tests and guards.","failed_test":"cop::rails::freeze_time::tests::autocorrects_travel_to_with_block_pass_argument"}}
{"run":3,"commit":"3454028","metric":0,"metrics":{},"status":"checks_failed","description":"Bundled FreezeTime + WhereMissing autocorrect attempt failed targeted tests before metric guard: FreezeTime block-pass autocorrect assertion and WhereMissing autocorrect fixture mismatch.","timestamp":1775685835898,"segment":0,"confidence":null,"iterationTokens":8729,"asi":{"hypothesis":"Enable supports_autocorrect for Rails/WhereMissing (where.missing rewrite) and include pending FreezeTime autocorrect drift in one validated bundle for +2 coverage.","rollback_reason":"Targeted tests failed: `cop::rails::freeze_time::tests::autocorrects_travel_to_with_block_pass_argument` and `cop::rails::where_missing::tests::autocorrect_fixture`.","next_action_hint":"Inspect exact expected/actual outputs from failing tests, fix FreezeTime block-pass replacement shape and WhereMissing corrected fixture/range handling, then rerun the same targeted bundle before benchmark guard.","tests":"cargo test --lib -- cop::rails::freeze_time cop::rails::where_missing","error":"exit code 101 with 2 failing tests","offenses_benchmark":"not reached"}}
{"run":4,"commit":"9159f2d","metric":0,"metrics":{},"status":"checks_failed","description":"Bundled FreezeTime + WhereMissing autocorrect validation failed: FreezeTime dropped block-pass argument in correction and WhereMissing produced no corrections for autocorrect fixture.","timestamp":1775685875138,"segment":0,"confidence":null,"iterationTokens":8427,"asi":{"hypothesis":"Validate a bundled +2 autocorrect increase by enabling RuboCop-aligned autocorrect for Rails/FreezeTime and Rails/WhereMissing while preserving offense invariant.","rollback_reason":"Targeted tests failed (`freeze_time` block-pass parity and `where_missing` autocorrect_fixture no corrections), so bundle is not keep-safe.","next_action_hint":"Fix FreezeTime replacement to preserve trailing block-pass argument and implement actual correction emission path in WhereMissing (or split into isolated single-cop experiments).","failed_tests":"cop::rails::freeze_time::tests::autocorrects_travel_to_with_block_pass_argument; cop::rails::where_missing::tests::autocorrect_fixture"}}
