{"run":452,"commit":"2a3c6b5","metric":624,"metrics":{},"status":"keep","description":"Added conservative autocorrect baseline for Rails/FilePath in slashes style by rewriting simple multi-string `Rails.root.join(\"a\", \"b\", ...)` calls to `Rails.root.join(\"a/b/...\")`. Added autocorrect unit coverage and supports_autocorrect assertion. Offense invariant remains 3992.","timestamp":1775760816380,"segment":1,"confidence":21.517241379310345,"iterationTokens":51892,"asi":{"hypothesis":"Rails/FilePath can safely gain supports_autocorrect with a narrow RuboCop-aligned baseline focused on deterministic slashes-style multi-string join normalization.","implemented_cop":"Rails/FilePath","rubocop_reference":"vendor/rubocop-rails/lib/rubocop/cop/rails/file_path.rb","tests":"cargo test --lib --quiet -- cop::rails::file_path","with_autocorrect_after":624,"missing_autocorrect_after":292,"offenses_benchmark":3992,"deferred_paths":"File.join and dstr autocorrections plus arguments-style conversion remain for parity; current baseline intentionally only corrects simple Rails.root.join string-arg slashes style."}}
{"run":453,"commit":"d08d912","metric":625,"metrics":{},"status":"keep","description":"Added RuboCop-aligned autocorrect support for Rails/PluralizationGrammar by replacing only the duration/byte selector (e.g., `3.day` -> `3.days`, `1.months` -> `1.month`) while preserving receiver and call chain. Added corrected fixture + supports_autocorrect coverage; offense invariant remains 3992.","timestamp":1775760956344,"segment":1,"confidence":21.551724137931036,"iterationTokens":5936,"asi":{"hypothesis":"Rails/PluralizationGrammar is a safe high-confidence gain because autocorrect is a selector-only replacement and mirrors upstream AutoCorrector behavior.","implemented_cop":"Rails/PluralizationGrammar","rubocop_reference":"vendor/rubocop-rails/lib/rubocop/cop/rails/pluralization_grammar.rb","tests":"cargo test --lib --quiet -- cop::rails::pluralization_grammar","with_autocorrect_after":625,"missing_autocorrect_after":291,"offenses_benchmark":3992,"deferred_paths":"No major deferred paths for this baseline; parity is largely complete for selector-level correction."}}
{"run":456,"commit":"d08d912","metric":0,"metrics":{},"status":"checks_failed","description":"Second Rails/RedundantForeignKey attempt still failed autocorrect fixture due to dangling commas/blank lines after removing sole foreign_key hash entries.","timestamp":1775761601541,"segment":1,"confidence":21.964912280701753,"iterationTokens":4059,"asi":{"hypothesis":"Adjusted corrected fixture content alone would satisfy snapshot without changing correction range behavior.","rollback_reason":"autocorrect output still contained dangling commas where foreign_key was the only hash entry.","next_action_hint":"Change autocorrect to remove the entire hash argument when it only contains foreign_key, then rerun fixture + benchmark gate.","error":"autocorrect produced `belongs_to :user, ` and similar trailing-comma outputs"}}
{"run":457,"commit":"a9555c7","metric":627,"metrics":{},"status":"keep","description":"Added conservative RuboCop-style autocorrect baseline for Rails/RakeEnvironment: task definitions missing dependencies now get `:environment` inserted by rewriting either the task name argument (`task :foo` -> `task foo: :environment`) or argument-array dependency slot (`[:args]` -> `[:args] => :environment`). Added targeted autocorrect unit coverage + supports_autocorrect test; offense invariant remains 3992.","timestamp":1775761816344,"segment":1,"confidence":21.620689655172413,"iterationTokens":29622,"asi":{"hypothesis":"Rails/RakeEnvironment can safely gain autocorrect with deterministic argument-level rewrites mirroring upstream behavior for core task-definition forms.","implemented_cop":"Rails/RakeEnvironment","rubocop_reference":"vendor/rubocop-rails/lib/rubocop/cop/rails/rake_environment.rb","tests":"cargo test --lib --quiet -- cop::rails::rake_environment","with_autocorrect_after":627,"missing_autocorrect_after":289,"offenses_benchmark":3992,"deferred_paths":"Autocorrect for more complex hash-first-arg dependency forms can be expanded with fixture-level corrected snapshots for full parity."}}
{"run":458,"commit":"ea13b6b","metric":628,"metrics":{},"status":"keep","description":"Added conservative autocorrect support for Rails/RedundantReceiverInWithOptions by removing redundant block-param receivers (`assoc.`) in flagged with_options calls. Added corrected fixture coverage and supports_autocorrect test; offense invariant remains 3992.","timestamp":1775762806355,"segment":1,"confidence":21.655172413793103,"iterationTokens":1307,"asi":{"hypothesis":"Rails/RedundantReceiverInWithOptions can safely gain baseline autocorrect by deleting receiver + dot ranges for already-flagged redundant receiver calls.","implemented_cop":"Rails/RedundantReceiverInWithOptions","rubocop_reference":"vendor/rubocop-rails/lib/rubocop/cop/rails/redundant_receiver_in_with_options.rb","tests":"cargo test --lib --quiet -- cop::rails::redundant_receiver_in_with_options","with_autocorrect_after":628,"missing_autocorrect_after":288,"offenses_benchmark":3992,"deferred_paths":"Full RuboCop parity includes block-argument removal in nested contexts; current baseline focuses on safe receiver-dot deletion."}}
{"run":459,"commit":"a494a79","metric":629,"metrics":{},"status":"keep","description":"Added RuboCop-aligned autocorrect support for Rails/PluckInWhere by rewriting flagged selector tokens only (`pluck` -> `select`, `ids` -> `select(:id)`) at the offense location within where/rewhere/where.not query contexts. Added corrected fixture + supports_autocorrect coverage; offense invariant remains 3992.","timestamp":1775762993967,"segment":1,"confidence":21.689655172413794,"iterationTokens":10256,"asi":{"hypothesis":"Rails/PluckInWhere is a safe selector-level autocorrect candidate because upstream replaces only the method selector and nitrocop already computes precise selector offsets.","implemented_cop":"Rails/PluckInWhere","rubocop_reference":"vendor/rubocop-rails/lib/rubocop/cop/rails/pluck_in_where.rb","tests":"cargo test --lib --quiet -- cop::rails::pluck_in_where","with_autocorrect_after":629,"missing_autocorrect_after":287,"offenses_benchmark":3992,"deferred_paths":"Potential future hardening for csend-specific edge cases and additional nested argument shapes, though current behavior matches covered offense fixtures."}}
{"run":460,"commit":"a494a79","metric":0,"metrics":{},"status":"checks_failed","description":"Attempted conservative autocorrect for Rails/RedundantPresenceValidationOnBelongsTo (single-symbol `presence: true` removal), but targeted autocorrect tests failed to produce diagnostics/corrections under rails-version-configured test harness.","timestamp":1775763386571,"segment":1,"confidence":21.689655172413794,"iterationTokens":2066,"asi":{"hypothesis":"A narrow, safe baseline could remove entire `validates :assoc, presence: true` lines while leaving multi-key validations unchanged.","rollback_reason":"targeted tests showed no offenses/corrections emitted in autocorrect path, indicating mismatch with cop matching context/config assumptions.","next_action_hint":"Defer this cop until matching behavior in run_cop_autocorrect_with_config is reconciled; pick another high-confidence selector-level Rails cop.","error":"cop::rails::redundant_presence_validation_on_belongs_to::tests::autocorrects_simple_single_symbol_presence_validation asserted diags.len()==1 but got 0"}}
{"run":461,"commit":"4e9e4c8","metric":630,"metrics":{},"status":"keep","description":"Added conservative autocorrect baseline for Rails/RootPathnameMethods: `File.join(Rails.root/public_path, ...)` now autocorrects to `Rails.root/public_path.join(...)` for deterministic direct-call forms. Added supports_autocorrect + targeted autocorrect unit coverage; offense invariant remains 3992.","timestamp":1775763502591,"segment":1,"confidence":21.724137931034484,"iterationTokens":11108,"asi":{"hypothesis":"RootPathnameMethods can safely gain baseline autocorrect on the most deterministic case (`File.join` with direct Rails.root/public_path first arg) while deferring broader method-family rewrites.","implemented_cop":"Rails/RootPathnameMethods","rubocop_reference":"vendor/rubocop-rails/lib/rubocop/cop/rails/root_pathname_methods.rb","tests":"cargo test --lib --quiet -- cop::rails::root_pathname_methods","with_autocorrect_after":630,"missing_autocorrect_after":286,"offenses_benchmark":3992,"deferred_paths":"Broader autocorrect parity for non-join methods (`File.read`, `Dir.glob`, `open` and argument reshaping) remains deferred due higher transformation complexity."}}
{"run":462,"commit":"8048951","metric":631,"metrics":{},"status":"keep","description":"Added conservative Rails/StrongParametersExpect autocorrect support (Rails 8+ gated) by rewriting core `params.require(...).permit(...)` and matching `params.permit(...).require(...)` forms to `params.expect(...)`. Added supports_autocorrect and targeted rails-version-aware autocorrect unit tests; offense invariant remains 3992.","timestamp":1775763763637,"segment":1,"confidence":21.75862068965517,"iterationTokens":1299,"asi":{"hypothesis":"StrongParametersExpect can safely gain baseline autocorrect by replacing only the matched canonical chain forms while preserving the permit argument source structure.","implemented_cop":"Rails/StrongParametersExpect","rubocop_reference":"vendor/rubocop-rails/lib/rubocop/cop/rails/strong_parameters_expect.rb","tests":"cargo test --lib --quiet -- cop::rails::strong_parameters_expect","with_autocorrect_after":631,"missing_autocorrect_after":285,"offenses_benchmark":3992,"deferred_paths":"Further parity may require handling more complex dynamic require-key/value expression variants and preserving edge formatting nuances."}}
{"run":463,"commit":"53c2d1d","metric":632,"metrics":{},"status":"keep","description":"Added conservative autocorrect support for Rails/TimeZone focused on RuboCop-aligned `String#to_time` offenses: rewrites string-literal `.to_time` to `Time.zone.parse(...)` (skipping safe-navigation). Added supports_autocorrect and targeted autocorrect test coverage; offense invariant remains 3992.","timestamp":1775767774824,"segment":1,"confidence":21.79310344827586,"iterationTokens":3260,"asi":{"hypothesis":"Rails/TimeZone can safely gain a narrow autocorrect baseline by correcting only deterministic string-literal `to_time` offenses already detected in both strict/flexible modes.","implemented_cop":"Rails/TimeZone","rubocop_reference":"vendor/rubocop-rails/lib/rubocop/cop/rails/time_zone.rb","tests":"cargo test --lib --quiet -- cop::rails::time_zone","with_autocorrect_after":632,"missing_autocorrect_after":284,"offenses_benchmark":3992,"deferred_paths":"Broader TimeZone autocorrect parity for dangerous `Time.now/parse/at/new/local` chains remains deferred due higher semantic risk."}}
{"run":464,"commit":"e52ff20","metric":633,"metrics":{},"status":"keep","description":"Added conservative autocorrect support for Rails/MatchRoute by rewriting selector-only `match` -> HTTP verb when no explicit `via:` option is present (safe baseline), plus supports_autocorrect and targeted autocorrect unit coverage. Offense invariant remains 3992.","timestamp":1775768110701,"segment":1,"confidence":21.82758620689655,"iterationTokens":13265,"asi":{"hypothesis":"MatchRoute can safely gain baseline autocorrect by applying selector-only replacement on deterministic no-via offenses while deferring option-shape rewrites that require dropping `via:` pairs.","implemented_cop":"Rails/MatchRoute","rubocop_reference":"vendor/rubocop-rails/lib/rubocop/cop/rails/match_route.rb","tests":"cargo test --lib --quiet -- cop::rails::match_route","with_autocorrect_after":633,"missing_autocorrect_after":283,"offenses_benchmark":3992,"deferred_paths":"Full parity autocorrect for `via:` forms (including safe removal of via pair and option reshaping) remains deferred."}}
{"run":465,"commit":"c7d6652","metric":634,"metrics":{},"status":"keep","description":"Added conservative autocorrect support for Rails/ActionOrder. Cop now supports autocorrect and swaps one simple adjacent out-of-order top-level action pair (`def` blocks) while preserving existing offense detection for broader cases. Added supports_autocorrect and targeted autocorrect unit coverage; benchmark offense invariant remains 3992.","timestamp":1775768494750,"segment":1,"confidence":21.862068965517242,"iterationTokens":73298,"asi":{"hypothesis":"ActionOrder can safely gain baseline autocorrect by limiting rewrites to a single deterministic adjacent top-level def swap, deferring complex multi-offense/commented/nested reorder cases.","implemented_cop":"Rails/ActionOrder","rubocop_reference":"vendor/rubocop-rails/lib/rubocop/cop/rails/action_order.rb","tests":"cargo test --lib --quiet -- cop::rails::action_order","with_autocorrect_after":634,"missing_autocorrect_after":282,"offenses_benchmark":3992,"deferred_paths":"Broader parity for multiple reorder offenses and comment/conditional-aware block swapping remains deferred."}}
{"run":466,"commit":"92596e6","metric":635,"metrics":{},"status":"keep","description":"Added conservative autocorrect support for Rails/Delegate. Baseline rewrites only deterministic direct-name/no-arg delegations (e.g., `def name; client.name; end` -> `delegate :name, to: :client`) while preserving broader detection behavior. Added supports_autocorrect and targeted autocorrect unit coverage; offense invariant remains 3992.","timestamp":1775768680603,"segment":1,"confidence":21.896551724137932,"iterationTokens":11230,"asi":{"hypothesis":"Delegate can safely gain baseline autocorrect by rewriting only the most deterministic direct delegations and deferring prefixed/arg/comment-sensitive rewrites.","implemented_cop":"Rails/Delegate","rubocop_reference":"vendor/rubocop-rails/lib/rubocop/cop/rails/delegate.rb","tests":"cargo test --lib --quiet -- cop::rails::delegate","with_autocorrect_after":635,"missing_autocorrect_after":281,"offenses_benchmark":3992,"deferred_paths":"Full parity requires preserving comments/visibility/prefix options and broader receiver forms (e.g., constant paths with `::`) when replacing full def nodes."}}
{"run":467,"commit":"b77ab7c","metric":636,"metrics":{},"status":"keep","description":"Added conservative autocorrect support for Rails/FindByOrAssignmentMemoization. Rewrites flagged `@ivar ||= find_by(...)` patterns into explicit `defined?` guard + assignment form, with supports_autocorrect and targeted autocorrect tests. Preserved offense invariant at 3992.","timestamp":1775768888311,"segment":1,"confidence":21.559322033898304,"iterationTokens":12800,"asi":{"hypothesis":"FindByOrAssignmentMemoization can safely gain baseline autocorrect by always expanding flagged `||= find_by` memoization into explicit `defined?` conditional assignment form.","implemented_cop":"Rails/FindByOrAssignmentMemoization","rubocop_reference":"vendor/rubocop-rails/lib/rubocop/cop/rails/find_by_or_assignment_memoization.rb","tests":"cargo test --lib --quiet -- cop::rails::find_by_or_assignment_memoization","with_autocorrect_after":636,"missing_autocorrect_after":280,"offenses_benchmark":3992,"deferred_paths":"Parity follow-up: support RuboCop's specialized on_def minimal rewrite shape and endless-method conversion semantics."}}
{"run":468,"commit":"810e706","metric":637,"metrics":{},"status":"keep","description":"Added conservative autocorrect support for Rails/Validation. Baseline rewrites deterministic single-attribute old-style validator calls (`validates_*_of :attr`) to `validates :attr, <type>: true`, with `validates_size_of` mapped to `length`. Added supports_autocorrect and targeted autocorrect tests; offense invariant remains 3992.","timestamp":1775769097407,"segment":1,"confidence":21.96551724137931,"iterationTokens":16312,"asi":{"hypothesis":"Rails/Validation can safely gain baseline autocorrect by handling only one-attribute old-style validators with selector replacement plus simple option insertion.","implemented_cop":"Rails/Validation","rubocop_reference":"vendor/rubocop-rails/lib/rubocop/cop/rails/validation.rb","tests":"cargo test --lib --quiet -- cop::rails::validation","with_autocorrect_after":637,"missing_autocorrect_after":279,"offenses_benchmark":3992,"deferred_paths":"Parity follow-up for hash/array/frozen-array argument forms and richer option rewrites remains deferred."}}
{"run":469,"commit":"875c50c","metric":638,"metrics":{},"status":"keep","description":"Added conservative autocorrect support for Rails/ActiveRecordCallbacksOrder. Baseline autocorrect swaps one deterministic adjacent out-of-order callback pair while preserving existing offense detection. Added supports_autocorrect and targeted autocorrect tests; offense invariant remains 3992.","timestamp":1775769286736,"segment":1,"confidence":22,"iterationTokens":10361,"asi":{"hypothesis":"ActiveRecordCallbacksOrder can safely gain baseline autocorrect by limiting to a single adjacent callback swap in simple top-level class-body cases.","implemented_cop":"Rails/ActiveRecordCallbacksOrder","rubocop_reference":"vendor/rubocop-rails/lib/rubocop/cop/rails/active_record_callbacks_order.rb","tests":"cargo test --lib --quiet -- cop::rails::active_record_callbacks_order","with_autocorrect_after":638,"missing_autocorrect_after":278,"offenses_benchmark":3992,"deferred_paths":"Broader parity for comment-aware swaps and multiple-order-violation reordering remains deferred."}}
{"run":470,"commit":"875c50c","metric":0,"metrics":{},"status":"checks_failed","description":"Reattempted conservative autocorrect for Rails/RedundantPresenceValidationOnBelongsTo (simple `validates :assoc, presence: true` removal) but targeted autocorrect test still emitted no diagnostics/corrections under rails-version-configured autocorrect harness.","timestamp":1775769507041,"segment":1,"confidence":22,"iterationTokens":13058,"asi":{"hypothesis":"A narrow baseline removing only simple single-symbol `presence: true` validations for belongs_to associations should be safe and testable.","rollback_reason":"autocorrect test path produced zero diagnostics (`diags.len()==0`) despite fixture-driven offense behavior, indicating unresolved harness/matching context gap.","next_action_hint":"Defer this cop again; investigate why `run_cop_autocorrect_with_config` does not trigger class-node offense for this cop before retrying corrections.","error":"cop::rails::redundant_presence_validation_on_belongs_to::tests::autocorrects_simple_single_symbol_presence_validation assertion left=0 right=1","failing_test":"cargo test --lib --quiet -- cop::rails::redundant_presence_validation_on_belongs_to"}}
{"run":471,"commit":"2d7e6cb","metric":639,"metrics":{},"status":"keep","description":"Added conservative autocorrect support for Rails/DuplicateAssociation. Baseline autocorrect removes non-last duplicates for duplicate association-name groups, leaving the last declaration in place; class_name-duplicate diagnostics remain non-correcting for now. Added supports_autocorrect and targeted autocorrect tests; offense invariant remains 3992.","timestamp":1775769620175,"segment":1,"confidence":22.03448275862069,"iterationTokens":3765,"asi":{"hypothesis":"DuplicateAssociation can safely gain baseline autocorrect by deleting earlier duplicate declarations and preserving the final declaration that ActiveRecord ultimately uses.","implemented_cop":"Rails/DuplicateAssociation","rubocop_reference":"vendor/rubocop-rails/lib/rubocop/cop/rails/duplicate_association.rb","tests":"cargo test --lib --quiet -- cop::rails::duplicate_association","with_autocorrect_after":639,"missing_autocorrect_after":277,"offenses_benchmark":3992,"deferred_paths":"Parity follow-up: include comment/line-aware removal and class_name-duplicate rewrite semantics closer to RuboCop's replace-first/remove-rest strategy."}}
{"run":472,"commit":"5bb20e6","metric":640,"metrics":{},"status":"keep","description":"Revisited Rails/RedundantPresenceValidationOnBelongsTo and landed conservative autocorrect support with rails-aware config path fixed in tests. Baseline autocorrect removes only exact `validates :assoc, presence: true` forms for matched belongs_to associations. Added supports_autocorrect and targeted autocorrect test coverage; offense invariant remains 3992.","timestamp":1775770464402,"segment":1,"confidence":21.694915254237287,"iterationTokens":3643,"asi":{"hypothesis":"The prior failure was a rails-version test harness config issue; with proper rails-target config, a narrow safe autocorrect baseline should pass and improve coverage.","implemented_cop":"Rails/RedundantPresenceValidationOnBelongsTo","rubocop_reference":"vendor/rubocop-rails/lib/rubocop/cop/rails/redundant_presence_validation_on_belongs_to.rb","tests":"cargo test --lib --quiet -- cop::rails::redundant_presence_validation_on_belongs_to","with_autocorrect_after":640,"missing_autocorrect_after":276,"offenses_benchmark":3992,"deferred_paths":"Parity still deferred for multi-key validations and richer option-preserving rewrite branches from RuboCop."}}
